Player,Offense,Defense,GP,Name,Squad,Viable
"Squirty",0,1,71865,Phoenix,"Hera G8, Kanan G8, Ezra Zeb G8, Sabine G8",1
"Squirty",1,0,73066,Troopers,"zVeers Starck G9, Shoretrooper G8, Snowtrooper G9, Stormtrooper G8",1
"Squirty",1,0,78620,Wampa (Counter),"zRex Wampa G8, Visas G8, Jyn G8, FOO",1
"Squirty",1,0,13324,SionSolo (Counter),"Sion G8",1
"Squirty",,,314888,Malevolence,"Malevolence 5* Sun Fac SF, Soldier SF, Spy SF, Hyena Bomber 5*, Vulture Droid 6*, IG-2000",0
"Squirty",,,360510,Executrix,"Executrix Tie Adv, Emperor's Shuttle 5*, TIE Reaper, Imperial TIE Fighter, Gauntlet Starfighter, First Order SF TIE Fighter, First Order TIE Fighter",0
"Squirty",1,1,76984,Ewoks,"zChirpa Elder Paploo 6* Wicket Logray G9",0
"Squirty",0,1,61979,BH,"Jango G7, Aurra 6* G7, IG-88 The Mandalorian 5* G8, Zam G8",0
"Squirty",1,0,46912,Jawas,"Nebit G7, Jawa Engineer G7, Jawa Scavenger G7, Jawa G8, Dathcha G7",0
"Flat Taco",0,1,130149,DRMalak,"zzzDR zzHK-47 zBSF zzMalak zThrawn",1
"Flat Taco",1,1,84789,NS_Alt,"zMT zAV Zombie Talia Daka",1
"Flat Taco",0,1,99910,Geonosians,"zzGBA Poggle Geo Soldier, Geo Spy, Sun Fac",1
"Flat Taco",1,1,95558,JTR,"zzJTR Scav Rey, zBB-8 zR2-D2 Finn",1
"Flat Taco",1,0,105786,Traya,"zzTraya zDN zSion zzEP zNest",1
"Flat Taco",1,1,111187,Revan,"zzzJKR BS zGMY zJolee zGK",1
"Flat Taco",1,1,84235,Carth,"zCarth Onasi, zMission zZaalbar Juhani G8, Canderous",1
"Flat Taco",0,1,98955,BH,"zJango Boba Greedo zzBossk Cad",1
"Flat Taco",0,1,81096,FO,"zKRU Kylo FOO FOST G8, FOE",1
"Flat Taco",1,0,92360,Wiggs,"Wedge Biggs zCLS zHan zChewbacca",1
"Flat Taco",0,1,67213,Phoenix,"Hera G8, Kanan G8, Chopper G8, Ezra G9, Zeb G8",1
"MetalPrawn",,,311124,HansMF,"Home One, Han's MF 5*, HT Biggs X-wing, Phantom Ghost Tie Adv, Wedge X-wing",1
"MetalPrawn",1,1,75219,Ewoks,"zChirpa G9, Elder Paploo G9, Wicket Logray G9",1
"MetalPrawn",1,0,124358,ShaakClones,"zzShaak Ti, zRex zEcho zzFives zARC Trooper",1
"MetalPrawn",0,1,94682,BH,"zBossk zBoba IG-88 Dengar G8, Jango",1
"MetalPrawn",1,1,84940,zEP,"zzEP zzVader Tarkin G9, Dooku TFP G8",1
"MetalPrawn",0,1,65090,Phoenix,"Hera G8, Kanan G8, Chopper G8, Ezra G8, Zeb G8",1
"MetalPrawn",0,1,93299,padme,"zzPadme zGK JKA zAhsoka C-3PO 6* G7",0
"MetalPrawn",0,1,88590,Geonosians,"zGBA Poggle Geo Soldier, Geo Spy, Sun Fac",0
"MetalPrawn",0,1,81375,Grievous,"zGG G8, zB2 G9, zB1 6* MagnaGuard G8, Nute",0
"MetalPrawn",1,1,56572,NS,"MT 6* G8, AV G9, Daka G9, Zombie 5* G8, Spirit 5* G8",0
"MetalPrawn",1,0,64251,Wiggs,"Wedge 6* G8, Biggs G8, CLS G8, Han Chewbacca G8",0
"MetalPrawn",1,1,42072,Rogue1,"Jyn 5* G8, Chirrut 6* G8, Baze 5* G8, K-2SO G8, Cassian G8",0
"MetalPrawn",0,1,50043,FO,"KRU G8, Kylo 5* G8, FOO G8, Phasma G8, FOTP G8",0
"MetalPrawn",1,0,7842,NestSolo (Counter),"Nest 2* G7",0
"Grand M'uff Talkin",0,1,95859,DR,"zzzDR HK-47 zBSF Sith Empire Trooper, Sith Assassin G8",1
"Grand M'uff Talkin",1,1,98076,NS_Alt,"zzMT zAV Zombie Talia zDaka",1
"Grand M'uff Talkin",0,1,92902,Geonosians,"zzGBA Poggle Geo Soldier, Geo Spy, Sun Fac",1
"Grand M'uff Talkin",1,0,111701,Traya,"zzTraya zDN zSion zzEP zThrawn",1
"Grand M'uff Talkin",1,1,116036,JTR,"zzzJTR Scav Rey, zzBB-8 zzR2-D2 zFinn",1
"Grand M'uff Talkin",0,1,87718,Grievous,"zzGG B2 MagnaGuard G9, Dooku T3-M4",1
"Grand M'uff Talkin",1,1,117283,Revan,"zzzJKR zBS zzGMY zJolee GK",1
"Grand M'uff Talkin",1,0,118164,CLS,"zzzCLS zHan zzChewbacca Leia zzC-3PO",1
"Grand M'uff Talkin",1,1,88258,Ewoks,"zChirpa Elder Paploo zWicket zLogray",1
"Grand M'uff Talkin",1,1,96109,Carth,"zCarth Onasi, zMission zZaalbar Juhani zCanderous",1
"Grand M'uff Talkin",0,1,110455,BH,"zzBossk zBoba zGreedo zDengar zZam",1
"Grand M'uff Talkin",1,0,99666,501st,"zRex Clone Sergeant, zEcho zzFives zAhsoka",1
"Grand M'uff Talkin",0,1,73582,Phoenix,"Hera Kanan Chopper Ezra G8, Zeb G8",1
"Grand M'uff Talkin",1,1,76783,Rogue1,"Jyn G8, Chirrut Baze K-2SO Cassian",1
"Grand M'uff Talkin",1,0,67682,Jawas,"Nebit G8, Jawa Engineer G9, Jawa Scavenger G8, Jawa G9, Dathcha G8",1
"Grand M'uff Talkin",1,0,15192,NestSolo (Counter),"Nest",1
"Grand M'uff Talkin",0,1,70252,FO,"KRU G9, Kylo FOST G8, FOE FOTP",0
"Grand M'uff Talkin",1,0,94861,Zader (Counter),"zzzVader zzWampa Tarkin Sidious G5, Stormtrooper G8",0
"bellojack",0,1,107460,padme,"zzPadme zGK zJKA zAhsoka zzC-3PO",1
"bellojack",0,1,113337,DRMalak,"zzzDR zzHK-47 zBSF zzMalak Sith Empire Trooper",1
"bellojack",,,422345,HansMF,"Home One, Han's MF, HT Biggs X-wing, Phantom Ghost Cassian's U-wing, Bistan's U-wing",1
"bellojack",0,1,106642,Grievous,"zzGG zB2 zB1 zDroideka zMagnaGuard",1
"bellojack",1,1,143943,JTR,"zzzJTR zScav Rey, zzBB-8 zzR2-D2 Finn",1
"bellojack",1,1,113880,Revan Offense,"zzzJKR zGMY zBS zJolee zEzra",1
"bellojack",1,1,93810,Ewoks,"zChirpa Elder zPaploo zWicket zLogray",1
"bellojack",1,1,89489,Carth,"Carth Onasi, zMission zZaalbar zJuhani Canderous",1
"bellojack",0,1,110701,BH,"zzBossk zBoba zIG-88 zGreedo zZam",1
"bellojack",1,0,107187,CLS,"zzzCLS zHan Leia zzOld Ben, zzChewbacca",1
"bellojack",1,1,107369,zEP,"zzEP zzzVader zTarkin zDooku TFP",1
"bellojack",0,1,95965,Phoenix,"zHera zKanan Chopper zZeb zSabine",1
"bellojack",1,1,71717,Rogue1,"Jyn G8, Chirrut G8, Baze G8, K-2SO G9, Cassian G9",1
"bellojack",1,0,21049,SionSolo (Counter),"zSion",1
"bellojack",0,1,75502,Geonosians,"GBA 6* G3, Poggle Geo Soldier, Geo Spy, Sun Fac G8",0
"bellojack",1,1,67010,NS,"zMT G5, zAV Daka G8, Zombie G4, Spirit G2",0
"bellojack",1,0,97891,ShaakClones,"zzShaak Ti, zRex zEcho zzFives Clone Sergeant G8",0
"bellojack",0,1,54824,BH,"Jango G6, Aurra 5* G2, Dengar 5* G3, Cad Nest G3",0
"bellojack",1,0,65602,Thragma (Counter),"zzThrawn Magma G8, zKrennic 5* G4, Stormtrooper G9, Shoretrooper 3* G3",0
"bellojack",0,1,81030,FO,"zzKRU G8, zKylo FOO FOST Phasma",0
"Rouge 5hadow",1,1,125896,Revan,"zzzJKR zBS zGMY zJolee GK",1
"Rouge 5hadow",0,1,101355,Phoenix,"zHera zKanan zEzra zZeb zSabine",1
"Rouge 5hadow",1,0,95265,Zader (Counter),"zzVader zMission G8, Zaalbar G8, zzWampa zBoba",1
"Rouge 5hadow",1,0,20038,SionSolo (Counter),"zSion",1
"Rouge 5hadow",0,1,64988,Geonosians,"zGBA Poggle G6, Geo Soldier G4, Geo Spy G5, Sun Fac G4",0
"Rouge 5hadow",1,1,71643,NS,"zMT AV Daka G8, Zombie 5* Spirit 5* G8",0
"Rouge 5hadow",0,1,46123,BH,"Bossk 4* G9, Greedo G5, Dengar 6* G5, Greef Karga 4* G8, zNest 3*",0
"Esaascar",0,1,129231,padme,"zzPadme zGK zJKA zAhsoka zzC-3PO",1
"Esaascar",0,1,98124,DR,"zzzDR zHK-47 zBSF Sith Assassin G8, zThrawn",1
"Esaascar",0,1,84284,Geonosians,"zzGBA Poggle Geo Soldier, Geo Spy, Sun Fac G8",1
"Esaascar",0,1,109431,Grievous,"zzGG zB2 zB1 zDroideka zMagnaGuard",1
"Esaascar",1,1,116147,JTR,"zzzJTR Scav Rey, zzBB-8 zzR2-D2 Finn",1
"Esaascar",1,1,113990,Revan Offense,"zzzJKR zGMY zBS zJolee HYoda",1
"Esaascar",1,1,84202,Ewoks,"zChirpa Elder Paploo zWicket Logray",1
"Esaascar",1,1,94802,Carth,"zCarth Onasi, zMission zZaalbar Juhani zCanderous",1
"Esaascar",0,1,92269,BH,"zzBossk Boba IG-88 Dengar Cad",1
"Esaascar",1,0,106886,CLS,"zzzCLS zHan Wedge Biggs zzChewbacca",1
"Esaascar",0,1,93461,FO,"zzKRU zKylo FOO FOST G9, FOTP",1
"Esaascar",1,1,96424,zEP,"zzEP zzzVader Tarkin Dooku TFP G8",1
"Esaascar",0,1,73526,Phoenix,"Hera G9, Kanan G9, Chopper G9, Ezra Zeb G8",1
"Esaascar",1,0,75196,Troopers,"zVeers Starck G9, Magma G8, Snowtrooper Stormtrooper",1
"Esaascar",1,0,20958,SionSolo (Counter),"zSion",1
"Esaascar",1,1,85161,NS,"zMT zzAV Daka Zombie Spirit G9",0
"Esaascar",,,393106,Negotiator,"Negotiator 5* HT Anakin's Eta-2 Starfighter 4*, Umbaran Starfighter, Ahsoka Tano's Jedi Starfighter, Clone Sergeant's ARC-170, Plo Koon's Jedi Starfighter, Rex's ARC-170",0
"Esaascar",,,286324,Executrix,"Executrix Tie Adv, Emperor's Shuttle 4*, TIE Reaper 4*, Imperial TIE Fighter, Gauntlet Starfighter 6*, First Order SF TIE Fighter, First Order TIE Fighter",0
"Esaascar",1,0,76029,ShaakClones,"Shaak Ti 4* G8, Rex Echo G9, zFives zARC Trooper G9",0
"Esaascar",1,1,59607,Rogue1,"Jyn 5* G8, Chirrut G8, Baze 4* G7, Bistan G8, Cassian G8",0
"Esaascar",1,0,56777,Jawas,"Nebit G7, Jawa Engineer G9, Jawa Scavenger G8, Jawa 5* G8, Dathcha G7",0
"Michael Wulf",1,1,137468,SL Kylo,"zzzzzzSL Kylo, zSith Trooper, zHux zzKRU zThrawn",1
"Michael Wulf",0,1,104293,padme,"zzPadme zGK JKA zAhsoka zC-3PO G9",1
"Michael Wulf",0,1,113183,DRMalak,"zzzDR zzHK-47 zBSF zzMalak Sith Empire Trooper",1
"Michael Wulf",1,1,92437,NS_Alt,"zMT zzAV Zombie Talia Daka",1
"Michael Wulf",,,377682,Negotiator,"Negotiator 5* HT Anakin's Eta-2 Starfighter, Umbaran Starfighter, Ahsoka Tano's Jedi Starfighter, Clone Sergeant's ARC-170, Plo Koon's Jedi Starfighter, Rex's ARC-170",1
"Michael Wulf",0,1,84877,Geonosians,"zzGBA 6* Poggle Geo Soldier, Geo Spy, Sun Fac G8",1
"Michael Wulf",0,1,87189,Grievous,"zzGG G9, zB2 G8, zB1 zDroideka G8, MagnaGuard G8",1
"Michael Wulf",1,1,96249,JTR,"zJTR Scav Rey, zBB-8 zzR2-D2 Finn",1
"Michael Wulf",1,0,118511,Traya,"zzTraya zDN zSion Dooku zzEP",1
"Michael Wulf",1,1,107873,Revan Offense,"zzzJKR zGMY zBS zJolee HYoda",1
"Michael Wulf",1,1,90163,Ewoks,"zChirpa Elder zPaploo zWicket zLogray G9",1
"Michael Wulf",0,1,92874,BH,"zJango Boba Dengar G9, zBossk Cad",1
"Michael Wulf",0,1,74000,Phoenix,"Hera G8, Kanan Chopper G9, Ezra Zeb G8",1
"Michael Wulf",1,0,84839,CLS,"zzCLS zHan Leia Old Ben G9, Chewbacca G8",1
"Michael Wulf",1,0,69813,Troopers,"zVeers Starck G9, Magma G8, Snowtrooper G7, Stormtrooper G8",1
"Michael Wulf",1,0,101250,Zader (Counter),"zzzVader zMission zZaalbar Tarkin Sidious",1
"Michael Wulf",,,279957,HansMF,"Home One, Han's MF 5*, Biggs X-wing, Bistan's U-wing 4*, Phantom Ghost Cassian's U-wing, Wedge X-wing",0
"Michael Wulf",1,0,89794,ShaakClones,"zzShaak Ti G8, Rex Echo zzFives G9, Clone Sergeant",0
"Michael Wulf",1,0,9729,NestSolo (Counter),"Nest 4* G8",0
"This Is The Way",0,1,145221,padme,"zzPadme zGK zJKA zAhsoka zzC-3PO",1
"This Is The Way",,,452647,Negotiator,"Negotiator 5* HT Anakin's Eta-2 Starfighter, Umbaran Starfighter, Ahsoka Tano's Jedi Starfighter, Clone Sergeant's ARC-170, Jedi Consular's Starfighter, Plo Koon's Jedi Starfighter",1
"This Is The Way",0,1,93853,Geonosians,"zzGBA Poggle Geo Soldier, Geo Spy, Sun Fac",1
"This Is The Way",0,1,139993,Grievous,"zzGG zB2 zB1 zDroideka zMagnaGuard",1
"This Is The Way",1,0,119443,Traya,"zzTraya zDN zSion zzEP zzThrawn",1
"This Is The Way",1,1,112736,JTR,"zzzJTR zScav Rey, zzBB-8 zzR2-D2 zFinn",1
"This Is The Way",,,152616,Disintegration,"zzAurra zzGreef Karga, zBoba zzBossk zzThe Mandalorian",1
"This Is The Way",0,1,119927,BH,"zzJango zzEmbo zDengar zZam zNest",1
"This Is The Way",1,1,96235,Ewoks,"zChirpa Elder zPaploo zWicket zLogray",1
"This Is The Way",1,0,105769,ShaakClones,"zzShaak Ti, zRex zEcho zzFives zARC Trooper",1
"This Is The Way",0,1,96103,FO,"zzKRU zKylo FOO zFOST FOE",1
"This Is The Way",1,0,107831,CLS,"zzzCLS zHan Leia zzOld Ben, zzChewbacca",1
"This Is The Way",0,1,75750,Phoenix,"Hera Kanan G8, Chopper Ezra Zeb G9",1
"This Is The Way",1,0,104720,Zader (Counter),"zzzVader zzWampa zzTarkin zSidious Stormtrooper G8",1
"This Is The Way",1,0,69212,Jawas,"Nebit G8, Jawa Engineer G9, Jawa Scavenger G8, Jawa G9, Dathcha G8",1
"This Is The Way",0,1,49861,Qira,"Qira L3-37 4* G8, Vandor Chewbacca 3* G8, Mission 6* G8, Zaalbar G7",0
"This Is The Way",,,323952,HansMF,"Home One, Han's MF, Biggs X-wing, Bistan's U-wing 5*, Phantom Ghost Cassian's U-wing, Wedge X-wing",0
"This Is The Way",1,1,72782,NS,"MT G8, zAV Daka Zombie G8, Spirit G8",0
"This Is The Way",1,0,59043,Troopers,"Veers Starck Admiral Piett 3* G8, Snowtrooper G8, Range Trooper 4* G8",0
"This Is The Way",1,1,56288,Rogue1,"Jyn G8, Chirrut G8, Baze 3* G7, K-2SO G8, Cassian G8",0
"Tzoid",0,1,135490,DRMalak,"zzzDR zzHK-47 zBSF zzMalak Sith Empire Trooper",1
"Tzoid",0,1,111385,padme,"zzPadme zGK JKA G9, zAhsoka C-3PO",1
"Tzoid",,,413269,HansMF,"Home One, Han's MF, HT Biggs X-wing, Phantom Ghost Cassian's U-wing, Bistan's U-wing",1
"Tzoid",0,1,93232,Geonosians,"zzGBA Poggle Geo Soldier, Geo Spy, Sun Fac",1
"Tzoid",0,1,100857,Grievous,"zzGG zB2 MagnaGuard G9, zNute zDooku",1
"Tzoid",1,1,135666,Revan Offense,"zzzJKR zzGMY zBS zJolee zEzra",1
"Tzoid",1,1,96007,Ewoks,"zChirpa Elder zPaploo zWicket zLogray",1
"Tzoid",1,1,93378,Carth,"zCarth Onasi, zMission zZaalbar zJuhani zCanderous",1
"Tzoid",0,1,101744,BH,"zzBossk zBoba Greedo Dengar Cad",1
"Tzoid",0,1,83506,FO,"zzKRU Kylo FOO FOE FOSFTP G9",1
"Tzoid",1,0,87116,Wiggs,"Wedge G8, Biggs CLS zHan Chewbacca",1
"Tzoid",1,0,103899,EP (trio),"zzEP Traya G8, zzDN zSion zThrawn",1
"Tzoid",1,0,96988,Zader (Counter),"zzzVader zzWampa zzTarkin Sidious G8, Stormtrooper G8",1
"Tzoid",1,1,76068,NestSisters,"AV MT Daka Zombie Nest 5* G6",0
"Tzoid",1,0,63764,ShaakClones,"Shaak Ti 4* G8, Rex Echo G9, Fives G9, ARC Trooper G8",0
"Tzoid",1,0,48340,Troopers,"Veers G8, Starck G8, Shoretrooper 5* G8, DT 5* G8, Snowtrooper G8",0
"Tzoid",0,1,88747,Phoenix,"zHera zKanan Chopper zZeb Sabine 5*",0
"Tzoid",1,1,58089,Rogue1,"Jyn 5* G8, Chirrut G8, Baze 5* G8, K-2SO G8, Cassian",0
"JuanQue NoloVi",0,1,112375,DR,"zzzDR zzHK-47 zBSF Sith Empire Trooper, Sith Assassin",1
"JuanQue NoloVi",1,1,139436,NS_Alt,"zzMT zzAV Zombie Talia zDaka",1
"JuanQue NoloVi",0,1,88395,Geonosians,"zzGBA Poggle Geo Soldier, Geo Spy, Sun Fac G8",1
"JuanQue NoloVi",1,1,124542,Revan,"zzzJKR zBS zzGMY zJolee GK",1
"JuanQue NoloVi",1,1,100149,Carth,"zCarth Onasi, zMission zZaalbar zJuhani zCanderous",1
"JuanQue NoloVi",0,1,104164,Phoenix,"zHera zKanan zEzra zZeb zSabine",1
"JuanQue NoloVi",1,0,101105,Zader (Counter),"zzzVader Tarkin Sidious zBoba Stormtrooper",1
"JuanQue NoloVi",1,0,68756,Jawas,"Nebit G8, Jawa Engineer G9, Jawa Scavenger G8, Jawa G9, Dathcha",1
"JuanQue NoloVi",1,0,70560,EP (trio),"EP Traya G8, DN G8, Sion G8, Thrawn G8",1
"JuanQue NoloVi",0,1,70221,Grievous,"GG G8, B2 6* G8, Dooku IG-88 T3-M4 G8",0
"JuanQue NoloVi",1,0,62981,ShaakClones,"Shaak Ti 4* G7, Rex G8, Echo G8, Fives G8, Clone Sergeant G8",0
"JuanQue NoloVi",1,1,56488,Ewoks,"Chirpa G8, Elder Paploo G7, Teebo G7, Scout G8",0
"JuanQue NoloVi",0,1,79930,BH,"zzBossk 6* Greedo G8, Dengar G8, Cad G8, Zam",0
"JuanQue NoloVi",1,0,85002,Wiggs,"Wedge 6* G8, Biggs G8, zzzCLS Han Fulcrum",0
"JuanQue NoloVi",1,0,55699,Troopers,"Veers G8, Starck G9, Shoretrooper 5* G8, DT 5* G8, Snowtrooper G8",0
"JuanQue NoloVi",1,1,64900,Rogue1,"Jyn G8, Chirrut G8, Baze 5* G8, K-2SO G8, Cassian G8",0
"JuanQue NoloVi",0,1,64435,FO,"KRU G8, Kylo G8, FOO G8, Phasma G8, FOSFTP G7",0
"Newhawk",0,1,128014,padme,"zzPadme zGK zJKA zAhsoka zzC-3PO",1
"Newhawk",,,377567,HansMF,"Home One, Han's MF, HT Biggs X-wing, Phantom Ghost Cassian's U-wing, Bistan's U-wing",1
"Newhawk",0,1,95932,Geonosians,"zzGBA Poggle Geo Soldier, Geo Spy, Sun Fac",1
"Newhawk",0,1,109071,Grievous,"zzGG zB2 zB1 zDroideka zMagnaGuard",1
"Newhawk",1,1,106221,JTR,"zzzJTR Scav Rey G8, zzBB-8 zzR2-D2 zFinn",1
"Newhawk",1,1,88911,Ewoks,"zChirpa G9, Elder zPaploo zWicket zLogray",1
"Newhawk",1,1,91072,Revan Offense,"zzzJKR G8, zGMY BS zJolee G9, Ezra G8",1
"Newhawk",1,0,121774,ShaakClones,"zzShaak Ti, zRex zEcho zzFives zARC Trooper",1
"Newhawk",0,1,98015,BH,"zzBossk zBoba Greedo Dengar Jango",1
"Newhawk",1,0,120080,CLS,"zzzCLS zHan Leia G8, Old Ben, zzChewbacca",1
"Newhawk",1,1,94628,NS,"zzMT zzAV zDaka Zombie Spirit G5",0
"Newhawk",1,1,50658,Carth,"Carth Onasi 5* G7, Mission G7, Zaalbar G8, Juhani 5* G7, Canderous 3* G5",0
"Newhawk",1,1,81006,zEP,"zzEP G8, zzzVader Tarkin G8, IPD 6* G7, TFP G8",0
"Newhawk",1,0,61389,Troopers,"Veers G9, Starck G6, Magma G7, Snowtrooper G6, Stormtrooper G9",0
"Newhawk",0,1,63946,Phoenix,"Hera G8, Kanan G8, Chopper G9, Zeb G8, Sabine 5* G7",0
"Newhawk",0,1,74439,FO,"zzKRU G9, Kylo G7, FOO G8, FOE FOTP G8",0
"Newhawk",1,0,8746,SionSolo (Counter),"Sion 5* G8",0
"KingZach",1,1,92679,NS,"zzMT zzAV Daka Zombie Spirit",1
"KingZach",0,1,111426,padme,"zzPadme zGK zJKA zAhsoka zzC-3PO",1
"KingZach",,,438328,HansMF,"Home One, Han's MF, HT Biggs X-wing, Phantom Ghost Cassian's U-wing, Bistan's U-wing",1
"KingZach",1,0,106717,Traya,"zzTraya zDN zSion zzEP zThrawn",1
"KingZach",1,1,117645,JTR,"zzzJTR Scav Rey, zBB-8 zzR2-D2 RT",1
"KingZach",1,1,115043,Revan Offense,"zzzJKR zGMY zzHYoda zJolee zEzra",1
"KingZach",1,1,86576,Ewoks,"zChirpa Elder Paploo zWicket zLogray",1
"KingZach",1,1,80385,Carth,"zCarth Onasi, Mission G8, Zaalbar G8, Juhani zCanderous",1
"KingZach",0,1,92111,BH,"zBossk Boba Greedo Dengar G9, zNest",1
"KingZach",1,0,82091,Troopers,"zVeers zStarck G9, DT Snowtrooper Range Trooper G9",1
"KingZach",1,0,148067,CLS,"zzzCLS zHan zLeia zzOld Ben, zzChewbacca",1
"KingZach",0,1,79460,FO,"zKRU zKylo FOO G9, FOE G9, FOTP G9",1
"KingZach",0,1,80926,Phoenix,"Hera Kanan Chopper Zeb Sabine",1
"KingZach",1,1,81247,Rogue1,"zzJyn Chirrut G8, Baze G8, K-2SO G8, Cassian",1
"KingZach",1,0,104351,zMaul,"zMaul zBSF zDooku zzzDR zSavage",1
"KingZach",1,0,104955,Zader (Counter),"zzzVader zzWampa Tarkin G9, zSidious Shoretrooper",1
"KingZach",0,1,79356,Grievous,"GG G9, B2 G8, zNute IG-88 T3-M4 G9",0
"KingZach",1,0,83358,ShaakClones,"zzShaak Ti G8, zRex Echo G9, zFives G8, Clone Sergeant G8",0
"KingZach",1,0,61085,Jawas,"Nebit G8, Jawa Engineer G8, Jawa Scavenger G7, Jawa G7, Dathcha",0
"Teg",0,1,128519,padme,"zzPadme zGK zJKA zAhsoka zzC-3PO",1
"Teg",0,1,106451,DRMalak,"zzzDR zHK-47 zBSF zzMalak Sith Empire Trooper G8",1
"Teg",,,391677,HansMF,"Home One, Han's MF, HT Biggs X-wing, Phantom Ghost Cassian's U-wing, Bistan's U-wing",1
"Teg",0,1,94405,Geonosians,"zzGBA Poggle Geo Soldier, Geo Spy, Sun Fac",1
"Teg",0,1,114340,Grievous,"zzGG zB2 zB1 zDroideka zMagnaGuard",1
"Teg",1,1,118543,JTR,"zzzJTR Scav Rey, zBB-8 zzR2-D2 zFinn",1
"Teg",1,1,116032,GAS,"zzzzGAS zRex zEcho zzFives zARC Trooper",1
"Teg",1,1,108443,Revan Offense,"zzzJKR zGMY BS zJolee HYoda",1
"Teg",1,1,80051,Ewoks,"zChirpa Elder Paploo G9, Wicket Logray G9",1
"Teg",1,1,91182,Carth,"zCarth Onasi, zMission Zaalbar Juhani Canderous",1
"Teg",0,1,99748,BH,"zzBossk Boba zIG-88 Greedo Dengar",1
"Teg",1,1,95651,zEP,"zzEP zzVader Tarkin DT G8, TFP G8",1
"Teg",0,1,96022,FO,"zKRU zKylo FOO FOE zHux",1
"Teg",0,1,82153,Phoenix,"Hera G9, Kanan G8, zEzra zZeb G8, zSabine",1
"Teg",1,0,111252,Wiggs,"Wedge G9, Biggs G8, zzzCLS zHan zzChewbacca",1
"Teg",1,1,72539,Rogue1,"Jyn G8, Chirrut G8, Baze G8, K-2SO G8, Cassian",1
"Teg",1,0,66125,Jawas,"Nebit G8, Jawa Engineer G8, Jawa Scavenger G8, Jawa G8, Dathcha G8",1
"Teg",1,0,14740,NestSolo (Counter),"Nest G9",1
"Teg",1,0,13777,SionSolo (Counter),"Sion G8",1
"Teg",,,331040,Malevolence,"Malevolence 6* Sun Fac SF, Soldier SF, Spy SF, Hyena Bomber 6*, Vulture Droid, IG-2000",0
"Teg",1,1,91194,NS_Alt,"zzMT G9, zzAV Zombie Talia G9, zDaka",0
"Teg",,,323111,Executrix,"Executrix Tie Adv, Emperor's Shuttle, TIE Reaper 6*, Imperial TIE Fighter, Gauntlet Starfighter, First Order SF TIE Fighter 5*, First Order TIE Fighter",0
"Teg",0,1,77201,BH,"Jango G9, Aurra 6* G8, Cad The Mandalorian 6*, Zam G9",0
"Teg",1,0,59786,Troopers,"Veers G9, Starck G8, Shoretrooper G8, Snowtrooper G8, Stormtrooper G5",0
"Mandaloian Ophace",1,1,100039,NS,"zzMT zzAV zDaka Zombie Spirit",1
"Mandaloian Ophace",0,1,76682,Geonosians,"zGBA 6* G9, Poggle G9, Geo Soldier G9, Geo Spy, Sun Fac G8",1
"Mandaloian Ophace",1,0,106080,Traya,"zzTraya zzDN zSion zzEP Thrawn G9",1
"Mandaloian Ophace",1,1,95630,JTR,"zzzJTR Scav Rey, BB-8 R2-D2 Finn",1
"Mandaloian Ophace",1,0,98068,501st,"zRex zARC Trooper, Echo zFives zAhsoka",1
"Mandaloian Ophace",0,1,81079,Phoenix,"zHera Kanan G8, zEzra Zeb G8, Sabine G8",1
"Mandaloian Ophace",1,0,97091,Wiggs,"Wedge G8, Biggs G8, zzzCLS zHan zFulcrum",1
"Mandaloian Ophace",0,1,110981,BS,"zBS zzGMY zJolee GK HYoda",1
"Mandaloian Ophace",1,0,116767,Zader (Counter),"zzzVader zzWampa Tarkin G8, zSidious zBoba",1
"Mandaloian Ophace",1,0,86236,Jawas,"Nebit Jawa Engineer, Jawa Scavenger, Jawa Dathcha",1
"Mandaloian Ophace",,,360777,Negotiator,"Negotiator 5* HT 3* Anakin's Eta-2 Starfighter, Umbaran Starfighter, Ahsoka Tano's Jedi Starfighter, Clone Sergeant's ARC-170, Plo Koon's Jedi Starfighter, Rex's ARC-170",0
"Mandaloian Ophace",0,1,71998,Grievous,"GG B2 5* G7, MagnaGuard 5* G7, zDooku IG-88",0
"Mandaloian Ophace",1,1,48489,Ewoks,"Chirpa 4* G7, Elder Paploo 5* G7, Teebo G6, Scout G6",0
"Mandaloian Ophace",1,1,41991,Carth,"Carth Onasi 6* G6, Mission 3* G8, Zaalbar 6* G8, Juhani 3* G8, Canderous 3* G7",0
"Mandaloian Ophace",0,1,73900,BH,"Bossk 5* G8, Greedo G9, Dengar 6* G8, Cad Zam G8",0
"Mandaloian Ophace",1,0,56949,Troopers,"Veers 6* G7, Starck G7, Magma G7, Snowtrooper G8, Stormtrooper G7",0
"Mandaloian Ophace",0,1,68643,FO,"KRU G8, Kylo G8, FOO G9, Phasma G8, FOSFTP G7",0
"RedWolf",0,1,117936,padme,"zzPadme zGK zJKA zAhsoka zzC-3PO",1
"RedWolf",0,1,116580,DRMalak,"zzzDR zzHK-47 zBSF zzMalak Thrawn G9",1
"RedWolf",,,401838,Negotiator,"Negotiator 6* HT Anakin's Eta-2 Starfighter, Umbaran Starfighter, Ahsoka Tano's Jedi Starfighter, BTL-B Y-wing Starfighter, Clone Sergeant's ARC-170, Plo Koon's Jedi Starfighter",1
"RedWolf",0,1,92842,Geonosians,"zzGBA Poggle Geo Soldier, Geo Spy, Sun Fac",1
"RedWolf",,,368096,HansMF,"Home One, Han's MF, Biggs X-wing, Bistan's U-wing, Phantom Ghost Cassian's U-wing, Wedge X-wing",1
"RedWolf",0,1,104757,Grievous,"zzGG zB2 zB1 zDroideka zMagnaGuard",1
"RedWolf",1,1,102889,JTR,"zzzJTR Scav Rey, zBB-8 G9, zzR2-D2 Finn G8",1
"RedWolf",,,391743,Executrix,"Executrix Tie Adv, Emperor's Shuttle, TIE Reaper, Imperial TIE Fighter, Gauntlet Starfighter, First Order SF TIE Fighter, First Order TIE Fighter",1
"RedWolf",,,103305,Nute-OR,"zNute zDooku zJango zZaalbar zMission",1
"RedWolf",1,1,112353,Revan Offense,"zzzJKR zzGMY BS zJolee zzHYoda",1
"RedWolf",1,1,88444,Ewoks,"zChirpa Elder zPaploo zWicket Logray G8",1
"RedWolf",0,1,101705,BH,"zzBossk zBoba IG-88 Greedo Dengar G8",1
"RedWolf",0,1,135544,FO,"zzKRU zKylo zFOST FOE zHux",1
"RedWolf",0,1,69723,Phoenix,"Hera G9, Kanan G8, Ezra G8, Zeb G8, Sabine G8",1
"RedWolf",1,0,100299,Wampa (Counter),"zRex zzWampa G8, Krennic G7, zzJyn FOO",1
"RedWolf",1,0,91077,Wiggs,"Wedge G8, Biggs G8, zzzCLS Fulcrum Leia",1
"RedWolf",1,0,18601,NestSolo (Counter),"zNest",1
"RedWolf",1,0,17743,SionSolo (Counter),"zSion G9",1
"RedWolf",1,1,90365,NS,"zzMT G8, zzAV zDaka Zombie Spirit 6* G2",0
"RedWolf",1,1,106294,zEP,"zzEP zzzVader Tarkin DT G5, TFP G9",0
"RedWolf",1,0,64091,Troopers,"Veers Starck G7, Shoretrooper G7, Snowtrooper G7, Range Trooper G7",0
"RedWolf",1,0,62107,Jawas,"Nebit G7, Jawa Engineer G7, Jawa Scavenger G8, Jawa G7, Dathcha G8",0
"Jazzy",0,1,101868,padme,"zzPadme zGK zJKA zAhsoka zBarriss",1
"Jazzy",0,1,102581,DR,"zzzDR zHK-47 zBSF Sith Assassin G8, zzThrawn",1
"Jazzy",,,375908,HansMF,"Home One, Han's MF, HT Biggs X-wing, Phantom Ghost Cassian's U-wing, Bistan's U-wing",1
"Jazzy",1,1,99330,JTR,"zzzJTR Scav Rey, zBB-8 G9, zzR2-D2 zFinn",1
"Jazzy",0,1,85964,Grievous,"zGG B2 G9, Droideka G9, MagnaGuard zDooku",1
"Jazzy",1,1,110778,Revan Offense,"zzzJKR zzGMY zBS zJolee HYoda",1
"Jazzy",1,0,107485,CLS,"zzzCLS zHan zChewbacca zLeia zC-3PO G9",1
"Jazzy",1,1,91970,Ewoks,"zChirpa Elder zPaploo zWicket zLogray",1
"Jazzy",0,1,108339,BH,"zzJango zBoba Dengar G9, zzBossk zZam",1
"Jazzy",1,1,83328,Carth,"zCarth Onasi, Mission Zaalbar G8, zJuhani Canderous",1
"Jazzy",0,1,91354,FO,"zzKRU zKylo FOO FOST G9, FOE",1
"Jazzy",1,0,85076,Clones,"zCody Rex Echo Fives Clone Sergeant",1
"Jazzy",0,1,75924,Phoenix,"Hera G8, zKanan G8, zEzra Zeb G8, Sabine G8",1
"Jazzy",1,0,94521,Zader (Counter),"zzzVader Wampa G8, zTarkin Sidious Stormtrooper G9",1
"Jazzy",1,0,17667,SionSolo (Counter),"Sion",1
"Jazzy",1,1,90314,NS,"zzMT G8, zzAV zDaka Zombie Spirit G9",0
"Jazzy",0,1,77037,Geonosians,"GBA Poggle Geo Soldier, Geo Spy G9, Sun Fac G8",0
"Jazzy",,,351301,Executrix,"Executrix Tie Adv, Emperor's Shuttle 5*, TIE Reaper 6*, Imperial TIE Fighter, Gauntlet Starfighter, First Order SF TIE Fighter, First Order TIE Fighter",0
"Jazzy",1,0,58093,Troopers,"Veers Starck G7, Shoretrooper 6* G8, Snowtrooper G7, Range Trooper 4* G6",0
"Jazzy",1,1,66469,Rogue1,"Jyn G7, Chirrut G8, Baze G7, K-2SO G8, Cassian G8",0
"Jazzy",1,0,68995,Jawas,"Nebit G8, Jawa Engineer G9, Jawa Scavenger G7, Jawa G9, Dathcha G9",0
"Jazzy",1,0,8643,NestSolo (Counter),"Nest 6* G7",0
"Chubbs Peterson",0,1,145009,DRMalak,"zzzDR zzHK-47 zBSF zzMalak Sith Empire Trooper",1
"Chubbs Peterson",0,1,130920,padme,"zzPadme zGK zJKA zAhsoka zzC-3PO",1
"Chubbs Peterson",,,380171,HansMF,"Home One, Han's MF, HT Biggs X-wing, Phantom Ghost Cassian's U-wing, Bistan's U-wing",1
"Chubbs Peterson",0,1,102515,Geonosians,"zzGBA Poggle Geo Soldier, Geo Spy, Sun Fac",1
"Chubbs Peterson",1,0,113368,Traya,"zzTraya zDN zSion zzEP zThrawn",1
"Chubbs Peterson",0,1,116505,Grievous,"zzGG zB2 zB1 zDroideka zMagnaGuard",1
"Chubbs Peterson",1,1,113514,JTR,"zzzJTR Scav Rey, zzBB-8 zzR2-D2 Finn",1
"Chubbs Peterson",1,1,119054,Revan Offense,"zzzJKR zzGMY zBS zJolee zHYoda",1
"Chubbs Peterson",,,97431,Nute-Sep,"zNute Dooku zJango zNest zAV",1
"Chubbs Peterson",1,0,108964,ShaakClones,"zzShaak Ti, zRex zEcho zzFives zARC Trooper",1
"Chubbs Peterson",1,1,81824,Ewoks,"zChirpa Elder Paploo Scout Logray",1
"Chubbs Peterson",1,1,89328,Carth,"zCarth Onasi, zMission Zaalbar Juhani Canderous G8",1
"Chubbs Peterson",0,1,102083,BH,"zzBossk Boba Greedo Dengar Cad",1
"Chubbs Peterson",0,1,99581,FO,"zzKRU zKylo FOO G8, FOE G9, zHux",1
"Chubbs Peterson",0,1,72405,Phoenix,"Hera G8, Kanan G8, Ezra Zeb G8, Sabine G8",1
"Chubbs Peterson",1,0,113408,CLS,"zzzCLS zHan Leia G8, zOld Ben, zzChewbacca",1
"Chubbs Peterson",1,0,84168,Wiggs,"Wedge G8, Biggs Fulcrum Chirrut Baze",1
"LordJarJar",0,1,135722,DR,"zzzDR zzHK-47 zBSF Sith Empire Trooper, zThrawn",1
"LordJarJar",1,1,90632,Carth,"zCarth Onasi, zMission zZaalbar zJuhani Canderous",1
"LordJarJar",0,1,76329,Phoenix,"Hera Kanan G9, Ezra Zeb G8, zSabine",1
"LordJarJar",1,0,75986,Wiggs,"Wedge G8, Biggs G8, zCLS zHan Leia G8",1
"LordJarJar",1,1,107022,zEP,"zzEP zzzVader Tarkin zDooku TFP",1
"LordJarJar",0,1,59802,padme,"Padme G9, GK G8, JKA 5* G8, Ahsoka G8, CW Chewbacca G8",0
"LordJarJar",0,1,47653,BH,"Bossk 3* G8, Boba G9, IG-88 G7, Greedo G6, The Mandalorian 3* G8",0
