Player,Offense,Defense,GP,Name,Squad,Viable
"Tzoid",1,0,108200,EP (Traya),"zzEP Traya G8 zzDN Sith Empire Trooper, zzzVader",1
"Tzoid",1,0,21396,SionSolo (Counter),"zSion",1
"Tzoid",1,1,75612,NS,"MT AV Daka Zombie Spirit G8",0
"Tzoid",1,0,63261,ShaakClones,"Shaak Ti 4* G8, Rex G8 Echo G9 Fives G8 Clone Sergeant,",0
"Tzoid",1,0,54085,Troopers,"Veers G8 Starck G8 DT 5* G8 Snowtrooper G8 Stormtrooper G8",0
"Tzoid",0,1,88841,Phoenix,"zHera Chopper zZeb zKanan Sabine 5*",0
"Tzoid",1,1,51347,Rogue1,"Jyn 5* G8 Chirrut G8 Baze 5* G8 K-2SO G8 Cassian G8",0
"Tzoid",1,0,7314,NestSolo (Counter),"Nest 5* G6",0
"Darthshmoe",1,1,103339,NS_Alt,"zzMT zAV Zombie zDaka Talia",1
"Darthshmoe",1,1,94303,JTR,"zzJTR Scav Rey, zBB-8 zR2-D2 Finn G9",1
"Darthshmoe",0,1,66865,Phoenix,"Hera G8 Chopper G8 zEzra Zeb G8 Kanan G8",1
"Darthshmoe",1,0,14845,SionSolo (Counter),"Sion G9",1
"Darthshmoe",0,1,102902,padme,"zzPadme zGK zJKA zAhsoka Fives 5* G8",0
"Darthshmoe",0,1,71932,DR,"zDR G8 HK-47 G9 BSF Sith Marauder 4* G8, zThrawn G9",0
"Darthshmoe",,,272012,HansMF,"Home One 6*, Han's MF 5*, HT 5* Biggs X-wing, Phantom 5* Ghost 5* Tie Adv 6*, Wedge X-wing 6*,",0
"Darthshmoe",1,1,79830,zEP,"zzEP zVader Tarkin G9 DT 5* G8 TFP 5* G8",0
"Darthshmoe",0,1,70110,BH,"zBossk 5* G8 Boba G9 Cad G9 Greedo G9 IG-88 G9",0
"Darthshmoe",1,0,68413,Wiggs,"Wedge 5* G8 Biggs G8 CLS zHan Leia G9",0
"Darthshmoe",0,1,69019,FO,"zKRU G8 Kylo Phasma G8 FOE 6* G9 FOO G8",0
"Darthshmoe",1,1,33713,Rogue1,"Jyn 5* G8 Chirrut 5* G8 Baze 5* G8 K-2SO 5* G8 Cassian 5* G8",0
"Darthshmoe",1,0,36544,QiraNest,"Qira 3* G9 zNest 4* HYoda 5*",0
"RedWolf",0,1,116106,padme,"zzPadme zGK zJKA zAhsoka zzC-3PO",1
"RedWolf",0,1,116582,DRMalak,"zzzDR zzHK-47 zBSF zzMalak Thrawn G9",1
"RedWolf",,,336989,Negotiator,"Negotiator 5* HT Anakin's Eta-2 Starfighter, Umbaran Starfighter, Ahsoka Tano's Jedi Starfighter, BTL-B Y-wing Starfighter, Clone Sergeant's ARC-170, Plo Koon's Jedi Starfighter,",1
"RedWolf",0,1,90833,Geonosians,"zzGBA Poggle Geo Soldier, Geo Spy, Sun Fac,",1
"RedWolf",0,1,104758,Grievous,"zzGG zB2 zB1 zDroideka zMagnaGuard",1
"RedWolf",1,1,102890,JTR,"zzzJTR Scav Rey, zBB-8 G9 zzR2-D2 Finn G8",1
"RedWolf",,,353762,Raddus,"Raddus 5* Sun Fac SF, Rey's Millennium Falcon, Poe Dameron's X-wing, Resistance X-wing, Biggs X-wing, Wedge X-wing, Phantom Ghost",1
"RedWolf",,,103305,Nute-OR,"zNute zDooku zJango zZaalbar zMission",1
"RedWolf",1,1,112353,Revan Offense,"zzzJKR zzGMY BS zJolee zzHYoda",1
"RedWolf",1,1,88444,Ewoks,"zChirpa Elder zPaploo zWicket Logray G8",1
"RedWolf",0,1,101707,BH,"zzBossk zBoba Dengar G8 Greedo IG-88",1
"RedWolf",0,1,108261,FO,"zzKRU zKylo FOE FOO FOST G9",1
"RedWolf",0,1,69723,Phoenix,"Hera G9 Ezra G8 Zeb G8 Kanan G8 Sabine G8",1
"RedWolf",1,0,91079,Wiggs,"Wedge G8 Biggs G8 zzzCLS Fulcrum Leia",1
"RedWolf",1,1,95587,Rogue1,"zJyn Chirrut Baze zK-2SO Cassian",1
"RedWolf",1,0,18601,NestSolo (Counter),"zNest",1
"RedWolf",1,0,17601,SionSolo (Counter),"zSion G9",1
"RedWolf",1,1,90012,NS,"zzMT G8 zzAV zDaka Zombie Spirit 6* G2",0
"RedWolf",,,356984,Executrix,"Executrix Tie Adv, Emperor's Shuttle, TIE Reaper, Imperial TIE Fighter, Gauntlet Starfighter, First Order SF TIE Fighter 6*, First Order TIE Fighter,",0
"RedWolf",1,0,83459,ShaakClones,"Shaak Ti, zRex zEcho G8 Fives G9 ARC Trooper G8,",0
"RedWolf",1,1,98984,zEP,"zzEP zzzVader Tarkin Krennic G6 TFP G9",0
"RedWolf",1,0,63729,Troopers,"Veers Starck G7 Range Trooper G7, Shoretrooper G7 Stormtrooper G7",0
"RedWolf",1,0,62107,Jawas,"Nebit G7 Jawa Engineer G7, Jawa Scavenger G8, Jawa G7 Dathcha G8",0
"This Is The Way",0,1,145354,padme,"zzPadme zGK zJKA zAhsoka zzC-3PO",1
"This Is The Way",0,1,93341,Geonosians,"zzGBA Poggle Geo Soldier, Geo Spy, Sun Fac,",1
"This Is The Way",0,1,136159,Grievous,"zzGG zB2 zB1 zDroideka zMagnaGuard",1
"This Is The Way",1,0,111188,Traya,"zzTraya zDN zSion zzEP zzThrawn",1
"This Is The Way",1,1,112646,JTR,"zzzJTR zScav Rey, zzBB-8 zzR2-D2 zFinn",1
"This Is The Way",,,375296,HansMF,"Home One, Han's MF, HT Biggs X-wing, Phantom Ghost Cassian's U-wing, Wedge X-wing,",1
"This Is The Way",0,1,127579,BH,"zzJango zzAurra zBoba zDengar zNest",1
"This Is The Way",1,1,96259,Ewoks,"zChirpa Elder zPaploo zWicket zLogray",1
"This Is The Way",1,0,105679,ShaakClones,"zzShaak Ti, zRex zEcho zzFives zARC Trooper,",1
"This Is The Way",0,1,119736,BH,"zzBossk zzEmbo zGreedo zIG-88 zZam",1
"This Is The Way",0,1,96103,FO,"zzKRU zKylo FOE FOO zFOST",1
"This Is The Way",1,0,109460,CLS,"zzzCLS zHan Leia zzOld Ben, zzChewbacca",1
"This Is The Way",0,1,76031,Phoenix,"Hera Chopper Ezra Zeb G9 Kanan G8",1
"This Is The Way",1,0,97037,Zader (Counter),"zzzVader zzWampa Tarkin Sidious Stormtrooper G8",1
"This Is The Way",1,0,70871,Jawas,"Nebit G8 Jawa Engineer G9, Jawa Scavenger G8, Jawa G9 Dathcha G8",1
"This Is The Way",0,1,49861,Qira,"Qira L3-37 4* G8 Vandor Chewbacca 3* G8, Mission 6* G8 Zaalbar G7",0
"This Is The Way",1,1,72851,NS,"MT G8 zAV Daka Zombie G8 Spirit G8",0
"This Is The Way",1,0,47768,Troopers,"Veers Starck 4* G5 Range Trooper 4* G7, Shoretrooper 3* G7 Snowtrooper G8",0
"This Is The Way",1,1,56288,Rogue1,"Jyn G8 Chirrut G8 Baze 3* G7 K-2SO G8 Cassian G8",0
"Esaascar",0,1,125391,padme,"zzPadme zGK zJKA zAhsoka zzC-3PO",1
"Esaascar",0,1,109406,Grievous,"zzGG zB2 zB1 zDroideka zMagnaGuard",1
"Esaascar",1,1,116168,JTR,"zzzJTR Scav Rey, zzBB-8 zzR2-D2 Finn",1
"Esaascar",1,1,110697,Revan Offense,"zzzJKR zGMY zBS zJolee HYoda",1
"Esaascar",1,1,84179,Ewoks,"zChirpa Elder Paploo zWicket Logray",1
"Esaascar",1,1,75964,Carth,"zCarth Onasi G9, Mission G9 Zaalbar G8 Juhani Canderous",1
"Esaascar",0,1,91582,BH,"zzBossk Boba Cad Dengar IG-88",1
"Esaascar",1,0,106883,CLS,"zzzCLS zHan Wedge Biggs zzChewbacca",1
"Esaascar",0,1,93505,FO,"zzKRU zKylo FOO FOST G9 FOTP",1
"Esaascar",1,1,95032,zEP,"zzEP zzzVader Tarkin Dooku TFP G8",1
"Esaascar",0,1,73505,Phoenix,"Hera G9 Chopper G9 Ezra Zeb G8 Kanan G9",1
"Esaascar",1,0,75105,Troopers,"zVeers Starck G9 Magma G8 Snowtrooper Stormtrooper",1
"Esaascar",1,0,20632,SionSolo (Counter),"zSion",1
"Esaascar",1,1,84955,NS,"zMT zzAV Daka Zombie Spirit G9",0
"Esaascar",0,1,77063,Geonosians,"zzGBA 4* Poggle G8 Geo Soldier, Geo Spy, Sun Fac G8,",0
"Esaascar",,,283307,Executrix,"Executrix Tie Adv, Emperor's Shuttle 4*, TIE Reaper 4*, Imperial TIE Fighter, Gauntlet Starfighter 6*, First Order SF TIE Fighter, First Order TIE Fighter,",0
"Esaascar",1,0,75775,ShaakClones,"Shaak Ti 4* G8, Rex Echo G9 zFives zARC Trooper G9,",0
"Esaascar",1,1,58397,Rogue1,"Jyn 5* G8 Chirrut G8 Baze 4* G7 Cassian G8 Bistan G8",0
"Esaascar",1,0,56544,Jawas,"Nebit G7 Jawa Engineer G9, Jawa Scavenger G8, Jawa 5* G8 Dathcha G7",0
"Lala",0,1,102561,padme,"zzPadme zGK zJKA zAhsoka zBarriss",1
"Lala",1,1,116691,JTR,"zzzJTR zScav Rey, zzBB-8 zzR2-D2 zFinn",1
"Lala",0,1,90612,Grievous,"zzGG B2 G8 MagnaGuard Dooku zT3-M4",1
"Lala",1,0,123909,CLS,"zzzCLS zHan zzChewbacca Thrawn C-3PO",1
"Lala",1,1,109443,Revan Offense,"zzzJKR zzGMY zBS zJolee Ezra",1
"Lala",1,1,91510,Ewoks,"zChirpa Elder zPaploo zWicket zLogray",1
"Lala",1,1,98744,Carth,"zCarth Onasi, zMission zZaalbar Juhani zCanderous",1
"Lala",0,1,111622,BH,"zzBossk zBoba zDengar zzJango zZam",1
"Lala",0,1,78332,Phoenix,"Hera Chopper Zeb Kanan Sabine G8",1
"Lala",1,0,76477,Wiggs,"Wedge G8 Biggs G8 Fulcrum Chirrut Baze",1
"Lala",1,0,16066,NestSolo (Counter),"Nest",1
"Lala",1,0,14367,SionSolo (Counter),"Sion G8",1
"Lala",1,1,73700,NS,"MT G8 zAV Daka G9 Zombie G7 Spirit G8",0
"Lala",1,0,64929,ShaakClones,"Shaak Ti 5* G7, Rex G8 Echo G7 Fives Clone Sergeant G9,",0
"Lala",0,1,75939,FO,"KRU Kylo FOO G8 FOST G9 FOTP",0
"Lala",1,0,86913,EP (Traya),"zEP Traya G8 DN Sith Empire Trooper 6* G8, zzzVader",0
"Newhawk",0,1,124108,padme,"zzPadme zGK zJKA zAhsoka zzC-3PO",1
"Newhawk",,,367009,HansMF,"Home One, Han's MF, HT Biggs X-wing, Phantom Ghost Cassian's U-wing, Bistan's U-wing,",1
"Newhawk",0,1,96046,Geonosians,"zzGBA Poggle Geo Soldier, Geo Spy, Sun Fac,",1
"Newhawk",1,1,106691,JTR,"zzzJTR Scav Rey G8, zzBB-8 zzR2-D2 zFinn",1
"Newhawk",1,1,88709,Ewoks,"zChirpa G9 Elder zPaploo zWicket zLogray",1
"Newhawk",1,1,91098,Revan Offense,"zzzJKR G8 zGMY BS zJolee G9 Ezra G8",1
"Newhawk",1,0,100096,ShaakClones,"zzShaak Ti, zRex zEcho zzFives ARC Trooper G8,",1
"Newhawk",0,1,97834,BH,"zzBossk zBoba Dengar Greedo Jango",1
"Newhawk",1,0,120396,CLS,"zzzCLS zHan Leia G8 Old Ben, zzChewbacca",1
"Newhawk",1,1,96277,NS,"zzMT zzAV zDaka Zombie Spirit G5",0
"Newhawk",0,1,91369,Grievous,"zGG zB2 G9 zB1 zDroideka MagnaGuard",0
"Newhawk",1,1,50067,Carth,"Carth Onasi 4* G6, Mission G7 Zaalbar G8 Juhani 5* G7 Canderous 3* G5",0
"Newhawk",1,1,73248,zEP,"EP G8 zzVader Tarkin G8 IPD 6* G7 TFP G8",0
"Newhawk",1,0,61661,Troopers,"Veers G9 Starck G6 Magma G7 Snowtrooper G6 Stormtrooper G9",0
"Newhawk",0,1,63946,Phoenix,"Hera G8 Chopper G9 Zeb G8 Kanan G8 Sabine 5* G7",0
"Newhawk",0,1,74439,FO,"zzKRU G9 Kylo G7 FOE FOO G8 FOTP G8",0
"Newhawk",1,0,8746,SionSolo (Counter),"Sion 5* G8",0
"Flat Taco",0,1,122211,DRMalak,"zzzDR zzHK-47 zBSF zzMalak zThrawn",1
"Flat Taco",1,1,84791,NS_Alt,"zMT zAV Zombie Daka Talia",1
"Flat Taco",0,1,99864,Geonosians,"zzGBA Poggle Geo Soldier, Geo Spy, Sun Fac,",1
"Flat Taco",1,1,95468,JTR,"zzJTR Scav Rey, zBB-8 zR2-D2 Finn",1
"Flat Taco",1,0,105786,Traya,"zzTraya zDN zSion zzEP zNest",1
"Flat Taco",1,1,108207,Revan,"zzzJKR BS zGMY zJolee GK",1
"Flat Taco",1,1,84235,Carth,"zCarth Onasi, zMission zZaalbar Juhani G8 Canderous",1
"Flat Taco",0,1,98955,BH,"zzBossk Boba Cad Greedo zJango",1
"Flat Taco",0,1,81096,FO,"zKRU Kylo FOE FOO FOST G8",1
"Flat Taco",1,0,92360,Wiggs,"Wedge Biggs zCLS zHan zChewbacca",1
"Flat Taco",0,1,67213,Phoenix,"Hera G8 Chopper G8 Ezra G9 Zeb G8 Kanan G8",1
"Squirty",,,120208,GL Rey,"zzzzzRey Holdo zGK zResistance Hero Poe, zResistance Hero Finn,",1
"Squirty",1,1,99901,NestSisters,"zzAV zMT zDaka Zombie zNest",1
"Squirty",,,374081,HansMF,"Home One, Han's MF, HT Biggs X-wing, Phantom Ghost Cassian's U-wing, Bistan's U-wing,",1
"Squirty",0,1,93996,Geonosians,"zzGBA Poggle Geo Soldier, Geo Spy, Sun Fac,",1
"Squirty",0,1,109522,Grievous,"zGG zB2 zB1 zDroideka MagnaGuard",1
"Squirty",1,1,138977,JTR,"zzzJTR Scav Rey, zBB-8 zzR2-D2 Finn",1
"Squirty",1,0,113106,CLS,"zzCLS zHan zChewbacca zThrawn zzC-3PO",1
"Squirty",1,1,104849,Revan Offense,"zzJKR zGMY HYoda zJolee zJKA",1
"Squirty",1,1,84275,Carth,"Carth Onasi, Mission Zaalbar Juhani G8 Canderous",1
"Squirty",0,1,94665,BH,"zBossk zBoba Cad Dengar G9 Greedo",1
"Squirty",1,1,98921,zEP,"zzEP zzzVader Tarkin DT TFP",1
"Squirty",0,1,98284,FO,"zzKRU zKylo FOE FOO FOST",1
"Squirty",0,1,71865,Phoenix,"Hera G8 Ezra Zeb G8 Kanan G8 Sabine G8",1
"Squirty",1,0,73066,Troopers,"zVeers Starck G9 Shoretrooper G8 Snowtrooper G9 Stormtrooper G8",1
"Squirty",1,0,13324,SionSolo (Counter),"Sion G8",1
"Squirty",0,1,105608,DRMalak,"zzzDR zHK-47 zBSF zzMalak SiT 6* G8",0
"Squirty",,,335209,Executrix,"Executrix Tie Adv, Emperor's Shuttle 5*, TIE Reaper, Imperial TIE Fighter, Gauntlet Starfighter, First Order SF TIE Fighter, First Order TIE Fighter,",0
"Squirty",1,1,73432,GAS,"GAS 6* G8 zRex Echo G9 Fives G9 ARC Trooper G8,",0
"Squirty",1,1,76984,Ewoks,"zChirpa Elder Paploo 6* Wicket Logray G9",0
"Squirty",1,1,66981,Rogue1,"Jyn G8 Chirrut G8 Baze G7 K-2SO G8 Cassian G8",0
"Squirty",1,0,46912,Jawas,"Nebit G7 Jawa Engineer G7, Jawa Scavenger G7, Jawa G8 Dathcha G7",0
"TorenCalduris",0,1,122765,padme,"zzPadme zGK zJKA zAhsoka zzC-3PO",1
"TorenCalduris",1,1,97675,NS_Alt,"zzMT zzAV Zombie Daka Talia",1
"TorenCalduris",0,1,109439,DR,"zzzDR zzHK-47 zBSF Sith Assassin G8, zThrawn",1
"TorenCalduris",,,405566,HansMF,"Home One, Han's MF, HT Biggs X-wing, Phantom Ghost Cassian's U-wing, Bistan's U-wing,",1
"TorenCalduris",0,1,95806,Geonosians,"zzGBA Poggle Geo Soldier, Geo Spy, Sun Fac,",1
"TorenCalduris",0,1,136524,Grievous,"zzGG zB2 zB1 zDroideka MagnaGuard",1
"TorenCalduris",1,1,103031,JTR,"zzJTR Scav Rey, zBB-8 zzR2-D2 Finn",1
"TorenCalduris",,,99685,Nute-OR,"zNute zDooku zJango zZaalbar zMission",1
"TorenCalduris",1,1,122872,GAS,"zzzzGAS zRex zEcho zzFives zARC Trooper,",1
"TorenCalduris",1,1,110112,Revan Offense,"zzzJKR zGMY zBS zJolee zHYoda",1
"TorenCalduris",1,1,86839,Ewoks,"zChirpa Elder Paploo Scout Wicket",1
"TorenCalduris",0,1,99412,BH,"zzBossk Boba Dengar Greedo IG-88",1
"TorenCalduris",1,1,104800,zEP,"zzEP zzzVader Tarkin DT TFP",1
"TorenCalduris",0,1,86606,FO,"zKRU zKylo FOE FOO FOST G9",1
"TorenCalduris",1,0,84849,Troopers,"zVeers Starck Range Trooper G9, Shoretrooper Snowtrooper",1
"TorenCalduris",1,0,112021,CLS,"zzzCLS zHan Wedge Biggs zzChewbacca",1
"TorenCalduris",0,1,75777,Phoenix,"Hera G9 zEzra Zeb G8 Kanan G8 Sabine G8",1
"TorenCalduris",1,1,83171,Rogue1,"zJyn Chirrut G9 Baze K-2SO G9 zCassian",1
"TorenCalduris",1,0,70453,Jawas,"Nebit G8 Jawa Engineer G9, Jawa Scavenger G8, Jawa G9 Dathcha G9",1
"TorenCalduris",1,0,20190,SionSolo (Counter),"zSion",1
"TorenCalduris",1,0,16731,NestSolo (Counter),"Nest",1
"TorenCalduris",,,364577,Executrix,"Executrix Tie Adv, Emperor's Shuttle, TIE Reaper, Imperial TIE Fighter, Gauntlet Starfighter, First Order SF TIE Fighter 3*, First Order TIE Fighter,",0
