Player,Offense,Defense,GP,Name,Squad,Viable
"DarkKnightDan80",1,1,100233,NS,"zzMT zzAV zDaka Zombie Spirit",1
"DarkKnightDan80",0,1,128408,padme,"zzPadme zGK zJKA zAhsoka zzC-3PO",1
"DarkKnightDan80",,,443250,Negotiator,"Negotiator HT Anakin's Eta-2 Starfighter, Umbaran Starfighter, Ahsoka Tano's Jedi Starfighter, BTL-B Y-wing Starfighter, Clone Sergeant's ARC-170, Plo Koon's Jedi Starfighter",1
"DarkKnightDan80",0,1,112676,DR,"zzzDR zzHK-47 zBSF Sith Empire Trooper, Sith Assassin",1
"DarkKnightDan80",0,1,93436,Geonosians,"zzGBA Poggle Geo Soldier, Geo Spy, Sun Fac",1
"DarkKnightDan80",,,434076,HansMF,"Home One, Han's MF, Biggs X-wing, Bistan's U-wing, Phantom Ghost Cassian's U-wing, Wedge X-wing",1
"DarkKnightDan80",1,0,129307,Traya,"zzTraya zDN zSion zzEP zzThrawn",1
"DarkKnightDan80",0,1,98491,Grievous,"zzGG B2 zB1 Droideka MagnaGuard",1
"DarkKnightDan80",1,1,111329,JTR,"zzJTR zScav Rey, zzBB-8 zzR2-D2 zFinn",1
"DarkKnightDan80",1,1,142229,Revan Offense,"zzzJKR zGMY zBS zJolee zzHYoda",1
"DarkKnightDan80",1,1,96259,Ewoks,"zChirpa Elder zPaploo zWicket zLogray",1
"DarkKnightDan80",1,0,98026,ShaakClones,"zzShaak Ti, zRex Echo zFives ARC Trooper",1
"DarkKnightDan80",0,1,111822,BH,"zzBossk zGreedo zBoba zDengar zzJango",1
"DarkKnightDan80",1,1,88356,Carth,"zCarth Onasi, Mission Zaalbar Juhani Canderous",1
"DarkKnightDan80",0,1,132139,FO,"zzKRU zKylo FOE zFOST FOO",1
"DarkKnightDan80",1,0,108908,CLS,"zzzCLS zHan Leia zOld Ben, zzChewbacca",1
"DarkKnightDan80",0,1,100005,Phoenix,"zHera zZeb zKanan zEzra zSabine",1
"DarkKnightDan80",1,0,87103,Troopers,"zVeers zStarck DT Stormtrooper Snowtrooper",1
"DarkKnightDan80",1,0,86635,Jawas,"Nebit Jawa Engineer, Jawa Scavenger, Jawa Dathcha",1
"DarkKnightDan80",1,0,19848,NestSolo (Counter),"zNest",1
"DarkKnightDan80",,,390717,Executrix,"Executrix Tie Adv, Emperor's Shuttle, TIE Reaper 3*, Imperial TIE Fighter, Gauntlet Starfighter, First Order SF TIE Fighter, First Order TIE Fighter",0
"DarkKnightDan80",1,1,82668,Rogue1,"Jyn Chirrut Baze 5* G8, K-2SO Cassian",0
"DarkKnightDan80",1,0,84872,zMaul,"Maul Dooku Sidious Savage Sith Marauder",0
"Sal",0,1,137392,DRMalak,"zzzDR zzHK-47 zBSF zzMalak Sith Empire Trooper",1
"Sal",0,1,113087,padme,"zzPadme G8, zGK zJKA zAhsoka zzC-3PO",1
"Sal",,,404361,HansMF,"Home One, Han's MF 6*, HT Biggs X-wing, Phantom Ghost Cassian's U-wing, Bistan's U-wing",1
"Sal",1,0,114235,Traya,"zzTraya zzDN zSion zzEP zzThrawn",1
"Sal",1,1,114313,JTR,"zzzJTR Scav Rey, zzBB-8 zzR2-D2 zFinn",1
"Sal",1,1,127348,Revan Offense,"zzzJKR zzGMY zBS zJolee zzHYoda",1
"Sal",1,1,95096,Ewoks,"zChirpa Elder zPaploo Scout zWicket",1
"Sal",1,1,107245,Carth,"zCarth Onasi, zMission zZaalbar zJuhani zCanderous",1
"Sal",0,1,110517,BH,"zzBossk zGreedo zBoba Cad zzJango",1
"Sal",1,0,129200,Wiggs,"Wedge Biggs zzzCLS zHan zzChewbacca",1
"Sal",0,1,76977,Phoenix,"Hera G9, Zeb G9, Kanan Ezra Sabine",1
"Sal",0,1,76986,Geonosians,"GBA G9, Poggle Geo Soldier, Geo Spy, Sun Fac G8",0
"Sal",0,1,66452,Grievous-Wat,"zzGG B2 G7, B1 4* G9, MagnaGuard G8, Wat Tambor 4* G8",0
"Sal",,,71891,Mon Mothma,"Mon Mothma 3* G8, Hoth Rebel Scout G8, Chirrut G8, Pao G8, Lando",0
"Sal",1,1,66203,NS,"MT G8, AV Daka G7, Zombie 6* G8, Spirit G8",0
"Sal",1,0,77314,ShaakClones,"Shaak Ti 4* G8, zRex Echo Fives Clone Sergeant",0
"Sal",1,0,63634,Troopers,"Veers Starck G7, Range Trooper 4* G6, Shoretrooper Snowtrooper G8",0
"Sal",0,1,69333,FO,"KRU 4* G8, Kylo FOTP FOST G9, FOO",0
"Sal",1,0,62334,Jawas,"Nebit G8, Jawa Engineer 6* G9, Jawa Scavenger G7, Jawa G9, Dathcha G7",0
"Sal",1,0,7303,NestSolo (Counter),"Nest 3* G7",0
"Esaascar",0,1,134857,padme,"zzPadme zGK zJKA zAhsoka zzC-3PO",1
"Esaascar",0,1,109884,DRMalak,"zzzDR zzHK-47 zBSF zzMalak Sith Empire Trooper G8",1
"Esaascar",,,442036,Negotiator,"Negotiator 6* HT Anakin's Eta-2 Starfighter, Umbaran Starfighter, Ahsoka Tano's Jedi Starfighter, Clone Sergeant's ARC-170, Plo Koon's Jedi Starfighter, Rex's ARC-170",1
"Esaascar",0,1,100746,Geonosians,"zzGBA Poggle Geo Soldier, Geo Spy, Sun Fac",1
"Esaascar",0,1,120166,Grievous,"zzGG zB2 zB1 zDroideka zMagnaGuard",1
"Esaascar",1,1,118625,JTR,"zzzJTR Scav Rey, zzBB-8 zzR2-D2 Finn",1
"Esaascar",1,1,117746,Revan Offense,"zzzJKR zGMY zBS zJolee zHYoda",1
"Esaascar",1,1,84140,Ewoks,"zChirpa Elder Paploo zWicket Logray",1
"Esaascar",1,1,94505,Carth,"zCarth Onasi, zMission zZaalbar Juhani zCanderous",1
"Esaascar",0,1,98280,BH,"zzBossk Boba Dengar Cad zzJango",1
"Esaascar",1,1,103675,zEP,"zzEP zzzVader Tarkin TFP G8, zzTraya",1
"Esaascar",1,0,107627,CLS,"zzzCLS zHan Wedge Biggs zzChewbacca",1
"Esaascar",0,1,95518,FO,"zzKRU zKylo FOTP FOST FOO",1
"Esaascar",0,1,73542,Phoenix,"Hera Chopper Zeb G8, Kanan G9, Ezra",1
"Esaascar",1,0,75512,Troopers,"zVeers Starck G9, Magma G9, Stormtrooper Snowtrooper",1
"Esaascar",1,0,21048,SionSolo (Counter),"zSion",1
"Esaascar",1,1,92155,NS,"zMT zzAV zDaka Zombie Spirit G9",0
"Esaascar",,,291338,Executrix,"Executrix Tie Adv, Emperor's Shuttle 4*, TIE Reaper 4*, Imperial TIE Fighter, Gauntlet Starfighter 6*, First Order SF TIE Fighter, First Order TIE Fighter",0
"Esaascar",,,68721,Mon Mothma,"zzMon Mothma 4* G8, Bistan G8, Chirrut G8, Lando G9, K-2SO G8",0
"Esaascar",1,1,99869,GAS,"zzzzGAS 5* G8, zRex zEcho zzFives zARC Trooper G9",0
"Esaascar",1,0,57649,Jawas,"Nebit G7, Jawa Engineer G9, Jawa Scavenger G8, Jawa 6* G8, Dathcha G7",0
"KingZach",1,1,92839,NS,"zzMT zzAV Daka Zombie Spirit",1
"KingZach",,,150801,JMLS,"zzzzzzJMLS zzJKL zzHYoda zzOld Ben, zEzra",1
"KingZach",0,1,126610,padme,"zzPadme zGK zJKA zAhsoka zzC-3PO",1
"KingZach",0,1,101412,DR,"zzzDR zHK-47 zBSF Sith Empire Trooper G8, zThrawn",1
"KingZach",,,448038,HansMF,"Home One, Han's MF, HT Biggs X-wing, Phantom Ghost Cassian's U-wing, Bistan's U-wing",1
"KingZach",1,1,117668,JTR,"zzzJTR Scav Rey, zBB-8 zzR2-D2 RT",1
"KingZach",1,0,105069,Traya,"zzTraya zDN zSion zzEP zNest",1
"KingZach",,,87903,Mon Mothma,"zzMon Mothma, Hoth Rebel Scout, Chirrut G8, Pao G8, Baze G8",1
"KingZach",1,1,86600,Ewoks,"zChirpa Elder Paploo zWicket zLogray",1
"KingZach",0,1,90434,BH,"zBossk Greedo Boba Dengar G9, IG-88",1
"KingZach",1,1,80629,Carth,"zCarth Onasi, Mission G8, Zaalbar G8, Juhani zCanderous",1
"KingZach",1,0,82069,Troopers,"zVeers zStarck G9, DT Range Trooper G9, Snowtrooper",1
"KingZach",1,0,138381,Wiggs,"Wedge Biggs zzzCLS zHan zzChewbacca",1
"KingZach",0,1,79791,FO,"zKRU zKylo FOE G9, FOTP G9, FOO G9",1
"KingZach",0,1,80926,Phoenix,"Hera Chopper Zeb Kanan Sabine",1
"KingZach",0,1,66108,Geonosians,"GBA 4* G8, Poggle G8, Geo Soldier G8, Geo Spy G7, Sun Fac G7",0
"KingZach",0,1,109123,Grievous,"GG G9, zB2 zB1 zDroideka zMagnaGuard",0
"KingZach",,,328294,Executrix,"Executrix Tie Adv, Emperor's Shuttle, TIE Reaper, Imperial TIE Fighter, Gauntlet Starfighter, First Order SF TIE Fighter 6*, First Order TIE Fighter",0
"KingZach",1,1,84760,GAS,"zzzzGAS 5* G9, zRex Echo G9, zzFives G8, ARC Trooper 4* G8",0
"KingZach",1,0,61085,Jawas,"Nebit G8, Jawa Engineer G8, Jawa Scavenger G7, Jawa G7, Dathcha",0
"Wolfie",0,1,111035,padme,"zzPadme zGK zJKA zAhsoka zzC-3PO",1
"Wolfie",0,1,104575,DR,"zzzDR zzHK-47 zBSF Sith Empire Trooper G8, Thrawn G8",1
"Wolfie",,,377595,Negotiator,"Negotiator HT Anakin's Eta-2 Starfighter, Umbaran Starfighter, Ahsoka Tano's Jedi Starfighter, Clone Sergeant's ARC-170, Jedi Consular's Starfighter, Plo Koon's Jedi Starfighter",1
"Wolfie",0,1,89809,Geonosians,"zzGBA Poggle Geo Soldier, Geo Spy, Sun Fac G8",1
"Wolfie",1,1,106544,JTR,"zzzJTR zScav Rey, BB-8 G9, zzR2-D2 zFinn",1
"Wolfie",1,1,128332,Revan Offense,"zzzJKR zzGMY zBS zJolee zEzra G8",1
"Wolfie",1,1,104217,Ewoks,"zChirpa Elder zPaploo Teebo zWicket",1
"Wolfie",1,1,107798,Carth,"zCarth Onasi, zMission zZaalbar zJuhani zCanderous",1
"Wolfie",0,1,110699,BH,"zzBossk zBoba Cad zzJango zIG-88",1
"Wolfie",1,0,103861,CLS,"zzzCLS zHan Leia Old Ben G9, zzChewbacca",1
"Wolfie",1,0,13249,SionSolo (Counter),"Sion G8",1
"Wolfie",0,1,71718,Grievous,"GG B2 G8, Nute G9, Dooku G8, T3-M4 G7",0
"Wolfie",1,1,78438,NS_Alt,"MT G8, AV Zombie Talia G8, Daka",0
"Wolfie",,,60994,Mon Mothma,"Mon Mothma 3* G7, Bistan G8, Hoth Rebel Scout G8, Chirrut G8, Baze G8",0
"Wolfie",1,0,81985,ShaakClones,"zzShaak Ti G9, zRex G8, Echo G9, zFives ARC Trooper G8",0
"Wolfie",1,1,100867,zEP,"zEP zzzVader zzTarkin TFP G8, Traya G8",0
"Wolfie",0,1,78070,Phoenix,"zHera G8, Chopper zZeb zKanan G8, Sabine 6* G8",0
"Wolfie",0,1,63762,FO,"KRU G8, Kylo G9, FOTP G8, FOST G8, FOO G8",0
"Wolfie",1,0,6694,NestSolo (Counter),"Nest 3* G7",0
"Newhawk",0,1,135310,padme,"zzPadme zGK zJKA zAhsoka zzC-3PO",1
"Newhawk",,,485011,Negotiator,"Negotiator HT Anakin's Eta-2 Starfighter, Umbaran Starfighter, Ahsoka Tano's Jedi Starfighter, Clone Sergeant's ARC-170, Plo Koon's Jedi Starfighter, Rex's ARC-170",1
"Newhawk",0,1,95932,Geonosians,"zzGBA Poggle Geo Soldier, Geo Spy, Sun Fac",1
"Newhawk",,,360740,HansMF,"Home One, Han's MF, Biggs X-wing, Bistan's U-wing, Phantom Ghost Cassian's U-wing, Wedge X-wing",1
"Newhawk",0,1,109997,Grievous,"zzGG zB2 zB1 zDroideka zMagnaGuard",1
"Newhawk",1,1,107609,JTR,"zzzJTR Scav Rey, zzBB-8 zzR2-D2 zFinn",1
"Newhawk",1,1,147957,GAS,"zzzzGAS zRex zEcho zzFives zARC Trooper",1
"Newhawk",1,1,103523,Revan Offense,"zzzJKR zGMY zBS zJolee zEzra G8",1
"Newhawk",1,1,88369,Ewoks,"zChirpa G9, Elder zPaploo zWicket zLogray",1
"Newhawk",0,1,103067,BH,"zzBossk zBoba Dengar zzJango IG-88",1
"Newhawk",1,1,91689,Carth,"zCarth Onasi, zMission zZaalbar zJuhani G8, zCanderous",1
"Newhawk",1,1,96673,zEP,"zzEP zzzVader Tarkin G8, TFP G8, zBSF",1
"Newhawk",0,1,79662,FO,"zzKRU zKylo G8, FOE FOTP G8, FOO G8",1
"Newhawk",1,0,120368,CLS,"zzzCLS zHan Leia G8, Old Ben, zzChewbacca",1
"Newhawk",1,0,14709,SionSolo (Counter),"Sion G8",1
"Newhawk",1,1,96318,NS,"zzMT zzAV zDaka Zombie Spirit G5",0
"Newhawk",1,0,61661,Troopers,"Veers G9, Starck G6, Magma G7, Stormtrooper G9, Snowtrooper G6",0
"Newhawk",0,1,67927,Phoenix,"Hera G8, Chopper G9, zZeb G8, Kanan G8, Sabine 5* G7",0
"Jameg",0,1,93849,padme,"zzPadme G9, zGK JKA zAhsoka CW Chewbacca G8",1
"Jameg",1,1,133764,Revan Offense,"zzzJKR zzGMY zBS zJolee zEzra",1
"Jameg",0,1,115991,BH,"zzBossk zGreedo zBoba zzJango zIG-88",1
"Jameg",1,0,121012,CLS,"zzzCLS zHan zLeia Old Ben G9, zzChewbacca",1
"Jameg",0,1,85122,Phoenix,"zHera Chopper Zeb G8, zKanan zSabine G8",1
"Jameg",0,1,113752,DR,"zzzDR zzHK-47 zBSF Sith Empire Trooper 6* G8, zzThrawn",0
"Jameg",1,0,77463,Traya,"Traya G8, DN 4* G8, Sion 3* G8, zDooku zEP",0
"Jameg",,,62191,Mon Mothma,"Mon Mothma 3* G6, Bodhi Rook G8, Biggs G8, Wedge K-2SO G8",0
"Jameg",1,1,80052,Carth,"zCarth Onasi, Mission G8, Zaalbar G8, zJuhani Canderous G7",0
"Jameg",1,1,73783,Ewoks,"Chirpa G9, Elder Paploo Teebo G8, Scout",0
"Jameg",1,0,69695,Clones,"Cody G8, Rex Echo 6* G9, Fives G8, Clone Sergeant G8",0
"Jameg",0,1,69709,FO,"KRU G8, Kylo G9, Phasma G8, FOTP G8, FOO G8",0
"Syn",0,1,100602,padme,"zzPadme GK zJKA zAhsoka zzC-3PO G8",1
"Syn",1,1,98049,NS_Alt,"zzMT zAV Zombie Talia Daka",1
"Syn",,,326944,Negotiator,"Negotiator HT Anakin's Eta-2 Starfighter, Umbaran Starfighter, Ahsoka Tano's Jedi Starfighter, Clone Sergeant's ARC-170, Plo Koon's Jedi Starfighter, Rex's ARC-170",1
"Syn",0,1,74160,Grievous,"zzGG B2 G8, B1 Droideka G9, MagnaGuard G8",1
"Syn",1,1,107485,JTR,"zzzJTR zScav Rey, zBB-8 zzR2-D2 Finn",1
"Syn",,,96260,Nute-OR,"zNute Dooku Jango zZaalbar zMission",1
"Syn",1,1,112714,Revan Offense,"zzzJKR zGMY zBS zJolee HYoda G9",1
"Syn",1,1,92679,Ewoks,"zChirpa Elder zPaploo zWicket zLogray",1
"Syn",0,1,94587,BH,"zBossk Greedo Boba Dengar IG-88",1
"Syn",1,1,104690,zEP,"zzEP zVader Tarkin TFP zBSF",1
"Syn",0,1,86858,FO,"zzKRU zKylo FOE G9, FOTP FOST G8",1
"Syn",0,1,72952,Phoenix,"Hera G8, Zeb G8, Kanan G8, zEzra Sabine G8",1
"Syn",1,0,92416,Wiggs,"Wedge Biggs zzCLS zHan Leia",1
"Syn",1,0,81821,Wampa (Counter),"Rex zzWampa DT G9, Visas G8, Jyn G8",1
"Syn",1,0,18076,SionSolo (Counter),"Sion",1
"Syn",1,0,15468,NestSolo (Counter),"Nest",1
"Syn",,,332701,HansMF,"Home One, Han's MF, Biggs X-wing, Bistan's U-wing 6*, Phantom Ghost Cassian's U-wing, Wedge X-wing",0
"Syn",0,1,86904,Geonosians,"zGBA Poggle Geo Soldier, Geo Spy, Sun Fac",0
"Syn",1,0,57055,Troopers,"Veers Starck G8, Shoretrooper G8, Stormtrooper G5, Snowtrooper G8",0
"Syn",1,0,98048,zMaul,"Maul DN zzzDR Sidious Savage",0
"LordJarJar",0,1,142634,DR,"zzzDR zzHK-47 zBSF Sith Empire Trooper, zThrawn",1
"LordJarJar",1,1,107869,Revan Offense,"zzJKR zGMY zBS zJolee JKA",1
"LordJarJar",1,1,90429,Carth,"zCarth Onasi, zMission zZaalbar zJuhani Canderous",1
"LordJarJar",1,1,114509,zEP,"zzEP zzzVader zTarkin TFP zDN",1
"LordJarJar",0,1,76715,Phoenix,"Hera Zeb G8, Kanan G9, Ezra zSabine",1
"LordJarJar",1,0,76663,Wiggs,"Wedge G8, Biggs G8, zCLS zHan Leia G8",1
"LordJarJar",1,0,84807,Troopers,"zVeers Starck Magma G7, Stormtrooper Snowtrooper G8",1
"LordJarJar",1,1,67695,Ewoks,"zChirpa 5* G8, Elder Paploo Wicket 6* Logray 5* G9",0
"LordJarJar",0,1,65536,BH,"Bossk 4* G8, Greedo G8, The Mandalorian 5* G8, Boba G9, Cad G8",0
"LordJarJar",1,0,113601,zMaul,"Maul zDooku zSidious zSavage Sith Marauder",0
"LordJarJar",0,1,58722,FO,"KRU G8, Kylo Phasma G8, FOTP G8, FOO G8",0
"LordJarJar",1,0,9277,SionSolo (Counter),"Sion 3* G8",0
"Scuba Bill23",0,1,113985,DRMalak,"zzzDR zzHK-47 zBSF zzMalak Sith Empire Trooper",1
"Scuba Bill23",0,1,118325,padme,"zzPadme zGK zJKA zAhsoka zzC-3PO",1
"Scuba Bill23",,,430075,Negotiator,"Negotiator HT Anakin's Eta-2 Starfighter, Umbaran Starfighter, Ahsoka Tano's Jedi Starfighter, BTL-B Y-wing Starfighter, Clone Sergeant's ARC-170, Plo Koon's Jedi Starfighter",1
"Scuba Bill23",,,282818,HansMF,"Home One, Han's MF, Biggs X-wing, Bistan's U-wing, Phantom Ghost Cassian's U-wing, Wedge X-wing",1
"Scuba Bill23",0,1,108161,Grievous,"zzGG zB2 zB1 zDroideka zMagnaGuard",1
"Scuba Bill23",1,1,131487,GAS,"zzzzGAS zRex zEcho zzFives zARC Trooper",1
"Scuba Bill23",1,1,97475,Revan Offense,"zzzJKR zGMY BS zJolee HYoda",1
"Scuba Bill23",1,1,78280,Ewoks,"zChirpa Elder Paploo Wicket Logray",1
"Scuba Bill23",0,1,92174,BH,"zBossk Boba Dengar G9, Cad Jango",1
"Scuba Bill23",1,1,84999,Carth,"zCarth Onasi, zMission zZaalbar Juhani G8, zCanderous",1
"Scuba Bill23",1,1,109803,zEP,"zzEP zzzVader zzTarkin zKrennic TFP G8",1
"Scuba Bill23",0,1,71657,Phoenix,"Hera Zeb G9, Kanan Ezra Sabine G8",1
"Scuba Bill23",1,0,92495,zMaul,"zMaul zDooku zSidious Savage Sith Marauder",1
"Scuba Bill23",1,0,15490,SionSolo (Counter),"Sion G9",1
"Scuba Bill23",1,1,68060,JTR,"JTR G8, zzR2-D2 BB-8 G9, Resistance Hero Finn 5* G8, Resistance Hero Poe G9",0
"Scuba Bill23",,,325532,Executrix,"Executrix Tie Adv, Emperor's Shuttle 6*, TIE Reaper, Imperial TIE Fighter, Gauntlet Starfighter, First Order SF TIE Fighter 5*, First Order TIE Fighter",0
"Scuba Bill23",1,0,71317,Wiggs,"Wedge G1, Biggs G8, zCLS zHan Fulcrum G9",0
"Scuba Bill23",1,0,83451,Troopers,"zVeers zStarck DT zzAdmiral Piett 6*, Snowtrooper G3",0
"Scuba Bill23",0,1,67397,FO,"KRU Kylo G9, FOSFTP G8, FOST G8, FOO",0
"Hollow Child",0,1,114457,padme,"zzPadme zGK JKA zAhsoka zC-3PO",1
"Hollow Child",0,1,115485,DRMalak,"zzzDR zHK-47 zBSF zzMalak Sith Empire Trooper G8",1
"Hollow Child",1,1,104978,NS_Alt,"zzMT zAV Zombie Talia Daka",1
"Hollow Child",,,394117,HansMF,"Home One, Han's MF, HT Biggs X-wing, Phantom Ghost Cassian's U-wing, Bistan's U-wing",1
"Hollow Child",1,1,94860,JTR,"zzJTR zzR2-D2 zBB-8 Resistance Hero Finn G8, Resistance Hero Poe G8",1
"Hollow Child",0,1,94555,Geonosians,"zzGBA Poggle Geo Soldier, Geo Spy, Sun Fac",1
"Hollow Child",0,1,110688,Grievous,"zzGG zB2 zB1 zDroideka MagnaGuard",1
"Hollow Child",1,1,109642,Revan Offense,"zzzJKR zGMY zBS zJolee HYoda",1
"Hollow Child",1,1,87377,Ewoks,"zChirpa G9, Elder zPaploo zWicket zLogray G9",1
"Hollow Child",1,0,108363,ShaakClones,"zzShaak Ti, zRex zEcho zFives zARC Trooper",1
"Hollow Child",1,1,94831,Carth,"zCarth Onasi, zMission zZaalbar zJuhani Canderous",1
"Hollow Child",0,1,94708,BH,"zzBossk Greedo Boba Dengar G8, Zam",1
"Hollow Child",1,1,113220,zEP,"zzEP zzVader zTarkin TFP zDN",1
"Hollow Child",0,1,120957,FO,"zzKRU zKylo FOE FOO zHux",1
"Hollow Child",0,1,84124,Phoenix,"Hera Zeb G8, Kanan Ezra zSabine",1
"Hollow Child",1,0,96071,CLS,"zzCLS zHan Leia Old Ben G9, zChewbacca",1
"Hollow Child",1,1,71351,Rogue1,"Jyn G8, Chirrut G8, Baze G8, K-2SO G8, Cassian G9",1
"Hollow Child",1,0,20119,SionSolo (Counter),"zSion",1
"Hollow Child",1,0,18858,NestSolo (Counter),"zNest",1
"Hollow Child",,,362200,Executrix,"Executrix Tie Adv, Emperor's Shuttle 4*, TIE Reaper 4*, Imperial TIE Fighter, Gauntlet Starfighter, First Order SF TIE Fighter 5*, First Order TIE Fighter",0
"Hollow Child",,,64097,Mon Mothma,"Mon Mothma 5* G8, Bistan G8, Hoth Rebel Scout G8, Pao G8, Lando",0
"Hollow Child",1,0,58747,Troopers,"Veers G8, Starck G7, DT G8, Range Trooper 4* G7, Snowtrooper G8",0
"Hollow Child",1,0,67295,Thragma (Counter),"zThrawn Magma G8, Krennic 6* G8, Stormtrooper G8, Shoretrooper 5* G7",0
"Hollow Child",0,1,80609,BH,"Jango The Mandalorian G8, Cad IG-88 Aurra G8",0
"Hollow Child",1,0,95948,zMaul,"Maul zDooku zSidious zSavage Sith Marauder",0
"Hollow Child",1,0,65035,Jawas,"Nebit G8, Jawa Engineer 6* G8, Jawa Scavenger G7, Jawa G8, Dathcha",0
"Jollyrogercjf",0,1,105010,padme,"zzPadme zGK zJKA zAhsoka C-3PO",1
"Jollyrogercjf",1,1,75957,Ewoks,"zChirpa G9, Elder Paploo Wicket Logray",1
"Jollyrogercjf",0,1,85826,BH,"zBossk Boba Dengar G9, Cad IG-88",1
"Jollyrogercjf",0,1,62501,Phoenix,"Hera G8, Chopper G8, Zeb G8, Kanan G8, Ezra G8",1
"Jollyrogercjf",1,0,73775,CLS,"zzCLS G8, Han Leia G9, Old Ben G8, Chewbacca G8",1
"Jollyrogercjf",,,244058,HansMF,"Home One 6*, Han's MF 6*, HT 6* Biggs X-wing, Phantom Ghost Cassian's U-wing 4*, Rey's Millennium Falcon 4*",0
"Jollyrogercjf",1,1,71426,NS,"MT G9, zAV zDaka G9, Zombie Spirit 5* G8",0
"Jollyrogercjf",0,1,67626,Geonosians,"zGBA G9, Poggle G9, Geo Soldier G9, Geo Spy G9, Sun Fac G8",0
"Jollyrogercjf",0,1,75071,Grievous,"GG G8, B2 Droideka G8, MagnaGuard G9, Dooku",0
"Jollyrogercjf",1,1,65778,zEP,"EP G9, Vader Tarkin G9, DT 5* G8, TFP G9",0
"Jollyrogercjf",1,0,37814,Clones,"Cody 5* G8, Rex 5* G8, Echo 5* G8, Fives G8, Clone Sergeant 5* G8",0
"Jollyrogercjf",0,1,63735,FO,"zKRU G8, Kylo G8, Phasma G8, FOST 6* G9, FOO G9",0
"Jollyrogercjf",1,1,34278,Rogue1,"Jyn 5* G8, Chirrut 5* G8, Baze 5* G8, K-2SO 5* G8, Cassian 5* G8",0
"Upgreyd",1,1,125658,NS,"zzMT zAV zDaka Zombie Spirit",1
"Upgreyd",0,1,145017,padme,"zzPadme zGK zJKA zAhsoka zC-3PO",1
"Upgreyd",0,1,116573,DRMalak,"zzzDR zHK-47 zBSF zzMalak Sith Assassin G8",1
"Upgreyd",,,451876,Negotiator,"Negotiator 6* HT Anakin's Eta-2 Starfighter, Umbaran Starfighter, Ahsoka Tano's Jedi Starfighter, BTL-B Y-wing Starfighter 6*, Clone Sergeant's ARC-170, Plo Koon's Jedi Starfighter",1
"Upgreyd",0,1,114974,Geonosians,"zzGBA Poggle Geo Soldier, Geo Spy, Sun Fac",1
"Upgreyd",,,412857,HansMF,"Home One, Han's MF, Biggs X-wing, Bistan's U-wing, Phantom Ghost Cassian's U-wing, Wedge X-wing",1
"Upgreyd",0,1,109963,Grievous,"zGG zB2 zB1 zDroideka zMagnaGuard",1
"Upgreyd",1,1,113607,JTR,"zJTR Scav Rey, BB-8 zzR2-D2 zFinn",1
"Upgreyd",,,340425,Executrix,"Executrix Tie Adv, Emperor's Shuttle, TIE Reaper, Imperial TIE Fighter, Gauntlet Starfighter, First Order SF TIE Fighter, First Order TIE Fighter",1
"Upgreyd",1,1,132543,Revan Offense,"zzzJKR zzGMY BS zJolee zHYoda",1
"Upgreyd",1,1,85988,Ewoks,"zChirpa Elder Paploo Wicket Logray",1
"Upgreyd",0,1,108459,BH,"zBossk Greedo Boba Dengar Zam",1
"Upgreyd",1,1,90617,Carth,"zCarth Onasi, Mission Zaalbar Juhani Canderous",1
"Upgreyd",0,1,76907,FO,"zKRU Kylo G8, FOE FOST G8, FOO G8",1
"Upgreyd",0,1,130325,Phoenix,"zHera zZeb zKanan Ezra zSabine",1
"Upgreyd",1,0,79500,Wiggs,"Wedge G8, Biggs G8, CLS Han Chewbacca",1
"Upgreyd",1,0,74959,Thragma (Counter),"Thrawn Magma G7, DT G8, Tarkin Stormtrooper G8",1
"Upgreyd",1,1,72753,Rogue1,"Jyn G8, Chirrut G8, Baze G8, K-2SO G9, Cassian G9",1
"Upgreyd",1,0,75133,EP (Counter, Rebel),"EP Shoretrooper G8, Wampa G8, Nest Starck G9",1
"Upgreyd",1,0,17596,SionSolo (Counter),"Sion",1
"Upgreyd",,,62432,Mon Mothma,"Mon Mothma 5* G8, Bistan G7, Bodhi Rook G8, Hoth Rebel Scout G8, Pao G8",0
"Upgreyd",1,0,92142,ShaakClones,"zzShaak Ti, Rex Echo G9, Fives ARC Trooper G8",0
"Upgreyd",0,1,81833,BH,"Jango The Mandalorian G8, Cad IG-88 Aurra G8",0
"Upgreyd",1,0,69377,Jawas,"Nebit G8, Jawa Engineer G9, Jawa Scavenger G7, Jawa G9, Dathcha G9",0
"Logan Ceti",,,146139,JMLS,"zzzzzzJMLS zzJKL zzHYoda zzOld Ben, Ezra G8",1
"Logan Ceti",,,467739,HansMF,"Home One, Han's MF, HT Biggs X-wing, Phantom Ghost Cassian's U-wing, Bistan's U-wing",1
"Logan Ceti",1,1,126710,JTR,"zzzJTR zScav Rey, zzBB-8 zzR2-D2 zFinn",1
"Logan Ceti",,,104876,Mon Mothma,"zzMon Mothma, Bistan Hoth Rebel Scout, Wedge Lando",1
"Logan Ceti",1,1,117453,Revan,"zzzJKR zBS zzGMY zJolee zGK G9",1
"Logan Ceti",1,0,155515,CLS,"zzzCLS zHan zzChewbacca zLeia zzC-3PO",1
"Logan Ceti",1,1,90061,Ewoks,"zChirpa Elder zPaploo zWicket zLogray",1
"Logan Ceti",0,1,115615,BH,"zzBossk zBoba zDengar zzJango zZam",1
"Logan Ceti",1,1,115692,zEP,"zzEP zzzVader zzTarkin TFP G9, zzDN G8",1
"Logan Ceti",1,0,116966,Troopers,"zVeers zStarck Magma zStormtrooper Snowtrooper",1
"Logan Ceti",0,1,92440,FO,"zzKRU zKylo Phasma zFOTP FOO",1
"Logan Ceti",0,1,79844,Grievous,"zGG G7, B2 G5, zDooku G9, zIG-88 T3-M4",0
"Logan Ceti",1,1,54859,NS,"MT G6, AV Daka G4, Zombie G4, Spirit G3",0
"Logan Ceti",1,0,52014,ShaakClones,"Shaak Ti 5* G3, Rex G6, Echo G2, zFives G8, Clone Sergeant G5",0
"Logan Ceti",0,1,75059,Phoenix,"zHera Chopper zZeb G9, Kanan G8, Sabine 4* G7",0
"Logan Ceti",1,0,50576,Jawas,"Nebit G7, Jawa Engineer G5, Jawa Scavenger G6, Jawa G5, Dathcha G7",0
"Logan Ceti",1,0,8233,NestSolo (Counter),"Nest 3* G6",0
"RedWolf",1,1,138658,SL Kylo,"zzzzzzSL Kylo, zSith Trooper, zHux zzKRU Thrawn G9",1
"RedWolf",0,1,122293,padme,"zzPadme zGK zJKA zAhsoka zzC-3PO",1
"RedWolf",0,1,117902,DRMalak,"zzzDR zzHK-47 zBSF zzMalak Sith Marauder",1
"RedWolf",,,407369,Negotiator,"Negotiator HT Anakin's Eta-2 Starfighter, Umbaran Starfighter, Ahsoka Tano's Jedi Starfighter, BTL-B Y-wing Starfighter, Clone Sergeant's ARC-170, Plo Koon's Jedi Starfighter",1
"RedWolf",1,1,105822,JTR,"zzzJTR zzR2-D2 zBB-8 Resistance Hero Finn G8, Resistance Hero Poe G9",1
"RedWolf",0,1,92842,Geonosians,"zzGBA Poggle Geo Soldier, Geo Spy, Sun Fac",1
"RedWolf",,,371709,HansMF,"Home One, Han's MF, Biggs X-wing, Bistan's U-wing, Phantom Ghost Cassian's U-wing, Wedge X-wing",1
"RedWolf",0,1,104802,Grievous,"zzGG zB2 zB1 zDroideka zMagnaGuard",1
"RedWolf",,,421042,Executrix,"Executrix Tie Adv, Emperor's Shuttle, TIE Reaper, Imperial TIE Fighter, Gauntlet Starfighter, First Order SF TIE Fighter, First Order TIE Fighter",1
"RedWolf",,,103377,Nute-OR,"zNute zDooku zJango zZaalbar zMission",1
"RedWolf",1,1,112284,Revan Offense,"zzzJKR zzGMY BS zJolee zzHYoda",1
"RedWolf",1,1,88420,Ewoks,"zChirpa Elder zPaploo zWicket Logray G8",1
"RedWolf",0,1,101657,BH,"zzBossk Greedo zBoba Dengar G8, IG-88",1
"RedWolf",1,1,113000,zEP,"zzEP zzzVader Tarkin TFP G9, zSion G9",1
"RedWolf",0,1,69747,Phoenix,"Hera G9, Zeb G8, Kanan G8, Ezra G8, Sabine G8",1
"RedWolf",1,0,104704,Wampa (Counter),"zRex zzWampa Krennic G8, zzJyn FOO",1
"RedWolf",1,0,91077,Wiggs,"Wedge G8, Biggs G8, zzzCLS Fulcrum Leia",1
"RedWolf",1,0,18601,NestSolo (Counter),"zNest",1
"RedWolf",1,1,92360,NS,"zzMT G8, zzAV zDaka Zombie Spirit G2",0
"RedWolf",,,73948,Mon Mothma,"Mon Mothma 4* G8, Bistan G8, Hoth Rebel Scout G8, Chirrut Baze",0
"RedWolf",1,0,65460,Troopers,"Veers Starck G7, Range Trooper G7, Shoretrooper G7, Snowtrooper G7",0
"RedWolf",1,0,62107,Jawas,"Nebit G7, Jawa Engineer G7, Jawa Scavenger G8, Jawa G7, Dathcha G8",0
"Grand M'uff Talkin",0,1,112112,padme,"zzPadme zGK zJKA zAhsoka zzC-3PO",1
"Grand M'uff Talkin",0,1,110358,DRMalak,"zzzDR HK-47 zBSF zzMalak 6* Sith Empire Trooper",1
"Grand M'uff Talkin",1,1,101365,NS_Alt,"zzMT zAV Zombie Talia zDaka",1
"Grand M'uff Talkin",0,1,96197,Geonosians,"zzGBA Poggle Geo Soldier, Geo Spy, Sun Fac",1
"Grand M'uff Talkin",1,0,113432,Traya,"zzTraya zDN zSion zzEP zThrawn",1
"Grand M'uff Talkin",0,1,84688,Grievous,"zzGG B2 zB1 Droideka MagnaGuard G9",1
"Grand M'uff Talkin",1,1,116991,JTR,"zzzJTR Scav Rey, zzBB-8 zzR2-D2 zFinn",1
"Grand M'uff Talkin",1,1,127315,Revan Offense,"zzzJKR zzGMY zBS zJolee zzHYoda",1
"Grand M'uff Talkin",1,1,88258,Ewoks,"zChirpa Elder Paploo zWicket zLogray",1
"Grand M'uff Talkin",0,1,112920,BH,"zzBossk zGreedo zBoba zDengar zZam",1
"Grand M'uff Talkin",1,1,100869,Carth,"zCarth Onasi, zMission zZaalbar zJuhani zCanderous",1
"Grand M'uff Talkin",1,0,100830,Clones,"Cody zRex zEcho zzFives zARC Trooper",1
"Grand M'uff Talkin",1,0,109661,Wiggs,"Wedge Biggs zzzCLS zHan zzChewbacca",1
"Grand M'uff Talkin",0,1,73969,Phoenix,"Hera Chopper Zeb G8, Kanan Ezra G8",1
"Grand M'uff Talkin",1,1,81575,Rogue1,"Jyn Chirrut Baze K-2SO Cassian",1
"Grand M'uff Talkin",1,0,67682,Jawas,"Nebit G8, Jawa Engineer G9, Jawa Scavenger G8, Jawa G9, Dathcha G8",1
"Grand M'uff Talkin",1,0,15192,NestSolo (Counter),"Nest",1
"Grand M'uff Talkin",,,297825,Malevolence,"Malevolence 6* Sun Fac SF, Soldier SF, Spy SF, Hyena Bomber 4*, Vulture Droid 5*, IG-2000 5*",0
"Grand M'uff Talkin",1,0,58012,Troopers,"Veers G9, Starck G7, Magma G7, Stormtrooper G8, Snowtrooper G9",0
"Grand M'uff Talkin",0,1,94875,BH,"Jango zThe Mandalorian, zzGreef Karga, Cad IG-88",0
"Grand M'uff Talkin",0,1,70252,FO,"KRU G9, Kylo FOE FOTP FOST G8",0
"Senat0r Lipost",1,1,100892,NS,"zzMT zzAV zDaka Zombie Spirit",1
"Senat0r Lipost",0,1,115641,padme,"zzPadme zGK zJKA zAhsoka zzC-3PO",1
"Senat0r Lipost",0,1,116640,DR,"zzzDR zzHK-47 zBSF Sith Empire Trooper, zzThrawn",1
"Senat0r Lipost",,,387933,HansMF,"Home One, Han's MF, HT Biggs X-wing, Phantom Ghost Cassian's U-wing, Bistan's U-wing",1
"Senat0r Lipost",1,1,110661,JTR,"zzzJTR zzR2-D2 zzBB-8 Resistance Hero Finn G8, Resistance Hero Poe G8",1
"Senat0r Lipost",0,1,93543,Geonosians,"zzGBA Poggle Geo Soldier, Geo Spy, Sun Fac",1
"Senat0r Lipost",0,1,101040,Grievous,"zzGG zB2 G9, zB1 zDroideka G9, MagnaGuard G9",1
