Player,Offense,Defense,GP,Name,Squad,Viable
"Krupten",0,1,124933,DRMalak,"zzzDR zzHK-47 zBSF zzMalak 6* zThrawn",1
"Krupten",1,1,99960,NS_Alt,"zzMT zzAV Zombie zDaka Talia",1
"Krupten",1,1,115417,JTR,"zzzJTR Scav Rey, zzBB-8 zzR2-D2 zFinn",1
"Krupten",1,0,87529,Traya,"zzTraya DN G9 Sion zzEP Sith Empire Trooper G8,",1
"Krupten",1,1,120543,Revan,"zzzJKR BS zGMY zJolee GK G8",1
"Krupten",1,0,111408,CLS,"zzzCLS zHan zzChewbacca Leia zzC-3PO",1
"Krupten",1,1,80722,Ewoks,"zChirpa Elder Paploo Scout zLogray",1
"Krupten",1,1,85914,Carth,"zCarth Onasi, Mission Zaalbar Juhani Canderous",1
"Krupten",0,1,106199,BH,"zzBossk zBoba zDengar zJango Zam",1
"Krupten",0,1,98421,FO,"zzKRU zKylo FOE FOO zFOST G9",1
"Krupten",0,1,76782,Phoenix,"Hera Chopper Ezra Zeb Kanan",1
"Krupten",0,1,62084,Geonosians,"GBA 6* G7 Poggle G9 Geo Soldier G8, Geo Spy G7, Sun Fac G7,",0
"Krupten",1,0,62712,Clones,"Cody G7 Rex G7 Echo G7 Fives G8 Clone Sergeant G8,",0
"Kyrie Unobii",0,1,146111,padme,"zzPadme zGK zJKA zAhsoka zzC-3PO",1
"Kyrie Unobii",1,1,118804,JTR,"zzzJTR zScav Rey, zzBB-8 zzR2-D2 zFinn",1
"Kyrie Unobii",1,1,91262,Ewoks,"zChirpa Elder zPaploo Teebo zWicket",1
"Kyrie Unobii",0,1,103615,BH,"zzBossk zBoba Greedo zIG-88 Zam",1
"Kyrie Unobii",1,0,135006,CLS,"zzzCLS zHan zLeia zzOld Ben, zzChewbacca",1
"Kyrie Unobii",1,1,98154,zEP,"zzEP zVader zTarkin zDooku TFP G9",1
"Kyrie Unobii",0,1,79924,Phoenix,"Hera G9 Chopper zEzra Zeb G8 Kanan",1
"Kyrie Unobii",0,1,96068,FO,"zzKRU zKylo Phasma FOO zFOTP",1
"Kyrie Unobii",1,0,21166,SionSolo (Counter),"zSion",1
"Michael Wulf",0,1,121993,DRMalak,"zzzDR zzHK-47 zBSF zzMalak zSiT",1
"Michael Wulf",0,1,98554,padme,"zzPadme GK JKA zAhsoka zC-3PO G9",1
"Michael Wulf",1,1,92437,NS_Alt,"zMT zzAV Zombie Daka Talia",1
"Michael Wulf",,,366589,Negotiator,"Negotiator 5* HT Anakin's Eta-2 Starfighter, Umbaran Starfighter, Ahsoka Tano's Jedi Starfighter, Clone Sergeant's ARC-170, Plo Koon's Jedi Starfighter, Rex's ARC-170,",1
"Michael Wulf",1,0,116004,Traya,"zzTraya zDN zSion zzEP zThrawn",1
"Michael Wulf",0,1,80582,Grievous,"zzGG G9 zB2 G8 zB1 G9 Droideka G8 MagnaGuard G8",1
"Michael Wulf",1,1,95841,JTR,"zJTR Scav Rey, zBB-8 zzR2-D2 Finn",1
"Michael Wulf",1,1,107696,Revan Offense,"zzzJKR zGMY zBS zJolee HYoda",1
"Michael Wulf",1,1,89986,Ewoks,"zChirpa Elder zPaploo zWicket zLogray G9",1
"Michael Wulf",0,1,92874,BH,"zBossk Boba Cad Dengar G9 zJango",1
"Michael Wulf",0,1,131643,FO,"zzKRU zKylo FOE FOO zFOST",1
"Michael Wulf",0,1,74000,Phoenix,"Hera G8 Chopper G9 Ezra Zeb G8 Kanan",1
"Michael Wulf",1,0,84839,CLS,"zzCLS zHan Leia Old Ben G9, Chewbacca G8",1
"Michael Wulf",1,0,69528,Troopers,"zVeers Starck G9 Magma G8 Snowtrooper G7 Stormtrooper G8",1
"Michael Wulf",1,0,92569,zMaul,"zMaul Dooku zSavage Sith Empire Trooper, Sith Marauder,",1
"Michael Wulf",1,0,101252,Zader (Counter),"zzzVader zMission zZaalbar Tarkin Sidious",1
"Michael Wulf",0,1,64367,Geonosians,"GBA 5* G8 Poggle Geo Soldier G8, Geo Spy G8, Sun Fac G7,",0
"Michael Wulf",1,0,89459,ShaakClones,"zzShaak Ti G8, Rex Echo zzFives G8 Clone Sergeant,",0
"Michael Wulf",1,0,9729,NestSolo (Counter),"Nest 4* G8",0
"KingZach",1,1,92679,NS,"zzMT zzAV Daka Zombie Spirit",1
"KingZach",0,1,109377,padme,"zzPadme zGK zJKA zAhsoka zzC-3PO",1
"KingZach",,,411460,HansMF,"Home One, Han's MF, HT Biggs X-wing, Phantom Ghost Cassian's U-wing, Bistan's U-wing,",1
"KingZach",1,0,106717,Traya,"zzTraya zDN zSion zzEP zThrawn",1
"KingZach",1,1,102555,JTR,"zzzJTR Scav Rey, zBB-8 zzR2-D2 RT",1
"KingZach",1,1,112994,Revan Offense,"zzzJKR zGMY zzHYoda zJolee zEzra",1
"KingZach",1,1,86576,Ewoks,"zChirpa Elder Paploo zWicket zLogray",1
"KingZach",0,1,92111,BH,"zBossk Boba Dengar G9 Greedo zNest",1
"KingZach",1,0,82091,Troopers,"zVeers zStarck G9 DT Range Trooper G9, Snowtrooper",1
"KingZach",1,0,140027,CLS,"zzzCLS zHan zLeia zzOld Ben, zzChewbacca",1
"KingZach",0,1,80926,Phoenix,"Hera Chopper Zeb Kanan Sabine",1
"KingZach",1,1,81125,Rogue1,"zzJyn Chirrut G8 Baze G8 K-2SO G8 Cassian",1
"KingZach",1,0,101998,Zader (Counter),"zzzVader Mission G8 Zaalbar G8 zzWampa zSidious",1
"KingZach",0,1,83421,Grievous,"GG G9 B2 G8 zNute zDooku IG-88",0
"KingZach",1,0,83216,ShaakClones,"zzShaak Ti G8, zRex Echo G9 zFives G8 Clone Sergeant G8,",0
"KingZach",0,1,78129,FO,"zKRU G8 zKylo FOE G9 FOO G9 FOTP G9",0
"KingZach",1,0,61085,Jawas,"Nebit G8 Jawa Engineer G8, Jawa Scavenger G7, Jawa G7 Dathcha",0
"The senate",0,1,94126,Geonosians,"zzGBA Poggle Geo Soldier, Geo Spy, Sun Fac,",1
"The senate",0,1,105220,Grievous,"zzGG zB2 zB1 zDroideka zMagnaGuard",1
"The senate",1,1,130728,Revan,"zzzJKR zBS zzGMY zJolee zGK",1
"The senate",1,0,108738,ShaakClones,"zzShaak Ti, zRex zEcho zzFives zARC Trooper,",1
"The senate",1,1,86714,Ewoks,"zChirpa Elder Paploo Scout zWicket",1
"The senate",0,1,107908,BH,"zzBossk zBoba Dengar G8 zGreedo zzJango",1
"The senate",0,1,95996,Phoenix,"zHera zEzra zZeb zKanan zSabine",1
"The senate",1,0,83630,Wiggs,"Wedge G8 Biggs G8 zzzCLS Han Leia",1
"The senate",1,0,78053,Zader (Counter),"zVader Mission G9 Zaalbar Wampa G8 Tarkin G9",1
"The senate",1,0,96262,EP (trio),"zEP Traya G9 zzDN zSion Thrawn G9",1
"The senate",0,1,51038,FO,"KRU 6* G7 Kylo 5* G8 Phasma G7 FOO G7 FOSFTP 4* G6",0
"The senate",1,0,6715,NestSolo (Counter),"Nest 3* G5",0
"Drcct",1,1,114874,NS,"zzMT zzAV zDaka Zombie Spirit",1
"Drcct",0,1,99161,padme,"zzPadme zGK zJKA zAhsoka CW Chewbacca G8,",1
"Drcct",0,1,101095,Geonosians,"zzGBA Poggle Geo Soldier, Geo Spy, Sun Fac,",1
"Drcct",1,1,114440,JTR,"zzzJTR zScav Rey, zzBB-8 zzR2-D2 zFinn",1
"Drcct",1,1,102520,Ewoks,"zChirpa Elder zPaploo zWicket zLogray",1
"Drcct",1,0,101361,ShaakClones,"zzShaak Ti, zRex zEcho zzFives Clone Sergeant,",1
"Drcct",0,1,118840,BH,"zzBossk zBoba zDengar zIG-88 zzJango",1
"Drcct",0,1,100464,Phoenix,"zHera zEzra zZeb zKanan zSabine",1
"Drcct",1,0,95562,Wiggs,"Wedge Biggs zzzCLS Han zLeia",1
"Drcct",0,1,99125,FO,"zzKRU zKylo zPhasma FOO zFOST",1
"Drcct",1,1,108291,zEP,"zzEP zzzVader zzTarkin zDooku TFP G9",1
"Drcct",1,0,69411,Jawas,"Nebit G9 Jawa Engineer G9, Jawa Scavenger G9, Jawa G9 Dathcha",1
"Drcct",1,0,68213,Troopers,"Veers Starck G8 Magma G8 Snowtrooper G9 Stormtrooper G8",0
"StarKiller316",0,1,117426,padme,"zzPadme zGK JKA zAhsoka zzC-3PO",1
"StarKiller316",1,1,96573,NestSisters,"zzAV zzMT Daka Zombie zNest",1
"StarKiller316",0,1,117055,DR,"zzzDR zzHK-47 zBSF zSiT Sith Assassin G8,",1
"StarKiller316",,,403158,HansMF,"Home One, Han's MF, HT Biggs X-wing, Phantom Ghost Cassian's U-wing, Bistan's U-wing,",1
"StarKiller316",0,1,118119,Grievous,"zzGG zB2 zB1 zDroideka MagnaGuard",1
"StarKiller316",1,1,106226,JTR,"zzzJTR Scav Rey, zzBB-8 zzR2-D2 Finn",1
"StarKiller316",1,1,128030,GAS,"zzzzGAS zRex Echo zzFives zARC Trooper,",1
"StarKiller316",1,1,118280,Revan Offense,"zzzJKR zGMY zBS zJolee zEzra",1
"StarKiller316",1,1,82074,Ewoks,"zChirpa G9 Elder Paploo zWicket Logray",1
"StarKiller316",0,1,98636,BH,"zBossk zBoba Dengar Greedo zZam",1
"StarKiller316",0,1,111589,FO,"zzKRU zKylo FOE FOO FOST",1
"StarKiller316",1,0,103877,CLS,"zzzCLS zHan Leia Old Ben, zzChewbacca",1
"StarKiller316",1,0,70506,Troopers,"zVeers Starck G9 Shoretrooper G8 Snowtrooper G9 Stormtrooper G9",1
"StarKiller316",1,1,106512,zEP,"zzEP zzzVader Tarkin Dooku TFP",1
"StarKiller316",0,1,85339,Phoenix,"Hera Chopper Zeb zKanan zSabine",1
"StarKiller316",1,0,77606,Wiggs,"Wedge Biggs Fulcrum G8 Chirrut Baze",1
"StarKiller316",1,0,74484,Jawas,"Nebit Jawa Engineer, Jawa Scavenger G9, Jawa G9 Dathcha",1
"StarKiller316",1,0,16236,SionSolo (Counter),"Sion",1
"StarKiller316",0,1,66480,Qira,"Qira 6* G9 L3-37 4* G8 Vandor Chewbacca 5* G7, zMission zZaalbar",0
"StarKiller316",0,1,77644,Geonosians,"zGBA G9 Poggle Geo Soldier, Geo Spy G8, Sun Fac G8,",0
"StarKiller316",,,345365,Executrix,"Executrix Tie Adv, Emperor's Shuttle 5*, TIE Reaper 6*, Imperial TIE Fighter, Gauntlet Starfighter 5*, First Order SF TIE Fighter, First Order TIE Fighter,",0
"StarKiller316",0,1,78520,BH,"Jango Aurra 5* G8 Cad Embo IG-88",0
"Wolfie",0,1,84203,padme,"zzPadme G8 zGK JKA Ahsoka CW Chewbacca G8,",1
"Wolfie",,,337542,Negotiator,"Negotiator 5* HT Anakin's Eta-2 Starfighter, Umbaran Starfighter, Ahsoka Tano's Jedi Starfighter, Clone Sergeant's ARC-170, Jedi Consular's Starfighter, Plo Koon's Jedi Starfighter,",1
"Wolfie",0,1,84767,Geonosians,"zzGBA Poggle G8 Geo Soldier, Geo Spy G9, Sun Fac G8,",1
"Wolfie",1,1,98398,JTR,"zzzJTR zScav Rey, BB-8 G9 R2-D2 zFinn",1
"Wolfie",1,1,115620,Revan Offense,"zzzJKR zzGMY zBS zJolee Ezra G8",1
"Wolfie",1,1,98532,Carth,"zCarth Onasi, zMission zZaalbar zJuhani zCanderous",1
"Wolfie",0,1,107093,BH,"zzBossk zBoba Cad zIG-88 zzJango",1
"Wolfie",1,0,90592,Wiggs,"Wedge G8 Biggs G8 zzzCLS zzChewbacca G9 Leia",1
"Wolfie",1,0,13249,SionSolo (Counter),"Sion G8",1
"Wolfie",0,1,67782,Grievous,"GG B2 G7 Nute G9 Dooku G6 T3-M4 G7",0
"Wolfie",1,1,74375,NS_Alt,"MT G8 AV Zombie Daka G8 Talia G8",0
"Wolfie",1,1,94882,Ewoks,"zChirpa 6* Elder zPaploo Teebo zWicket",0
"Wolfie",1,0,75699,ShaakClones,"Shaak Ti 5* G7, zRex G8 Echo G9 zFives Clone Sergeant,",0
"Wolfie",0,1,68884,Phoenix,"Hera G8 Chopper Zeb G9 Kanan G8 Sabine 6* G8",0
"Wolfie",0,1,63762,FO,"KRU G8 Kylo G9 FOO G8 FOST G8 FOTP G8",0
"Wolfie",1,1,64392,Rogue1,"Jyn 4* G7 Chirrut G8 Baze G8 Bodhi Rook G7, Bistan G8",0
"Wolfie",1,0,76795,EP (Traya),"EP Traya G8 DN 4* G8 Sith Empire Trooper 5* G8, zzzVader",0
"JaidenHawk",1,1,115331,JTR,"zzzJTR zScav Rey, zzBB-8 zzR2-D2 zFinn",1
"JaidenHawk",1,1,143163,Revan,"zzzJKR zBS zzGMY zJolee zGK",1
"JaidenHawk",1,1,85151,Carth,"zCarth Onasi, zMission G9 Zaalbar G8 zJuhani zCanderous G8",1
"JaidenHawk",1,0,102577,Wiggs,"Wedge Biggs zzzCLS zHan Leia",1
"JaidenHawk",1,0,17649,SionSolo (Counter),"zSion G9",1
"JaidenHawk",1,1,89682,NS,"zzMT AV zDaka Zombie Spirit G7",0
"JaidenHawk",0,1,74882,DR,"DR G8 HK-47 zBSF Sith Assassin 5* G6, Thrawn 6* G8",0
"JaidenHawk",0,1,84344,Grievous,"zzGG B2 5* G7 zNute G7 zIG-88 T3-M4",0
"JaidenHawk",1,1,99215,zEP,"zzEP zzzVader zzTarkin Dooku 6* G9 TFP G7",0
"JaidenHawk",0,1,103258,BH,"zzBossk 5* zBoba Cad zDengar zGreedo",0
"JaidenHawk",1,0,52851,Troopers,"Veers 5* G7 Starck G7 Range Trooper 4* G8, Snowtrooper G8 Stormtrooper G5",0
"JaidenHawk",0,1,67534,Phoenix,"Hera 6* G8 Chopper Ezra G8 Zeb G8 Kanan G8",0
"JaidenHawk",0,1,73470,FO,"KRU G9 Kylo G9 Phasma FOST G9 FOTP",0
"MetalPrawn",1,1,75219,Ewoks,"zChirpa G9 Elder Paploo G9 Wicket Logray G9",1
"MetalPrawn",1,0,121740,ShaakClones,"zzShaak Ti, zRex zEcho zFives zARC Trooper,",1
"MetalPrawn",0,1,93503,BH,"zBossk zBoba Dengar G8 IG-88 Jango",1
"MetalPrawn",1,1,79269,zEP,"zEP zVader Tarkin G9 Dooku TFP G8",1
"MetalPrawn",0,1,65090,Phoenix,"Hera G8 Chopper G8 Ezra G8 Zeb G8 Kanan G8",1
"MetalPrawn",0,1,85376,padme,"zzPadme zGK JKA G9 zAhsoka C-3PO 6* G7",0
"MetalPrawn",0,1,86337,Geonosians,"zGBA Poggle Geo Soldier, Geo Spy, Sun Fac G9,",0
"MetalPrawn",0,1,69466,Grievous,"GG 6* G8 zB2 G9 zB1 5* G9 MagnaGuard 6* G8 Nute",0
"MetalPrawn",,,293808,HansMF,"Home One 6*, Han's MF 5*, HT Biggs X-wing, Phantom Ghost Tie Adv, Wedge X-wing,",0
"MetalPrawn",1,1,47898,NS_Alt,"MT 5* G8 AV G8 Spirit 5* G8 Daka G8 Talia 5* G8",0
"MetalPrawn",1,0,61313,Wiggs,"Wedge 5* G8 Biggs G8 CLS G8 Chewbacca G8 Leia G8",0
"MetalPrawn",1,1,40931,Rogue1,"Jyn 5* G8 Chirrut 5* G8 Baze 5* G8 K-2SO G8 Cassian G8",0
"MetalPrawn",0,1,50043,FO,"KRU G8 Kylo 5* G8 Phasma G8 FOO G8 FOTP G8",0
"MetalPrawn",1,0,7365,NestSolo (Counter),"Nest 2* G7",0
"Jakoby77",1,1,106014,NS,"zzMT zzAV zDaka Zombie Spirit",1
"Jakoby77",0,1,121581,padme,"zzPadme zGK zJKA zAhsoka zzC-3PO",1
"Jakoby77",0,1,133577,DRMalak,"zzzDR zzHK-47 zBSF zzMalak zThrawn",1
"Jakoby77",,,357786,Negotiator,"Negotiator 5* HT Anakin's Eta-2 Starfighter, Umbaran Starfighter, Ahsoka Tano's Jedi Starfighter, BTL-B Y-wing Starfighter, Clone Sergeant's ARC-170, Plo Koon's Jedi Starfighter,",1
"Jakoby77",0,1,87508,Geonosians,"zzGBA Poggle Geo Soldier, Geo Spy, Sun Fac G8,",1
"Jakoby77",0,1,111689,Grievous,"zzGG zB2 zB1 zDroideka MagnaGuard",1
"Jakoby77",1,1,97239,JTR,"zJTR Scav Rey, zBB-8 zzR2-D2 Finn",1
"Jakoby77",1,0,106828,Traya,"zzTraya DN zSion zzEP zNest",1
"Jakoby77",,,297486,Executrix,"Executrix Tie Adv, Emperor's Shuttle, TIE Reaper, Imperial TIE Fighter, Gauntlet Starfighter, First Order SF TIE Fighter, First Order TIE Fighter,",1
"Jakoby77",1,1,143761,GAS,"zzzzGAS zRex zEcho zzFives zARC Trooper,",1
"Jakoby77",1,1,114764,Revan Offense,"zzzJKR zGMY BS zJolee zHYoda",1
"Jakoby77",1,1,70315,Ewoks,"zChirpa Elder Paploo Wicket Logray G9",1
"Jakoby77",1,1,95268,Carth,"zCarth Onasi, zMission zZaalbar Juhani Canderous",1
"Jakoby77",0,1,105109,BH,"zzBossk Boba Dengar G9 zEmbo zJango",1
"Jakoby77",0,1,99010,FO,"zzKRU zKylo FOE FOO zFOST",1
"Jakoby77",0,1,71477,Phoenix,"Hera G8 Ezra Zeb G8 Kanan G8 Sabine G8",1
"Jakoby77",1,0,111914,Wiggs,"Wedge G9 Biggs zzzCLS zHan zzChewbacca",1
"Jakoby77",1,0,83053,Zader (Counter),"zzVader Tarkin G8 Sidious G8 Sith Empire Trooper, Shoretrooper",1
"Jakoby77",1,0,58114,Troopers,"Veers G9 Starck G7 DT G9 Snowtrooper G7 Stormtrooper G5",0
"Jakoby77",1,1,71078,Rogue1,"Jyn G7 Chirrut G9 Baze K-2SO G8 Cassian G8",0
"Jakoby77",1,0,46902,Jawas,"Nebit G8 Jawa Engineer G8, Jawa Scavenger G7, Jawa G8 Dathcha G7",0
"Jameg",1,1,118269,Revan,"zzzJKR BS zzGMY zJolee zGK",1
"Jameg",0,1,106958,BH,"zzJango zBoba Cad zGreedo zIG-88",1
"Jameg",0,1,76142,Phoenix,"Hera G9 Ezra Zeb G8 zKanan Sabine G8",1
"Jameg",1,0,105257,Wiggs,"Wedge Biggs G8 zzzCLS zHan zLeia",1
"Jameg",1,0,88882,Zader (Counter),"zzzVader Mission G8 Zaalbar G8 Tarkin Stormtrooper G8",1
"Jameg",1,0,65981,501st,"Rex G8 Clone Sergeant G8, Echo 5* G8 Fives G8 Ahsoka",0
"Jameg",0,1,69587,FO,"KRU G8 Kylo G9 Phasma G8 FOO G8 FOTP G8",0
"Upgreyd",1,1,96607,NS,"zMT zAV zDaka Zombie Spirit",1
"Upgreyd",0,1,108641,padme,"zzPadme GK JKA zAhsoka zC-3PO",1
"Upgreyd",,,389299,HansMF,"Home One, Han's MF, HT Biggs X-wing, Phantom Ghost Cassian's U-wing, Bistan's U-wing,",1
"Upgreyd",0,1,95219,Geonosians,"zzGBA Poggle Geo Soldier, Geo Spy, Sun Fac,",1
"Upgreyd",1,1,105167,JTR,"zJTR Scav Rey, BB-8 zzR2-D2 zFinn",1
"Upgreyd",1,1,115469,Revan Offense,"zzzJKR zzGMY HYoda zJolee Ezra",1
"Upgreyd",1,1,86081,Ewoks,"zChirpa Elder Paploo Wicket Logray",1
"Upgreyd",1,1,82382,Carth,"zCarth Onasi, Mission G8 Zaalbar G8 Juhani Canderous",1
"Upgreyd",0,1,102958,BH,"zBossk Boba Dengar Greedo Zam",1
"Upgreyd",1,0,77824,Wiggs,"Wedge G8 Biggs G8 CLS Han Chewbacca",1
"Upgreyd",1,0,66378,Wampa (Counter),"Rex G7 Wampa G8 DT G7 Jyn G8 FOO G8",1
"Upgreyd",0,1,137330,Phoenix,"zHera Chopper zZeb zKanan zSabine",1
"Upgreyd",1,0,16303,NestSolo (Counter),"Nest",1
"Upgreyd",1,0,16605,SionSolo (Counter),"Sion",1
"Upgreyd",0,1,88414,DR,"DR HK-47 zBSF Sith Marauder G8, Thrawn",0
"Upgreyd",0,1,75387,Grievous,"GG B2 G8 zB1 G9 Droideka G8 MagnaGuard G8",0
"Upgreyd",,,284327,Executrix,"Executrix Tie Adv, Emperor's Shuttle 4*, TIE Reaper 5*, Imperial TIE Fighter, Gauntlet Starfighter, First Order SF TIE Fighter 4*, First Order TIE Fighter,",0
"Upgreyd",1,1,74240,zEP,"EP Vader Tarkin Krennic 4* G7 TFP G8",0
"Upgreyd",1,0,63592,Troopers,"Veers Starck G8 Range Trooper 5* G6, Snowtrooper G9 Stormtrooper G8",0
"Upgreyd",0,1,71603,FO,"zKRU G8 Kylo G8 Phasma G8 FOE FOTP G8",0
"Upgreyd",1,0,61479,Jawas,"Nebit G8 Jawa Engineer 5* G7, Jawa Scavenger G7, Jawa G8 Dathcha G9",0
"Hollow Child",0,1,107253,padme,"zzPadme GK JKA zAhsoka zBarriss",1
"Hollow Child",0,1,105869,DRMalak,"zzDR zHK-47 zBSF zzMalak 6* SiT G8",1
"Hollow Child",1,1,103900,NS_Alt,"zzMT zAV Zombie Daka Talia",1
"Hollow Child",,,384701,HansMF,"Home One, Han's MF, HT Biggs X-wing, Phantom Ghost Cassian's U-wing, Bistan's U-wing,",1
"Hollow Child",0,1,93319,Geonosians,"zzGBA Poggle Geo Soldier, Geo Spy, Sun Fac,",1
"Hollow Child",1,1,99972,JTR,"zzJTR Scav Rey, zBB-8 zzR2-D2 Finn",1
"Hollow Child",1,1,108969,Revan Offense,"zzzJKR zGMY zBS zJolee HYoda G9",1
"Hollow Child",1,0,98956,CLS,"zzCLS zHan Chewbacca zThrawn C-3PO G9",1
"Hollow Child",1,1,87179,Ewoks,"zChirpa G9 Elder zPaploo zWicket zLogray G9",1
"Hollow Child",1,0,94890,ShaakClones,"zzShaak Ti, Rex Echo zFives ARC Trooper G8,",1
"Hollow Child",1,1,93643,Carth,"zCarth Onasi, zMission zZaalbar zJuhani Canderous",1
"Hollow Child",0,1,94528,BH,"zzBossk Boba Dengar G8 Greedo Zam",1
"Hollow Child",1,1,96650,zEP,"zzEP zzVader zTarkin DT G8 TFP",1
"Hollow Child",0,1,86118,FO,"zKRU Kylo G9 FOE FOO zFOTP",1
"Hollow Child",0,1,84124,Phoenix,"Hera Ezra Zeb G8 Kanan zSabine",1
"Hollow Child",1,0,20119,SionSolo (Counter),"zSion",1
"Hollow Child",1,0,16254,NestSolo (Counter),"Nest",1
"Hollow Child",0,1,83960,Grievous,"GG zB2 zB1 zDroideka G8 MagnaGuard G8",0
"Hollow Child",,,330357,Executrix,"Executrix Tie Adv, Emperor's Shuttle 4*, TIE Reaper 3*, Imperial TIE Fighter, Gauntlet Starfighter, First Order SF TIE Fighter 5*, First Order TIE Fighter,",0
"Hollow Child",1,0,55868,Troopers,"Veers G8 Starck 6* G7 Range Trooper 3* G7, Snowtrooper G8 Stormtrooper G8",0
"Hollow Child",0,1,76775,BH,"Jango Aurra G8 Cad Embo 4* G8 IG-88",0
"Hollow Child",1,1,67301,Rogue1,"Jyn G8 Chirrut G8 Baze 5* G8 K-2SO G8 Cassian G8",0
"Hollow Child",1,0,99340,zMaul,"Maul zDooku zDN zSidious zSavage",0
"Hollow Child",1,0,63746,Jawas,"Nebit G8 Jawa Engineer 6* G8, Jawa Scavenger G7, Jawa G8 Dathcha",0
"Sal",0,1,110121,padme,"zzPadme G8 zGK zJKA zAhsoka zzC-3PO",1
"Sal",1,0,108793,Traya,"zzTraya zDN zSion zzEP zThrawn",1
"Sal",1,1,114314,JTR,"zzzJTR Scav Rey, zzBB-8 zzR2-D2 zFinn",1
"Sal",1,1,121701,Revan Offense,"zzzJKR zzGMY zBS zJolee zzHYoda",1
"Sal",1,1,94894,Ewoks,"zChirpa Elder zPaploo Scout zWicket",1
"Sal",1,1,104841,Carth,"zCarth Onasi, zMission zZaalbar Juhani zCanderous",1
"Sal",0,1,110517,BH,"zzBossk zBoba Cad zGreedo zzJango",1
"Sal",0,1,76393,Phoenix,"Hera G9 Ezra Zeb G9 Kanan Sabine",1
"Sal",1,0,120303,CLS,"zzzCLS zHan Wedge Biggs zzChewbacca",1
"Sal",1,0,81978,Zader (Counter),"zzVader Tarkin Sidious G8 Sith Empire Trooper G8, Shoretrooper",1
"Sal",0,1,103796,DRMalak,"zzzDR zzHK-47 zBSF zMalak 5* Sith Assassin 6* G8,",0
"Sal",0,1,76819,Geonosians,"GBA G8 Poggle Geo Soldier, Geo Spy, Sun Fac G8,",0
"Sal",0,1,86319,Grievous,"zGG B2 G7 Nute IG-88 zT3-M4",0
"Sal",1,1,62044,NS,"MT 6* G8 AV Daka G7 Zombie 6* G8 Spirit G8",0
"Sal",1,0,77202,ShaakClones,"Shaak Ti 4* G8, zRex Echo Fives Clone Sergeant,",0
"Sal",1,0,57455,Troopers,"Veers Starck 5* G7 Range Trooper 4* G6, Snowtrooper G8 Stormtrooper G8",0
"Sal",1,1,68766,Rogue1,"zJyn Chirrut G8 Baze 5* G8 K-2SO G8 Cassian G8",0
"Sal",0,1,67809,FO,"KRU 4* G6 Kylo FOO FOST G9 FOTP",0
"Sal",1,0,59917,Jawas,"Nebit G8 Jawa Engineer 5* G9, Jawa Scavenger G7, Jawa G9 Dathcha G7",0
"Sal",1,0,7191,NestSolo (Counter),"Nest 3* G7",0
"Logan Ceti",,,418864,HansMF,"Home One, Han's MF, HT Biggs X-wing, Phantom Ghost Cassian's U-wing, Bistan's U-wing,",1
"Logan Ceti",1,1,117420,JTR,"zzzJTR zScav Rey, zzBB-8 zzR2-D2 zFinn",1
"Logan Ceti",1,1,111962,Revan,"zzzJKR zBS zzGMY zJolee zGK G9",1
"Logan Ceti",1,0,154491,CLS,"zzzCLS zHan zzChewbacca zLeia zzC-3PO",1
"Logan Ceti",1,1,91642,Ewoks,"zChirpa Elder zPaploo zWicket zLogray",1
"Logan Ceti",0,1,113099,BH,"zzBossk zBoba zDengar zGreedo zZam",1
"Logan Ceti",1,0,116973,Troopers,"zVeers zStarck Magma Snowtrooper zStormtrooper",1
"Logan Ceti",1,1,105114,zEP,"zzEP zzzVader zzTarkin zDooku G9 TFP G9",1
"Logan Ceti",0,1,79385,Phoenix,"zHera Chopper Ezra G8 zZeb G9 Kanan G8",1
"Logan Ceti",0,1,92394,FO,"zzKRU zKylo Phasma FOO zFOTP",1
"Logan Ceti",0,1,72644,Grievous,"zGG G7 B2 G5 MagnaGuard G5 zIG-88 T3-M4",0
"Logan Ceti",1,1,49908,NS,"MT 6* G6 AV Daka G4 Zombie 6* G2 Spirit G3",0
"Logan Ceti",1,0,62909,501st,"Rex G6 Clone Sergeant G5, Echo G2 zFives G8 zAhsoka G9",0
"Logan Ceti",1,0,50576,Jawas,"Nebit G7 Jawa Engineer G5, Jawa Scavenger G6, Jawa G5 Dathcha G7",0
"Logan Ceti",1,0,8233,NestSolo (Counter),"Nest 3* G6",0
"Teg",0,1,127536,padme,"zzPadme zGK zJKA zAhsoka zzC-3PO",1
"Teg",0,1,110237,DRMalak,"zzzDR zHK-47 BSF zzMalak zThrawn",1
"Teg",,,378814,HansMF,"Home One, Han's MF, HT Biggs X-wing, Phantom Ghost Cassian's U-wing, Bistan's U-wing,",1
"Teg",0,1,92893,Geonosians,"zzGBA Poggle Geo Soldier, Geo Spy, Sun Fac,",1
"Teg",1,1,114023,JTR,"zzzJTR Scav Rey, zBB-8 zzR2-D2 zFinn",1
"Teg",1,1,106674,GAS,"zzzzGAS Rex zEcho zzFives zARC Trooper G9,",1
"Teg",1,1,108267,Revan Offense,"zzzJKR zGMY BS zJolee HYoda",1
"Teg",1,1,79712,Ewoks,"zChirpa Elder Paploo G9 Wicket Logray G9",1
"Teg",1,1,91182,Carth,"zCarth Onasi, zMission Zaalbar Juhani Canderous",1
"Teg",0,1,96997,BH,"zzBossk Boba Cad Dengar Greedo",1
"Teg",0,1,81965,Phoenix,"Hera G9 zEzra zZeb G8 Kanan G8 zSabine",1
"Teg",1,0,106992,Wiggs,"Wedge G9 Biggs G8 zzzCLS zHan zzChewbacca",1
"Teg",1,1,94178,zEP,"zzEP zzVader Tarkin Dooku TFP G8",1
"Teg",1,1,72260,Rogue1,"Jyn G8 Chirrut G8 Baze G8 K-2SO G8 Cassian",1
"Teg",1,0,65882,Jawas,"Nebit G8 Jawa Engineer G8, Jawa Scavenger G8, Jawa G8 Dathcha G8",1
"Teg",1,0,14320,NestSolo (Counter),"Nest G9",1
"Teg",1,0,13777,SionSolo (Counter),"Sion G8",1
"Teg",,,243308,Malevolence,"Malevolence 5* Sun Fac SF, Soldier SF, Spy SF, Hyena Bomber 5*, Vulture Droid, IG-2000",0
"Teg",0,1,110332,Grievous,"zGG zB2 zB1 zDroideka zMagnaGuard",0
"Teg",1,1,89805,NS_Alt,"zzMT G9 zzAV Zombie zDaka G9 Talia G8",0
"Teg",,,309407,Executrix,"Executrix Tie Adv, Emperor's Shuttle, TIE Reaper 6*, Imperial TIE Fighter, Gauntlet Starfighter, First Order SF TIE Fighter 5*, First Order TIE Fighter,",0
"Teg",1,0,66484,Troopers,"Veers G9 Starck G8 DT G7 Shoretrooper G8 Snowtrooper G8",0
"Teg",0,1,69951,FO,"KRU G8 Kylo G8 FOE G9 FOO FOST G8",0
"Eanid September",0,1,108375,padme,"zzPadme GK zJKA zAhsoka C-3PO",1
"Eanid September",,,315417,Negotiator,"Negotiator 5* HT Anakin's Eta-2 Starfighter, Umbaran Starfighter, Ahsoka Tano's Jedi Starfighter, BTL-B Y-wing Starfighter 6*, Clone Sergeant's ARC-170, Plo Koon's Jedi Starfighter,",1
"Eanid September",0,1,102365,DR,"zzzDR zHK-47 zBSF Sith Assassin G8, zThrawn",1
"Eanid September",0,1,93376,Geonosians,"zzGBA Poggle Geo Soldier, Geo Spy, Sun Fac,",1
"Eanid September",0,1,93358,Grievous,"zGG B2 zB1 zDroideka MagnaGuard",1
"Eanid September",1,1,101700,JTR,"zzzJTR Scav Rey, BB-8 zR2-D2 Finn",1
"Eanid September",1,0,105044,Traya,"zzTraya zDN zSion Dooku zzEP",1
"Eanid September",1,1,119378,Revan Offense,"zzzJKR zGMY zBS zJolee Ezra",1
"Eanid September",1,1,90353,Ewoks,"zChirpa Elder Paploo zWicket Logray G9",1
"Eanid September",1,1,80272,Carth,"zCarth Onasi, Mission G8 Zaalbar G8 Juhani Canderous",1
"Eanid September",0,1,105559,BH,"zBossk zAurra zBoba Dengar zJango",1
"Eanid September",1,0,107767,CLS,"zzzCLS zHan zLeia Old Ben, zzChewbacca",1
"Eanid September",0,1,88346,FO,"zzKRU Kylo Phasma FOE FOO",1
"Eanid September",0,1,73404,Phoenix,"Hera G9 Chopper G8 Zeb G9 Kanan Sabine G9",1
"Eanid September",1,1,75428,Rogue1,"Jyn G9 Chirrut G9 Baze G8 K-2SO G9 Cassian",1
"Eanid September",1,0,85222,Zader (Counter),"zzzVader Tarkin Sidious G9 Sith Empire Trooper, Stormtrooper G8",1
"Eanid September",1,0,15181,NestSolo (Counter),"Nest",1
"Eanid September",1,1,81538,NS,"zMT zAV Daka Zombie Spirit G7",0
"Eanid September",,,373934,Raddus,"Raddus 4* Sun Fac SF, Rey's Millennium Falcon, Poe Dameron's X-wing, Resistance X-wing, Biggs X-wing, Wedge X-wing, Phantom Ghost",0
"Eanid September",,,302024,Executrix,"Executrix Tie Adv, Emperor's Shuttle, TIE Reaper 6*, Imperial TIE Fighter, Gauntlet Starfighter, First Order SF TIE Fighter, First Order TIE Fighter,",0
"Eanid September",1,0,77065,ShaakClones,"Shaak Ti, Rex Echo G8 Fives ARC Trooper G8,",0
"Eanid September",1,0,66367,Troopers,"Veers G9 Starck G8 Magma G7 Shoretrooper G8 Snowtrooper G7",0
"Eanid September",1,0,68399,Jawas,"Nebit G8 Jawa Engineer G9, Jawa Scavenger G8, Jawa G7 Dathcha G9",0
"Senat0r Lipost",1,1,101623,NS_Alt,"zzMT zzAV Zombie zDaka Talia",1
"Senat0r Lipost",0,1,87943,Geonosians,"zzGBA Poggle Geo Soldier, Geo Spy, Sun Fac G8,",1
"Senat0r Lipost",,,382120,HansMF,"Home One, Han's MF, HT Biggs X-wing, Phantom Ghost Cassian's U-wing, Rey's Millennium Falcon,",1
"Senat0r Lipost",0,1,85227,Grievous,"zzGG B2 G8 B1 Droideka G8 MagnaGuard G8",1
"Senat0r Lipost",1,1,113016,JTR,"zzzJTR Scav Rey, zzBB-8 zzR2-D2 zFinn",1
"Senat0r Lipost",1,1,123843,Revan,"zzzJKR zBS zzGMY zJolee zGK",1
"Senat0r Lipost",1,1,91490,Ewoks,"zChirpa G9 Elder zPaploo zWicket zLogray G9",1
"Senat0r Lipost",1,0,102653,CLS,"zzzCLS Han Chewbacca G9 zThrawn zC-3PO",1
"Senat0r Lipost",0,1,107897,BH,"zzBossk zBoba Cad Dengar G9 zzJango",1
"Senat0r Lipost",0,1,78625,Phoenix,"Hera Ezra Zeb G8 Kanan Sabine",1
"Senat0r Lipost",1,1,93110,zEP,"zEP zVader Tarkin Dooku TFP G9",1
"Senat0r Lipost",1,0,13083,SionSolo (Counter),"Sion G8",1
"Senat0r Lipost",0,1,59403,Qira,"Qira 6* G8 L3-37 5* G8 Vandor Chewbacca 3* G7, Mission Zaalbar",0
"Senat0r Lipost",0,1,90878,DR,"zzzDR zzHK-47 zBSF Sith Marauder 4* G8, Sith Assassin 5* G8,",0
"Senat0r Lipost",,,303622,Executrix,"Executrix Tie Adv, Emperor's Shuttle 6*, TIE Reaper, Imperial TIE Fighter, Gauntlet Starfighter 4*, First Order SF TIE Fighter 1*, First Order TIE Fighter,",0
"Senat0r Lipost",1,0,78026,ShaakClones,"Shaak Ti G8, Rex Echo Fives G9 ARC Trooper G8,",0
"Senat0r Lipost",1,0,69267,Troopers,"Veers Starck G9 Range Trooper G8, Shoretrooper G8 Snowtrooper G8",0
"Senat0r Lipost",1,1,52069,Rogue1,"Jyn 5* G7 Chirrut 4* G8 Baze 4* G7 K-2SO G8 Cassian G8",0
"Senat0r Lipost",0,1,83695,FO,"KRU Kylo Phasma FOO FOST G8",0
"Senat0r Lipost",1,0,78496,QGJ,"QGJ G9 Aayla 3* G6 JKA zzOld Ben, Ahsoka",0
"Senat0r Lipost",1,0,60965,Jawas,"Nebit G7 Jawa Engineer 4* G9, Jawa Scavenger G8, Jawa G9 Dathcha",0
"Senat0r Lipost",1,0,11794,NestSolo (Counter),"Nest 5*",0
"Btr Nut",0,1,105102,padme,"zPadme zGK zJKA zAhsoka zC-3PO",1
"Btr Nut",0,1,102277,DR,"zzzDR zHK-47 zBSF Sith Assassin G8, zThrawn",1
"Btr Nut",,,402774,HansMF,"Home One, Han's MF, HT Biggs X-wing, Phantom Ghost Cassian's U-wing, Bistan's U-wing,",1
"Btr Nut",1,1,106934,JTR,"zzzJTR Scav Rey, zBB-8 zR2-D2 zFinn",1
"Btr Nut",1,1,110195,Revan Offense,"zzzJKR zGMY zBS zJolee HYoda G9",1
