Player,Offense,Defense,GP,Name,Squad,Viable
"LordJarJar",0,1,60824,FO,"KRU G8, Kylo FOO G8, Phasma G8, FOTP G8",0
"LordJarJar",1,0,9277,SionSolo (Counter),"Sion 3* G8",0
"StarKiller316",0,1,117425,padme,"zzPadme zGK JKA zAhsoka zzC-3PO",1
"StarKiller316",1,1,96573,NestSisters,"zzAV zzMT Daka Zombie zNest",1
"StarKiller316",0,1,112336,DR,"zzzDR zzHK-47 zBSF Sith Empire Trooper, Sith Assassin G8",1
"StarKiller316",,,403188,HansMF,"Home One, Han's MF, HT Biggs X-wing, Phantom Ghost Cassian's U-wing, Bistan's U-wing",1
"StarKiller316",0,1,91817,Geonosians,"zzGBA Poggle Geo Soldier, Geo Spy, Sun Fac",1
"StarKiller316",0,1,118163,Grievous,"zzGG zB2 zB1 zDroideka MagnaGuard",1
"StarKiller316",1,1,106249,JTR,"zzzJTR Scav Rey, zzBB-8 zzR2-D2 Finn",1
"StarKiller316",1,1,128031,GAS,"zzzzGAS zRex Echo zzFives zARC Trooper",1
"StarKiller316",1,1,119908,Revan Offense,"zzzJKR zGMY zBS zJolee zzHYoda",1
"StarKiller316",1,1,82074,Ewoks,"zChirpa G9, Elder Paploo zWicket Logray",1
"StarKiller316",0,1,98636,BH,"zBossk zBoba Greedo Dengar zZam",1
"StarKiller316",0,1,133207,FO,"zzKRU zKylo FOO FOE zHux",1
"StarKiller316",0,1,89757,Phoenix,"Hera zKanan zEzra Zeb zSabine",1
"StarKiller316",1,0,103901,CLS,"zzzCLS zHan Leia Old Ben, zzChewbacca",1
"StarKiller316",1,0,70506,Troopers,"zVeers Starck G9, Shoretrooper G8, Snowtrooper G9, Stormtrooper G9",1
"StarKiller316",1,1,108037,zEP,"zzEP zzzVader Tarkin Dooku TFP",1
"StarKiller316",1,0,78013,Wiggs,"Wedge Biggs Fulcrum G8, Chirrut Baze",1
"StarKiller316",1,0,74484,Jawas,"Nebit Jawa Engineer, Jawa Scavenger G9, Jawa G9, Dathcha",1
"StarKiller316",1,0,16236,SionSolo (Counter),"Sion",1
"StarKiller316",0,1,66480,Qira,"Qira 6* G9, L3-37 4* G8, Vandor Chewbacca 5* G7, zMission zZaalbar",0
"StarKiller316",,,383001,Executrix,"Executrix Tie Adv, Emperor's Shuttle 5*, TIE Reaper 6*, Imperial TIE Fighter, Gauntlet Starfighter 5*, First Order SF TIE Fighter, First Order TIE Fighter",0
"StarKiller316",0,1,81471,BH,"Jango Embo IG-88 Cad zThe Mandalorian 6* G9",0
"Michl Johso",0,1,152718,DRMalak,"zzzDR zzHK-47 zBSF zzMalak Sith Empire Trooper",1
"Michl Johso",0,1,109907,padme,"zzPadme zGK zJKA zAhsoka CW Chewbacca G9",1
"Michl Johso",,,415017,Negotiator,"Negotiator 5* HT Anakin's Eta-2 Starfighter, Umbaran Starfighter, Ahsoka Tano's Jedi Starfighter, Clone Sergeant's ARC-170, Jedi Consular's Starfighter, Plo Koon's Jedi Starfighter",1
"Michl Johso",0,1,93175,Geonosians,"zzGBA Poggle Geo Soldier, Geo Spy, Sun Fac",1
"Michl Johso",1,0,123708,Traya,"zzTraya zzDN zSion zzEP zThrawn",1
"Michl Johso",1,1,103533,JTR,"zzzJTR Scav Rey, zBB-8 zzR2-D2 zFinn",1
"Michl Johso",0,1,101630,Grievous,"zzGG zB2 zB1 zMagnaGuard zDooku",1
"Michl Johso",1,1,114974,Revan Offense,"zzzJKR zGMY zBS zJolee zEzra",1
"Michl Johso",1,1,92381,Ewoks,"zChirpa Elder zPaploo Scout zWicket",1
"Michl Johso",1,1,97878,Carth,"zCarth Onasi, zMission zZaalbar zJuhani zCanderous",1
"Michl Johso",0,1,108020,BH,"zzBossk zAurra zBoba zDengar G9, zJango",1
"Michl Johso",1,0,92315,Clones,"zCody Rex zEcho zFives Clone Sergeant",1
"Michl Johso",1,0,108857,CLS,"zzzCLS zHan zLeia Old Ben, zzChewbacca",1
"Michl Johso",1,0,74389,Jawas,"Nebit G8, Jawa Engineer G9, Jawa Scavenger G9, Jawa G9, Dathcha",1
"Michl Johso",1,1,80539,NS,"zMT G8, zAV Daka Zombie G9, Spirit G8",0
"Michl Johso",0,1,70157,Phoenix,"Hera Kanan G9, Chopper Zeb G8, Sabine 5* G8",0
"Michl Johso",1,1,59038,Rogue1,"Jyn 4* G8, Chirrut 4* G7, Baze 3* G7, K-2SO G9, zCassian G8",0
"Michl Johso",0,1,77650,FO,"KRU G8, zKylo FOO G8, FOST G9, Phasma",0
"Michl Johso",1,0,83085,Zader (Counter),"zzzVader Tarkin Sidious Shoretrooper 3* G4, Stormtrooper G8",0
"Michl Johso",1,0,10257,NestSolo (Counter),"Nest 5* G8",0
"Logan Ceti",,,467839,HansMF,"Home One, Han's MF, HT Biggs X-wing, Phantom Ghost Cassian's U-wing, Bistan's U-wing",1
"Logan Ceti",1,1,120155,JTR,"zzzJTR zScav Rey, zzBB-8 zzR2-D2 zFinn",1
"Logan Ceti",1,1,112104,Revan,"zzzJKR zBS zzGMY zJolee zGK G9",1
"Logan Ceti",1,0,154593,CLS,"zzzCLS zHan zzChewbacca zzThrawn zzC-3PO",1
"Logan Ceti",1,1,90061,Ewoks,"zChirpa Elder zPaploo zWicket zLogray",1
"Logan Ceti",0,1,115575,BH,"zzJango zBoba zDengar zzBossk zZam",1
"Logan Ceti",1,1,114273,zEP,"zzEP zzzVader zzTarkin zDooku G9, TFP G9",1
"Logan Ceti",1,0,116966,Troopers,"zVeers zStarck Magma Snowtrooper zStormtrooper",1
"Logan Ceti",0,1,79385,Phoenix,"zHera Kanan G8, Chopper Ezra G8, zZeb G9",1
"Logan Ceti",0,1,92394,FO,"zzKRU zKylo FOO Phasma zFOTP",1
"Logan Ceti",0,1,72644,Grievous,"zGG G7, B2 G5, MagnaGuard G5, zIG-88 T3-M4",0
"Logan Ceti",1,1,52818,NS,"MT 6* G6, AV Daka G4, Zombie G4, Spirit G3",0
"Logan Ceti",1,0,62909,501st,"Rex G6, Clone Sergeant G5, Echo G2, zFives G8, zAhsoka G9",0
"Logan Ceti",1,0,50576,Jawas,"Nebit G7, Jawa Engineer G5, Jawa Scavenger G6, Jawa G5, Dathcha G7",0
"Logan Ceti",1,0,8233,NestSolo (Counter),"Nest 3* G6",0
"Sal",0,1,125747,DRMalak,"zzzDR zzHK-47 zBSF zzMalak 6* Sith Empire Trooper",1
"Sal",0,1,110120,padme,"zzPadme G8, zGK zJKA zAhsoka zzC-3PO",1
"Sal",1,0,111199,Traya,"zzTraya zzDN zSion zzEP zThrawn",1
"Sal",1,1,114313,JTR,"zzzJTR Scav Rey, zzBB-8 zzR2-D2 zFinn",1
"Sal",1,1,121744,Revan Offense,"zzzJKR zzGMY zBS zJolee zzHYoda",1
"Sal",1,1,94894,Ewoks,"zChirpa Elder zPaploo Scout zWicket",1
"Sal",1,1,104839,Carth,"zCarth Onasi, zMission zZaalbar Juhani zCanderous",1
"Sal",0,1,110517,BH,"zzJango zBoba zGreedo zzBossk Cad",1
"Sal",0,1,76393,Phoenix,"Hera G9, Kanan Ezra Zeb G9, Sabine",1
"Sal",1,0,121820,CLS,"zzzCLS zHan Wedge Biggs zzChewbacca",1
"Sal",1,0,87052,Zader (Counter),"zzzVader Tarkin Sidious G8, Shoretrooper Stormtrooper G8",1
"Sal",0,1,76941,Geonosians,"GBA G9, Poggle Geo Soldier, Geo Spy, Sun Fac G8",0
"Sal",0,1,82866,Grievous,"zGG B2 G7, MagnaGuard G8, IG-88 zT3-M4",0
"Sal",1,1,64282,NS,"MT G8, AV Daka G7, Zombie 6* G8, Spirit G8",0
"Sal",1,0,77202,ShaakClones,"Shaak Ti 4* G8, zRex Echo Fives Clone Sergeant",0
"Sal",1,0,51295,Troopers,"Veers Starck 5* G7, DT 4* G7, Snowtrooper G8, Range Trooper 4* G6",0
"Sal",1,1,68766,Rogue1,"zJyn Chirrut G8, Baze 5* G8, K-2SO G8, Cassian G8",0
"Sal",0,1,69198,FO,"KRU 4* G8, Kylo FOO FOST G9, FOTP",0
"Sal",1,0,59917,Jawas,"Nebit G8, Jawa Engineer 5* G9, Jawa Scavenger G7, Jawa G9, Dathcha G7",0
"Sal",1,0,7191,NestSolo (Counter),"Nest 3* G7",0
"Darthshmoe",1,1,103409,NS_Alt,"zzMT zAV Zombie Talia zDaka",1
"Darthshmoe",1,1,98540,JTR,"zzJTR Scav Rey, zBB-8 zR2-D2 Finn",1
"Darthshmoe",0,1,66656,Phoenix,"Hera G8, Kanan G8, Chopper G8, zEzra Zeb G8",1
"Darthshmoe",0,1,106308,padme,"zzPadme zGK zJKA zAhsoka Fives G8",1
"Darthshmoe",1,0,14845,SionSolo (Counter),"Sion G9",1
"Darthshmoe",,,292934,Negotiator,"Negotiator 5* HT 5* Anakin's Eta-2 Starfighter 4*, Umbaran Starfighter 5*, Ahsoka Tano's Jedi Starfighter, BTL-B Y-wing Starfighter 3*, Clone Sergeant's ARC-170 6*, Jedi Consular's Starfighter",0
"Darthshmoe",0,1,89671,DR,"zDR HK-47 zBSF Sith Marauder 6* G8, zThrawn",0
"Darthshmoe",0,1,43784,Geonosians,"GBA 4* G9, Poggle G9, Geo Soldier 6* G8, Geo Spy 5* G6, Sun Fac 6* G6",0
"Darthshmoe",0,1,78035,Grievous,"GG G9, B2 G8, Nute G8, zDooku IG-88",0
"Darthshmoe",1,1,84492,zEP,"zzEP zzVader Tarkin G9, DT 5* G8, TFP 5* G8",0
"Darthshmoe",0,1,70508,BH,"zBossk 5* G8, Boba G9, Greedo G9, Cad zNest 4*",0
"Darthshmoe",1,0,69729,Wiggs,"Wedge 5* G8, Biggs G8, CLS zHan Leia G9",0
"Darthshmoe",0,1,71092,FO,"zKRU G8, zKylo FOO G8, Phasma G8, FOE 6* G9",0
"Darthshmoe",1,1,40378,Rogue1,"Jyn 5* G8, Chirrut 5* G8, Baze 5* G8, Pao 5* G8, Cassian 5* G8",0
"Eanid September",0,1,110834,padme,"zzPadme zGK zJKA zAhsoka zBarriss",1
"Eanid September",,,369736,Negotiator,"Negotiator 6* HT Anakin's Eta-2 Starfighter, Umbaran Starfighter, Ahsoka Tano's Jedi Starfighter, BTL-B Y-wing Starfighter, Clone Sergeant's ARC-170, Plo Koon's Jedi Starfighter",1
"Eanid September",0,1,101726,DR,"zzzDR zHK-47 zBSF Sith Empire Trooper, Sith Assassin G8",1
"Eanid September",0,1,93856,Geonosians,"zzGBA Poggle Geo Soldier, Geo Spy, Sun Fac",1
"Eanid September",,,369534,HansMF,"Home One, Han's MF, Biggs X-wing, Bistan's U-wing, Phantom Ghost Cassian's U-wing, Wedge X-wing",1
"Eanid September",0,1,93811,Grievous,"zGG B2 zB1 zDroideka MagnaGuard",1
"Eanid September",1,0,107636,Traya,"zzTraya zDN zSion zzEP zThrawn",1
"Eanid September",1,1,101700,JTR,"zzzJTR Scav Rey, BB-8 zR2-D2 Finn",1
"Eanid September",1,0,109733,CLS,"zzzCLS zHan zzChewbacca zLeia C-3PO",1
"Eanid September",1,1,121335,Revan Offense,"zzzJKR zGMY zBS zJolee Ezra",1
"Eanid September",1,1,90353,Ewoks,"zChirpa Elder Paploo zWicket Logray G9",1
"Eanid September",1,1,94102,Carth,"zCarth Onasi, zMission zZaalbar Juhani Canderous",1
"Eanid September",0,1,105559,BH,"zBossk zAurra zBoba Dengar zJango",1
"Eanid September",0,1,92819,FO,"zzKRU Kylo FOO FOE zHux",1
"Eanid September",0,1,73404,Phoenix,"Hera G9, Kanan Chopper G8, Zeb G9, Sabine G9",1
"Eanid September",1,1,75890,Rogue1,"Jyn G9, Chirrut G9, Baze G8, K-2SO G9, Cassian",1
"Eanid September",1,0,84341,Zader (Counter),"zzzVader Tarkin Sidious G9, Shoretrooper G8, Stormtrooper G8",1
"Eanid September",1,0,15181,NestSolo (Counter),"Nest",1
"Eanid September",1,1,88917,NS,"zMT zAV Daka Zombie Spirit G8",0
"Eanid September",,,303968,Executrix,"Executrix Tie Adv, Emperor's Shuttle, TIE Reaper 6*, Imperial TIE Fighter, Gauntlet Starfighter, First Order SF TIE Fighter, First Order TIE Fighter",0
"Eanid September",1,0,77186,ShaakClones,"Shaak Ti, Rex Echo G9, Fives ARC Trooper G8",0
"Eanid September",1,0,68399,Jawas,"Nebit G8, Jawa Engineer G9, Jawa Scavenger G8, Jawa G7, Dathcha G9",0
"Upgreyd",1,1,98313,NS,"zMT zAV zDaka Zombie Spirit",1
"Upgreyd",0,1,109655,padme,"zzPadme GK JKA zAhsoka zC-3PO",1
"Upgreyd",0,1,100468,DR,"zzzDR zHK-47 zBSF Sith Empire Trooper G8, Sith Assassin G8",1
"Upgreyd",,,429261,HansMF,"Home One, Han's MF, HT Biggs X-wing, Phantom Ghost Cassian's U-wing, Bistan's U-wing",1
"Upgreyd",0,1,106781,Geonosians,"zzGBA Poggle Geo Soldier, Geo Spy, Sun Fac",1
"Upgreyd",0,1,90563,Grievous,"zGG zB2 G9, zB1 zDroideka G9, zMagnaGuard G9",1
"Upgreyd",1,1,107812,JTR,"zJTR Scav Rey, BB-8 zzR2-D2 zFinn",1
"Upgreyd",1,1,124427,Revan Offense,"zzzJKR zzGMY BS zJolee HYoda",1
"Upgreyd",1,1,86080,Ewoks,"zChirpa Elder Paploo Wicket Logray",1
"Upgreyd",1,1,91489,Carth,"zCarth Onasi, Mission Zaalbar Juhani Canderous",1
"Upgreyd",0,1,103154,BH,"zBossk Boba Greedo Dengar Zam",1
"Upgreyd",0,1,130848,Phoenix,"zHera zKanan Ezra zZeb zSabine",1
"Upgreyd",1,0,78433,Wiggs,"Wedge G8, Biggs G8, CLS Han Chewbacca",1
"Upgreyd",1,0,68739,Wampa (Counter),"Rex G8, Wampa G8, DT G8, Jyn G8, FOO G8",1
"Upgreyd",1,0,81795,EP (trio),"EP Traya G8, DN G8, Sion Thrawn",1
"Upgreyd",1,0,16303,NestSolo (Counter),"Nest",1
"Upgreyd",,,308317,Executrix,"Executrix Tie Adv, Emperor's Shuttle 5*, TIE Reaper 6*, Imperial TIE Fighter, Gauntlet Starfighter, First Order SF TIE Fighter 5*, First Order TIE Fighter",0
"Upgreyd",1,0,65893,Troopers,"Veers Starck G9, Snowtrooper G9, Stormtrooper G8, Range Trooper 6* G6",0
"Upgreyd",0,1,70514,BH,"Jango IG-88 Greef Karga 5* G7, Cad G8, The Mandalorian 5* G7",0
"Upgreyd",0,1,72483,FO,"zKRU G8, Kylo G8, Phasma G8, FOE FOTP G8",0
"Upgreyd",1,0,67260,Jawas,"Nebit G8, Jawa Engineer G9, Jawa Scavenger G7, Jawa G9, Dathcha G9",0
"Krupten",0,1,122517,DRMalak,"zzzDR zzHK-47 zBSF zzMalak Sith Empire Trooper G8",1
"Krupten",0,1,99539,padme,"zzPadme GK G8, zJKA Ahsoka zzC-3PO",1
"Krupten",1,1,99960,NS_Alt,"zzMT zzAV Zombie Talia zDaka",1
"Krupten",0,1,95362,Geonosians,"zzGBA Poggle Geo Soldier, Geo Spy, Sun Fac",1
"Krupten",1,0,96795,Traya,"zzTraya DN G9, Sion zzEP zThrawn",1
"Krupten",1,1,115257,JTR,"zzzJTR Scav Rey, zzBB-8 zzR2-D2 zFinn",1
"Krupten",1,1,127341,Revan Offense,"zzzJKR zGMY BS zJolee zHYoda",1
"Krupten",1,1,80722,Ewoks,"zChirpa Elder Paploo Scout zLogray",1
"Krupten",1,1,86182,Carth,"zCarth Onasi, Mission Zaalbar Juhani Canderous",1
"Krupten",0,1,106312,BH,"zzBossk zBoba zDengar zJango Zam",1
"Krupten",0,1,104878,FO,"zzKRU zKylo FOO zFOST FOE",1
"Krupten",1,0,98084,CLS,"zzzCLS zHan Leia Old Ben, zzChewbacca",1
"Krupten",0,1,76511,Phoenix,"Hera Kanan Chopper Ezra Zeb",1
"Krupten",1,0,65814,ShaakClones,"zShaak Ti G7, Rex G7, Echo G7, Fives G8, Clone Sergeant G8",0
"Jakoby77",1,1,106059,NS,"zzMT zzAV zDaka Zombie Spirit",1
"Jakoby77",0,1,124748,DRMalak,"zzzDR zzHK-47 zBSF zzMalak Sith Empire Trooper",1
"Jakoby77",0,1,126810,padme,"zzPadme zGK zJKA zAhsoka zzC-3PO",1
"Jakoby77",,,439578,Negotiator,"Negotiator 6* HT Anakin's Eta-2 Starfighter, Umbaran Starfighter, Ahsoka Tano's Jedi Starfighter, BTL-B Y-wing Starfighter, Clone Sergeant's ARC-170, Plo Koon's Jedi Starfighter",1
"Jakoby77",0,1,92363,Geonosians,"zzGBA Poggle Geo Soldier, Geo Spy, Sun Fac",1
"Jakoby77",,,386785,HansMF,"Home One, Han's MF, Biggs X-wing, Bistan's U-wing, Phantom Ghost Cassian's U-wing, Wedge X-wing",1
"Jakoby77",0,1,111959,Grievous,"zzGG zB2 zB1 zDroideka MagnaGuard",1
"Jakoby77",1,0,115241,Traya,"zzTraya DN zSion zzEP zzThrawn",1
"Jakoby77",1,1,95732,JTR,"zJTR Scav Rey, zBB-8 zzR2-D2 Finn",1
"Jakoby77",,,315771,Executrix,"Executrix Tie Adv, Emperor's Shuttle, TIE Reaper, Imperial TIE Fighter, Gauntlet Starfighter, First Order SF TIE Fighter, First Order TIE Fighter",1
"Jakoby77",1,1,144121,GAS,"zzzzGAS zRex zEcho zzFives zARC Trooper",1
"Jakoby77",0,1,105186,BH,"zJango Boba Dengar G9, zzBossk zNest",1
"Jakoby77",1,1,122012,Revan Offense,"zzzJKR zGMY BS zJolee zzHYoda",1
"Jakoby77",1,1,70315,Ewoks,"zChirpa Elder Paploo Wicket Logray G9",1
"Jakoby77",1,1,95199,Carth,"zCarth Onasi, zMission zZaalbar Juhani Canderous",1
"Jakoby77",0,1,107910,FO,"zzKRU zKylo zFOST FOE zHux",1
"Jakoby77",0,1,71058,Phoenix,"Hera G8, Kanan G8, Ezra Zeb G8, Sabine G8",1
"Jakoby77",1,0,117188,Wiggs,"Wedge G9, Biggs zzzCLS zHan zzChewbacca",1
"Jakoby77",1,0,66910,Troopers,"Veers G9, Starck G7, Shoretrooper DT G9, Snowtrooper G7",0
"Jakoby77",1,1,70965,Rogue1,"Jyn G7, Chirrut G9, Baze K-2SO G8, Cassian G8",0
"Jakoby77",1,0,77408,Zader (Counter),"zzzVader Wampa 5* Tarkin G8, Sidious G8, Stormtrooper G5",0
"Jakoby77",1,0,46902,Jawas,"Nebit G8, Jawa Engineer G8, Jawa Scavenger G7, Jawa G8, Dathcha G7",0
"Ryu Herr",0,1,123174,padme,"zzPadme zGK zJKA zAhsoka zzC-3PO",1
"Ryu Herr",0,1,121080,DRMalak,"zzzDR zzHK-47 zBSF zzMalak Sith Empire Trooper G8",1
"Ryu Herr",,,399497,HansMF,"Home One, Han's MF, HT Biggs X-wing, Phantom Ghost Cassian's U-wing, Bistan's U-wing",1
"Ryu Herr",0,1,90316,Geonosians,"zGBA Poggle Geo Soldier, Geo Spy, Sun Fac",1
"Ryu Herr",0,1,119092,Grievous,"zzGG zB2 zB1 zDroideka zMagnaGuard",1
"Ryu Herr",1,1,105143,JTR,"zzJTR zScav Rey, zBB-8 zzR2-D2 Finn",1
"Ryu Herr",1,1,121237,Revan Offense,"zzzJKR zzGMY zBS zJolee zEzra",1
"Ryu Herr",1,1,84730,Ewoks,"zChirpa G9, Elder Paploo Wicket zLogray",1
"Ryu Herr",1,0,98937,ShaakClones,"zzShaak Ti, zRex zEcho zFives ARC Trooper G8",1
"Ryu Herr",0,1,100281,BH,"zJango zBoba zGreedo Dengar G9, zBossk",1
"Ryu Herr",1,1,89587,Carth,"zCarth Onasi, zMission zZaalbar Juhani Canderous",1
"Ryu Herr",1,1,90863,zEP,"zEP zzzVader Tarkin IPD G8, TFP G9",1
"Ryu Herr",0,1,87356,FO,"zKRU zKylo FOO FOST G8, FOE",1
"Ryu Herr",1,0,82430,Troopers,"zVeers Starck DT Snowtrooper Range Trooper",1
"Ryu Herr",1,0,109450,Wiggs,"Wedge Biggs zzzCLS zHan zzChewbacca",1
"Ryu Herr",0,1,77709,Phoenix,"Hera Kanan G9, Chopper G9, Zeb G8, zSabine",1
"Ryu Herr",1,0,15417,NestSolo (Counter),"Nest",1
"Ryu Herr",1,0,15145,SionSolo (Counter),"Sion G9",1
"Ryu Herr",1,1,89486,NS,"zMT zzAV zDaka Zombie G8, Spirit G8",0
"Ryu Herr",,,332539,Executrix,"Executrix Tie Adv, Emperor's Shuttle 4*, TIE Reaper, Imperial TIE Fighter, Gauntlet Starfighter, First Order SF TIE Fighter 3*, First Order TIE Fighter",0
"Ryu Herr",1,0,74302,Thragma (Counter),"zThrawn Magma G8, Krennic 6* G7, Stormtrooper Shoretrooper",0
"Ryu Herr",1,1,70659,Rogue1,"Jyn 5* G7, Chirrut Baze K-2SO G8, Cassian G9",0
"Ryu Herr",1,0,91301,zMaul,"Maul zDooku zDN Savage Sith Marauder",0
"Ryu Herr",1,0,55333,Jawas,"Nebit G6, Jawa Engineer 4* G9, Jawa Scavenger G8, Jawa 6* G6, Dathcha G9",0
"Syn",1,1,97778,NS_Alt,"zzMT zAV Zombie Talia Daka",1
"Syn",,,313934,Negotiator,"Negotiator 6* HT Anakin's Eta-2 Starfighter, Umbaran Starfighter, Ahsoka Tano's Jedi Starfighter, Clone Sergeant's ARC-170, Plo Koon's Jedi Starfighter, Rex's ARC-170",1
"Syn",1,1,107214,JTR,"zzzJTR zScav Rey, zBB-8 zzR2-D2 Finn",1
"Syn",0,1,69194,Grievous,"zzGG B2 G8, Droideka G8, MagnaGuard G8, Dooku",1
"Syn",1,1,115114,Revan,"zzzJKR zBS zGMY zJolee GK",1
"Syn",1,1,92679,Ewoks,"zChirpa Elder zPaploo zWicket zLogray",1
"Syn",1,1,90999,Carth,"Carth Onasi, Mission Zaalbar zJuhani zCanderous",1
"Syn",0,1,97443,BH,"zBossk Boba Greedo Dengar Jango",1
"Syn",1,1,93521,zEP,"zzEP zVader Tarkin DT G9, TFP",1
"Syn",0,1,81716,FO,"zKRU zKylo FOST G8, FOE G8, FOTP",1
"Syn",0,1,72709,Phoenix,"Hera G8, Kanan G8, zEzra Zeb G8, Sabine G8",1
"Syn",1,0,92144,Wiggs,"Wedge Biggs zzCLS zHan Leia",1
"Syn",1,0,81097,Wampa (Counter),"Rex zzWampa Visas G8, HYoda G9, Jyn G8",1
"Syn",1,0,18075,SionSolo (Counter),"Sion",1
"Syn",1,0,15288,NestSolo (Counter),"Nest",1
"Syn",,,321516,HansMF,"Home One, Han's MF 5*, Biggs X-wing, Bistan's U-wing 6*, Phantom Ghost Cassian's U-wing, Wedge X-wing",0
"Syn",0,1,81787,Geonosians,"zGBA Poggle Geo Soldier, Geo Spy, Sun Fac G8",0
"Syn",1,0,57365,Troopers,"Veers Starck G8, Shoretrooper G8, Snowtrooper G8, Stormtrooper G5",0
"Syn",1,0,91058,zMaul,"Maul zBSF DN Sidious Savage",0
