Player,Offense,Defense,GP,Name,Squad,Viable
"Jazzy",0,1,98468,DR,"zzzDR zzHK-47 zBSF Sith Empire Trooper G8, Sith Assassin G8",1
"Jazzy",,,403049,Negotiator,"Negotiator HT Anakin's Eta-2 Starfighter, Umbaran Starfighter, Ahsoka Tano's Jedi Starfighter, Clone Sergeant's ARC-170, Plo Koon's Jedi Starfighter, Rex's ARC-170",1
"Jazzy",1,1,95287,NS_Alt,"zzMT Acolyte zDaka zzAV Zombie",1
"Jazzy",0,1,91089,Geonosians,"zzGBA Poggle Geo Soldier, Geo Spy, Sun Fac",1
"Jazzy",,,352719,HansMF,"Home One, Han's MF, Biggs X-wing, Bistan's U-wing, Phantom Ghost Cassian's U-wing, Wedge X-wing",1
"Jazzy",1,0,115103,Traya,"zzTraya zzDN zSion zzEP zzThrawn",1
"Jazzy",0,1,94310,Grievous,"zzGG zB2 zB1 zDroideka G9, MagnaGuard",1
"Jazzy",1,1,99165,JTR,"zzzJTR Scav Rey, zBB-8 G9, zzR2-D2 zFinn",1
"Jazzy",1,1,122558,Revan Offense,"zzzJKR zzGMY zBS zJolee zzHYoda",1
"Jazzy",1,1,92146,Ewoks,"zChirpa Elder zPaploo zWicket zLogray",1
"Jazzy",0,1,108453,BH,"zzBossk zBoba Dengar G9, zzJango zZam",1
"Jazzy",1,1,98140,Carth,"zCarth Onasi, zMission zZaalbar zJuhani zCanderous",1
"Jazzy",0,1,91128,FO,"zzKRU zKylo FOE FOST G9, FOO",1
"Jazzy",1,0,83205,Clones,"zCody Rex Echo Fives ARC Trooper G8",1
"Jazzy",0,1,75813,Phoenix,"Hera G8, Zeb G8, zKanan G8, zEzra Sabine G8",1
"Jazzy",1,0,106838,CLS,"zzzCLS zHan zLeia Old Ben, zChewbacca",1
"Jazzy",1,0,70745,Jawas,"Nebit G8, Jawa Engineer G9, Jawa Scavenger G8, Jawa G9, Dathcha G9",1
"Jazzy",1,0,14910,NestSolo (Counter),"Nest G9",1
"Jazzy",,,377784,Executrix,"Executrix Tie Adv, Emperor's Shuttle 6*, TIE Reaper 6*, Imperial TIE Fighter, Gauntlet Starfighter, First Order SF TIE Fighter, First Order TIE Fighter",0
"Jazzy",,,63751,Mon Mothma,"Mon Mothma 4* G7, Hoth Rebel Scout G8, Chirrut G8, Lando Jyn G7",0
"Jazzy",1,0,65578,Troopers,"Veers Starck G7, DT G8, Range Trooper 5* G8, Stormtrooper",0
