Player,Offense,Defense,GP,Name,Squad,Viable
"Btr Nut",1,1,89713,Ewoks,"zChirpa Elder Paploo Wicket zLogray",1
"Btr Nut",1,0,96483,ShaakClones,"zShaak Ti, Rex zEcho zzFives ARC Trooper G8,",1
"Btr Nut",0,1,110998,BH,"zzBossk zBoba Dengar zIG-88 zJango",1
"Btr Nut",1,1,100413,zEP,"zEP zzzVader zTarkin zKrennic G9 TFP G9",1
"Btr Nut",0,1,75214,Phoenix,"Hera Ezra G9 Zeb G8 Kanan G8 Sabine",1
"Btr Nut",1,0,92638,Wiggs,"Wedge G8 Biggs zzzCLS Fulcrum Leia",1
"Btr Nut",1,1,84896,Rogue1,"zJyn Chirrut G8 Baze G8 K-2SO G9 zCassian",1
"Btr Nut",1,0,72116,Jawas,"Nebit G8 Jawa Engineer G9, Jawa Scavenger G8, Jawa G9 Dathcha",1
"Btr Nut",1,0,16182,NestSolo (Counter),"Nest",1
"Btr Nut",1,0,16435,SionSolo (Counter),"Sion",1
"Btr Nut",0,1,65904,Qira,"Qira L3-37 4* G8 Vandor Chewbacca 4* G8, Mission G9 Zaalbar G8",0
"Btr Nut",1,1,84582,NS,"MT zzAV Daka Zombie Spirit G8",0
"Btr Nut",0,1,80653,Geonosians,"GBA Poggle Geo Soldier, Geo Spy G9, Sun Fac G8,",0
"Btr Nut",0,1,80615,Grievous,"zGG B2 5* G8 B1 G9 MagnaGuard G8 zDooku",0
"Btr Nut",,,347510,Executrix,"Executrix Tie Adv, Emperor's Shuttle 5*, TIE Reaper 6*, Imperial TIE Fighter, Gauntlet Starfighter, First Order SF TIE Fighter 4*, First Order TIE Fighter,",0
"Btr Nut",1,0,67316,Troopers,"Veers Starck G9 Range Trooper 4* G8, Shoretrooper G8 Stormtrooper G9",0
"Btr Nut",0,1,80672,FO,"zKRU G8 Kylo G9 FOE FOO FOTP",0
"Sutti",0,1,125733,padme,"zzPadme zGK zJKA zAhsoka zC-3PO",1
"Sutti",0,1,152126,DRMalak,"zzzDR zzHK-47 zBSF zzMalak zzThrawn",1
"Sutti",1,1,96036,NS_Alt,"zzMT Acolyte Daka zzAV Zombie",1
"Sutti",0,1,94165,Geonosians,"zzGBA Poggle Geo Soldier, Geo Spy, Sun Fac,",1
"Sutti",0,1,124087,Grievous,"zzGG zB2 zB1 zDroideka zMagnaGuard",1
"Sutti",1,1,95627,JTR,"zzJTR Scav Rey, BB-8 zR2-D2 Finn",1
"Sutti",1,0,103839,Traya,"zzTraya zDN Sion zzEP Sith Empire Trooper,",1
"Sutti",,,400492,HansMF,"Home One, Han's MF, HT Biggs X-wing, Phantom Ghost Cassian's U-wing, Wedge X-wing,",1
"Sutti",1,1,130851,GAS,"zzzzGAS zRex zEcho zzFives zARC Trooper,",1
"Sutti",1,1,118263,Revan Offense,"zzzJKR zGMY zBS zJolee HYoda",1
"Sutti",1,1,78663,Ewoks,"zChirpa G9 Elder Paploo G9 Wicket Logray G9",1
"Sutti",1,1,86912,Carth,"zCarth Onasi, zMission Zaalbar Juhani G8 Canderous",1
"Sutti",0,1,104544,BH,"zzBossk zBoba Dengar Greedo zJango",1
"Sutti",0,1,82155,FO,"zzKRU Kylo G9 FOE G9 FOO FOST G9",1
"Sutti",1,0,111638,Wiggs,"Wedge Biggs zzzCLS zHan zChewbacca",1
"Sutti",0,1,71215,Phoenix,"Hera G8 Ezra Zeb G8 Kanan G8 Sabine G8",1
"Sutti",1,0,73693,Troopers,"zVeers Starck G9 DT G9 Shoretrooper G8 Stormtrooper G8",1
"Sutti",1,1,69192,Rogue1,"Jyn G8 Chirrut G8 Baze G8 K-2SO G8 Cassian G9",1
"Sutti",1,0,15526,NestSolo (Counter),"Nest",1
"Sutti",,,308427,Executrix,"Executrix Tie Adv, Emperor's Shuttle 6*, TIE Reaper 6*, Imperial TIE Fighter, Gauntlet Starfighter 5*, First Order SF TIE Fighter 4*, First Order TIE Fighter,",0
"Michl Johso",0,1,127850,DRMalak,"zzzDR zzHK-47 zBSF zzMalak 6* Sith Assassin G8,",1
"Michl Johso",1,0,120446,Traya,"zzTraya zzDN zSion zzEP zThrawn",1
"Michl Johso",1,1,103488,JTR,"zzzJTR Scav Rey, zBB-8 zzR2-D2 zFinn",1
"Michl Johso",,,101876,Nute-OR,"zNute zDooku zJango zZaalbar zMission",1
"Michl Johso",1,1,120501,Revan,"zzzJKR zBS zGMY zJolee zGK",1
"Michl Johso",1,1,91775,Ewoks,"zChirpa Elder zPaploo Scout zWicket",1
"Michl Johso",0,1,107345,BH,"zzBossk zAurra zBoba zDengar G9 zGreedo",1
"Michl Johso",1,0,97263,501st,"Rex Clone Sergeant, zEcho zFives zAhsoka",1
"Michl Johso",1,0,98972,Wiggs,"Wedge Biggs zzzCLS zHan zLeia",1
"Michl Johso",0,1,78294,Phoenix,"Hera Chopper zEzra Zeb G8 Kanan G9",1
"Michl Johso",1,0,99475,Zader (Counter),"zzzVader Tarkin Sidious Sith Empire Trooper, Stormtrooper G8",1
"Michl Johso",1,0,74344,Jawas,"Nebit G8 Jawa Engineer G9, Jawa Scavenger G9, Jawa G9 Dathcha",1
"Michl Johso",1,1,77942,NS,"MT G8 zAV Daka Zombie G9 Spirit G8",0
"Michl Johso",0,1,81910,Geonosians,"GBA 6* Poggle Geo Soldier, Geo Spy, Sun Fac,",0
"Michl Johso",0,1,96600,Grievous,"GG zB2 zMagnaGuard zIG-88 zT3-M4",0
"Michl Johso",0,1,77604,FO,"KRU G8 zKylo Phasma FOO G8 FOST G9",0
"Michl Johso",1,0,10257,NestSolo (Counter),"Nest 5* G8",0
"Ryu Herr",0,1,113146,padme,"zzPadme zGK zJKA zAhsoka zC-3PO",1
"Ryu Herr",0,1,120409,DRMalak,"zzzDR zzHK-47 zBSF zzMalak Sith Assassin G8,",1
"Ryu Herr",,,383084,HansMF,"Home One, Han's MF, HT Biggs X-wing, Phantom Ghost Cassian's U-wing, Bistan's U-wing,",1
"Ryu Herr",0,1,89476,Geonosians,"zGBA Poggle Geo Soldier, Geo Spy, Sun Fac,",1
"Ryu Herr",0,1,111613,Grievous,"zzGG zB2 zB1 zDroideka zMagnaGuard",1
"Ryu Herr",1,1,102715,JTR,"zzJTR Scav Rey, zBB-8 zzR2-D2 Finn",1
"Ryu Herr",1,1,121238,Revan Offense,"zzzJKR zzGMY zBS zJolee zEzra",1
"Ryu Herr",1,1,84532,Ewoks,"zChirpa G9 Elder Paploo Wicket zLogray",1
"Ryu Herr",1,0,95598,ShaakClones,"zShaak Ti, zRex zEcho zFives ARC Trooper G8,",1
"Ryu Herr",1,1,88737,Carth,"zCarth Onasi, zMission zZaalbar Juhani Canderous G9",1
"Ryu Herr",0,1,97978,BH,"zBossk zBoba Dengar G9 zGreedo IG-88",1
"Ryu Herr",1,1,90481,zEP,"zEP zzzVader Tarkin IPD G8 TFP G9",1
"Ryu Herr",0,1,86757,FO,"zKRU zKylo FOE FOO FOST G8",1
"Ryu Herr",1,0,82220,Troopers,"zVeers Starck DT Range Trooper, Snowtrooper",1
"Ryu Herr",1,0,108662,Wiggs,"Wedge Biggs zzzCLS zHan zzChewbacca",1
"Ryu Herr",0,1,75141,Phoenix,"Hera G9 Chopper G8 Zeb G8 Kanan G9 zSabine",1
"Ryu Herr",1,0,15417,NestSolo (Counter),"Nest",1
"Ryu Herr",1,0,15121,SionSolo (Counter),"Sion G9",1
"Ryu Herr",1,1,88558,NS,"zMT zzAV zDaka Zombie G8 Spirit G8",0
"Ryu Herr",1,0,73435,Thragma (Counter),"zThrawn Magma G8 Krennic 6* G6 Stormtrooper Shoretrooper",0
"Ryu Herr",1,1,68992,Rogue1,"Jyn 5* G7 Chirrut Baze K-2SO G8 Cassian G8",0
"Ryu Herr",1,0,91008,zMaul,"Maul zDooku zDN Savage Sith Marauder,",0
"Ryu Herr",1,0,53361,Jawas,"Nebit G6 Jawa Engineer 4* G9, Jawa Scavenger G8, Jawa 6* G6 Dathcha G9",0
"DarkKnightDan80",0,1,116842,padme,"zzPadme zGK zJKA zAhsoka zzC-3PO",1
"DarkKnightDan80",1,1,100760,NestSisters,"zzAV zMT zDaka Zombie zNest",1
"DarkKnightDan80",,,443903,HansMF,"Home One, Han's MF, HT Biggs X-wing, Phantom Ghost Cassian's U-wing, Bistan's U-wing,",1
"DarkKnightDan80",0,1,89633,Geonosians,"zzGBA Poggle Geo Soldier, Geo Spy, Sun Fac,",1
"DarkKnightDan80",1,0,109541,Traya,"zzTraya DN Sion zzEP zzThrawn",1
"DarkKnightDan80",1,1,107534,JTR,"zzJTR zScav Rey, zBB-8 zzR2-D2 zFinn",1
"DarkKnightDan80",1,1,139805,Revan Offense,"zzzJKR zGMY zBS zJolee zHYoda",1
"DarkKnightDan80",1,1,88741,Ewoks,"zChirpa Elder Paploo Wicket zLogray",1
"DarkKnightDan80",0,1,109416,BH,"zzBossk zBoba zDengar Greedo zzJango",1
"DarkKnightDan80",0,1,101998,FO,"zzKRU zKylo FOE FOO zFOST",1
"DarkKnightDan80",1,0,107384,CLS,"zzzCLS zHan Leia zOld Ben, zzChewbacca",1
"DarkKnightDan80",0,1,97503,Phoenix,"zHera zEzra zZeb zKanan Sabine",1
"DarkKnightDan80",1,0,84239,Clones,"Cody Rex Echo Fives Clone Sergeant,",1
"DarkKnightDan80",1,0,87103,Troopers,"zVeers zStarck DT Snowtrooper Stormtrooper",1
"DarkKnightDan80",1,0,93758,Zader (Counter),"zVader Mission Zaalbar zWampa Tarkin",1
"DarkKnightDan80",1,0,80174,Jawas,"Nebit Jawa Engineer, Jawa Scavenger, Jawa Dathcha",1
"DarkKnightDan80",0,1,89199,Grievous,"GG B2 MagnaGuard Dooku IG-88",0
"DarkKnightDan80",1,1,73747,Rogue1,"Jyn Chirrut Baze 5* G8 K-2SO Cassian",0
"DarkKnightDan80",1,0,83027,zMaul,"Maul BSF Sidious Savage Sith Empire Trooper,",0
"Blades",0,1,102730,BH,"zBossk zBoba Cad Dengar zJango",1
"Blades",1,0,93875,CLS,"zzCLS zHan Leia G9 Old Ben, Chewbacca",1
"Blades",0,1,72225,Phoenix,"Hera G9 Chopper Ezra Zeb G9 Kanan G9",1
"Blades",1,1,66447,Ewoks,"zChirpa G8 Elder Paploo Wicket 4* G7 Logray 5* G9",0
"Blades",0,1,65965,BS,"BS G9 GMY Jolee 4* GK G9 Ahsoka G7",0
"Blades",0,1,48853,FO,"KRU G8 Kylo G7 Phasma G7 FOE G7 FOST 5* G8",0
"Blades",1,0,80843,Zader (Counter),"zzzVader Wampa G7 Tarkin G8 Sidious G8 Stormtrooper G9",0
"Mandaloian Ophace",1,1,100173,NS,"zzMT zzAV zDaka Zombie Spirit",1
"Mandaloian Ophace",1,0,106080,Traya,"zzTraya zzDN zSion zzEP Thrawn G9",1
"Mandaloian Ophace",1,1,95605,JTR,"zzzJTR Scav Rey, BB-8 R2-D2 Finn",1
"Mandaloian Ophace",1,0,97910,501st,"zRex zARC Trooper, Echo zFives zAhsoka",1
"Mandaloian Ophace",0,1,81011,Phoenix,"zHera zEzra Zeb G8 Kanan G8 Sabine G8",1
"Mandaloian Ophace",1,0,94161,Wiggs,"Wedge G8 Biggs G8 zzzCLS zHan zFulcrum",1
"Mandaloian Ophace",0,1,110824,BS,"zBS zzGMY zJolee GK HYoda",1
"Mandaloian Ophace",1,0,85676,Jawas,"Nebit Jawa Engineer, Jawa Scavenger, Jawa Dathcha",1
"Mandaloian Ophace",,,345793,Negotiator,"Negotiator 5* HT 3* Anakin's Eta-2 Starfighter, Umbaran Starfighter, Ahsoka Tano's Jedi Starfighter, Clone Sergeant's ARC-170, Plo Koon's Jedi Starfighter, Rex's ARC-170,",0
"Mandaloian Ophace",0,1,69535,Geonosians,"GBA 4* G9 Poggle G8 Geo Soldier G8, Geo Spy, Sun Fac G8,",0
"Mandaloian Ophace",0,1,70770,Grievous,"GG B2 5* G7 MagnaGuard 5* G7 zDooku IG-88",0
"Mandaloian Ophace",0,1,75952,BH,"Jango 3* G7 zBoba Cad Greedo G8 Zam G8",0
"Mandaloian Ophace",1,0,56574,Troopers,"Veers 6* G7 Starck G7 Magma G7 Snowtrooper G8 Stormtrooper G7",0
"Mandaloian Ophace",0,1,68466,FO,"KRU G8 Kylo G8 Phasma G8 FOO G9 FOSFTP G7",0
"Mandaloian Ophace",1,0,94237,Zader (Counter),"zzzVader Mission 3* G7 Zaalbar 6* G8 zzWampa Sidious",0
"Kaervek",1,1,112279,NS,"zzMT zzAV zDaka Zombie Spirit",1
"Kaervek",0,1,116721,padme,"zzPadme zGK zJKA zAhsoka zC-3PO",1
"Kaervek",0,1,94595,Geonosians,"zzGBA Poggle Geo Soldier, Geo Spy, Sun Fac,",1
"Kaervek",1,0,107997,Traya,"zzTraya DN zSion zNest zThrawn",1
"Kaervek",1,1,109877,JTR,"zzzJTR Scav Rey, zzBB-8 zzR2-D2 Finn",1
"Kaervek",0,1,100876,Grievous,"zzGG zB2 zB1 MagnaGuard G9 zNute",1
"Kaervek",1,1,112806,Revan Offense,"zzzJKR zGMY zBS zJolee zHYoda",1
"Kaervek",1,1,84056,Ewoks,"zChirpa Elder Paploo Wicket zLogray",1
"Kaervek",0,1,104215,BH,"zzBossk zBoba Dengar Greedo zzJango",1
"Kaervek",1,1,97231,zEP,"zEP zzVader zTarkin DT TFP",1
"Kaervek",0,1,86699,FO,"zzKRU Kylo FOE FOO FOTP",1
"Kaervek",0,1,74872,Phoenix,"Hera G8 zEzra Zeb G8 Kanan G8 Sabine G8",1
"Kaervek",1,0,115455,CLS,"zzzCLS zHan Leia Old Ben, zzChewbacca",1
"Kaervek",1,0,84180,Troopers,"zVeers zStarck Shoretrooper G8 Snowtrooper Stormtrooper",1
"Kaervek",1,1,80626,Rogue1,"zJyn G8 Chirrut Baze Cassian G9 Bistan G8",1
"Kaervek",1,0,46918,Jawas,"Nebit G8 Jawa Engineer 5* G7, Jawa Scavenger G7, Jawa 5* G8 Dathcha G8",0
"Syn",1,1,97911,NS_Alt,"zzMT zAV Zombie Daka Talia",1
"Syn",1,1,107485,JTR,"zzzJTR zScav Rey, zBB-8 zzR2-D2 Finn",1
"Syn",,,356625,HansMF,"Home One, Han's MF 5*, HT Biggs X-wing, Phantom Ghost Cassian's U-wing, Wedge X-wing,",1
"Syn",1,1,115315,Revan,"zzzJKR zBS zGMY zJolee GK",1
"Syn",1,1,80627,Carth,"Carth Onasi, Mission Zaalbar Juhani Canderous",1
"Syn",0,1,97082,BH,"zBossk Boba Dengar Greedo Jango",1
"Syn",1,1,93373,zEP,"zzEP zVader Tarkin DT G9 TFP",1
"Syn",1,0,98029,Wiggs,"Wedge Biggs zzCLS zHan zEzra",1
"Syn",1,0,79260,Wampa (Counter),"Rex G8 zzWampa Visas G8 HYoda G9 Jyn G8",1
"Syn",0,1,81873,FO,"zKRU zKylo Phasma G8 FOST G8 FOTP",1
"Syn",1,0,18346,SionSolo (Counter),"Sion",1
"Syn",1,0,15559,NestSolo (Counter),"Nest",1
"Syn",0,1,76622,Geonosians,"zGBA Poggle Geo Soldier, Geo Spy, Sun Fac G8,",0
"Syn",0,1,78749,Grievous,"zzGG B2 G5 MagnaGuard G8 zNute Dooku",0
"Syn",1,1,79657,Ewoks,"Chirpa Elder Paploo Wicket Logray G9",0
"Syn",1,0,57365,Troopers,"Veers Starck G8 Shoretrooper G8 Snowtrooper G8 Stormtrooper G5",0
"Syn",0,1,66734,Phoenix,"Hera G8 Chopper Zeb G8 Kanan G8 Sabine 6* G8",0
"Syn",1,0,91283,zMaul,"Maul zBSF DN Sidious Savage",0
"Rouge 5hadow",1,1,119765,Revan,"zzzJKR zBS zGMY zJolee GK",1
"Rouge 5hadow",0,1,92659,Phoenix,"zHera Ezra zZeb zKanan Sabine G8",1
"Rouge 5hadow",1,0,91340,Zader (Counter),"zzVader zMission G8 Zaalbar G8 zzWampa zBoba G9",1
"Rouge 5hadow",0,1,60639,Geonosians,"zGBA 5* G9 Poggle G6 Geo Soldier G4, Geo Spy G5, Sun Fac G4,",0
"Rouge 5hadow",1,0,90196,Traya,"zzTraya DN 6* G9 zSion 6* zBSF zThrawn G8",0
"Rouge 5hadow",1,1,69853,NS,"zMT AV Daka G8 Zombie 4* G9 Spirit 5* G8",0
"Rouge 5hadow",1,0,14145,NestSolo (Counter),"zNest 3*",0
"Grand M'uff Talkin",1,1,98031,NS_Alt,"zzMT zAV Zombie zDaka Talia",1
"Grand M'uff Talkin",0,1,79078,Geonosians,"zGBA 6* Poggle Geo Soldier, Geo Spy, Sun Fac G8,",1
"Grand M'uff Talkin",1,0,108269,Traya,"zzTraya zDN zSion zzEP zThrawn",1
"Grand M'uff Talkin",1,1,115944,JTR,"zzzJTR Scav Rey, zzBB-8 zzR2-D2 zFinn",1
"Grand M'uff Talkin",0,1,86442,Grievous,"zzGG B2 MagnaGuard G9 Nute Dooku",1
"Grand M'uff Talkin",1,1,115602,Revan,"zzzJKR zBS zzGMY zJolee GK",1
"Grand M'uff Talkin",1,0,116538,CLS,"zzzCLS zHan zzChewbacca Leia zzC-3PO",1
"Grand M'uff Talkin",1,1,87893,Ewoks,"zChirpa Elder Paploo zWicket zLogray",1
"Grand M'uff Talkin",1,1,89332,Carth,"zCarth Onasi, Mission zZaalbar Juhani Canderous",1
"Grand M'uff Talkin",0,1,110363,BH,"zzBossk zBoba zDengar zGreedo zZam",1
"Grand M'uff Talkin",1,0,99618,501st,"zRex Clone Sergeant, zEcho zzFives zAhsoka",1
"Grand M'uff Talkin",0,1,73589,Phoenix,"Hera Chopper Ezra G8 Zeb G8 Kanan",1
"Grand M'uff Talkin",1,1,76783,Rogue1,"Jyn G8 Chirrut Baze K-2SO Cassian",1
"Grand M'uff Talkin",1,0,67682,Jawas,"Nebit G8 Jawa Engineer G9, Jawa Scavenger G8, Jawa G9 Dathcha G8",1
"Grand M'uff Talkin",1,0,14907,NestSolo (Counter),"Nest G9",1
"Grand M'uff Talkin",0,1,70252,FO,"KRU G9 Kylo FOE FOST G8 FOTP",0
"Grand M'uff Talkin",1,0,90384,Zader (Counter),"zzzVader zzWampa Tarkin Sidious G5 Stormtrooper G8",0
"neyde jean",0,1,112799,DRMalak,"zzzDR zHK-47 zBSF zzMalak Sith Assassin G8,",1
"neyde jean",0,1,100744,padme,"zPadme GK zJKA zAhsoka zzC-3PO",1
"neyde jean",1,1,90327,NS_Alt,"zMT zzAV Zombie Daka Talia",1
"neyde jean",0,1,87995,Geonosians,"zzGBA Poggle Geo Soldier, Geo Spy, Sun Fac G9,",1
"neyde jean",1,1,106398,JTR,"zzzJTR Scav Rey, zBB-8 zzR2-D2 RT",1
"neyde jean",0,1,93419,Grievous,"zzGG B2 zDroideka G9 MagnaGuard G8 zNute",1
"neyde jean",1,1,113786,Revan Offense,"zzzJKR zGMY zBS zJolee zHYoda",1
"neyde jean",1,1,89983,Ewoks,"zChirpa Elder zPaploo zWicket zLogray",1
"neyde jean",1,1,95283,Carth,"zCarth Onasi, zMission zZaalbar zJuhani Canderous",1
"neyde jean",0,1,94044,BH,"zBossk Boba Dengar Jango Zam",1
"neyde jean",1,1,88852,zEP,"zEP zzzVader Tarkin G9 Krennic TFP G9",1
"neyde jean",0,1,76118,Phoenix,"Hera G9 zEzra Zeb G8 Kanan Sabine G8",1
"neyde jean",1,0,101861,Wampa (Counter),"zRex zzWampa zVisas Jyn G9 FOO",1
"neyde jean",1,0,73753,Troopers,"zVeers Starck G9 DT G9 Shoretrooper G9 Snowtrooper G9",1
"neyde jean",1,0,96707,CLS,"zzzCLS zHan Leia Old Ben G9, zChewbacca",1
"neyde jean",0,1,85722,FO,"zzKRU zKylo Phasma G8 zFOST G9 FOTP",1
"neyde jean",1,0,72235,Wiggs,"Wedge G9 Biggs G8 Fulcrum G9 Chirrut G9 Baze",1
"neyde jean",1,0,14677,SionSolo (Counter),"Sion G8",1
"neyde jean",1,0,65637,Jawas,"Nebit G9 Jawa Engineer G9, Jawa Scavenger G8, Jawa G7 Dathcha G8",0
"neyde jean",1,0,13339,NestSolo (Counter),"zNest 6* G7",0
"Val",0,1,144937,DRMalak,"zzzDR zzHK-47 zBSF zzMalak zThrawn",1
"Val",1,1,109336,NS_Alt,"zzMT zzAV Zombie zDaka Talia",1
"Val",1,1,104627,JTR,"zzJTR Scav Rey, zzBB-8 zzR2-D2 RT",1
"Val",0,1,105372,Grievous,"zzGG zB2 zB1 zDroideka IG-88",1
"Val",,,377444,HansMF,"Home One, Han's MF, HT Biggs X-wing, Phantom Ghost Tie Adv, Wedge X-wing,",1
"Val",1,1,125044,Revan,"zzzJKR zBS zGMY zJolee zGK",1
"Val",1,1,89717,Carth,"zCarth Onasi, zMission zZaalbar Juhani G9 zCanderous",1
"Val",0,1,120373,FO,"zzKRU zKylo FOO zFOST zFOTP",1
"Val",0,1,72819,Phoenix,"Hera Chopper Ezra Zeb G9 Kanan G9",1
"Val",1,0,95784,EP (Traya),"zEP zTraya DN Sith Empire Trooper, Vader",1
"Val",1,0,23575,SionSolo (Counter),"zSion",1
"Val",1,0,102968,Wiggs,"Wedge 6* Biggs zzCLS zHan zzChewbacca",0
"bellojack",0,1,106773,padme,"zzPadme zGK zJKA zAhsoka zzC-3PO",1
"bellojack",0,1,119741,DRMalak,"zzzDR zzHK-47 zBSF zzMalak zzThrawn",1
"bellojack",,,421246,HansMF,"Home One, Han's MF, HT Biggs X-wing, Phantom Ghost Cassian's U-wing, Bistan's U-wing,",1
"bellojack",0,1,106057,Grievous,"zzGG zB2 zB1 zDroideka zMagnaGuard",1
"bellojack",1,1,136279,JTR,"zzzJTR zScav Rey, zzBB-8 zzR2-D2 Finn",1
"bellojack",1,1,113880,Revan Offense,"zzzJKR zGMY zBS zJolee zEzra",1
"bellojack",1,1,93810,Ewoks,"zChirpa Elder zPaploo zWicket zLogray",1
"bellojack",1,1,89583,Carth,"Carth Onasi, zMission zZaalbar zJuhani Canderous",1
"bellojack",0,1,110075,BH,"zzBossk zBoba zGreedo zIG-88 zZam",1
"bellojack",1,0,107165,CLS,"zzzCLS zHan Leia zzOld Ben, zzChewbacca",1
"bellojack",1,1,106447,zEP,"zzEP zzzVader zTarkin zDooku TFP",1
"bellojack",0,1,95939,Phoenix,"zHera Chopper zZeb zKanan zSabine",1
"bellojack",1,1,71467,Rogue1,"Jyn G8 Chirrut G8 Baze G8 K-2SO G9 Cassian G9",1
"bellojack",1,0,21097,SionSolo (Counter),"zSion",1
"bellojack",0,1,75321,Geonosians,"GBA 6* G3 Poggle Geo Soldier, Geo Spy, Sun Fac G8,",0
"bellojack",1,1,64141,NS,"MT G5 zAV Daka G8 Zombie G4 Spirit G2",0
"bellojack",1,0,97452,ShaakClones,"zzShaak Ti, zRex zEcho zzFives Clone Sergeant G8,",0
"bellojack",0,1,73647,FO,"KRU G8 Kylo Phasma FOO FOST",0
"bellojack",1,0,78848,zMaul,"Maul G8 zDN Sidious Savage Sith Empire Trooper,",0
"bellojack",1,0,10120,NestSolo (Counter),"Nest G2",0
"Scuba Bill23",0,1,119415,padme,"zzPadme zGK zJKA zAhsoka zzC-3PO",1
"Scuba Bill23",0,1,119517,DRMalak,"zzzDR zzHK-47 zBSF zzMalak zThrawn",1
"Scuba Bill23",,,390856,Negotiator,"Negotiator 6* HT Anakin's Eta-2 Starfighter, Umbaran Starfighter, Ahsoka Tano's Jedi Starfighter, Clone Sergeant's ARC-170, Plo Koon's Jedi Starfighter, Rex's ARC-170,",1
"Scuba Bill23",0,1,109333,Grievous,"zzGG zB2 zB1 zDroideka zMagnaGuard",1
"Scuba Bill23",1,1,98907,Revan Offense,"zzzJKR zGMY BS zJolee HYoda",1
"Scuba Bill23",1,1,79565,Ewoks,"zChirpa Elder Paploo Wicket Logray",1
"Scuba Bill23",1,1,86309,Carth,"zCarth Onasi, zMission zZaalbar Juhani G8 zCanderous",1
"Scuba Bill23",0,1,92398,BH,"zBossk Boba Cad Dengar G9 Jango",1
"Scuba Bill23",1,1,86658,zEP,"zEP zzVader Tarkin Krennic TFP G8",1
"Scuba Bill23",0,1,71657,Phoenix,"Hera Ezra Zeb G9 Kanan Sabine G8",1
"Scuba Bill23",1,0,15762,SionSolo (Counter),"Sion G9",1
"Scuba Bill23",1,1,71736,JTR,"JTR G8 Scav Rey, BB-8 G9 zR2-D2 Finn G9",0
"Scuba Bill23",1,0,95424,ShaakClones,"zzShaak Ti, zRex Echo zFives G9 zARC Trooper,",0
"Scuba Bill23",1,0,70060,Wiggs,"Wedge G1 Biggs G8 zCLS zHan Leia G9",0
"Scuba Bill23",0,1,67239,FO,"KRU Kylo G9 FOO FOSFTP G8 FOST G8",0
"Jazzy",0,1,100701,padme,"zzPadme zGK zJKA zAhsoka zBarriss",1
"Jazzy",,,366385,HansMF,"Home One, Han's MF, HT Biggs X-wing, Phantom Ghost Cassian's U-wing, Bistan's U-wing,",1
"Jazzy",1,1,98674,JTR,"zzzJTR Scav Rey, zBB-8 G9 zzR2-D2 zFinn",1
"Jazzy",1,1,108160,Revan Offense,"zzzJKR zzGMY zBS zJolee HYoda G9",1
"Jazzy",1,0,107485,CLS,"zzzCLS zHan zChewbacca zLeia zC-3PO G9",1
"Jazzy",1,1,91946,Ewoks,"zChirpa Elder zPaploo zWicket zLogray",1
"Jazzy",1,1,75666,Carth,"Carth Onasi, Mission G9 Zaalbar G8 zJuhani G8 Canderous G9",1
"Jazzy",0,1,107587,BH,"zzBossk zBoba Dengar G9 zzJango zZam",1
"Jazzy",0,1,89935,FO,"zzKRU zKylo FOE FOO FOST G9",1
"Jazzy",1,0,84942,Clones,"zCody Rex Echo Fives Clone Sergeant,",1
"Jazzy",0,1,75636,Phoenix,"Hera G8 zEzra Zeb G8 zKanan G8 Sabine G8",1
"Jazzy",1,1,109291,zEP,"zzEP zzzVader zTarkin zDooku TFP G8",1
"Jazzy",1,0,98113,zMaul,"zMaul zBSF zzDN Sidious zSavage",1
"Jazzy",1,0,17562,SionSolo (Counter),"Sion",1
"Jazzy",1,1,90199,NS,"zzMT G8 zzAV zDaka Zombie Spirit G9",0
"Jazzy",0,1,76489,Geonosians,"GBA Poggle Geo Soldier, Geo Spy G8, Sun Fac G8,",0
"Jazzy",0,1,78257,Grievous,"GG B2 G8 Droideka G8 MagnaGuard G8 zIG-88",0
"Jazzy",,,332703,Executrix,"Executrix Tie Adv, Emperor's Shuttle 5*, TIE Reaper 5*, Imperial TIE Fighter, Gauntlet Starfighter, First Order SF TIE Fighter, First Order TIE Fighter,",0
"Jazzy",1,0,63803,Troopers,"Veers Starck G7 Shoretrooper 5* G8 Snowtrooper G7 Stormtrooper G9",0
"Jazzy",1,1,64737,Rogue1,"Jyn G7 Chirrut G8 Baze G7 K-2SO G8 Cassian G8",0
"Jazzy",1,0,68909,Jawas,"Nebit G8 Jawa Engineer G9, Jawa Scavenger G7, Jawa G9 Dathcha G9",0
"JuanQue NoloVi",0,1,106455,DR,"zzzDR zHK-47 zBSF Sith Marauder, Sith Assassin,",1
"JuanQue NoloVi",0,1,86981,Geonosians,"zzGBA Poggle Geo Soldier, Geo Spy, Sun Fac G8,",1
"JuanQue NoloVi",1,1,110384,Revan,"zzJKR zBS zzGMY zJolee GK G9",1
"JuanQue NoloVi",1,1,86581,Carth,"zCarth Onasi, Mission G8 Zaalbar G8 zJuhani zCanderous",1
"JuanQue NoloVi",0,1,104074,Phoenix,"zHera zEzra zZeb zKanan zSabine",1
"JuanQue NoloVi",1,0,100616,Zader (Counter),"zzzVader Tarkin Sidious zBoba Stormtrooper",1
"JuanQue NoloVi",1,0,68709,Jawas,"Nebit G8 Jawa Engineer G9, Jawa Scavenger G8, Jawa G9 Dathcha",1
"JuanQue NoloVi",1,1,101564,NS,"zzMT zzAV zDaka Zombie 5* G8 Spirit 5* G8",0
"JuanQue NoloVi",1,0,65350,Traya,"Traya G8 DN G8 Sion 5* G8 Dooku Thrawn G8",0
"JuanQue NoloVi",1,0,63676,501st,"Rex 6* G8 Clone Sergeant G8, Echo 6* G8 Fives G8 Ahsoka",0
"JuanQue NoloVi",0,1,72500,BH,"Bossk 5* G8 Cad G8 Greedo G8 IG-88 Zam",0
"JuanQue NoloVi",1,0,75817,Wiggs,"Wedge 6* G8 Biggs G8 zCLS Han Fulcrum",0
"JuanQue NoloVi",1,0,55316,Troopers,"Veers G8 Starck G9 DT 5* G8 Shoretrooper 5* G8 Snowtrooper G8",0
"JuanQue NoloVi",1,1,64036,Rogue1,"Jyn G8 Chirrut G8 Baze 5* G8 K-2SO G8 Cassian G8",0
"JuanQue NoloVi",0,1,62648,FO,"KRU G8 Kylo G8 Phasma G8 FOO G8 FOSFTP G7",0
"LordJarJar",0,1,75696,Phoenix,"Hera Ezra Zeb G8 Kanan G9 zSabine",1
"LordJarJar",1,0,77568,Wiggs,"Wedge G8 Biggs G8 zCLS zHan Leia G8",1
"LordJarJar",1,1,96302,zEP,"zzEP zzzVader Tarkin zDooku TFP",1
"LordJarJar",1,1,81495,Carth,"zCarth Onasi, Mission 6* G8 zZaalbar zJuhani Canderous",0
"LordJarJar",1,0,114826,zMaul,"Maul zBSF zzzDR zSavage Sith Empire Trooper,",0
"LordJarJar",0,1,58815,FO,"KRU G8 Kylo Phasma G8 FOO G8 FOTP G8",0
"LordJarJar",1,0,9277,SionSolo (Counter),"Sion 3* G8",0
"Dalziel",0,1,111348,padme,"zzPadme zGK zJKA zAhsoka zzC-3PO",1
"Dalziel",0,1,134722,DRMalak,"zzzDR zzHK-47 zBSF zzMalak zThrawn",1
"Dalziel",1,1,91166,NS_Alt,"zMT zAV Zombie Daka Talia",1
"Dalziel",,,394782,HansMF,"Home One, Han's MF, HT Biggs X-wing, Phantom Ghost Cassian's U-wing, Bistan's U-wing,",1
"Dalziel",1,1,111914,JTR,"zzzJTR Scav Rey, zzBB-8 zzR2-D2 Finn",1
"Dalziel",1,0,104390,Traya,"zzTraya zDN zSion zzEP Sith Empire Trooper,",1
"Dalziel",1,1,121446,Revan Offense,"zzzJKR zzGMY zBS zJolee zzHYoda",1
"Dalziel",1,1,87023,Ewoks,"zChirpa Elder zPaploo zWicket Logray G9",1
"Dalziel",1,0,107542,ShaakClones,"zzShaak Ti, zRex zEcho zzFives zARC Trooper,",1
"Dalziel",1,1,93246,Carth,"zCarth Onasi, zMission zZaalbar Juhani zCanderous",1
"Dalziel",0,1,103823,BH,"zzBossk zBoba Dengar Jango zNest",1
"Dalziel",0,1,88810,FO,"zKRU zKylo FOE FOO FOST G9",1
"Dalziel",1,0,89768,Troopers,"zVeers zStarck DT Range Trooper, Shoretrooper",1
"Dalziel",0,1,71407,Phoenix,"Hera G9 Ezra Zeb G8 Kanan G8 Sabine G8",1
"Dalziel",1,0,112946,CLS,"zzzCLS zHan Wedge Biggs zzChewbacca",1
"Dalziel",1,0,92332,Zader (Counter),"zzzVader Wampa Tarkin Sidious Stormtrooper G8",1
"Dalziel",1,0,71742,Jawas,"Nebit G9 Jawa Engineer G9, Jawa Scavenger G8, Jawa G9 Dathcha",1
"Dalziel",0,1,73612,Geonosians,"GBA 5* G9 Poggle G8 Geo Soldier, Geo Spy, Sun Fac G9,",0
"Dalziel",0,1,82538,Grievous,"GG zB2 zB1 G9 zDroideka G8 MagnaGuard G8",0
"Dalziel",1,1,61804,Rogue1,"Jyn 5* G7 Chirrut G8 Baze 5* G7 K-2SO G8 Cassian G8",0
"Rajess Moduron",1,0,61298,Wiggs,"Wedge G8 Biggs G8 Han G7 Ezra G8 Leia G8",1
"Rajess Moduron",1,1,96561,zEP,"zEP zzVader Tarkin zDooku TFP G8",1
"Rajess Moduron",1,0,104877,zMaul,"zMaul zzDN zSidious Sith Assassin, zSavage",1
"Rajess Moduron",0,1,101204,BS,"zBS zzGMY zJolee GK JKA",1
"Rajess Moduron",1,0,21390,SionSolo (Counter),"zSion",1
"Rajess Moduron",1,1,75910,Carth,"Carth Onasi G7, Mission G9 Zaalbar G8 Juhani Canderous",0
"Rajess Moduron",0,1,74529,BH,"Jango 4* G8 Boba G8 Cad Greedo G9 IG-88",0
"Rajess Moduron",0,1,61485,Phoenix,"Hera G8 Chopper G8 Zeb G7 Kanan G8 Sabine G8",0
"Rajess Moduron",0,1,54126,FO,"KRU G8 Kylo G7 Phasma G7 FOST 4* G8 FOTP G7",0
"Chubbs Peterson",0,1,127156,padme,"zzPadme zGK zJKA zAhsoka zzC-3PO",1
"Chubbs Peterson",0,1,144324,DRMalak,"zzzDR zzHK-47 zBSF zzMalak zThrawn",1
"Chubbs Peterson",,,367671,HansMF,"Home One, Han's MF, HT Biggs X-wing, Phantom Ghost Cassian's U-wing, Bistan's U-wing,",1
"Chubbs Peterson",0,1,102515,Geonosians,"zzGBA Poggle Geo Soldier, Geo Spy, Sun Fac,",1
"Chubbs Peterson",0,1,83338,Grievous,"zzGG B2 B1 G9 Droideka G8 MagnaGuard",1
"Chubbs Peterson",1,1,113561,JTR,"zzzJTR Scav Rey, zzBB-8 zzR2-D2 Finn",1
"Chubbs Peterson",1,0,114056,Traya,"zzTraya zDN zSion zzEP Sith Empire Trooper,",1
"Chubbs Peterson",1,1,119055,Revan Offense,"zzzJKR zzGMY zBS zJolee zHYoda",1
"Chubbs Peterson",1,0,108964,ShaakClones,"zzShaak Ti, zRex zEcho zzFives zARC Trooper,",1
"Chubbs Peterson",1,1,81824,Ewoks,"zChirpa Elder Paploo Scout Logray",1
"Chubbs Peterson",1,1,89328,Carth,"zCarth Onasi, zMission Zaalbar Juhani Canderous G8",1
"Chubbs Peterson",0,1,104740,BH,"zzBossk Boba Cad Dengar zNest",1
"Chubbs Peterson",0,1,87915,FO,"zzKRU zKylo Phasma G8 FOE G9 FOO G8",1
"Chubbs Peterson",0,1,72405,Phoenix,"Hera G8 Ezra Zeb G8 Kanan G8 Sabine G8",1
"Chubbs Peterson",1,0,113433,CLS,"zzzCLS zHan Leia G8 zOld Ben, zzChewbacca",1
"Chubbs Peterson",1,0,84168,Wiggs,"Wedge G8 Biggs Fulcrum Chirrut Baze",1
"Chubbs Peterson",1,1,89726,NS_Alt,"zMT zAV Zombie Daka Talia G9",0
"Chubbs Peterson",0,1,72056,BH,"zJango Aurra 4* G7 Greedo IG-88 Zam G1",0
"Tzoid",0,1,92897,padme,"zzPadme zGK JKA G8 Ahsoka G8 C-3PO G9",1
"Tzoid",0,1,132097,DRMalak,"zzzDR zzHK-47 zBSF zzMalak zThrawn",1
"Tzoid",,,402564,HansMF,"Home One, Han's MF, HT Biggs X-wing, Phantom Ghost Cassian's U-wing, Bistan's U-wing,",1
"Tzoid",0,1,93040,Geonosians,"zzGBA Poggle Geo Soldier, Geo Spy, Sun Fac,",1
"Tzoid",0,1,95951,Grievous,"zzGG zB2 MagnaGuard G8 zNute zDooku",1
"Tzoid",1,1,135666,Revan Offense,"zzzJKR zzGMY zBS zJolee zEzra",1
"Tzoid",1,1,96007,Ewoks,"zChirpa Elder zPaploo zWicket zLogray",1
"Tzoid",1,1,93378,Carth,"zCarth Onasi, zMission zZaalbar zJuhani zCanderous",1
"Tzoid",0,1,101744,BH,"zzBossk zBoba Cad Dengar Greedo",1
"Tzoid",0,1,83505,FO,"zzKRU Kylo FOE FOO FOSFTP G9",1
"Tzoid",1,0,87116,Wiggs,"Wedge G8 Biggs CLS zHan Chewbacca",1
