Player,Offense,Defense,GP,Name,Squad,Viable
"Lala",0,1,108881,DRMalak,"zzzDR zzHK-47 zBSF zzMalak 6* Thrawn",1
"Lala",1,1,119234,JTR,"zzzJTR zScav Rey, zzBB-8 zzR2-D2 zFinn",1
"Lala",0,1,94390,Grievous,"zzGG B2 G8, MagnaGuard zDooku zT3-M4",1
"Lala",1,1,109398,Revan Offense,"zzzJKR zzGMY zBS zJolee Ezra",1
"Lala",1,1,91959,Ewoks,"zChirpa Elder zPaploo zWicket zLogray",1
"Lala",1,1,98697,Carth,"zCarth Onasi, zMission zZaalbar Juhani zCanderous",1
"Lala",1,0,127117,CLS,"zzzCLS zHan Leia G9, zzOld Ben, zzChewbacca",1
"Lala",1,0,76477,Wiggs,"Wedge G8, Biggs G8, Fulcrum Chirrut Baze",1
"Lala",1,0,17253,NestSolo (Counter),"Nest",1
"Lala",1,0,14874,SionSolo (Counter),"Sion G9",1
"Lala",,,359758,Negotiator,"Negotiator 5* HT Anakin's Eta-2 Starfighter 3*, Umbaran Starfighter, Ahsoka Tano's Jedi Starfighter, Clone Sergeant's ARC-170, Plo Koon's Jedi Starfighter, Rex's ARC-170",0
"Lala",0,1,67008,Geonosians,"GBA 4* G7, Poggle Geo Soldier, Geo Spy G8, Sun Fac G8",0
"Lala",1,1,73700,NS,"MT G8, zAV Daka G9, Zombie G7, Spirit G8",0
"Lala",1,0,71575,ShaakClones,"Shaak Ti 5* G7, Rex Echo Fives Clone Sergeant G9",0
"Lala",1,0,91418,Zader (Counter),"zzzVader Tarkin Sidious G8, zBoba Stormtrooper G7",0
"Teg",0,1,128523,padme,"zzPadme zGK zJKA zAhsoka zzC-3PO",1
"Teg",0,1,106451,DRMalak,"zzzDR zHK-47 zBSF zzMalak Sith Empire Trooper G8",1
"Teg",,,381749,HansMF,"Home One, Han's MF, HT Biggs X-wing, Phantom Ghost Cassian's U-wing, Bistan's U-wing",1
"Teg",0,1,94405,Geonosians,"zzGBA Poggle Geo Soldier, Geo Spy, Sun Fac",1
"Teg",0,1,114295,Grievous,"zzGG zB2 zB1 zDroideka zMagnaGuard",1
"Teg",1,1,116603,JTR,"zzzJTR Scav Rey, zBB-8 zzR2-D2 zFinn",1
"Teg",1,1,113418,GAS,"zzzzGAS Rex zEcho zzFives zARC Trooper",1
"Teg",1,1,108444,Revan Offense,"zzzJKR zGMY BS zJolee HYoda",1
"Teg",1,1,80051,Ewoks,"zChirpa Elder Paploo G9, Wicket Logray G9",1
"Teg",1,1,91182,Carth,"zCarth Onasi, zMission Zaalbar Juhani Canderous",1
"Teg",1,1,94377,zEP,"zzEP zzVader Tarkin DT G8, TFP G8",1
"Teg",1,0,107135,Wiggs,"Wedge G9, Biggs G8, zzzCLS zHan zzChewbacca",1
"Teg",1,1,72539,Rogue1,"Jyn G8, Chirrut G8, Baze G8, Cassian K-2SO G8",1
"Teg",1,0,66125,Jawas,"Nebit G8, Jawa Engineer G8, Jawa Scavenger G8, Jawa G8, Dathcha G8",1
"Teg",1,0,14740,NestSolo (Counter),"Nest G9",1
"Teg",1,0,13777,SionSolo (Counter),"Sion G8",1
"Teg",,,253093,Malevolence,"Malevolence 5* Sun Fac SF, Soldier SF, Spy SF, Hyena Bomber 6*, Vulture Droid, IG-2000",0
"Teg",,,312825,Executrix,"Executrix Tie Adv, Emperor's Shuttle, TIE Reaper 6*, Imperial TIE Fighter, Gauntlet Starfighter, First Order SF TIE Fighter 5*, First Order TIE Fighter",0
"Teg",0,1,75036,FO,"zKRU Kylo G9, FOE G9, Sith Trooper 5* G8, Hux G9",0
"Teg",1,0,62512,Thragma (Counter),"zThrawn Magma G8, Krennic 4* G7, Stormtrooper G5, Shoretrooper G8",0
"Krupten",0,1,122517,DRMalak,"zzzDR zzHK-47 zBSF zzMalak Sith Empire Trooper G8",1
"Krupten",0,1,82376,padme,"zPadme G8, GK G8, JKA G9, Ahsoka G8, zzC-3PO",1
"Krupten",0,1,94723,Geonosians,"zzGBA Poggle Geo Soldier, Geo Spy, Sun Fac",1
"Krupten",1,0,96795,Traya,"zzTraya DN G9, Sion zzEP zThrawn",1
"Krupten",1,1,115258,JTR,"zzzJTR Scav Rey, zzBB-8 zzR2-D2 zFinn",1
"Krupten",1,1,127340,Revan Offense,"zzzJKR zGMY BS zJolee zHYoda",1
"Krupten",1,1,80722,Ewoks,"zChirpa Elder Paploo Scout zLogray",1
"Krupten",1,1,86182,Carth,"zCarth Onasi, Mission Zaalbar Juhani Canderous",1
"Krupten",1,0,98084,CLS,"zzzCLS zHan Leia Old Ben, zzChewbacca",1
"Krupten",1,0,98402,Zader (Counter),"zzzVader Wampa zTarkin Sidious zBoba",1
"Krupten",1,0,62712,Clones,"Cody G7, Rex G7, Echo G7, Fives G8, Clone Sergeant G8",0
"Tzoid",0,1,132530,DRMalak,"zzzDR zzHK-47 zBSF zzMalak Sith Empire Trooper",1
"Tzoid",0,1,108259,padme,"zzPadme zGK JKA G9, Ahsoka C-3PO",1
"Tzoid",,,408059,HansMF,"Home One, Han's MF, HT Biggs X-wing, Phantom Ghost Cassian's U-wing, Bistan's U-wing",1
"Tzoid",0,1,93250,Geonosians,"zzGBA Poggle Geo Soldier, Geo Spy, Sun Fac",1
"Tzoid",0,1,97322,Grievous,"zzGG zB2 MagnaGuard G8, zNute zDooku",1
"Tzoid",1,1,135666,Revan Offense,"zzzJKR zzGMY zBS zJolee zEzra",1
"Tzoid",1,1,96007,Ewoks,"zChirpa Elder zPaploo zWicket zLogray",1
"Tzoid",1,1,93378,Carth,"zCarth Onasi, zMission zZaalbar zJuhani zCanderous",1
"Tzoid",1,0,87116,Wiggs,"Wedge G8, Biggs CLS zHan Chewbacca",1
"Tzoid",1,0,94963,IG88,"IG-88 zzWampa Cassian zBoba Kylo",1
"Tzoid",1,0,103899,EP (trio),"zzEP Traya G8, zzDN zSion zThrawn",1
"Tzoid",1,1,76758,NS,"MT AV Daka Zombie Spirit G8",0
"Tzoid",1,0,58230,ShaakClones,"Shaak Ti 4* G8, Rex G8, Echo G9, Fives G8, ARC Trooper G8",0
"Tzoid",1,1,50591,Rogue1,"Jyn 5* G8, Chirrut G8, Baze 5* G8, Bodhi Rook G7, K-2SO G8",0
"Tzoid",1,0,80824,Zader (Counter),"zzzVader zzTarkin Sidious G8, Shoretrooper 5* G8, Stormtrooper G8",0
"Tzoid",1,0,7314,NestSolo (Counter),"Nest 5* G6",0
"Hollow Child",0,1,112873,DRMalak,"zzDR zHK-47 zBSF zzMalak Sith Empire Trooper G8",1
"Hollow Child",0,1,109677,padme,"zzPadme GK JKA zAhsoka zC-3PO",1
"Hollow Child",,,388680,HansMF,"Home One, Han's MF, HT Biggs X-wing, Phantom Ghost Cassian's U-wing, Bistan's U-wing",1
"Hollow Child",0,1,93529,Geonosians,"zzGBA Poggle Geo Soldier, Geo Spy, Sun Fac",1
"Hollow Child",0,1,98811,Grievous,"zGG zB2 zB1 zDroideka MagnaGuard",1
"Hollow Child",1,1,99972,JTR,"zzJTR Scav Rey, zBB-8 zzR2-D2 Finn",1
"Hollow Child",1,1,108969,Revan Offense,"zzzJKR zGMY zBS zJolee HYoda G9",1
"Hollow Child",1,1,87179,Ewoks,"zChirpa G9, Elder zPaploo zWicket zLogray G9",1
"Hollow Child",1,0,99861,ShaakClones,"zzShaak Ti, Rex Echo zFives zARC Trooper G9",1
"Hollow Child",1,1,94039,Carth,"zCarth Onasi, zMission zZaalbar zJuhani Canderous",1
"Hollow Child",1,1,96650,zEP,"zzEP zzVader zTarkin DT G8, TFP",1
"Hollow Child",1,0,92861,CLS,"zzCLS zHan Leia Old Ben G9, Chewbacca",1
"Hollow Child",1,0,80036,IG88,"IG-88 Wampa G8, Cassian G9, Boba Kylo G9",1
"Hollow Child",1,0,20119,SionSolo (Counter),"zSion",1
"Hollow Child",1,0,16452,NestSolo (Counter),"Nest",1
"Hollow Child",1,1,98946,NS,"zzMT zAV Daka Zombie Spirit G8",0
"Hollow Child",,,334467,Executrix,"Executrix Tie Adv, Emperor's Shuttle 4*, TIE Reaper 3*, Imperial TIE Fighter, Gauntlet Starfighter, First Order SF TIE Fighter 5*, First Order TIE Fighter",0
"Hollow Child",1,0,66787,Thragma (Counter),"zThrawn Magma G8, Krennic 6* G8, Stormtrooper G8, Shoretrooper 4* G7",0
"Hollow Child",1,0,99340,zMaul,"Maul zDooku zDN zSidious zSavage",0
"Hollow Child",1,1,66930,Rogue1,"Jyn G8, Chirrut G8, Baze 5* G8, Bistan G8, K-2SO G8",0
"Hollow Child",1,0,64405,Jawas,"Nebit G8, Jawa Engineer 6* G8, Jawa Scavenger G7, Jawa G8, Dathcha",0
