Player,Offense,Defense,GP,Name,Squad,Viable
"Scuba Bill23",,,442315,Negotiator,"Negotiator HT Anakin's Eta-2 Starfighter, Umbaran Starfighter, Ahsoka Tano's Jedi Starfighter, Clone Sergeant's ARC-170, Plo Koon's Jedi Starfighter, Rex's ARC-170",1
"Scuba Bill23",,,255838,HansMF,"Home One, Han's MF, Biggs X-wing, Bistan's U-wing, Phantom Ghost Cassian's U-wing, Wedge X-wing",1
"Scuba Bill23",0,1,108161,Grievous,"zzGG zB2 zB1 zDroideka zMagnaGuard",1
"Scuba Bill23",1,1,131487,GAS,"zzzzGAS zRex zEcho zzFives zARC Trooper",1
"Scuba Bill23",1,1,97079,Revan Offense,"zzzJKR zGMY BS zJolee HYoda",1
"Scuba Bill23",1,1,78280,Ewoks,"zChirpa Elder Paploo Wicket Logray",1
"Scuba Bill23",1,1,84999,Carth,"zCarth Onasi, zMission zZaalbar Juhani G8, zCanderous",1
"Scuba Bill23",0,1,91631,BH,"zBossk Jango Boba Cad Dengar G9",1
"Scuba Bill23",1,1,92628,zEP,"zzEP zzVader Tarkin Krennic TFP G8",1
"Scuba Bill23",0,1,71657,Phoenix,"Hera Ezra Kanan Sabine G8, Zeb G9",1
"Scuba Bill23",1,0,15490,SionSolo (Counter),"Sion G9",1
"Scuba Bill23",1,1,75338,JTR,"JTR G8, Scav Rey, BB-8 G9, zzR2-D2 RT",0
"Scuba Bill23",1,0,69268,Wiggs,"Wedge G1, Biggs G8, zCLS zHan Fulcrum G9",0
"Scuba Bill23",1,0,57931,Troopers,"Veers 6* Starck G9, DT G9, Snowtrooper G3, Admiral Piett 3* G8",0
"Scuba Bill23",0,1,67116,FO,"KRU Kylo G9, FOO FOSFTP G8, FOST G8",0
"Ryu Herr",0,1,123174,padme,"zzPadme zGK zJKA zAhsoka zzC-3PO",1
"Ryu Herr",0,1,121080,DRMalak,"zzzDR zzHK-47 zBSF zzMalak Sith Empire Trooper G8",1
"Ryu Herr",,,399497,HansMF,"Home One, Han's MF, HT Biggs X-wing, Phantom Ghost Cassian's U-wing, Bistan's U-wing",1
"Ryu Herr",0,1,90316,Geonosians,"zGBA Poggle Geo Soldier, Geo Spy, Sun Fac",1
"Ryu Herr",0,1,119092,Grievous,"zzGG zB2 zB1 zDroideka zMagnaGuard",1
"Ryu Herr",1,1,105143,JTR,"zzJTR zScav Rey, zBB-8 zzR2-D2 Finn",1
"Ryu Herr",1,1,121237,Revan Offense,"zzzJKR zzGMY zBS zJolee zEzra",1
"Ryu Herr",1,1,84730,Ewoks,"zChirpa G9, Elder Paploo Wicket zLogray",1
"Ryu Herr",1,0,98937,ShaakClones,"zzShaak Ti, zRex zEcho zFives ARC Trooper G8",1
"Ryu Herr",0,1,100281,BH,"zJango zGreedo zBoba Dengar G9, zBossk",1
"Ryu Herr",1,1,89797,Carth,"zCarth Onasi, zMission zZaalbar Juhani Canderous",1
"Ryu Herr",1,1,91832,zEP,"zEP zzzVader Tarkin IPD G8, TFP G9",1
"Ryu Herr",0,1,87356,FO,"zKRU zKylo FOO FOST G8, FOE",1
"Ryu Herr",1,0,82430,Troopers,"zVeers Starck DT Range Trooper, Snowtrooper",1
"Ryu Herr",1,0,109450,Wiggs,"Wedge Biggs zzzCLS zHan zzChewbacca",1
"Ryu Herr",0,1,77709,Phoenix,"Hera Kanan G9, zSabine Chopper G9, Zeb G8",1
"Ryu Herr",1,0,15417,NestSolo (Counter),"Nest",1
"Ryu Herr",1,0,15145,SionSolo (Counter),"Sion G9",1
"Ryu Herr",1,1,89486,NS,"zMT zzAV zDaka Zombie G8, Spirit G8",0
"Ryu Herr",,,335105,Executrix,"Executrix Tie Adv, Emperor's Shuttle 4*, TIE Reaper, Imperial TIE Fighter, Gauntlet Starfighter, First Order SF TIE Fighter 3*, First Order TIE Fighter",0
"Ryu Herr",1,0,74302,Thragma (Counter),"zThrawn Magma G8, Krennic 6* G7, Stormtrooper Shoretrooper",0
"Ryu Herr",1,1,70659,Rogue1,"Jyn 5* G7, Chirrut Baze Cassian G9, K-2SO G8",0
"Ryu Herr",1,0,91301,zMaul,"Maul zDooku zDN Savage Sith Marauder",0
"Ryu Herr",1,0,55333,Jawas,"Nebit G6, Jawa Engineer 4* G9, Jawa Scavenger G8, Jawa 6* G6, Dathcha G9",0
"KingZach",1,1,92679,NS,"zzMT zzAV Daka Zombie Spirit",1
"KingZach",0,1,111426,padme,"zzPadme zGK zJKA zAhsoka zzC-3PO",1
"KingZach",,,444739,HansMF,"Home One, Han's MF, HT Biggs X-wing, Phantom Ghost Cassian's U-wing, Bistan's U-wing",1
"KingZach",1,0,106717,Traya,"zzTraya zDN zSion zzEP zThrawn",1
"KingZach",1,1,117645,JTR,"zzzJTR Scav Rey, zBB-8 zzR2-D2 RT",1
"KingZach",1,1,115043,Revan Offense,"zzzJKR zGMY zzHYoda zJolee zEzra",1
"KingZach",1,1,86576,Ewoks,"zChirpa Elder Paploo zWicket zLogray",1
"KingZach",1,1,80627,Carth,"zCarth Onasi, Mission G8, Zaalbar G8, Juhani zCanderous",1
"KingZach",0,1,92111,BH,"zBossk Greedo Boba Dengar G9, zNest",1
"KingZach",1,0,82091,Troopers,"zVeers zStarck G9, DT Range Trooper G9, Snowtrooper",1
"KingZach",1,0,149024,CLS,"zzzCLS zHan zLeia zzOld Ben, zzChewbacca",1
"KingZach",0,1,79637,FO,"zKRU zKylo FOTP G9, FOO G9, FOE G9",1
"KingZach",0,1,80926,Phoenix,"Hera Kanan Sabine Chopper Zeb",1
"KingZach",1,1,81247,Rogue1,"zzJyn Chirrut G8, Baze G8, Cassian K-2SO G8",1
"KingZach",1,0,104351,zMaul,"zMaul zBSF zDooku zzzDR zSavage",1
"KingZach",1,0,104955,Zader (Counter),"zzzVader zzWampa Tarkin G9, zSidious Shoretrooper",1
"KingZach",0,1,62438,Geonosians,"GBA 4* G8, Poggle G8, Geo Soldier G8, Geo Spy G7, Sun Fac G7",0
"KingZach",0,1,79710,Grievous,"GG G9, B2 G8, zNute IG-88 T3-M4 G9",0
"KingZach",1,0,83535,ShaakClones,"zzShaak Ti G8, zRex Echo G9, zFives G8, Clone Sergeant G8",0
"KingZach",1,0,61085,Jawas,"Nebit G8, Jawa Engineer G8, Jawa Scavenger G7, Jawa G7, Dathcha",0
"RedWolf",0,1,117936,padme,"zzPadme zGK zJKA zAhsoka zzC-3PO",1
"RedWolf",0,1,116580,DRMalak,"zzzDR zzHK-47 zBSF zzMalak Thrawn G9",1
"RedWolf",,,401838,Negotiator,"Negotiator 6* HT Anakin's Eta-2 Starfighter, Umbaran Starfighter, Ahsoka Tano's Jedi Starfighter, BTL-B Y-wing Starfighter, Clone Sergeant's ARC-170, Plo Koon's Jedi Starfighter",1
"RedWolf",0,1,92842,Geonosians,"zzGBA Poggle Geo Soldier, Geo Spy, Sun Fac",1
"RedWolf",,,371344,HansMF,"Home One, Han's MF, Biggs X-wing, Bistan's U-wing, Phantom Ghost Cassian's U-wing, Wedge X-wing",1
"RedWolf",0,1,104757,Grievous,"zzGG zB2 zB1 zDroideka zMagnaGuard",1
"RedWolf",1,1,102889,JTR,"zzzJTR Scav Rey, zBB-8 G9, zzR2-D2 Finn G8",1
"RedWolf",,,394106,Executrix,"Executrix Tie Adv, Emperor's Shuttle, TIE Reaper, Imperial TIE Fighter, Gauntlet Starfighter, First Order SF TIE Fighter, First Order TIE Fighter",1
"RedWolf",,,103305,Nute-OR,"zNute zDooku zJango zZaalbar zMission",1
"RedWolf",1,1,112353,Revan Offense,"zzzJKR zzGMY BS zJolee zzHYoda",1
"RedWolf",1,1,88444,Ewoks,"zChirpa Elder zPaploo zWicket Logray G8",1
"RedWolf",0,1,101705,BH,"zzBossk Greedo zBoba IG-88 Dengar G8",1
"RedWolf",1,1,109305,zEP,"zzEP zzzVader Tarkin Krennic G8, TFP G9",1
"RedWolf",0,1,135544,FO,"zzKRU zKylo zFOST zHux FOE",1
"RedWolf",0,1,69723,Phoenix,"Hera G9, Ezra G8, Kanan G8, Sabine G8, Zeb G8",1
"RedWolf",1,0,98550,Wampa (Counter),"zRex zzWampa G8, Visas G7, zzJyn FOO",1
"RedWolf",1,0,91077,Wiggs,"Wedge G8, Biggs G8, zzzCLS Fulcrum Leia",1
"RedWolf",1,0,18601,NestSolo (Counter),"zNest",1
"RedWolf",1,0,17743,SionSolo (Counter),"zSion G9",1
"RedWolf",1,1,90365,NS,"zzMT G8, zzAV zDaka Zombie Spirit 6* G2",0
"RedWolf",1,0,64091,Troopers,"Veers Starck G7, Range Trooper G7, Snowtrooper G7, Shoretrooper G7",0
"RedWolf",1,0,62107,Jawas,"Nebit G7, Jawa Engineer G7, Jawa Scavenger G8, Jawa G7, Dathcha G8",0
"Upgreyd",1,1,98313,NS,"zMT zAV zDaka Zombie Spirit",1
"Upgreyd",0,1,109472,padme,"zzPadme GK JKA zAhsoka zC-3PO",1
"Upgreyd",0,1,100743,DR,"zzzDR zHK-47 zBSF Sith Empire Trooper G8, Sith Assassin G8",1
"Upgreyd",,,430715,HansMF,"Home One, Han's MF, HT Biggs X-wing, Phantom Ghost Cassian's U-wing, Bistan's U-wing",1
"Upgreyd",0,1,106804,Geonosians,"zzGBA Poggle Geo Soldier, Geo Spy, Sun Fac",1
"Upgreyd",0,1,90539,Grievous,"zGG zB2 G9, zB1 zDroideka G9, zMagnaGuard G9",1
"Upgreyd",1,1,107767,JTR,"zJTR Scav Rey, BB-8 zzR2-D2 zFinn",1
"Upgreyd",1,1,124995,Revan Offense,"zzzJKR zzGMY BS zJolee HYoda",1
"Upgreyd",1,1,86080,Ewoks,"zChirpa Elder Paploo Wicket Logray",1
"Upgreyd",1,1,91237,Carth,"zCarth Onasi, Mission Zaalbar Juhani Canderous",1
"Upgreyd",0,1,103658,BH,"zBossk Greedo Boba Zam Dengar",1
"Upgreyd",0,1,130779,Phoenix,"zHera Ezra zKanan zSabine zZeb",1
"Upgreyd",1,0,78433,Wiggs,"Wedge G8, Biggs G8, CLS Han Chewbacca",1
"Upgreyd",1,0,69169,Wampa (Counter),"Rex G8, Wampa G8, DT G8, Jyn G8, FOO G8",1
"Upgreyd",1,0,72612,Thragma (Counter),"Thrawn Magma G7, Tarkin Stormtrooper G8, Shoretrooper G7",1
"Upgreyd",1,0,17574,SionSolo (Counter),"Sion",1
"Upgreyd",1,0,16303,NestSolo (Counter),"Nest",1
"Upgreyd",,,314300,Executrix,"Executrix Tie Adv, Emperor's Shuttle 5*, TIE Reaper 6*, Imperial TIE Fighter, Gauntlet Starfighter, First Order SF TIE Fighter 5*, First Order TIE Fighter",0
"Upgreyd",1,0,61324,Troopers,"Veers Starck G9, Range Trooper 6* G6, Snowtrooper G9, Admiral Piett 3* G6",0
"Upgreyd",0,1,70422,BH,"Jango Greef Karga 5* G7, IG-88 Cad G8, The Mandalorian 5* G7",0
"Upgreyd",0,1,72483,FO,"zKRU G8, Kylo G8, FOTP G8, Phasma G8, FOE",0
"Upgreyd",1,0,67260,Jawas,"Nebit G8, Jawa Engineer G9, Jawa Scavenger G7, Jawa G9, Dathcha G9",0
"Squirty",1,1,138080,GL Rey,"zzzzzzRey Holdo zGK zResistance Hero Poe, zResistance Hero Finn",1
"Squirty",1,1,100589,NestSisters,"zzAV zMT zDaka Zombie zNest",1
"Squirty",0,1,107127,DR,"zzzDR zHK-47 zBSF Sith Empire Trooper G8, zThrawn",1
"Squirty",,,374695,HansMF,"Home One, Han's MF, HT Biggs X-wing, Phantom Ghost Cassian's U-wing, Bistan's U-wing",1
"Squirty",0,1,93996,Geonosians,"zzGBA Poggle Geo Soldier, Geo Spy, Sun Fac",1
"Squirty",0,1,109519,Grievous,"zGG zB2 zB1 zDroideka MagnaGuard",1
"Squirty",1,1,138978,JTR,"zzzJTR Scav Rey, zBB-8 zzR2-D2 Finn",1
"Squirty",1,1,104871,Revan Offense,"zzJKR zGMY HYoda zJolee zJKA",1
"Squirty",1,0,107498,CLS,"zzCLS zHan zChewbacca Leia zzC-3PO",1
"Squirty",1,1,84275,Carth,"Carth Onasi, Mission Zaalbar Juhani G8, Canderous",1
"Squirty",0,1,94688,BH,"zBossk Greedo zBoba Cad Dengar G9",1
"Squirty",1,1,107425,zEP,"zzEP zzzVader Tarkin DT TFP",1
"Squirty",0,1,119730,FO,"zzKRU zKylo FOST zHux FOE",1
"Squirty",0,1,71865,Phoenix,"Hera G8, Ezra Kanan G8, Sabine G8, Zeb G8",1
"Squirty",1,0,73066,Troopers,"zVeers Starck G9, Snowtrooper G9, Shoretrooper G8, Stormtrooper G8",1
"Squirty",1,0,78620,Wampa (Counter),"zRex Wampa G8, Visas G8, Jyn G8, FOO",1
"Squirty",1,0,13324,SionSolo (Counter),"Sion G8",1
"Squirty",,,317410,Malevolence,"Malevolence 5* Sun Fac SF, Soldier SF, Spy SF, Hyena Bomber 6*, Vulture Droid 6*, IG-2000",0
"Squirty",,,362346,Executrix,"Executrix Tie Adv, Emperor's Shuttle 5*, TIE Reaper, Imperial TIE Fighter, Gauntlet Starfighter, First Order SF TIE Fighter, First Order TIE Fighter",0
"Squirty",1,1,76984,Ewoks,"zChirpa Elder Paploo 6* Wicket Logray G9",0
"Squirty",0,1,61979,BH,"Jango G7, IG-88 Aurra 6* G7, The Mandalorian 5* G8, Zam G8",0
"Squirty",1,0,46912,Jawas,"Nebit G7, Jawa Engineer G7, Jawa Scavenger G7, Jawa G8, Dathcha G7",0
"StarKiller316",0,1,117635,padme,"zzPadme zGK JKA zAhsoka zzC-3PO",1
"StarKiller316",1,1,96573,NestSisters,"zzAV zzMT Daka Zombie zNest",1
"StarKiller316",0,1,112336,DR,"zzzDR zzHK-47 zBSF Sith Empire Trooper, Sith Assassin G8",1
"StarKiller316",,,405565,HansMF,"Home One, Han's MF, HT Biggs X-wing, Phantom Ghost Cassian's U-wing, Bistan's U-wing",1
"StarKiller316",0,1,92213,Geonosians,"zzGBA Poggle Geo Soldier, Geo Spy, Sun Fac",1
"StarKiller316",0,1,118163,Grievous,"zzGG zB2 zB1 zDroideka MagnaGuard",1
"StarKiller316",1,1,107638,JTR,"zzzJTR Scav Rey, zzBB-8 zzR2-D2 Finn",1
"StarKiller316",1,1,128031,GAS,"zzzzGAS zRex Echo zzFives zARC Trooper",1
"StarKiller316",1,1,119908,Revan Offense,"zzzJKR zGMY zBS zJolee zzHYoda",1
"StarKiller316",1,1,82074,Ewoks,"zChirpa G9, Elder Paploo zWicket Logray",1
"StarKiller316",0,1,98636,BH,"zBossk Greedo zBoba zZam Dengar",1
"StarKiller316",0,1,133207,FO,"zzKRU zKylo FOO zHux FOE",1
"StarKiller316",0,1,89757,Phoenix,"Hera zEzra zKanan zSabine Zeb",1
"StarKiller316",1,0,105662,CLS,"zzzCLS zHan Leia Old Ben, zzChewbacca",1
"StarKiller316",1,0,70506,Troopers,"zVeers Starck G9, Snowtrooper G9, Shoretrooper G8, Stormtrooper G9",1
"StarKiller316",1,1,108037,zEP,"zzEP zzzVader Tarkin Dooku TFP",1
"StarKiller316",1,0,78013,Wiggs,"Wedge Biggs Fulcrum G8, Chirrut Baze",1
"StarKiller316",1,0,74484,Jawas,"Nebit Jawa Engineer, Jawa Scavenger G9, Jawa G9, Dathcha",1
"StarKiller316",1,0,16236,SionSolo (Counter),"Sion",1
"StarKiller316",0,1,66480,Qira,"Qira 6* G9, L3-37 4* G8, Vandor Chewbacca 5* G7, zMission zZaalbar",0
"StarKiller316",,,383001,Executrix,"Executrix Tie Adv, Emperor's Shuttle 5*, TIE Reaper 6*, Imperial TIE Fighter, Gauntlet Starfighter 5*, First Order SF TIE Fighter, First Order TIE Fighter",0
"StarKiller316",0,1,81471,BH,"Jango IG-88 Cad zThe Mandalorian 6* G9, Embo",0
"Senat0r Lipost",0,1,107067,padme,"zzPadme zGK JKA Ahsoka zzC-3PO",1
"Senat0r Lipost",1,1,101968,NS_Alt,"zzMT zzAV zDaka Talia Zombie",1
"Senat0r Lipost",0,1,89882,Geonosians,"zzGBA Poggle Geo Soldier, Geo Spy, Sun Fac G9",1
"Senat0r Lipost",,,390689,HansMF,"Home One, Han's MF, HT Biggs X-wing, Phantom Ghost Cassian's U-wing, Rey's Millennium Falcon",1
"Senat0r Lipost",0,1,90350,Grievous,"zzGG B2 G9, B1 Droideka G8, MagnaGuard G8",1
"Senat0r Lipost",1,1,116708,JTR,"zzzJTR Scav Rey, zzBB-8 zzR2-D2 zFinn",1
"Senat0r Lipost",1,1,115235,Revan Offense,"zzzJKR zzGMY zBS zJolee Ezra",1
"Senat0r Lipost",1,1,93777,Ewoks,"zChirpa Elder zPaploo zWicket zLogray",1
"Senat0r Lipost",0,1,108936,BH,"zzJango zBoba IG-88 Dengar G9, zzBossk",1
"Senat0r Lipost",1,0,85973,Wiggs,"Wedge G8, Biggs G8, zzzCLS Han Chewbacca G9",1
"Senat0r Lipost",1,1,105187,zEP,"zzEP zzzVader Tarkin Dooku TFP",1
"Senat0r Lipost",0,1,78703,Phoenix,"Hera Kanan Sabine Chopper Zeb G8",1
"Senat0r Lipost",1,0,14281,SionSolo (Counter),"Sion G9",1
"Senat0r Lipost",0,1,66575,Qira,"Qira 6* G8, L3-37 5* G8, Vandor Chewbacca 3* G7, zMission zZaalbar",0
"Senat0r Lipost",,,296733,Malevolence,"Malevolence 5* Sun Fac SF, Soldier SF, Spy SF, Hyena Bomber 4*, Vulture Droid 3*, IG-2000",0
"Senat0r Lipost",0,1,112769,DRMalak,"zzzDR zzHK-47 zBSF Malak G9, zThrawn",0
"Senat0r Lipost",,,342284,Executrix,"Executrix Tie Adv, Emperor's Shuttle, TIE Reaper, Imperial TIE Fighter, Gauntlet Starfighter 5*, First Order SF TIE Fighter 1*, First Order TIE Fighter",0
"Senat0r Lipost",1,0,78549,ShaakClones,"Shaak Ti G9, Rex Echo Fives G9, ARC Trooper G8",0
"Senat0r Lipost",1,0,69618,Troopers,"Veers Starck G9, Range Trooper G8, Snowtrooper G8, Shoretrooper G8",0
"Senat0r Lipost",1,1,53777,Rogue1,"Jyn 5* G7, Chirrut 4* G8, Baze 4* G7, Cassian G8, K-2SO G8",0
"Senat0r Lipost",0,1,84159,FO,"KRU Kylo FOO FOST G8, Phasma",0
"Senat0r Lipost",1,0,63062,Jawas,"Nebit G7, Jawa Engineer 4* G9, Jawa Scavenger G8, Jawa G9, Dathcha",0
"Senat0r Lipost",1,0,14119,NestSolo (Counter),"Nest 6*",0
"Lala",0,1,109361,padme,"zzPadme zGK zJKA zAhsoka zzC-3PO",1
"Lala",0,1,112661,DRMalak,"zzzDR zzHK-47 zBSF zzMalak Thrawn",1
"Lala",1,1,119233,JTR,"zzzJTR zScav Rey, zzBB-8 zzR2-D2 zFinn",1
"Lala",0,1,95182,Grievous,"zzGG B2 G8, MagnaGuard zDooku zT3-M4",1
"Lala",1,1,109398,Revan Offense,"zzzJKR zzGMY zBS zJolee Ezra",1
"Lala",1,1,91959,Ewoks,"zChirpa Elder zPaploo zWicket zLogray",1
"Lala",0,1,111856,BH,"zzJango zBoba zZam zDengar zzBossk",1
"Lala",1,1,98697,Carth,"zCarth Onasi, zMission zZaalbar Juhani zCanderous",1
"Lala",1,0,127115,CLS,"zzzCLS zHan Leia G9, zzOld Ben, zzChewbacca",1
"Lala",0,1,78284,Phoenix,"Hera Kanan Sabine G8, Chopper Zeb",1
"Lala",0,1,83494,FO,"zzKRU zKylo FOTP FOO G8, FOST G9",1
"Lala",1,0,76477,Wiggs,"Wedge G8, Biggs G8, Fulcrum Chirrut Baze",1
"Lala",1,0,17253,NestSolo (Counter),"Nest",1
"Lala",1,0,14874,SionSolo (Counter),"Sion G9",1
"Lala",,,367926,Negotiator,"Negotiator 5* HT Anakin's Eta-2 Starfighter 4*, Umbaran Starfighter, Ahsoka Tano's Jedi Starfighter, Clone Sergeant's ARC-170, Plo Koon's Jedi Starfighter, Rex's ARC-170",0
"Lala",0,1,70103,Geonosians,"GBA 4* G7, Poggle Geo Soldier, Geo Spy, Sun Fac G8",0
"Lala",1,1,73700,NS,"MT G8, zAV Daka G9, Zombie G7, Spirit G8",0
"Lala",1,0,77363,ShaakClones,"Shaak Ti 6* G8, Rex Echo Fives Clone Sergeant G9",0
"Lala",1,0,87857,EP (Traya),"zEP Traya G8, DN Sith Empire Trooper 6* G8, zzzVader",0
"Michl Johso",0,1,154615,DRMalak,"zzzDR zzHK-47 zBSF zzMalak Sith Empire Trooper",1
"Michl Johso",0,1,119670,padme,"zzPadme zGK zJKA zAhsoka zzC-3PO",1
"Michl Johso",,,415017,Negotiator,"Negotiator 5* HT Anakin's Eta-2 Starfighter, Umbaran Starfighter, Ahsoka Tano's Jedi Starfighter, Clone Sergeant's ARC-170, Jedi Consular's Starfighter, Plo Koon's Jedi Starfighter",1
"Michl Johso",0,1,93418,Geonosians,"zzGBA Poggle Geo Soldier, Geo Spy, Sun Fac",1
"Michl Johso",1,0,123708,Traya,"zzTraya zzDN zSion zzEP zThrawn",1
"Michl Johso",1,1,103743,JTR,"zzzJTR Scav Rey, zBB-8 zzR2-D2 zFinn",1
"Michl Johso",0,1,101630,Grievous,"zzGG zB2 zB1 zMagnaGuard zDooku",1
"Michl Johso",1,1,114974,Revan Offense,"zzzJKR zGMY zBS zJolee zEzra",1
"Michl Johso",1,1,92381,Ewoks,"zChirpa Elder zPaploo Scout zWicket",1
"Michl Johso",1,1,97878,Carth,"zCarth Onasi, zMission zZaalbar zJuhani zCanderous",1
"Michl Johso",0,1,108020,BH,"zzBossk zJango zBoba zAurra zDengar G9",1
"Michl Johso",1,0,92315,Clones,"zCody Rex zEcho zFives Clone Sergeant",1
"Michl Johso",1,0,109475,CLS,"zzzCLS zHan zLeia Old Ben, zzChewbacca",1
"Michl Johso",1,0,74389,Jawas,"Nebit G8, Jawa Engineer G9, Jawa Scavenger G9, Jawa G9, Dathcha",1
"Michl Johso",1,1,80539,NS,"zMT G8, zAV Daka Zombie G9, Spirit G8",0
"Michl Johso",0,1,70157,Phoenix,"Hera Kanan G9, Sabine 5* G8, Chopper Zeb G8",0
"Michl Johso",1,1,59038,Rogue1,"Jyn 4* G8, Chirrut 4* G7, Baze 3* G7, zCassian G8, K-2SO G9",0
"Michl Johso",0,1,77650,FO,"KRU G8, zKylo FOO G8, FOST G9, Phasma",0
"Michl Johso",1,0,83470,Zader (Counter),"zzzVader Tarkin Sidious Shoretrooper 3* G5, Stormtrooper G8",0
"Michl Johso",1,0,10257,NestSolo (Counter),"Nest 5* G8",0
"Kaervek",1,1,112279,NS,"zzMT zzAV zDaka Zombie Spirit",1
"Kaervek",0,1,121764,padme,"zzPadme zGK zJKA zAhsoka zC-3PO",1
"Kaervek",0,1,95645,Geonosians,"zzGBA Poggle Geo Soldier, Geo Spy, Sun Fac",1
"Kaervek",1,0,108205,Traya,"zzTraya DN zSion zNest zThrawn",1
"Kaervek",1,1,109901,JTR,"zzzJTR Scav Rey, zzBB-8 zzR2-D2 Finn",1
"Kaervek",0,1,105147,Grievous,"zzGG zB2 zB1 MagnaGuard zNute",1
"Kaervek",1,1,113343,Revan Offense,"zzzJKR zGMY zBS zJolee zHYoda",1
"Kaervek",1,1,84079,Ewoks,"zChirpa Elder Paploo Wicket zLogray",1
"Kaervek",0,1,104354,BH,"zzJango Greedo zBoba Dengar zzBossk",1
"Kaervek",1,0,92495,ShaakClones,"zShaak Ti, Rex Echo zFives Clone Sergeant",1
"Kaervek",1,1,97345,zEP,"zEP zzVader zTarkin DT TFP",1
"Kaervek",0,1,86651,FO,"zzKRU Kylo FOTP FOO FOE",1
"Kaervek",0,1,74969,Phoenix,"Hera G8, zEzra Kanan G8, Sabine G8, Zeb G8",1
"Kaervek",1,0,115453,CLS,"zzzCLS zHan Leia Old Ben, zzChewbacca",1
"Kaervek",1,0,84447,Troopers,"zVeers zStarck Snowtrooper Shoretrooper G8, Stormtrooper",1
"Kaervek",1,1,80523,Rogue1,"zJyn G8, Chirrut Baze Cassian G9, Bistan G8",1
"Kaervek",,,349454,Negotiator,"Negotiator 5* HT Anakin's Eta-2 Starfighter 4*, Umbaran Starfighter, Ahsoka Tano's Jedi Starfighter, Clone Sergeant's ARC-170, Jedi Consular's Starfighter, Plo Koon's Jedi Starfighter",0
"Kaervek",1,0,46918,Jawas,"Nebit G8, Jawa Engineer 5* G7, Jawa Scavenger G7, Jawa 5* G8, Dathcha G8",0
