Player,Offense,Defense,GP,Name,Squad,Viable
"Kyrie Unobii",1,0,135002,CLS,"zzzCLS zHan zLeia zzOld Ben, zzChewbacca",1
"Kyrie Unobii",0,1,79924,Phoenix,"Hera G9, Chopper Zeb G8, Kanan zEzra",1
"Kyrie Unobii",1,0,94290,zMaul,"zMaul zDooku zSidious Savage Sith Empire Trooper",1
"Kyrie Unobii",1,0,21166,SionSolo (Counter),"zSion",1
"Michl Johso",0,1,156418,DRMalak,"zzzDR zzHK-47 zBSF zzMalak Sith Empire Trooper",1
"Michl Johso",0,1,137644,padme,"zzPadme zGK zJKA zAhsoka zzC-3PO",1
"Michl Johso",,,435746,Negotiator,"Negotiator 6* HT Anakin's Eta-2 Starfighter, Umbaran Starfighter, Ahsoka Tano's Jedi Starfighter, Clone Sergeant's ARC-170, Jedi Consular's Starfighter, Plo Koon's Jedi Starfighter",1
"Michl Johso",0,1,94298,Geonosians,"zzGBA Poggle Geo Soldier, Geo Spy, Sun Fac",1
"Michl Johso",0,1,121149,Grievous,"zzGG zB2 zB1 zDroideka zMagnaGuard",1
"Michl Johso",1,0,128981,Traya,"zzTraya zzDN zSion zzEP zThrawn",1
"Michl Johso",1,1,103672,JTR,"zzzJTR Scav Rey, zBB-8 zzR2-D2 zFinn",1
"Michl Johso",,,104409,Nute-OR,"zNute zDooku zzJango zZaalbar zMission",1
"Michl Johso",1,1,115217,Revan Offense,"zzzJKR zGMY zBS zJolee zEzra",1
"Michl Johso",1,1,91378,Ewoks,"zChirpa Elder zPaploo zWicket Logray",1
"Michl Johso",0,1,107559,BH,"zzBossk zGreedo zBoba zDengar G9, zAurra",1
"Michl Johso",1,0,97897,ShaakClones,"zzShaak Ti, Rex zEcho zFives Clone Sergeant",1
"Michl Johso",1,0,109823,CLS,"zzzCLS zHan zLeia Old Ben, zzChewbacca",1
"Michl Johso",1,0,75801,Jawas,"Nebit G8, Jawa Engineer G9, Jawa Scavenger, Jawa G9, Dathcha",1
"Michl Johso",1,1,95585,NS,"zzMT G8, zzAV zDaka Zombie Spirit G9",0
"Michl Johso",,,377878,HansMF,"Home One, Han's MF 5*, Biggs X-wing, Bistan's U-wing 6*, Phantom Ghost Cassian's U-wing, Wedge X-wing",0
"Michl Johso",,,66181,Mon Mothma,"Mon Mothma 3* G7, Bistan G8, Hoth Rebel Scout G8, Pao G8, Biggs",0
"Michl Johso",1,0,62072,Troopers,"Veers Starck G8, Range Trooper 3* G6, Stormtrooper G8, Snowtrooper G7",0
"Michl Johso",0,1,71109,Phoenix,"Hera Chopper Zeb G8, Kanan G9, Sabine 5* G8",0
"Michl Johso",1,1,67784,Rogue1,"zJyn G8, Chirrut 4* G7, Baze 4* G7, K-2SO G9, zCassian G9",0
"Michl Johso",0,1,77867,FO,"KRU G8, zKylo Phasma FOST G9, FOO G8",0
"Michl Johso",1,0,10281,NestSolo (Counter),"Nest 5* G8",0
"Jakoby77",1,1,106059,NS,"zzMT zzAV zDaka Zombie Spirit",1
"Jakoby77",0,1,124958,DRMalak,"zzzDR zzHK-47 zBSF zzMalak Sith Empire Trooper",1
"Jakoby77",0,1,126945,padme,"zzPadme zGK zJKA zAhsoka zzC-3PO",1
"Jakoby77",,,446938,Negotiator,"Negotiator HT Anakin's Eta-2 Starfighter, Umbaran Starfighter, Ahsoka Tano's Jedi Starfighter, BTL-B Y-wing Starfighter, Clone Sergeant's ARC-170, Plo Koon's Jedi Starfighter",1
"Jakoby77",,,137400,JKL,"zzJKL zzzJKR zzHYoda zzOld Ben, zBarriss",1
"Jakoby77",0,1,92481,Geonosians,"zzGBA Poggle Geo Soldier, Geo Spy, Sun Fac",1
"Jakoby77",,,411331,HansMF,"Home One, Han's MF, Biggs X-wing, Bistan's U-wing, Phantom Ghost Cassian's U-wing, Wedge X-wing",1
"Jakoby77",0,1,111959,Grievous,"zzGG zB2 zB1 zDroideka MagnaGuard",1
"Jakoby77",1,0,115127,Traya,"zzTraya DN zSion zzEP zzThrawn",1
"Jakoby77",1,1,118712,JTR,"zzzJTR Scav Rey, zBB-8 zzR2-D2 Finn",1
"Jakoby77",,,319244,Executrix,"Executrix Tie Adv, Emperor's Shuttle, TIE Reaper, Imperial TIE Fighter, Gauntlet Starfighter, First Order SF TIE Fighter, First Order TIE Fighter",1
"Jakoby77",1,1,144348,GAS,"zzzzGAS zRex zEcho zzFives zARC Trooper",1
"Jakoby77",,,91049,Mon Mothma,"zMon Mothma, Bistan G8, Chirrut G9, Baze Lando",1
"Jakoby77",1,1,70315,Ewoks,"zChirpa Elder Paploo Wicket Logray G9",1
"Jakoby77",0,1,104807,BH,"zzBossk Boba Dengar G9, zJango zEmbo",1
"Jakoby77",1,1,95175,Carth,"zCarth Onasi, zMission zZaalbar Juhani Canderous",1
"Jakoby77",0,1,106906,FO,"zzKRU zKylo FOE zFOST zHux",1
"Jakoby77",1,0,131612,CLS,"zzzCLS zHan Wedge Biggs zzChewbacca",1
"Jakoby77",0,1,66821,Phoenix,"Hera G8, Zeb G8, Kanan G8, Ezra Sabine G8",1
"Jakoby77",1,0,20568,NestSolo (Counter),"zNest",1
"Jakoby77",1,0,66910,Troopers,"Veers G9, Starck G7, DT G9, Shoretrooper Snowtrooper G7",0
"Jakoby77",1,0,46902,Jawas,"Nebit G8, Jawa Engineer G8, Jawa Scavenger G7, Jawa G8, Dathcha G7",0
"Beck",0,1,113222,DRMalak,"zzzDR zzHK-47 zBSF zzMalak 6* Sith Empire Trooper G8",1
"Beck",,,360775,HansMF,"Home One, Han's MF 5*, HT Biggs X-wing, Phantom Ghost Cassian's U-wing, Bistan's U-wing",1
"Beck",0,1,102364,Geonosians,"zzGBA Poggle Geo Soldier, Geo Spy, Sun Fac",1
"Beck",1,1,112847,JTR,"zzzJTR zScav Rey, BB-8 G8, zzR2-D2 zFinn",1
"Beck",1,1,141807,Revan,"zzzJKR zBS zzGMY zJolee zGK",1
"Beck",1,1,92358,Ewoks,"zChirpa Elder zPaploo Scout zWicket",1
"Beck",0,1,114021,BH,"zzBossk zGreedo zBoba zDengar zIG-88",1
"Beck",1,1,93262,Carth,"zCarth Onasi, zMission zZaalbar zJuhani Canderous G8",1
"Beck",1,1,131448,zEP,"zzEP zzzVader zzTarkin TFP G8, zzDN",1
"Beck",0,1,76237,Phoenix,"zHera Zeb G8, Kanan G8, Ezra G8, zSabine",1
"Beck",1,0,113195,Wiggs,"Wedge G9, Biggs zzzCLS zzC-3PO zLeia",1
"Beck",1,0,92703,Wampa (Counter),"zRex zzWampa DT G8, HYoda G7, Jyn G8",1
"Beck",1,0,79198,Jawas,"Nebit G8, Jawa Engineer G8, Jawa Scavenger, Jawa G8, Dathcha",1
"Beck",1,0,14139,SionSolo (Counter),"Sion G8",1
"Beck",1,1,95996,NS,"zzMT zzAV zDaka Zombie Spirit G9",0
"Beck",0,1,89058,Grievous,"zzGG B2 4* G7, B1 G8, Droideka G8, zDooku",0
"Beck",,,63523,Mon Mothma,"Mon Mothma 4* G7, Hoth Rebel Scout G8, Chirrut G8, Baze G8, K-2SO G8",0
"Beck",1,0,57722,Troopers,"Veers G9, Starck G5, Range Trooper 4* G7, Stormtrooper G8, Snowtrooper G8",0
"Beck",0,1,75392,FO,"zzKRU G8, zKylo FOE G8, FOST G8, FOO G8",0
"Beck",0,1,64869,BH,"Jango 6* G4, The Mandalorian G7, Greef Karga G7, Cad Zam G7",0
"Beck",1,0,88740,QGJ,"QGJ G8, Aayla 5* G4, zJKA zzOld Ben, zAhsoka",0
"Beck",1,0,12409,NestSolo (Counter),"Nest G7",0
"Eanid September",0,1,110879,padme,"zzPadme zGK zJKA zAhsoka zBarriss",1
"Eanid September",0,1,113105,DRMalak,"zzzDR zzHK-47 zBSF zzMalak 6* Sith Empire Trooper",1
"Eanid September",,,385856,Negotiator,"Negotiator HT Anakin's Eta-2 Starfighter, Umbaran Starfighter, Ahsoka Tano's Jedi Starfighter, BTL-B Y-wing Starfighter, Clone Sergeant's ARC-170, Plo Koon's Jedi Starfighter",1
"Eanid September",1,1,124618,JTR,"zzzJTR zR2-D2 zzBB-8 zResistance Hero Finn, Resistance Hero Poe",1
"Eanid September",0,1,93991,Geonosians,"zzGBA Poggle Geo Soldier, Geo Spy, Sun Fac",1
"Eanid September",,,375242,HansMF,"Home One, Han's MF, Biggs X-wing, Bistan's U-wing, Phantom Ghost Cassian's U-wing, Wedge X-wing",1
"Eanid September",0,1,99598,Grievous,"zGG zB2 zB1 zDroideka zMagnaGuard",1
"Eanid September",1,0,107636,Traya,"zzTraya zDN zSion zzEP zThrawn",1
"Eanid September",,,321220,Executrix,"Executrix Tie Adv, Emperor's Shuttle, TIE Reaper, Imperial TIE Fighter, Gauntlet Starfighter, First Order SF TIE Fighter, First Order TIE Fighter",1
"Eanid September",,,94367,Disintegration,"zAurra Greef Karga G8, zBoba zBossk The Mandalorian G8",1
"Eanid September",1,0,109943,CLS,"zzzCLS zHan zzChewbacca zLeia C-3PO",1
"Eanid September",1,1,121662,Revan Offense,"zzzJKR zGMY zBS zJolee Ezra",1
"Eanid September",1,1,90353,Ewoks,"zChirpa Elder Paploo zWicket Logray G9",1
"Eanid September",1,1,94102,Carth,"zCarth Onasi, zMission zZaalbar Juhani Canderous",1
"Eanid September",0,1,95225,FO,"zzKRU zKylo FOE FOO zHux",1
"Eanid September",0,1,75923,Phoenix,"Hera G9, Chopper G8, Zeb G9, Kanan Sabine",1
"Eanid September",1,1,76211,Rogue1,"Jyn G9, Chirrut G9, Baze G8, K-2SO G9, Cassian",1
"Eanid September",1,0,15181,NestSolo (Counter),"Nest",1
"Eanid September",1,1,89963,NS,"zMT zAV Daka Zombie Spirit G9",0
"Eanid September",1,0,80030,ShaakClones,"Shaak Ti, Rex Echo G9, Fives ARC Trooper G8",0
"Eanid September",1,0,67360,Troopers,"Veers G9, Starck G8, Shoretrooper G8, Stormtrooper G8, Snowtrooper G7",0
"Eanid September",0,1,94549,BH,"zJango Greedo Dengar Cad IG-88",0
"Eanid September",1,0,68399,Jawas,"Nebit G8, Jawa Engineer G9, Jawa Scavenger G8, Jawa G7, Dathcha G9",0
"bellojack",0,1,112795,padme,"zzPadme zGK zJKA zAhsoka zzC-3PO",1
"bellojack",0,1,113652,DRMalak,"zzzDR zzHK-47 zBSF zzMalak Sith Empire Trooper",1
"bellojack",,,424177,HansMF,"Home One, Han's MF, HT Biggs X-wing, Phantom Ghost Cassian's U-wing, Bistan's U-wing",1
"bellojack",1,1,142643,JTR,"zzzJTR zzR2-D2 zzBB-8 zResistance Hero Finn, zResistance Hero Poe",1
"bellojack",0,1,106732,Grievous,"zzGG zB2 zB1 zDroideka zMagnaGuard",1
"bellojack",1,1,116472,Revan Offense,"zzzJKR zzGMY zBS zJolee zEzra",1
"bellojack",1,1,93967,Ewoks,"zChirpa Elder zPaploo zWicket zLogray",1
"bellojack",1,1,90052,Carth,"Carth Onasi, zMission zZaalbar zJuhani Canderous",1
"bellojack",0,1,110865,BH,"zzBossk zGreedo zBoba zZam zIG-88",1
"bellojack",1,1,127826,zEP,"zzEP zzzVader zzTarkin TFP zSion",1
"bellojack",1,0,107661,CLS,"zzzCLS zHan Leia zzOld Ben, zzChewbacca",1
"bellojack",0,1,96280,Phoenix,"zHera Chopper zZeb zKanan zSabine",1
"bellojack",1,0,82508,Troopers,"zVeers zStarck Magma G8, Stormtrooper G9, Snowtrooper G8",1
"bellojack",1,1,71831,Rogue1,"Jyn G8, Chirrut G8, Baze G8, K-2SO G9, Cassian G9",1
"bellojack",1,0,113656,zMaul,"zMaul zDooku zDN zSidious zSavage",1
"bellojack",0,1,75279,Geonosians,"GBA 6* G3, Poggle Geo Soldier, Geo Spy, Sun Fac G8",0
"bellojack",1,1,67108,NS,"zMT G5, zAV Daka G8, Zombie G5, Spirit G2",0
"bellojack",1,0,98076,ShaakClones,"zzShaak Ti, zRex zEcho zzFives Clone Sergeant G8",0
"bellojack",0,1,64319,BH,"Jango G6, zThe Mandalorian 4* G5, zzGreef Karga 5* G2, Cad Nest G4",0
"bellojack",0,1,81526,FO,"zzKRU G8, zKylo Phasma FOST FOO",0
"This Is The Way",0,1,145735,padme,"zzPadme zGK zJKA zAhsoka zzC-3PO",1
"This Is The Way",,,462380,Negotiator,"Negotiator 6* HT Anakin's Eta-2 Starfighter, Umbaran Starfighter, Ahsoka Tano's Jedi Starfighter, Clone Sergeant's ARC-170, Jedi Consular's Starfighter, Plo Koon's Jedi Starfighter",1
"This Is The Way",0,1,93057,Geonosians,"zzGBA Poggle Geo Soldier, Geo Spy, Sun Fac",1
"This Is The Way",0,1,139653,Grievous,"zzGG zB2 zB1 zDroideka zMagnaGuard",1
"This Is The Way",1,0,126104,Traya,"zzTraya zDN zSion zzEP zzThrawn",1
"This Is The Way",1,1,111908,JTR,"zzzJTR zScav Rey, zzBB-8 zzR2-D2 zFinn",1
"This Is The Way",,,149384,Disintegration,"zzAurra zzGreef Karga, zBoba zzBossk zzThe Mandalorian",1
"This Is The Way",,,117884,Nute-Wat,"zNute zDooku zWat Tambor 4*, zzJango zNest",1
"This Is The Way",1,1,111165,GAS,"zzzzGAS zRex zEcho zzFives zARC Trooper",1
"This Is The Way",1,1,89515,Ewoks,"zChirpa Elder zPaploo zWicket zLogray",1
"This Is The Way",0,1,94015,FO,"zzKRU zKylo FOE zFOST FOO",1
"This Is The Way",1,0,107982,CLS,"zzzCLS zHan Leia zzOld Ben, zzChewbacca",1
"This Is The Way",1,0,101423,Troopers,"zVeers zStarck zzAdmiral Piett, Stormtrooper G8, Snowtrooper G8",1
"This Is The Way",0,1,73162,Phoenix,"Hera Chopper Zeb G9, Kanan G8, Ezra",1
"This Is The Way",1,0,63851,Jawas,"Nebit G8, Jawa Engineer G9, Jawa Scavenger G8, Jawa G9, Dathcha G8",1
"This Is The Way",0,1,50086,Qira,"Qira L3-37 4* G8, Vandor Chewbacca 3* G8, Mission 6* G8, Zaalbar G7",0
"This Is The Way",,,326427,HansMF,"Home One, Han's MF, Biggs X-wing, Bistan's U-wing 5*, Phantom Ghost Cassian's U-wing, Wedge X-wing",0
"This Is The Way",1,1,72416,NS,"MT G8, zAV Daka Zombie G8, Spirit G8",0
"This Is The Way",,,65265,Mon Mothma,"Mon Mothma 3* G7, Hoth Rebel Scout G8, zCara Dune, Chirrut G8, Pao G8",0
"Tzoid",0,1,135573,DRMalak,"zzzDR zzHK-47 zBSF zzMalak Sith Empire Trooper",1
"Tzoid",0,1,129453,padme,"zzPadme zGK zJKA zAhsoka zzC-3PO",1
"Tzoid",,,429478,HansMF,"Home One, Han's MF, HT Biggs X-wing, Phantom Ghost Cassian's U-wing, Bistan's U-wing",1
"Tzoid",0,1,93232,Geonosians,"zzGBA Poggle Geo Soldier, Geo Spy, Sun Fac",1
"Tzoid",0,1,121196,Grievous,"zzGG zB2 zB1 zDroideka zMagnaGuard",1
"Tzoid",1,1,135621,Revan Offense,"zzzJKR zzGMY zBS zJolee zEzra",1
"Tzoid",1,1,96277,Ewoks,"zChirpa Elder zPaploo zWicket zLogray",1
"Tzoid",1,0,95490,ShaakClones,"zzShaak Ti, Rex Echo Fives ARC Trooper G9",1
"Tzoid",0,1,103688,BH,"zzBossk Greedo zBoba Dengar Cad",1
"Tzoid",1,1,93378,Carth,"zCarth Onasi, zMission zZaalbar zJuhani zCanderous",1
"Tzoid",1,1,119348,zEP,"zzEP zzzVader zzTarkin TFP zzDN",1
"Tzoid",0,1,85162,FO,"zzKRU Kylo FOE FOSFTP G9, FOO",1
"Tzoid",1,0,105957,CLS,"zzzCLS zHan Leia zOld Ben, zzChewbacca",1
"Tzoid",1,0,21396,SionSolo (Counter),"zSion",1
"Tzoid",1,1,82544,NestSisters,"zzAV MT Daka Zombie Nest 5* G6",0
"Tzoid",1,0,54451,Troopers,"Veers G8, Starck G8, DT 5* G8, Stormtrooper G8, Snowtrooper G8",0
"Tzoid",0,1,89038,Phoenix,"zHera Chopper zZeb zKanan Sabine 5*",0
"Tzoid",1,1,61004,Rogue1,"Jyn G8, Chirrut G8, Baze 5* G8, K-2SO G8, Cassian",0
"MetalPrawn",0,1,120826,padme,"zzPadme zGK zJKA zAhsoka zzC-3PO",1
"MetalPrawn",,,417685,Negotiator,"Negotiator 6* HT Anakin's Eta-2 Starfighter, Umbaran Starfighter, Ahsoka Tano's Jedi Starfighter, Clone Sergeant's ARC-170, Jedi Consular's Starfighter, Plo Koon's Jedi Starfighter",1
"MetalPrawn",0,1,108663,Grievous,"zzGG zB2 zB1 zDroideka MagnaGuard",1
"MetalPrawn",1,1,82310,Ewoks,"zChirpa Elder Paploo Wicket Logray G9",1
"MetalPrawn",1,0,133414,ShaakClones,"zzShaak Ti, zRex zEcho zzFives zARC Trooper",1
"MetalPrawn",0,1,98152,BH,"zBossk zBoba Dengar G8, zJango IG-88",1
"MetalPrawn",1,1,89625,zEP,"zzEP zzVader Tarkin G9, TFP G8, Traya G8",1
"MetalPrawn",1,0,69484,Wiggs,"Wedge G8, Biggs G8, CLS G8, zHan Chewbacca G9",1
"MetalPrawn",0,1,65889,Phoenix,"Hera G8, Chopper G8, Zeb G8, Kanan G8, Ezra G8",1
"MetalPrawn",,,246354,HansMF,"Home One, Han's MF 5*, Biggs X-wing, Bistan's U-wing 6*, Phantom Ghost Cassian's U-wing 6*, Wedge X-wing",0
"MetalPrawn",0,1,89753,Geonosians,"zGBA Poggle Geo Soldier, Geo Spy, Sun Fac",0
"MetalPrawn",1,1,68977,NS,"MT G8, zAV Daka G9, Zombie 5* G8, Spirit 6* G8",0
"MetalPrawn",1,1,46391,Rogue1,"Jyn 5* G8, Chirrut G8, Baze 5* G8, K-2SO G8, Cassian G8",0
"MetalPrawn",0,1,53699,FO,"KRU G8, Kylo 6* G8, Phasma G8, FOTP G8, FOO G8",0
"MetalPrawn",1,0,7729,NestSolo (Counter),"Nest 4* G7",0
"Kaervek",1,1,113315,NS,"zzMT zzAV zDaka Zombie Spirit",1
"Kaervek",0,1,122863,padme,"zzPadme zGK zJKA zAhsoka zC-3PO",1
"Kaervek",0,1,111321,DRMalak,"zzzDR zHK-47 zBSF zzMalak 6* Sith Empire Trooper",1
"Kaervek",,,388222,Negotiator,"Negotiator 5* HT Anakin's Eta-2 Starfighter, Umbaran Starfighter, Ahsoka Tano's Jedi Starfighter, Clone Sergeant's ARC-170, Plo Koon's Jedi Starfighter, Rex's ARC-170",1
"Kaervek",0,1,95948,Geonosians,"zzGBA Poggle Geo Soldier, Geo Spy, Sun Fac",1
"Kaervek",0,1,112975,Grievous,"zzGG zB2 zB1 zDroideka MagnaGuard",1
"Kaervek",1,0,108530,Traya,"zzTraya DN zSion zNest zThrawn",1
"Kaervek",1,1,109942,JTR,"zzzJTR Scav Rey, zzBB-8 zzR2-D2 Finn",1
"Kaervek",,,99930,Nute-OR,"zNute Dooku zzJango zZaalbar zMission",1
"Kaervek",1,1,116265,Revan Offense,"zzzJKR zGMY zBS zJolee zHYoda",1
"Kaervek",1,1,84285,Ewoks,"zChirpa Elder Paploo Wicket zLogray",1
"Kaervek",1,0,92714,ShaakClones,"zzShaak Ti, Rex Echo zFives ARC Trooper G8",1
"Kaervek",0,1,97007,BH,"zzBossk Greedo zBoba Dengar IG-88",1
"Kaervek",1,1,102812,zEP,"zEP zzzVader zTarkin DT TFP",1
"Kaervek",0,1,86742,FO,"zzKRU Kylo FOE FOTP FOO",1
"Kaervek",0,1,74993,Phoenix,"Hera G8, Zeb G8, Kanan G8, zEzra Sabine G8",1
"Kaervek",1,0,115198,CLS,"zzzCLS zHan Leia Old Ben, zzChewbacca",1
"Kaervek",1,0,86574,Troopers,"zVeers zStarck Shoretrooper G9, Stormtrooper Snowtrooper",1
"Kaervek",1,1,81192,Rogue1,"zJyn G8, Chirrut Baze Bistan G8, Cassian G9",1
"Kaervek",1,0,46918,Jawas,"Nebit G8, Jawa Engineer 5* G7, Jawa Scavenger G7, Jawa 5* G8, Dathcha G8",0
"Flat Taco",0,1,118052,padme,"zzPadme zGK zJKA zAhsoka zzC-3PO",1
"Flat Taco",1,1,91419,NestSisters,"zzAV zMT Daka Zombie zNest",1
"Flat Taco",0,1,130379,DRMalak,"zzzDR zzHK-47 zBSF zzMalak zThrawn",1
"Flat Taco",0,1,99948,Geonosians,"zzGBA Poggle Geo Soldier, Geo Spy, Sun Fac",1
"Flat Taco",1,1,95581,JTR,"zzJTR Scav Rey, zBB-8 zR2-D2 Finn",1
"Flat Taco",1,1,111024,Revan Offense,"zzzJKR zGMY BS zJolee zHYoda",1
"Flat Taco",1,1,84235,Carth,"zCarth Onasi, zMission zZaalbar Juhani G8, Canderous",1
"Flat Taco",0,1,99028,BH,"zzBossk Greedo Boba Cad zJango",1
"Flat Taco",1,1,97220,zEP,"zzEP zzVader Tarkin G9, TFP G9, zzTraya",1
"Flat Taco",0,1,81119,FO,"zKRU Kylo FOE FOST G8, FOO",1
"Flat Taco",1,0,92467,Wiggs,"Wedge Biggs zCLS zHan zChewbacca",1
"Flat Taco",0,1,67257,Phoenix,"Hera G8, Chopper G8, Zeb G8, Kanan G8, Ezra G9",1
"Flat Taco",1,0,21352,SionSolo (Counter),"zSion",1
"Flat Taco",,,379678,Negotiator,"Negotiator HT Anakin's Eta-2 Starfighter, Umbaran Starfighter, Ahsoka Tano's Jedi Starfighter, BTL-B Y-wing Starfighter 3*, Clone Sergeant's ARC-170 5*, Rex's ARC-170",0
"Flat Taco",0,1,116199,Grievous,"zGG zB2 zB1 zDroideka MagnaGuard",0
"Flat Taco",1,1,104976,GAS,"zzzzGAS zRex zEcho zzFives ARC Trooper 6*",0
"Flat Taco",1,1,67961,Ewoks,"zChirpa G9, Elder Paploo G9, Wicket Logray G7",0
"JuanQue NoloVi",0,1,124525,DRMalak,"zzzDR zzHK-47 zBSF zzMalak Sith Empire Trooper",1
"JuanQue NoloVi",1,1,144324,NS_Alt,"zzMT zzAV Zombie Talia zDaka",1
"JuanQue NoloVi",0,1,98480,Geonosians,"zzGBA Poggle Geo Soldier, Geo Spy, Sun Fac",1
"JuanQue NoloVi",,,403980,HansMF,"Home One, Han's MF, HT Biggs X-wing, Phantom Ghost Cassian's U-wing, Wedge X-wing",1
"JuanQue NoloVi",1,0,113105,CLS,"zzzCLS zHan zzChewbacca G9, zzR2-D2 zzC-3PO",1
"JuanQue NoloVi",1,1,136289,Revan,"zzzJKR zBS zzGMY zJolee zGK",1
"JuanQue NoloVi",1,1,87402,Ewoks,"zChirpa Elder Paploo Wicket Logray",1
"JuanQue NoloVi",0,1,102078,BH,"zzBossk Greedo zBoba Dengar G9, Zam",1
"JuanQue NoloVi",1,1,99865,Carth,"zCarth Onasi, zMission zZaalbar zJuhani zCanderous",1
"JuanQue NoloVi",0,1,106295,Phoenix,"zHera zZeb zKanan zEzra zSabine",1
"JuanQue NoloVi",1,0,61955,Jawas,"Nebit G8, Jawa Engineer G9, Jawa Scavenger G8, Jawa G9, Dathcha",1
"JuanQue NoloVi",1,0,69456,IG88,"IG-88 GG G8, BB-8 G9, T3-M4 G8, L3-37 G8",1
"JuanQue NoloVi",1,0,69121,EP (trio),"EP Traya G8, DN G8, Sion G8, Thrawn G9",1
"JuanQue NoloVi",,,49477,Nute-Wat,"Nute B1 6* G7, B2 G8, MagnaGuard G7, Wat Tambor 4* G5",0
"JuanQue NoloVi",1,0,72487,ShaakClones,"zzShaak Ti, Rex G8, Echo G9, Fives G9, Clone Sergeant G8",0
"JuanQue NoloVi",1,0,57155,Troopers,"Veers G8, Starck G9, DT 5* G8, Stormtrooper Snowtrooper G8",0
"JuanQue NoloVi",0,1,64237,FO,"KRU G8, Kylo G8, Phasma G8, FOE FOO G8",0
"JuanQue NoloVi",1,1,66903,Rogue1,"Jyn G8, Chirrut G8, Baze 6* G8, K-2SO G8, Cassian G8",0
"JuanQue NoloVi",1,0,81638,zMaul,"Maul G8, zDooku Sidious Sith Assassin, Sith Marauder",0
"Drcct",1,1,117213,NS,"zzMT zzAV zDaka Zombie Spirit",1
"Drcct",0,1,134830,padme,"zzPadme zGK zJKA zAhsoka zzC-3PO",1
"Drcct",,,465432,HansMF,"Home One, Han's MF, HT Biggs X-wing, Phantom Ghost Cassian's U-wing, Bistan's U-wing",1
"Drcct",0,1,101471,Geonosians,"zzGBA Poggle Geo Soldier, Geo Spy, Sun Fac",1
"Drcct",0,1,103516,Grievous,"zzGG zB2 zB1 zDroideka zMagnaGuard",1
"Drcct",1,1,114866,JTR,"zzzJTR zScav Rey, zzBB-8 zzR2-D2 zFinn",1
"Drcct",1,1,104803,Ewoks,"zChirpa Elder zPaploo zWicket zLogray",1
"Drcct",0,1,123749,BH,"zzBossk zBoba zDengar zzJango zIG-88",1
"Drcct",1,0,110225,ShaakClones,"zzShaak Ti, zRex zEcho zzFives Clone Sergeant",1
"Drcct",1,1,121788,zEP,"zzEP zzzVader zzTarkin TFP G9, zzTraya",1
"Drcct",0,1,100680,Phoenix,"zHera zZeb zKanan zEzra zSabine",1
"Drcct",1,0,111900,CLS,"zzzCLS zHan zLeia zOld Ben, zzChewbacca",1
"Drcct",1,0,79912,Troopers,"zVeers zStarck Shoretrooper G8, Stormtrooper G8, Snowtrooper",1
"Drcct",0,1,99293,FO,"zzKRU zKylo zPhasma zFOST FOO",1
"Drcct",1,0,69978,Jawas,"Nebit G9, Jawa Engineer G9, Jawa Scavenger G9, Jawa G9, Dathcha",1
"Mandaloian Ophace",1,1,100617,NS,"zzMT zzAV zDaka Zombie Spirit",1
"Mandaloian Ophace",0,1,85120,Geonosians,"zzGBA Poggle Geo Soldier, Geo Spy, Sun Fac G8",1
"Mandaloian Ophace",1,0,106149,Traya,"zzTraya zzDN zSion zzEP Thrawn G9",1
"Mandaloian Ophace",1,1,96365,JTR,"zzzJTR Scav Rey, BB-8 R2-D2 Finn",1
"Mandaloian Ophace",1,0,101462,ShaakClones,"zzShaak Ti, zRex Echo zFives zARC Trooper",1
"Mandaloian Ophace",0,1,105083,BH,"zzBossk zBoba zDengar Cad zIG-88",1
"Mandaloian Ophace",0,1,81309,Phoenix,"zHera Zeb G8, Kanan G8, zEzra Sabine G8",1
"Mandaloian Ophace",1,0,100690,Wiggs,"Wedge G8, Biggs zzzCLS zHan zFulcrum",1
"Mandaloian Ophace",0,1,116329,BS,"zBS zzGMY zJolee GK zHYoda",1
"Mandaloian Ophace",1,0,86556,Jawas,"Nebit Jawa Engineer, Jawa Scavenger, Jawa Dathcha",1
"Mandaloian Ophace",,,380796,Negotiator,"Negotiator 5* HT 3* Anakin's Eta-2 Starfighter, Umbaran Starfighter, Ahsoka Tano's Jedi Starfighter, Clone Sergeant's ARC-170, Plo Koon's Jedi Starfighter, Rex's ARC-170",0
"Mandaloian Ophace",0,1,76451,Grievous,"GG B2 5* G7, B1 Nute G8, zDooku",0
"Mandaloian Ophace",,,69368,Mon Mothma,"Mon Mothma 3* G6, Hoth Rebel Soldier G7, Chirrut G7, Lando Jyn G8",0
"Mandaloian Ophace",1,1,79105,Ewoks,"Chirpa 4* G8, Elder zPaploo Scout zLogray",0
"Mandaloian Ophace",1,1,58264,Carth,"Carth Onasi G7, Mission G9, Zaalbar G9, Juhani 6* G8, Canderous 3* G7",0
"Mandaloian Ophace",1,0,57182,Troopers,"Veers 6* G7, Starck G7, Magma G7, Stormtrooper G7, Snowtrooper G8",0
"Mandaloian Ophace",0,1,68691,FO,"KRU G8, Kylo G8, Phasma G8, FOSFTP G7, FOO G9",0
"Mandaloian Ophace",1,0,76754,QGJ,"QGJ G7, Aayla 6* G6, zJKA Old Ben G9, zAhsoka",0
"Teg",0,1,128535,padme,"zzPadme zGK zJKA zAhsoka zzC-3PO",1
"Teg",0,1,109400,DRMalak,"zzzDR zzHK-47 zBSF zzMalak Sith Empire Trooper G8",1
"Teg",,,353675,Malevolence,"Malevolence Sun Fac SF, Soldier SF, Spy SF, Hyena Bomber, Vulture Droid, IG-2000",1
"Teg",,,393043,HansMF,"Home One, Han's MF, HT Biggs X-wing, Phantom Ghost Cassian's U-wing, Bistan's U-wing",1
"Teg",0,1,95661,Geonosians,"zzGBA Poggle Geo Soldier, Geo Spy, Sun Fac",1
"Teg",1,1,104890,JTR,"zzzJTR zzR2-D2 zBB-8 Resistance Hero Finn G8, Resistance Hero Poe G8",1
"Teg",0,1,118527,Grievous,"zzGG zB2 zB1 zDroideka zMagnaGuard",1
"Teg",1,1,116491,GAS,"zzzzGAS zRex zEcho zzFives zARC Trooper",1
"Teg",1,1,109827,Revan Offense,"zzzJKR zGMY BS zJolee HYoda",1
"Teg",1,1,80228,Ewoks,"zChirpa Elder Paploo G9, Wicket Logray G9",1
"Teg",0,1,100501,BH,"zzBossk Greedo Boba Dengar zIG-88",1
"Teg",1,1,91137,Carth,"zCarth Onasi, zMission Zaalbar Juhani Canderous",1
"Teg",1,1,102233,zEP,"zzEP zzVader Tarkin IPD G8, TFP G8",1
"Teg",0,1,135648,FO,"zzKRU zKylo FOE zFOST zHux",1
"Teg",0,1,82200,Phoenix,"Hera G9, zZeb G8, Kanan G8, zEzra zSabine",1
"Teg",1,0,112245,CLS,"zzzCLS zHan Wedge Biggs G8, zzChewbacca",1
"Teg",1,1,72539,Rogue1,"Jyn G8, Chirrut G8, Baze G8, K-2SO G8, Cassian",1
"Teg",1,0,66247,Jawas,"Nebit G8, Jawa Engineer G8, Jawa Scavenger G8, Jawa G8, Dathcha G8",1
"Teg",1,0,14740,NestSolo (Counter),"Nest G9",1
"Teg",1,0,13777,SionSolo (Counter),"Sion G8",1
"Teg",1,1,93500,NS_Alt,"zzMT zzAV Zombie Talia zDaka",0
"Teg",,,387204,Executrix,"Executrix Tie Adv, Emperor's Shuttle, TIE Reaper 6*, Imperial TIE Fighter, Gauntlet Starfighter, First Order SF TIE Fighter, First Order TIE Fighter",0
"Teg",,,63956,Mon Mothma,"Mon Mothma 5* G8, Hoth Rebel Scout G8, Hoth Rebel Soldier G8, Cara Dune 5* G8, Lando",0
"Teg",1,0,67329,Troopers,"Veers G9, Starck G8, DT G8, Shoretrooper G8, Snowtrooper G8",0
"Teg",0,1,82646,BH,"Jango G9, The Mandalorian, Greef Karga G8, Cad Zam G9",0
"FiftyHaydsOfGrey",1,1,94740,NS,"zzMT zzAV zDaka Zombie Spirit",1
"FiftyHaydsOfGrey",0,1,126883,DRMalak,"zzzDR zzHK-47 zBSF zzMalak Sith Empire Trooper",1
"FiftyHaydsOfGrey",0,1,114811,padme,"zzPadme zGK zJKA zAhsoka zzC-3PO",1
"FiftyHaydsOfGrey",,,340902,HansMF,"Home One, Han's MF, HT Biggs X-wing, Phantom Ghost Cassian's U-wing, Bistan's U-wing",1
"FiftyHaydsOfGrey",0,1,82865,Geonosians,"zzGBA G9, Poggle Geo Soldier, Geo Spy, Sun Fac G8",1
"FiftyHaydsOfGrey",1,1,102415,JTR,"zzzJTR Scav Rey, zBB-8 zzR2-D2 Finn",1
"FiftyHaydsOfGrey",,,90293,Nute-OR,"zNute Dooku Jango zZaalbar zMission",1
"FiftyHaydsOfGrey",1,1,117752,Revan Offense,"zzzJKR zGMY zBS zJolee Ezra",1
"FiftyHaydsOfGrey",1,1,82842,Ewoks,"zChirpa Elder zPaploo Wicket Logray",1
"FiftyHaydsOfGrey",1,0,97411,ShaakClones,"zzShaak Ti, zRex zEcho zzFives zARC Trooper G9",1
"FiftyHaydsOfGrey",0,1,97523,BH,"zBossk Greedo zBoba Dengar Cad",1
"FiftyHaydsOfGrey",1,1,96936,zEP,"zzEP zzVader Tarkin DT G9, TFP",1
"FiftyHaydsOfGrey",0,1,83257,FO,"zKRU zKylo G9, Phasma G8, FOE FOO",1
"FiftyHaydsOfGrey",1,0,111433,CLS,"zzzCLS zHan Wedge G8, Biggs G8, zzChewbacca",1
"FiftyHaydsOfGrey",1,0,20958,NestSolo (Counter),"zNest",1
"FiftyHaydsOfGrey",0,1,110312,Grievous,"zGG zB2 zB1 zDroideka zMagnaGuard",0
"FiftyHaydsOfGrey",0,1,65166,Phoenix,"Hera Chopper G9, Zeb Kanan G9, Sabine 5* G7",0
"FiftyHaydsOfGrey",1,0,8494,SionSolo (Counter),"Sion 2* G6",0
"neyde jean",0,1,112851,DRMalak,"zzzDR zHK-47 zBSF zzMalak Sith Assassin G8",1
"neyde jean",0,1,123351,padme,"zzPadme zGK zJKA zAhsoka zzC-3PO",1
"neyde jean",1,1,93792,NS_Alt,"zzMT zzAV Zombie Talia Daka",1
"neyde jean",,,374253,HansMF,"Home One, Han's MF 6*, HT Biggs X-wing, Phantom Ghost Cassian's U-wing, Bistan's U-wing",1
"neyde jean",0,1,94433,Geonosians,"zzGBA Poggle Geo Soldier, Geo Spy, Sun Fac",1
"neyde jean",0,1,99622,Grievous,"zzGG zB2 zB1 zDroideka G9, zMagnaGuard G8",1
"neyde jean",1,0,93253,Traya,"zzTraya DN G8, Sion G8, zzEP Thrawn G9",1
"neyde jean",1,1,109803,JTR,"zzzJTR Scav Rey, zBB-8 zzR2-D2 RT",1
"neyde jean",,,89875,Nute-Wat,"zNute zDooku zWat Tambor 4* G9, Jango zNest",1
"neyde jean",1,1,123090,Revan Offense,"zzzJKR zzGMY zBS zJolee zzHYoda",1
"neyde jean",1,1,90031,Ewoks,"zChirpa Elder zPaploo zWicket zLogray",1
"neyde jean",0,1,99366,BH,"zzBossk zBoba Dengar Cad Zam",1
"neyde jean",1,1,95167,Carth,"zCarth Onasi, zMission zZaalbar zJuhani Canderous",1
"neyde jean",0,1,76163,Phoenix,"Hera G9, Zeb G8, Kanan zEzra Sabine G8",1
"neyde jean",1,0,106360,Wampa (Counter),"zRex zzWampa Krennic zVisas FOO",1
"neyde jean",1,0,107243,CLS,"zzzCLS zHan Wedge Biggs G8, zzChewbacca",1
"neyde jean",1,0,73867,Troopers,"zVeers Starck G9, DT G9, Shoretrooper G9, Snowtrooper G9",1
"neyde jean",0,1,85964,FO,"zzKRU zKylo Phasma G8, FOTP zFOST G9",1
"neyde jean",1,1,74624,Rogue1,"Jyn G9, Chirrut G9, Baze K-2SO G8, Cassian",1
"neyde jean",1,0,65731,Jawas,"Nebit G9, Jawa Engineer G9, Jawa Scavenger G8, Jawa G7, Dathcha G8",0
"Jazzy",0,1,107712,padme,"zzPadme zGK zJKA zAhsoka zzC-3PO",1
