Player,Offense,Defense,GP,Name,Squad,Viable
"Senat0r Lipost",1,1,116048,Revan Offense,"zzzJKR zzGMY zBS zJolee Ezra",1
"Senat0r Lipost",1,1,97043,Ewoks,"zChirpa Elder zPaploo zWicket zLogray",1
"Senat0r Lipost",0,1,109025,BH,"zzBossk zBoba Dengar G9, zzJango IG-88",1
"Senat0r Lipost",1,1,105988,zEP,"zzEP zzzVader Tarkin TFP DN",1
"Senat0r Lipost",1,0,108322,CLS,"zzzCLS zHan Leia G9, zzOld Ben, zzChewbacca",1
"Senat0r Lipost",0,1,78928,Phoenix,"Hera Chopper Zeb G8, Kanan Sabine",1
"Senat0r Lipost",1,0,18739,NestSolo (Counter),"zNest",1
"Senat0r Lipost",1,0,16258,SionSolo (Counter),"Sion",1
"Senat0r Lipost",0,1,72951,Qira,"Qira G9, L3-37 6* G8, Vandor Chewbacca 3* G7, zMission zZaalbar",0
"Senat0r Lipost",,,327247,Malevolence,"Malevolence 6* Sun Fac SF, Soldier SF, Spy SF, Hyena Bomber 5*, Vulture Droid 4*, IG-2000",0
"Senat0r Lipost",,,364210,Executrix,"Executrix Tie Adv, Emperor's Shuttle, TIE Reaper, Imperial TIE Fighter, Gauntlet Starfighter 6*, First Order SF TIE Fighter 4*, First Order TIE Fighter",0
"Senat0r Lipost",,,65401,Mon Mothma,"Mon Mothma 3* G8, Chirrut G8, Pao G8, Lando Cassian G8",0
"Senat0r Lipost",1,0,86864,ShaakClones,"zzShaak Ti, Rex Echo Fives G9, ARC Trooper G8",0
"Senat0r Lipost",1,0,70768,Troopers,"Veers Starck G9, Range Trooper G8, Stormtrooper G8, Snowtrooper G8",0
"Senat0r Lipost",0,1,83108,FO,"KRU Kylo FOE FOST G8, FOO",0
"Senat0r Lipost",1,0,71150,Jawas,"Nebit G8, Jawa Engineer 6* G9, Jawa Scavenger G8, Jawa Dathcha",0
"Chubbs Peterson",0,1,145013,DRMalak,"zzzDR zzHK-47 zBSF zzMalak Sith Empire Trooper",1
"Chubbs Peterson",0,1,130970,padme,"zzPadme zGK zJKA zAhsoka zzC-3PO",1
"Chubbs Peterson",,,437624,Negotiator,"Negotiator HT Anakin's Eta-2 Starfighter, Umbaran Starfighter, Ahsoka Tano's Jedi Starfighter, BTL-B Y-wing Starfighter, Clone Sergeant's ARC-170, Plo Koon's Jedi Starfighter",1
"Chubbs Peterson",0,1,102515,Geonosians,"zzGBA Poggle Geo Soldier, Geo Spy, Sun Fac",1
"Chubbs Peterson",,,346742,HansMF,"Home One, Han's MF, Biggs X-wing, Bistan's U-wing, Phantom Ghost Cassian's U-wing, Wedge X-wing",1
"Chubbs Peterson",1,0,122343,Traya,"zzTraya zDN zSion zzEP zThrawn",1
"Chubbs Peterson",0,1,117445,Grievous,"zzGG zB2 zB1 zDroideka zMagnaGuard",1
"Chubbs Peterson",1,1,113469,JTR,"zzzJTR Scav Rey, zzBB-8 zzR2-D2 Finn",1
"Chubbs Peterson",,,93371,Nute-Wat,"zNute zDooku zWat Tambor 4*, zJango zNest",1
"Chubbs Peterson",1,1,139208,GAS,"zzzzGAS zRex zEcho zzFives zARC Trooper",1
"Chubbs Peterson",1,1,119099,Revan Offense,"zzzJKR zzGMY zBS zJolee zHYoda",1
"Chubbs Peterson",1,1,81824,Ewoks,"zChirpa Elder Paploo Scout Logray",1
"Chubbs Peterson",0,1,108083,BH,"zzBossk zzGreef Karga, Boba Dengar Cad",1
"Chubbs Peterson",1,1,89328,Carth,"zCarth Onasi, zMission Zaalbar Juhani Canderous G8",1
"Chubbs Peterson",0,1,131880,FO,"zzKRU zKylo FOE FOO zHux",1
"Chubbs Peterson",0,1,72405,Phoenix,"Hera G8, Zeb G8, Kanan G8, Ezra Sabine G8",1
"Chubbs Peterson",1,0,113408,CLS,"zzzCLS zHan Leia G8, zOld Ben, zzChewbacca",1
"Chubbs Peterson",1,0,84168,Wiggs,"Wedge G8, Biggs Fulcrum Chirrut Baze",1
"Chubbs Peterson",1,1,90396,NS,"zzMT zAV zDaka Zombie Spirit G3",0
"Chubbs Peterson",,,61783,Mon Mothma,"Mon Mothma 4* G7, Lando K-2SO G6, Jyn G7, Cassian G6",0
"Chubbs Peterson",1,0,40121,Jawas,"Nebit G1, Jawa Engineer G1, Jawa Scavenger G7, Jawa G3, Dathcha G1",0
"StarKiller316",1,1,148464,SL Kylo,"zzzzzzSL Kylo, zSith Trooper, zHux zzKRU zThrawn",1
"StarKiller316",1,1,96912,NS,"zzMT zzAV zDaka Zombie Spirit",1
"StarKiller316",0,1,120632,padme,"zzPadme zGK JKA zAhsoka zzC-3PO",1
"StarKiller316",0,1,112435,DR,"zzzDR zzHK-47 zBSF Sith Empire Trooper, Sith Assassin G8",1
"StarKiller316",,,119827,JKL,"zzJKL zzzJKR zzHYoda Old Ben, zEzra",1
"StarKiller316",,,429813,HansMF,"Home One, Han's MF, HT Biggs X-wing, Phantom Ghost Cassian's U-wing, Bistan's U-wing",1
"StarKiller316",0,1,92807,Geonosians,"zzGBA Poggle Geo Soldier, Geo Spy, Sun Fac",1
"StarKiller316",1,1,102805,JTR,"zzzJTR zzR2-D2 zzBB-8 Resistance Hero Finn G9, Resistance Hero Poe",1
"StarKiller316",0,1,118208,Grievous,"zzGG zB2 zB1 zDroideka MagnaGuard",1
"StarKiller316",,,96129,Nute-OR,"zNute zDooku zJango zZaalbar zMission",1
"StarKiller316",1,1,128187,GAS,"zzzzGAS zRex Echo zzFives zARC Trooper",1
"StarKiller316",1,1,82074,Ewoks,"zChirpa G9, Elder Paploo zWicket Logray",1
"StarKiller316",0,1,98636,BH,"zBossk Greedo zBoba Dengar zZam",1
"StarKiller316",1,1,111690,zEP,"zzEP zzzVader Tarkin TFP DN",1
"StarKiller316",1,0,118742,CLS,"zzzCLS zHan Wedge Biggs zzChewbacca",1
"StarKiller316",1,0,73052,Troopers,"zVeers Starck G9, DT G9, Stormtrooper G9, Snowtrooper G9",1
"StarKiller316",0,1,85162,Phoenix,"Hera Chopper Zeb zKanan zSabine",1
"StarKiller316",1,0,74484,Jawas,"Nebit Jawa Engineer, Jawa Scavenger G9, Jawa G9, Dathcha",1
"StarKiller316",1,0,18588,NestSolo (Counter),"zNest",1
"StarKiller316",1,0,16236,SionSolo (Counter),"Sion",1
"StarKiller316",,,396666,Executrix,"Executrix Tie Adv, Emperor's Shuttle 5*, TIE Reaper 6*, Imperial TIE Fighter, Gauntlet Starfighter 6*, First Order SF TIE Fighter, First Order TIE Fighter",0
"StarKiller316",,,81066,Mon Mothma,"zzMon Mothma 6* G8, Bistan G8, Chirrut zPao Baze",0
"Michael Wulf",1,1,149558,SL Kylo,"zzzzzzSL Kylo, zSith Trooper, zHux zzKRU zThrawn",1
"Michael Wulf",0,1,121140,padme,"zzPadme zGK JKA zAhsoka zzC-3PO",1
"Michael Wulf",0,1,113183,DRMalak,"zzzDR zzHK-47 zBSF zzMalak Sith Empire Trooper",1
"Michael Wulf",1,1,92486,NS_Alt,"zMT zzAV Zombie Talia Daka",1
"Michael Wulf",,,413071,Negotiator,"Negotiator HT Anakin's Eta-2 Starfighter, Umbaran Starfighter, Ahsoka Tano's Jedi Starfighter, Clone Sergeant's ARC-170, Plo Koon's Jedi Starfighter, Rex's ARC-170",1
"Michael Wulf",0,1,94276,Geonosians,"zzGBA Poggle Geo Soldier, Geo Spy, Sun Fac",1
"Michael Wulf",0,1,96779,Grievous,"zzGG G9, zB2 G9, zB1 zDroideka zMagnaGuard G8",1
"Michael Wulf",1,1,96473,JTR,"zJTR Scav Rey, zBB-8 zzR2-D2 Finn",1
"Michael Wulf",1,0,120917,Traya,"zzTraya zDN zSion zDooku zzEP",1
"Michael Wulf",1,1,107873,Revan Offense,"zzzJKR zGMY zBS zJolee HYoda",1
"Michael Wulf",1,1,90163,Ewoks,"zChirpa Elder zPaploo zWicket zLogray G9",1
"Michael Wulf",0,1,95955,BH,"zBossk zBoba Dengar G9, Cad zJango",1
"Michael Wulf",1,0,83311,Wiggs,"Wedge G8, Biggs G8, zzCLS zHan Ezra",1
"Michael Wulf",1,0,71268,Troopers,"zVeers Starck Magma G8, Stormtrooper G8, Snowtrooper G7",1
"Michael Wulf",,,316163,HansMF,"Home One, Han's MF 5*, Biggs X-wing, Bistan's U-wing 6*, Phantom Ghost Cassian's U-wing, Wedge X-wing",0
"Michael Wulf",1,0,101919,ShaakClones,"zzShaak Ti, zRex zEcho zzFives G9, zARC Trooper G8",0
"Michael Wulf",1,1,86070,Carth,"zCarth Onasi, zMission zZaalbar zJuhani Canderous G7",0
"Michael Wulf",0,1,66720,Phoenix,"Hera G8, Chopper G9, Zeb G8, Kanan Sabine 5* G7",0
"Michael Wulf",1,1,63368,Rogue1,"Jyn 6* G7, Chirrut G8, Baze 6* G7, K-2SO G8, Cassian G9",0
"Michael Wulf",1,0,11172,NestSolo (Counter),"Nest 4* G9",0
"JaidenHawk",1,1,100122,NS_Alt,"zzMT zzAV Zombie Talia zDaka",1
"JaidenHawk",1,1,117082,JTR,"zzzJTR zScav Rey, zzBB-8 zzR2-D2 zFinn",1
"JaidenHawk",1,1,149673,Revan,"zzzJKR zBS zzGMY zJolee zGK",1
"JaidenHawk",0,1,110787,BH,"zzBossk zGreedo zBoba zDengar zIG-88",1
"JaidenHawk",1,1,89558,Carth,"zCarth Onasi, zMission G9, Zaalbar G8, zJuhani zCanderous",1
"JaidenHawk",1,1,128628,zEP,"zzEP zzzVader zzTarkin zBSF zSion G9",1
"JaidenHawk",1,0,103353,Wiggs,"Wedge Biggs zzzCLS zHan Leia",1
"JaidenHawk",0,1,69368,Phoenix,"Hera G8, Chopper Zeb G8, Kanan G8, Ezra G8",1
"JaidenHawk",,,329441,Negotiator,"Negotiator 6* HT 5* Anakin's Eta-2 Starfighter 3*, Umbaran Starfighter, Ahsoka Tano's Jedi Starfighter, BTL-B Y-wing Starfighter 3*, Clone Sergeant's ARC-170, Plo Koon's Jedi Starfighter",0
"JaidenHawk",0,1,60122,Geonosians,"GBA 5* G4, Poggle G8, Geo Soldier G8, Geo Spy G8, Sun Fac G8",0
"JaidenHawk",0,1,92243,Grievous,"zzGG B2 6* G7, zNute zDooku G9, zzT3-M4",0
"JaidenHawk",,,61997,Mon Mothma,"Mon Mothma 3* G5, Bistan G8, Lando G8, K-2SO G9, Jyn G7",0
"JaidenHawk",1,0,69479,501st,"Rex G6, Clone Sergeant G9, Echo G7, Fives G9, Ahsoka",0
"JaidenHawk",1,0,56059,Troopers,"Veers G7, Starck G7, Range Trooper 4* G8, Stormtrooper G5, Snowtrooper G8",0
"JaidenHawk",0,1,59903,BH,"Jango 5* G7, zThe Mandalorian 5* G8, Cad Zam G6, Nest 5* G2",0
"JaidenHawk",0,1,74278,FO,"KRU G9, Kylo G9, Phasma FOTP FOST G9",0
"JaidenHawk",1,0,51942,Jawas,"Nebit G8, Jawa Engineer 6* G6, Jawa Scavenger G7, Jawa 5* G7, Dathcha G2",0
"Btr Nut",0,1,121970,padme,"zzPadme zGK zJKA zAhsoka zC-3PO",1
"Btr Nut",1,1,99659,NestSisters,"zzAV zMT Daka Zombie zNest",1
"Btr Nut",0,1,102639,DR,"zzzDR zHK-47 zBSF Sith Empire Trooper G8, Sith Assassin G8",1
"Btr Nut",,,462619,Negotiator,"Negotiator HT Anakin's Eta-2 Starfighter, Umbaran Starfighter, Ahsoka Tano's Jedi Starfighter, Clone Sergeant's ARC-170, Plo Koon's Jedi Starfighter, Rex's ARC-170",1
"Btr Nut",0,1,94486,Geonosians,"zzGBA Poggle Geo Soldier, Geo Spy, Sun Fac",1
"Btr Nut",,,392070,HansMF,"Home One, Han's MF, Biggs X-wing, Bistan's U-wing, Phantom Ghost Cassian's U-wing, Wedge X-wing",1
"Btr Nut",0,1,80119,Grievous,"zGG B2 G8, B1 Droideka G8, MagnaGuard G8",1
"Btr Nut",1,1,109673,JTR,"zzzJTR Scav Rey, zBB-8 zzR2-D2 zFinn",1
"Btr Nut",,,108716,Nute-OR,"zNute zDooku zzJango zZaalbar zMission",1
"Btr Nut",1,1,127091,Revan Offense,"zzzJKR zzGMY zBS zJolee HYoda G9",1
"Btr Nut",1,1,89959,Ewoks,"zChirpa Elder Paploo Wicket zLogray",1
"Btr Nut",1,0,113338,ShaakClones,"zzShaak Ti, zRex zEcho zzFives zARC Trooper",1
"Btr Nut",0,1,110474,BH,"zzBossk Greedo zBoba Dengar zIG-88",1
"Btr Nut",1,1,104354,zEP,"zEP zzzVader zTarkin TFP G9, zDN",1
"Btr Nut",0,1,83162,FO,"zKRU Kylo G9, FOE FOTP FOO",1
"Btr Nut",0,1,76744,Phoenix,"Hera Zeb G8, Kanan G8, Ezra Sabine",1
"Btr Nut",1,0,105035,CLS,"zzzCLS zHan Leia Old Ben, zChewbacca",1
"Btr Nut",1,0,83765,Thragma (Counter),"zzThrawn Magma G9, zKrennic G9, Stormtrooper Shoretrooper G8",1
"Btr Nut",1,1,85938,Rogue1,"zJyn Chirrut G8, Baze G8, K-2SO G9, zCassian",1
"Btr Nut",1,0,72554,Jawas,"Nebit G8, Jawa Engineer G9, Jawa Scavenger G8, Jawa G9, Dathcha",1
"Btr Nut",1,0,20236,SionSolo (Counter),"zSion",1
"Btr Nut",,,355785,Executrix,"Executrix Tie Adv, Emperor's Shuttle 5*, TIE Reaper 6*, Imperial TIE Fighter, Gauntlet Starfighter, First Order SF TIE Fighter 4*, First Order TIE Fighter",0
"Btr Nut",,,72596,Mon Mothma,"Mon Mothma 4* G8, Bistan G8, Hoth Rebel Scout, Pao G8, Biggs",0
"Btr Nut",1,0,66490,Troopers,"Veers Starck DT 5* G8, Range Trooper 4* G8, Snowtrooper G8",0
"Krupten",0,1,122715,DRMalak,"zzzDR zzHK-47 zBSF zzMalak Sith Empire Trooper G8",1
"Krupten",0,1,111684,padme,"zzPadme zGK zJKA zAhsoka zzC-3PO",1
"Krupten",1,1,99960,NS_Alt,"zzMT zzAV Zombie Talia zDaka",1
"Krupten",0,1,95360,Geonosians,"zzGBA Poggle Geo Soldier, Geo Spy, Sun Fac",1
"Krupten",,,372952,HansMF,"Home One, Han's MF 5*, HT Biggs X-wing, Phantom Ghost Cassian's U-wing, Rey's Millennium Falcon",1
"Krupten",0,1,99412,Grievous,"zzGG zB2 zB1 zDroideka zMagnaGuard",1
"Krupten",1,0,101604,Traya,"zzTraya DN G9, Sion zzEP zThrawn",1
"Krupten",1,1,115168,JTR,"zzzJTR Scav Rey, zzBB-8 zzR2-D2 zFinn",1
"Krupten",1,1,128040,Revan Offense,"zzzJKR zGMY BS zJolee zHYoda",1
"Krupten",1,1,78493,Ewoks,"zChirpa Elder Paploo Wicket G8, zLogray",1
"Krupten",0,1,106312,BH,"zzBossk zBoba zDengar zJango Zam",1
"Krupten",1,1,87398,Carth,"zCarth Onasi, Mission Zaalbar Juhani Canderous",1
"Krupten",0,1,106141,FO,"zzKRU zKylo FOE zFOST FOO",1
"Krupten",1,0,105632,CLS,"zzzCLS zHan Leia Old Ben, zzChewbacca",1
"Krupten",0,1,76535,Phoenix,"Hera Chopper Zeb Kanan Ezra",1
"Krupten",1,0,87794,ShaakClones,"zzShaak Ti G9, zRex zEcho G8, zzFives Clone Sergeant G9",0
"Lala",0,1,122387,DRMalak,"zzzDR zzHK-47 zBSF zzMalak Sith Empire Trooper",1
"Lala",0,1,111337,padme,"zzPadme zGK zJKA zAhsoka zzC-3PO",1
"Lala",,,409302,HansMF,"Home One, Han's MF, HT Biggs X-wing, Phantom Ghost Cassian's U-wing, Bistan's U-wing",1
"Lala",0,1,90063,Geonosians,"zzGBA Poggle Geo Soldier, Geo Spy, Sun Fac G9",1
"Lala",0,1,102889,Grievous,"zzGG zB2 zB1 zDroideka zMagnaGuard",1
"Lala",1,1,122306,JTR,"zzzJTR zScav Rey, zzBB-8 zzR2-D2 zFinn",1
"Lala",,,104795,Nute-OR,"zNute zDooku zzJango zZaalbar zMission",1
"Lala",1,1,110858,Revan Offense,"zzzJKR zzGMY zBS zJolee Ezra",1
"Lala",1,1,92451,Ewoks,"zChirpa Elder zPaploo zWicket zLogray",1
"Lala",1,0,89259,ShaakClones,"zzShaak Ti, Rex Echo Fives ARC Trooper G8",1
"Lala",0,1,106833,BH,"zzBossk zBoba zDengar Cad zZam",1
"Lala",1,1,101875,zEP,"zzEP zzzVader zzTarkin TFP G8, DN",1
"Lala",1,0,128196,CLS,"zzzCLS zHan Leia G9, zzOld Ben, zzChewbacca",1
"Lala",0,1,79730,Phoenix,"Hera Chopper Zeb Kanan Sabine G8",1
"Lala",0,1,83584,FO,"zzKRU zKylo FOTP FOST G9, FOO G8",1
"Lala",1,1,81775,Rogue1,"Jyn G8, Chirrut Baze K-2SO G9, zCassian",1
"Lala",1,0,19659,NestSolo (Counter),"zNest",1
"Lala",1,0,14874,SionSolo (Counter),"Sion G9",1
"Lala",1,1,74444,NS,"MT G8, zAV Daka G9, Zombie G8, Spirit G8",0
"Rouge 5hadow",1,0,101730,Traya,"zzTraya zDN zSion zBSF zThrawn G8",1
"Rouge 5hadow",1,1,137175,Revan,"zzzJKR zBS zGMY zJolee GK",1
"Rouge 5hadow",1,1,93870,Carth,"zCarth Onasi, zMission zZaalbar G8, Juhani zCanderous",1
"Rouge 5hadow",0,1,100992,Phoenix,"zHera zZeb zKanan zEzra zSabine",1
"Rouge 5hadow",,,262682,Negotiator,"Negotiator HT 3* Anakin's Eta-2 Starfighter 5*, Umbaran Starfighter 5*, Ahsoka Tano's Jedi Starfighter, BTL-B Y-wing Starfighter 6*, Clone Sergeant's ARC-170, Plo Koon's Jedi Starfighter",0
"Rouge 5hadow",0,1,71950,Geonosians,"zzGBA Poggle G6, Geo Soldier G8, Geo Spy G8, Sun Fac G7",0
"Rouge 5hadow",1,1,76078,NS,"zMT AV Daka G8, Zombie 6* Spirit 5* G8",0
"Rouge 5hadow",0,1,75268,BH,"zzBossk 4* Greedo G5, zzGreef Karga 6*, zBoba Dengar 6* G5",0
"Rouge 5hadow",1,0,72669,EP (Counter, Rebel),"EP G8, zzWampa zNest 3* Stormtrooper G7, Starck G6",0
"Val",1,1,146466,SL Kylo,"zzzzzzSL Kylo, zSith Trooper, zHux zzKRU zThrawn",1
"Val",0,1,141425,DRMalak,"zzzDR zzHK-47 zBSF zzMalak Sith Empire Trooper",1
"Val",,,318877,Malevolence,"Malevolence Sun Fac SF, Soldier SF, Spy SF, Hyena Bomber, Vulture Droid, IG-2000",1
"Val",1,1,109218,NS_Alt,"zzMT zzAV Zombie Talia zDaka",1
"Val",0,1,104250,Grievous,"zzGG zB2 zB1 zDroideka MagnaGuard",1
"Val",1,1,104851,JTR,"zzJTR Scav Rey, zzBB-8 zzR2-D2 RT",1
"Val",,,384357,HansMF,"Home One, Han's MF, HT Biggs X-wing, Phantom Ghost Tie Adv, Wedge X-wing",1
"Val",1,1,128004,Revan,"zzzJKR zBS zGMY zJolee zGK",1
"Val",1,1,85537,Carth,"zCarth Onasi, zMission zZaalbar Juhani G9, zCanderous",1
"Val",0,1,94743,BH,"zBossk zBoba Cad zJango IG-88",1
"Val",1,1,105732,zEP,"zEP Vader Tarkin TFP zSion",1
"Val",0,1,73983,Phoenix,"Hera Chopper Zeb G9, Kanan G9, Ezra",1
"Val",0,1,90496,Geonosians,"zGBA Poggle Geo Soldier, Geo Spy, Sun Fac",0
"Val",1,0,102786,Wiggs,"Wedge 6* Biggs zzCLS zHan zzChewbacca",0
"Squirty",1,1,152638,SL Kylo,"zzzzzzSL Kylo, zSith Trooper, zHux zzKRU zThrawn",1
"Squirty",1,1,141323,GL Rey,"zzzzzzRey Holdo zGK zResistance Hero Poe, zResistance Hero Finn",1
"Squirty",1,1,103266,NestSisters,"zzAV zMT zDaka Zombie zNest",1
"Squirty",0,1,98483,DR,"zzzDR zHK-47 zBSF Sith Marauder G8, Sith Empire Trooper G8",1
"Squirty",,,383445,HansMF,"Home One, Han's MF, HT Biggs X-wing, Phantom Ghost Cassian's U-wing, Bistan's U-wing",1
"Squirty",0,1,94088,Geonosians,"zzGBA Poggle Geo Soldier, Geo Spy, Sun Fac",1
"Squirty",0,1,109552,Grievous,"zGG zB2 zB1 zDroideka MagnaGuard",1
"Squirty",1,1,139188,JTR,"zzzJTR Scav Rey, zBB-8 zzR2-D2 Finn",1
"Squirty",1,1,108088,Revan Offense,"zzJKR zGMY zHYoda zJolee zJKA",1
"Squirty",1,0,115941,CLS,"zzzCLS zHan zChewbacca Leia zzC-3PO",1
"Squirty",1,1,80149,Ewoks,"zChirpa Elder Paploo Wicket Logray G9",1
"Squirty",1,1,84275,Carth,"Carth Onasi, Mission Zaalbar Juhani G8, Canderous",1
"Squirty",0,1,97516,BH,"zzBossk Greedo zBoba Dengar G9, Cad",1
"Squirty",1,1,114801,zEP,"zzEP zzzVader zTarkin DT TFP",1
"Squirty",0,1,71865,Phoenix,"Hera G8, Zeb G8, Kanan G8, Ezra Sabine G8",1
"Squirty",1,0,75408,Troopers,"zVeers Starck Admiral Piett G8, Shoretrooper G8, Snowtrooper G9",1
"Squirty",1,0,85968,Wampa (Counter),"zRex Wampa G8, Visas G8, Jyn G8, FOO",1
"Squirty",1,0,13324,SionSolo (Counter),"Sion G8",1
"Squirty",,,317709,Malevolence,"Malevolence 5* Sun Fac SF, Soldier SF, Spy SF, Hyena Bomber 6*, Vulture Droid 6*, IG-2000",0
"Squirty",,,407103,Executrix,"Executrix Tie Adv, Emperor's Shuttle 5*, TIE Reaper, Imperial TIE Fighter, Gauntlet Starfighter, First Order SF TIE Fighter, First Order TIE Fighter",0
"Squirty",,,71768,Mon Mothma,"Mon Mothma 6* G8, Chirrut G8, Pao G8, Biggs Lando",0
"Squirty",0,1,74053,BH,"Jango G7, zThe Mandalorian G9, Greef Karga G8, Zam G8, IG-88",0
"Squirty",1,0,59228,Jawas,"Nebit G8, Jawa Engineer G9, Jawa Scavenger G8, Jawa G8, Dathcha G8",0
"Ryu Herr",0,1,126549,padme,"zzPadme zGK zJKA zAhsoka zzC-3PO",1
"Ryu Herr",0,1,122144,DRMalak,"zzzDR zzHK-47 zBSF zzMalak Sith Empire Trooper G8",1
"Ryu Herr",,,413921,Negotiator,"Negotiator 5* HT Anakin's Eta-2 Starfighter, Umbaran Starfighter, Ahsoka Tano's Jedi Starfighter, BTL-B Y-wing Starfighter, Clone Sergeant's ARC-170, Plo Koon's Jedi Starfighter",1
"Ryu Herr",,,114357,JKL,"zzJKL zzzJKR zHYoda Old Ben, zEzra",1
"Ryu Herr",0,1,93361,Geonosians,"zzGBA Poggle Geo Soldier, Geo Spy, Sun Fac",1
"Ryu Herr",1,1,94728,JTR,"zzJTR zzR2-D2 zBB-8 Resistance Hero Finn G8, Resistance Hero Poe G8",1
"Ryu Herr",,,409036,HansMF,"Home One, Han's MF, Biggs X-wing, Bistan's U-wing, Phantom Ghost Cassian's U-wing, Wedge X-wing",1
"Ryu Herr",0,1,119092,Grievous,"zzGG zB2 zB1 zDroideka zMagnaGuard",1
"Ryu Herr",,,100251,Nute-OR,"zNute zDooku zJango zZaalbar zMission",1
"Ryu Herr",1,1,84668,Ewoks,"zChirpa G9, Elder Paploo Wicket zLogray",1
"Ryu Herr",1,0,99600,ShaakClones,"zzShaak Ti, zRex zEcho zFives ARC Trooper G8",1
"Ryu Herr",0,1,98303,BH,"zBossk zGreedo zBoba Dengar G9, IG-88",1
"Ryu Herr",1,1,98041,zEP,"zzEP zzzVader Tarkin IPD G8, TFP G9",1
"Ryu Herr",0,1,87356,FO,"zKRU zKylo FOE FOST G8, FOO",1
"Ryu Herr",1,0,84593,Troopers,"zVeers Starck DT Range Trooper, Stormtrooper",1
"Ryu Herr",1,0,115745,Wiggs,"Wedge Biggs zzzCLS zHan zzChewbacca",1
"Ryu Herr",0,1,79949,Phoenix,"Hera Chopper Zeb G8, Kanan zSabine",1
"Ryu Herr",1,1,77273,Rogue1,"Jyn Chirrut Baze K-2SO G8, Cassian G9",1
"Ryu Herr",1,0,18612,NestSolo (Counter),"zNest",1
"Ryu Herr",1,0,15145,SionSolo (Counter),"Sion G9",1
"Ryu Herr",1,1,89882,NS,"zMT zzAV zDaka Zombie G8, Spirit G8",0
"Ryu Herr",,,362366,Executrix,"Executrix Tie Adv, Emperor's Shuttle 4*, TIE Reaper, Imperial TIE Fighter, Gauntlet Starfighter, First Order SF TIE Fighter 3*, First Order TIE Fighter",0
"Ryu Herr",1,0,86489,zMaul,"Maul zDN Sidious Savage Sith Marauder",0
"Ryu Herr",1,0,60457,Jawas,"Nebit G6, Jawa Engineer 4* G9, Jawa Scavenger G8, Jawa G7, Dathcha G9",0
"Dalziel",0,1,141873,DRMalak,"zzzDR zzHK-47 zBSF zzMalak Sith Empire Trooper",1
"Dalziel",0,1,121020,padme,"zzPadme zGK zJKA zAhsoka zzC-3PO",1
"Dalziel",,,421851,Negotiator,"Negotiator HT Anakin's Eta-2 Starfighter, Umbaran Starfighter, Ahsoka Tano's Jedi Starfighter, BTL-B Y-wing Starfighter, Clone Sergeant's ARC-170, Plo Koon's Jedi Starfighter",1
"Dalziel",,,117857,JKL,"zzJKL zzzJKR zzHYoda Old Ben, zBarriss",1
"Dalziel",1,1,97292,NS_Alt,"zzMT zAV Zombie Talia zDaka",1
"Dalziel",0,1,93759,Geonosians,"zzGBA Poggle Geo Soldier, Geo Spy, Sun Fac",1
"Dalziel",,,401032,HansMF,"Home One, Han's MF, Biggs X-wing, Bistan's U-wing, Phantom Ghost Cassian's U-wing, Wedge X-wing",1
"Dalziel",0,1,114060,Grievous,"zzGG zB2 zB1 zDroideka zMagnaGuard",1
"Dalziel",1,0,109679,Traya,"zzTraya zDN zSion zzEP zThrawn",1
"Dalziel",1,1,114929,JTR,"zzzJTR Scav Rey, zzBB-8 zzR2-D2 Finn",1
"Dalziel",,,95018,Nute-Wat,"zNute zDooku zWat Tambor 4*, zJango zNest",1
"Dalziel",1,1,87812,Ewoks,"zChirpa Elder zPaploo zWicket Logray G9",1
"Dalziel",1,0,108248,ShaakClones,"zzShaak Ti, zRex zEcho zzFives zARC Trooper",1
"Dalziel",0,1,102358,BH,"zzBossk zBoba Dengar Zam IG-88",1
"Dalziel",1,1,93201,Carth,"zCarth Onasi, zMission zZaalbar Juhani zCanderous",1
"Dalziel",0,1,91219,FO,"zzKRU zKylo FOE FOST G9, FOO",1
"Dalziel",1,0,89952,Troopers,"zVeers zStarck DT Range Trooper, Shoretrooper",1
"Dalziel",0,1,72037,Phoenix,"Hera G9, Zeb G8, Kanan G8, Ezra Sabine G8",1
"Dalziel",1,0,122761,CLS,"zzzCLS zHan Wedge Biggs zzChewbacca",1
"Dalziel",1,0,72741,Jawas,"Nebit Jawa Engineer G9, Jawa Scavenger G8, Jawa G9, Dathcha",1
"Dalziel",,,72590,Mon Mothma,"Mon Mothma 3* G7, Chirrut G8, Pao G8, Lando Cassian G8",0
"Sutti",,,132345,JMLS,"zzzJMLS zzJKL zHYoda Old Ben, Ezra",1
"Sutti",0,1,146171,DRMalak,"zzzDR zzHK-47 zBSF zzMalak Sith Empire Trooper",1
"Sutti",0,1,130232,padme,"zzPadme zGK zJKA zAhsoka zC-3PO",1
"Sutti",,,465525,Negotiator,"Negotiator 5* HT Anakin's Eta-2 Starfighter, Umbaran Starfighter, Ahsoka Tano's Jedi Starfighter, Clone Sergeant's ARC-170, Plo Koon's Jedi Starfighter, Rex's ARC-170",1
"Sutti",0,1,99389,Geonosians,"zzGBA Poggle Geo Soldier, Geo Spy, Sun Fac",1
"Sutti",1,1,97947,NS_Alt,"zzMT Acolyte Daka zzAV Zombie",1
"Sutti",0,1,125873,Grievous,"zzGG zB2 zB1 zDroideka zMagnaGuard",1
"Sutti",1,0,110438,Traya,"zzTraya zDN Sion zzEP zzThrawn",1
"Sutti",1,1,118244,JTR,"zzzJTR Scav Rey, BB-8 zzR2-D2 Finn",1
"Sutti",,,108659,Disintegration,"zAurra zGreef Karga, zBoba zzBossk The Mandalorian",1
"Sutti",,,93348,Nute-Wat,"zNute zDooku zWat Tambor 4*, zJango Nest",1
"Sutti",1,1,142107,GAS,"zzzzGAS zRex zEcho zzFives zARC Trooper",1
"Sutti",,,94926,Mon Mothma,"zzMon Mothma, Hoth Rebel Scout G9, Chirrut G8, Baze G8, Lando",1
"Sutti",1,1,78729,Ewoks,"zChirpa G9, Elder Paploo G9, Wicket Logray G9",1
"Sutti",1,1,87678,Carth,"zCarth Onasi, zMission Zaalbar Juhani G8, Canderous",1
"Sutti",0,1,98954,FO,"zzKRU zKylo FOE G9, FOO zHux",1
"Sutti",1,0,131249,Wiggs,"Wedge Biggs zzzCLS zHan zzChewbacca",1
"Sutti",1,0,91564,Troopers,"zVeers Starck DT zzAdmiral Piett, Shoretrooper G9",1
"Sutti",0,1,70492,Phoenix,"Hera G8, Chopper Zeb G8, Kanan G8, Sabine G8",1
"Sutti",,,404732,HansMF,"Home One, Han's MF, Biggs X-wing, Bistan's U-wing 5*, Phantom Ghost Cassian's U-wing, Wedge X-wing",0
"Sutti",,,345882,Executrix,"Executrix Tie Adv, Emperor's Shuttle 6*, TIE Reaper 6*, Imperial TIE Fighter, Gauntlet Starfighter 5*, First Order SF TIE Fighter 4*, First Order TIE Fighter",0
"Sutti",1,0,54896,Jawas,"Nebit G7, Jawa Engineer 4* G5, Jawa Scavenger G7, Jawa G7, Dathcha G6",0
"The senate",0,1,137751,padme,"zzPadme zGK zJKA zAhsoka zzC-3PO",1
"The senate",,,432631,Negotiator,"Negotiator 5* HT Anakin's Eta-2 Starfighter, Umbaran Starfighter, Ahsoka Tano's Jedi Starfighter, Clone Sergeant's ARC-170, Jedi Consular's Starfighter, Plo Koon's Jedi Starfighter",1
"The senate",0,1,95176,Geonosians,"zzGBA Poggle Geo Soldier, Geo Spy, Sun Fac",1
"The senate",0,1,119718,Grievous,"zzGG zB2 zB1 zDroideka zMagnaGuard",1
"The senate",1,1,131160,Revan Offense,"zzzJKR zzGMY zBS zJolee zzHYoda",1
"The senate",1,0,125289,ShaakClones,"zzShaak Ti, zRex zEcho zzFives zARC Trooper",1
"The senate",1,1,90506,Ewoks,"zChirpa Elder zPaploo Scout zWicket",1
"The senate",0,1,107908,BH,"zzBossk zGreedo zBoba Dengar G8, zzJango",1
"The senate",1,1,111243,zEP,"zzEP zzzVader Tarkin G9, zSion zzDN",1
"The senate",0,1,96313,Phoenix,"zHera zZeb zKanan zEzra zSabine",1
"The senate",1,0,98270,CLS,"zzzCLS zHan Leia Old Ben G9, zzChewbacca",1
"The senate",,,58847,Mon Mothma,"Mon Mothma 3* G6, Biggs G8, Wedge G8, Lando K-2SO G7",0
"The senate",0,1,54689,FO,"KRU 6* G7, Kylo G8, Phasma G7, Sith Trooper 3* G6, FOO G7",0
"The senate",1,0,6715,NestSolo (Counter),"Nest 3* G5",0
"TorenCalduris",1,1,105019,NS,"zzMT zzAV zDaka Zombie Spirit",1
"TorenCalduris",0,1,122886,padme,"zzPadme zGK zJKA zAhsoka zzC-3PO",1
"TorenCalduris",0,1,112621,DR,"zzzDR zzHK-47 zBSF Sith Empire Trooper, Sith Assassin G8",1
"TorenCalduris",,,132462,JKL,"zzJKL zzzJKR zzHYoda zzOld Ben, zEzra",1
"TorenCalduris",,,435149,HansMF,"Home One, Han's MF, HT Biggs X-wing, Phantom Ghost Cassian's U-wing, Bistan's U-wing",1
"TorenCalduris",0,1,106430,Geonosians,"zzGBA Poggle Geo Soldier, Geo Spy, Sun Fac",1
"TorenCalduris",0,1,136390,Grievous,"zzGG zB2 zB1 zDroideka MagnaGuard",1
"TorenCalduris",1,0,108526,Traya,"zzTraya zDN zSion zDooku zThrawn",1
"TorenCalduris",1,1,102797,JTR,"zzJTR Scav Rey, zBB-8 zzR2-D2 Finn",1
"TorenCalduris",1,1,156406,GAS,"zzzzGAS zRex zEcho zzFives zARC Trooper",1
"TorenCalduris",1,1,83898,Ewoks,"zChirpa Elder Paploo Wicket Logray G8",1
"TorenCalduris",0,1,109942,BH,"zzBossk Greedo zzThe Mandalorian, Boba Dengar",1
"TorenCalduris",1,1,92177,Carth,"zCarth Onasi, zMission zZaalbar Juhani Canderous",1
"TorenCalduris",1,1,106851,zEP,"zzEP zzzVader Tarkin DT TFP",1
"TorenCalduris",0,1,87000,FO,"zKRU zKylo FOE FOST G9, FOO",1
"TorenCalduris",1,0,88959,Troopers,"zVeers zStarck Range Trooper G9, Shoretrooper Snowtrooper",1
"TorenCalduris",1,0,112538,CLS,"zzzCLS zHan Wedge Biggs zzChewbacca",1
"TorenCalduris",0,1,71556,Phoenix,"Hera G9, Chopper G9, Zeb G8, Kanan G8, Sabine G8",1
"TorenCalduris",1,1,91400,Rogue1,"zzJyn Chirrut Baze zK-2SO G9, zCassian",1
"TorenCalduris",1,0,71631,Jawas,"Nebit G8, Jawa Engineer G9, Jawa Scavenger G9, Jawa G9, Dathcha G9",1
"TorenCalduris",1,0,16731,NestSolo (Counter),"Nest",1
"TorenCalduris",,,379764,Executrix,"Executrix Tie Adv, Emperor's Shuttle, TIE Reaper, Imperial TIE Fighter, Gauntlet Starfighter, First Order SF TIE Fighter 3*, First Order TIE Fighter",0
"TorenCalduris",,,73900,Mon Mothma,"Mon Mothma 4* G8, Bistan G8, Hoth Rebel Scout G8, Pao G9, Lando",0
"TorenCalduris",0,1,96137,BH,"zJango zzGreef Karga, Cad Zam G9, IG-88",0
"Kyrie Unobii",0,1,148010,padme,"zzPadme zGK zJKA zAhsoka zzC-3PO",1
"Kyrie Unobii",0,1,89257,Geonosians,"zzGBA Poggle Geo Soldier, Geo Spy, Sun Fac G9",1
"Kyrie Unobii",1,1,119759,JTR,"zzzJTR zScav Rey, zzBB-8 zzR2-D2 zFinn",1
"Kyrie Unobii",1,1,91460,Ewoks,"zChirpa Elder zPaploo Teebo zWicket",1
"Kyrie Unobii",0,1,123987,BH,"zzBossk zGreedo zBoba zJango zZam",1
"Kyrie Unobii",1,1,117864,zEP,"zzEP zzVader zTarkin TFP zzTraya",1
"Kyrie Unobii",0,1,101004,FO,"zzKRU zKylo FOE zFOTP FOO",1
