Player,Offense,Defense,GP,Name,Squad,Viable
"Sutti",1,0,115207,CLS,"zzzCLS zHan Wedge Biggs zzChewbacca",1
"Sutti",0,1,71215,Phoenix,"Hera G8, Ezra Kanan G8, Sabine G8, Zeb G8",1
"Sutti",1,0,74595,Troopers,"zVeers Starck G9, DT G9, Shoretrooper G8, Stormtrooper G8",1
"Sutti",1,1,69467,Rogue1,"Jyn G8, Chirrut G8, Baze G8, Cassian G9, K-2SO G8",1
"Sutti",1,0,16206,NestSolo (Counter),"Nest",1
"Sutti",,,326585,Executrix,"Executrix Tie Adv, Emperor's Shuttle 6*, TIE Reaper 6*, Imperial TIE Fighter, Gauntlet Starfighter 5*, First Order SF TIE Fighter 4*, First Order TIE Fighter",0
"Krupten",0,1,122517,DRMalak,"zzzDR zzHK-47 zBSF zzMalak Sith Empire Trooper G8",1
"Krupten",0,1,101052,padme,"zzPadme GK G8, zJKA Ahsoka zzC-3PO",1
"Krupten",1,1,99960,NS_Alt,"zzMT zzAV zDaka Talia Zombie",1
"Krupten",0,1,95045,Geonosians,"zzGBA Poggle Geo Soldier, Geo Spy, Sun Fac",1
"Krupten",1,0,96463,Traya,"zzTraya DN G9, Sion zzEP zThrawn",1
"Krupten",1,1,115257,JTR,"zzzJTR Scav Rey, zzBB-8 zzR2-D2 zFinn",1
"Krupten",1,1,127386,Revan Offense,"zzzJKR zGMY BS zJolee zHYoda",1
"Krupten",1,1,80722,Ewoks,"zChirpa Elder Paploo Scout zLogray",1
"Krupten",1,1,87398,Carth,"zCarth Onasi, Mission Zaalbar Juhani Canderous",1
"Krupten",0,1,106312,BH,"zzBossk zJango zBoba Zam zDengar",1
"Krupten",0,1,105472,FO,"zzKRU zKylo FOO zFOST FOE",1
"Krupten",1,0,98084,CLS,"zzzCLS zHan Leia Old Ben, zzChewbacca",1
"Krupten",0,1,76511,Phoenix,"Hera Ezra Kanan Chopper Zeb",1
"Krupten",0,1,64371,Grievous,"GG G7, B2 G5, Nute G8, IG-88 T3-M4",0
"Krupten",1,0,66346,ShaakClones,"zShaak Ti G7, Rex G7, Echo G7, Fives G8, Clone Sergeant G8",0
"bellojack",0,1,107460,padme,"zzPadme zGK zJKA zAhsoka zzC-3PO",1
"bellojack",0,1,113337,DRMalak,"zzzDR zzHK-47 zBSF zzMalak Sith Empire Trooper",1
"bellojack",,,422406,HansMF,"Home One, Han's MF, HT Biggs X-wing, Phantom Ghost Cassian's U-wing, Bistan's U-wing",1
"bellojack",0,1,106642,Grievous,"zzGG zB2 zB1 zDroideka zMagnaGuard",1
"bellojack",1,1,143652,JTR,"zzzJTR zScav Rey, zzBB-8 zzR2-D2 Finn",1
"bellojack",1,1,113880,Revan Offense,"zzzJKR zGMY zBS zJolee zEzra",1
"bellojack",1,1,93810,Ewoks,"zChirpa Elder zPaploo zWicket zLogray",1
"bellojack",1,1,89489,Carth,"Carth Onasi, zMission zZaalbar zJuhani Canderous",1
"bellojack",0,1,110701,BH,"zzBossk zGreedo zBoba zIG-88 zZam",1
"bellojack",1,0,107232,CLS,"zzzCLS zHan Leia zzOld Ben, zzChewbacca",1
"bellojack",1,1,108338,zEP,"zzEP zzzVader zTarkin zDooku TFP",1
"bellojack",0,1,95965,Phoenix,"zHera zKanan zSabine Chopper zZeb",1
"bellojack",1,1,71717,Rogue1,"Jyn G8, Chirrut G8, Baze G8, Cassian G9, K-2SO G9",1
"bellojack",1,0,21049,SionSolo (Counter),"zSion",1
"bellojack",0,1,75502,Geonosians,"GBA 6* G3, Poggle Geo Soldier, Geo Spy, Sun Fac G8",0
"bellojack",1,1,67010,NS,"zMT G5, zAV Daka G8, Zombie G4, Spirit G2",0
"bellojack",1,0,97891,ShaakClones,"zzShaak Ti, zRex zEcho zzFives Clone Sergeant G8",0
"bellojack",0,1,54824,BH,"Jango G6, Aurra 5* G2, Cad Dengar 5* G3, Nest G3",0
"bellojack",1,0,46054,Troopers,"Veers 6* G4, Starck 5* G3, Snowtrooper G8, Shoretrooper 3* G3, Stormtrooper G9",0
"bellojack",0,1,81030,FO,"zzKRU G8, zKylo FOO FOST Phasma",0
"MetalPrawn",,,311721,HansMF,"Home One, Han's MF 5*, HT Biggs X-wing, Phantom Ghost Tie Adv, Wedge X-wing",1
"MetalPrawn",1,1,75789,Ewoks,"zChirpa G9, Elder Paploo G9, Wicket Logray G9",1
"MetalPrawn",1,0,124778,ShaakClones,"zzShaak Ti, zRex zEcho zzFives zARC Trooper",1
"MetalPrawn",0,1,94682,BH,"zBossk Jango zBoba IG-88 Dengar G8",1
"MetalPrawn",1,1,84940,zEP,"zzEP zzVader Tarkin G9, Dooku TFP G8",1
"MetalPrawn",0,1,65090,Phoenix,"Hera G8, Ezra G8, Kanan G8, Chopper G8, Zeb G8",1
"MetalPrawn",0,1,94466,padme,"zzPadme zGK JKA zAhsoka C-3PO 6* G7",0
"MetalPrawn",0,1,88590,Geonosians,"zGBA Poggle Geo Soldier, Geo Spy, Sun Fac",0
"MetalPrawn",0,1,83370,Grievous,"zGG G8, zB2 G9, zB1 MagnaGuard G8, Nute",0
"MetalPrawn",1,1,62736,NS,"MT 6* G8, AV Daka G9, Zombie 5* G8, Spirit 6* G8",0
"MetalPrawn",1,0,64251,Wiggs,"Wedge 6* G8, Biggs G8, CLS G8, Han Chewbacca G8",0
"MetalPrawn",1,1,42072,Rogue1,"Jyn 5* G8, Chirrut 6* G8, Baze 5* G8, Cassian G8, K-2SO G8",0
"MetalPrawn",0,1,50043,FO,"KRU G8, Kylo 5* G8, FOTP G8, FOO G8, Phasma G8",0
"MetalPrawn",1,0,7842,NestSolo (Counter),"Nest 2* G7",0
"Dalziel",0,1,138820,DRMalak,"zzzDR zzHK-47 zBSF zzMalak Sith Empire Trooper",1
"Dalziel",0,1,116028,padme,"zzPadme zGK zJKA zAhsoka zzC-3PO",1
"Dalziel",1,1,91444,NS_Alt,"zMT zAV Daka Talia Zombie",1
"Dalziel",,,403710,HansMF,"Home One, Han's MF, HT Biggs X-wing, Phantom Ghost Cassian's U-wing, Bistan's U-wing",1
"Dalziel",0,1,92078,Geonosians,"zzGBA Poggle Geo Soldier, Geo Spy, Sun Fac",1
"Dalziel",0,1,106322,Grievous,"zzGG zB2 zB1 zDroideka zMagnaGuard",1
"Dalziel",1,0,107413,Traya,"zzTraya zDN zSion zzEP zThrawn",1
"Dalziel",1,1,111980,JTR,"zzzJTR Scav Rey, zzBB-8 zzR2-D2 Finn",1
"Dalziel",,,97462,Nute-OR,"zNute zDooku Jango zZaalbar zMission",1
"Dalziel",1,1,121465,Revan Offense,"zzzJKR zzGMY zBS zJolee zzHYoda",1
"Dalziel",1,1,87026,Ewoks,"zChirpa Elder zPaploo zWicket Logray G9",1
"Dalziel",1,0,107674,ShaakClones,"zzShaak Ti, zRex zEcho zzFives zARC Trooper",1
"Dalziel",0,1,103184,BH,"zzBossk zBoba Zam Dengar zNest",1
"Dalziel",0,1,88835,FO,"zKRU zKylo FOO FOST G9, FOE",1
"Dalziel",1,0,89812,Troopers,"zVeers zStarck DT Range Trooper, Shoretrooper",1
"Dalziel",0,1,71528,Phoenix,"Hera G9, Ezra Kanan G8, Sabine G8, Zeb G8",1
"Dalziel",1,0,113731,CLS,"zzzCLS zHan Wedge Biggs zzChewbacca",1
"Dalziel",1,0,92454,Zader (Counter),"zzzVader Wampa Tarkin Sidious Stormtrooper G8",1
"Dalziel",1,0,72149,Jawas,"Nebit G9, Jawa Engineer G9, Jawa Scavenger G8, Jawa G9, Dathcha",1
"Dalziel",1,1,63730,Rogue1,"Jyn 5* G7, Chirrut G8, Baze 6* G7, Cassian G8, K-2SO G8",0
"Darthshmoe",1,1,103782,NS_Alt,"zzMT zAV zDaka Talia Zombie",1
"Darthshmoe",1,1,98469,JTR,"zzJTR Scav Rey, zBB-8 zR2-D2 Finn",1
"Darthshmoe",0,1,66656,Phoenix,"Hera G8, zEzra Kanan G8, Chopper G8, Zeb G8",1
"Darthshmoe",0,1,106518,padme,"zzPadme zGK zJKA zAhsoka Fives G8",1
"Darthshmoe",1,0,17250,SionSolo (Counter),"zSion G9",1
"Darthshmoe",,,294944,Negotiator,"Negotiator 5* HT 5* Anakin's Eta-2 Starfighter 4*, Umbaran Starfighter 5*, Ahsoka Tano's Jedi Starfighter, BTL-B Y-wing Starfighter 3*, Clone Sergeant's ARC-170 6*, Jedi Consular's Starfighter",0
"Darthshmoe",0,1,92786,DR,"zDR HK-47 zBSF Sith Marauder G8, zThrawn",0
"Darthshmoe",0,1,43582,Geonosians,"GBA 4* G9, Poggle G9, Geo Soldier 6* G8, Geo Spy 5* G6, Sun Fac 6* G6",0
"Darthshmoe",0,1,77970,Grievous,"GG G9, B2 G8, Nute G8, zDooku IG-88",0
"Darthshmoe",1,1,87449,zEP,"zzEP zzVader Tarkin DT 5* G8, TFP 5* G8",0
"Darthshmoe",0,1,72672,BH,"zBossk 5* G8, Greedo G9, Boba G9, Cad zNest 4*",0
"Darthshmoe",1,0,69729,Wiggs,"Wedge 5* G8, Biggs G8, CLS zHan Leia G9",0
"Darthshmoe",0,1,71092,FO,"zKRU G8, zKylo FOO G8, Phasma G8, FOE 6* G9",0
"Darthshmoe",1,1,40378,Rogue1,"Jyn 5* G8, Chirrut 5* G8, Baze 5* G8, Cassian 5* G8, Pao 5* G8",0
"Kyrie Unobii",0,1,148010,padme,"zzPadme zGK zJKA zAhsoka zzC-3PO",1
"Kyrie Unobii",1,1,119783,JTR,"zzzJTR zScav Rey, zzBB-8 zzR2-D2 zFinn",1
"Kyrie Unobii",1,1,91262,Ewoks,"zChirpa Elder zPaploo Teebo zWicket",1
"Kyrie Unobii",0,1,104684,BH,"zzBossk Greedo zBoba zIG-88 Zam",1
"Kyrie Unobii",1,0,135002,CLS,"zzzCLS zHan zLeia zzOld Ben, zzChewbacca",1
"Kyrie Unobii",1,1,119568,zEP,"zzEP zzVader zTarkin zDooku TFP",1
"Kyrie Unobii",0,1,79924,Phoenix,"Hera G9, zEzra Kanan Chopper Zeb G8",1
"Kyrie Unobii",0,1,96338,FO,"zzKRU zKylo zFOTP FOO Phasma",1
"Kyrie Unobii",1,0,21166,SionSolo (Counter),"zSion",1
"Esaascar",0,1,131292,padme,"zzPadme zGK zJKA zAhsoka zzC-3PO",1
"Esaascar",0,1,99360,DR,"zzzDR zHK-47 zBSF Sith Assassin G8, zThrawn",1
"Esaascar",0,1,84833,Geonosians,"zzGBA Poggle Geo Soldier, Geo Spy, Sun Fac G9",1
"Esaascar",0,1,109653,Grievous,"zzGG zB2 zB1 zDroideka zMagnaGuard",1
"Esaascar",1,1,116147,JTR,"zzzJTR Scav Rey, zzBB-8 zzR2-D2 Finn",1
"Esaascar",1,1,113990,Revan Offense,"zzzJKR zGMY zBS zJolee HYoda",1
"Esaascar",1,1,84202,Ewoks,"zChirpa Elder Paploo zWicket Logray",1
"Esaascar",1,1,94802,Carth,"zCarth Onasi, zMission zZaalbar Juhani zCanderous",1
"Esaascar",0,1,92269,BH,"zzBossk Boba IG-88 Cad Dengar",1
"Esaascar",1,0,106886,CLS,"zzzCLS zHan Wedge Biggs zzChewbacca",1
"Esaascar",0,1,93461,FO,"zzKRU zKylo FOTP FOO FOST G9",1
"Esaascar",1,1,96624,zEP,"zzEP zzzVader Tarkin Dooku TFP G8",1
"Esaascar",0,1,73526,Phoenix,"Hera G9, Ezra Kanan G9, Chopper G9, Zeb G8",1
"Esaascar",1,0,75196,Troopers,"zVeers Starck G9, Snowtrooper Magma G8, Stormtrooper",1
"Esaascar",1,0,20958,SionSolo (Counter),"zSion",1
"Esaascar",1,1,85914,NS,"zMT zzAV Daka Zombie Spirit G9",0
"Esaascar",,,401348,Negotiator,"Negotiator 5* HT Anakin's Eta-2 Starfighter 5*, Umbaran Starfighter, Ahsoka Tano's Jedi Starfighter, Clone Sergeant's ARC-170, Plo Koon's Jedi Starfighter, Rex's ARC-170",0
"Esaascar",,,286324,Executrix,"Executrix Tie Adv, Emperor's Shuttle 4*, TIE Reaper 4*, Imperial TIE Fighter, Gauntlet Starfighter 6*, First Order SF TIE Fighter, First Order TIE Fighter",0
"Esaascar",1,0,76383,ShaakClones,"Shaak Ti 4* G8, Rex Echo G9, zFives zARC Trooper G9",0
"Esaascar",1,1,59607,Rogue1,"Jyn 5* G8, Chirrut G8, Baze 4* G7, Cassian G8, Bistan G8",0
"Esaascar",1,0,56777,Jawas,"Nebit G7, Jawa Engineer G9, Jawa Scavenger G8, Jawa 5* G8, Dathcha G7",0
"Michael Wulf",1,1,139070,SL Kylo,"zzzzzzSL Kylo, zSith Trooper, zHux zzKRU zThrawn",1
"Michael Wulf",0,1,104503,padme,"zzPadme zGK JKA zAhsoka zC-3PO G9",1
"Michael Wulf",0,1,113183,DRMalak,"zzzDR zzHK-47 zBSF zzMalak Sith Empire Trooper",1
"Michael Wulf",1,1,92437,NS_Alt,"zMT zzAV Daka Talia Zombie",1
"Michael Wulf",,,377682,Negotiator,"Negotiator 5* HT Anakin's Eta-2 Starfighter, Umbaran Starfighter, Ahsoka Tano's Jedi Starfighter, Clone Sergeant's ARC-170, Plo Koon's Jedi Starfighter, Rex's ARC-170",1
"Michael Wulf",0,1,84923,Geonosians,"zzGBA 6* Poggle Geo Soldier, Geo Spy, Sun Fac G8",1
"Michael Wulf",0,1,87189,Grievous,"zzGG G9, zB2 G8, zB1 zDroideka G8, MagnaGuard G8",1
"Michael Wulf",1,1,96249,JTR,"zJTR Scav Rey, zBB-8 zzR2-D2 Finn",1
"Michael Wulf",1,0,120917,Traya,"zzTraya zDN zSion zDooku zzEP",1
"Michael Wulf",1,1,107873,Revan Offense,"zzzJKR zGMY zBS zJolee HYoda",1
"Michael Wulf",1,1,90163,Ewoks,"zChirpa Elder zPaploo zWicket zLogray G9",1
"Michael Wulf",0,1,92874,BH,"zJango Boba Cad Dengar G9, zBossk",1
"Michael Wulf",0,1,74000,Phoenix,"Hera G8, Ezra Kanan Chopper G9, Zeb G8",1
"Michael Wulf",1,0,84839,CLS,"zzCLS zHan Leia Old Ben G9, Chewbacca G8",1
"Michael Wulf",1,0,70154,Troopers,"zVeers Starck G9, Snowtrooper G7, Magma G8, Stormtrooper G8",1
"Michael Wulf",1,0,101250,Zader (Counter),"zzzVader zMission zZaalbar Tarkin Sidious",1
"Michael Wulf",,,282043,HansMF,"Home One, Han's MF 5*, Biggs X-wing, Bistan's U-wing 4*, Phantom Ghost Cassian's U-wing, Wedge X-wing",0
"Michael Wulf",1,0,89794,ShaakClones,"zzShaak Ti G8, Rex Echo zzFives G9, Clone Sergeant",0
"Michael Wulf",1,0,9729,NestSolo (Counter),"Nest 4* G8",0
"Rouge 5hadow",1,1,129392,Revan,"zzzJKR zBS zGMY zJolee GK",1
"Rouge 5hadow",0,1,101355,Phoenix,"zHera zEzra zKanan zSabine zZeb",1
"Rouge 5hadow",1,0,97671,Zader (Counter),"zzVader zMission G8, zZaalbar G8, zzWampa zBoba",1
"Rouge 5hadow",1,0,20038,SionSolo (Counter),"zSion",1
"Rouge 5hadow",0,1,64988,Geonosians,"zGBA Poggle G6, Geo Soldier G4, Geo Spy G5, Sun Fac G4",0
"Rouge 5hadow",1,1,71643,NS,"zMT AV Daka G8, Zombie 5* Spirit 5* G8",0
"Rouge 5hadow",0,1,46266,BH,"Bossk 4* G9, Greef Karga 4* G8, Greedo G5, Dengar 6* G5, zNest 3*",0
"Newhawk",0,1,128014,padme,"zzPadme zGK zJKA zAhsoka zzC-3PO",1
"Newhawk",,,377567,HansMF,"Home One, Han's MF, HT Biggs X-wing, Phantom Ghost Cassian's U-wing, Bistan's U-wing",1
"Newhawk",0,1,95932,Geonosians,"zzGBA Poggle Geo Soldier, Geo Spy, Sun Fac",1
"Newhawk",0,1,109978,Grievous,"zzGG zB2 zB1 zDroideka zMagnaGuard",1
"Newhawk",1,1,106221,JTR,"zzzJTR Scav Rey G8, zzBB-8 zzR2-D2 zFinn",1
"Newhawk",1,1,133983,GAS,"zzzzGAS zRex zEcho zzFives zARC Trooper",1
"Newhawk",1,1,88911,Ewoks,"zChirpa G9, Elder zPaploo zWicket zLogray",1
"Newhawk",1,1,91072,Revan Offense,"zzzJKR G8, zGMY BS zJolee G9, Ezra G8",1
"Newhawk",0,1,98015,BH,"zzBossk Jango Greedo zBoba Dengar",1
"Newhawk",1,0,120080,CLS,"zzzCLS zHan Leia G8, Old Ben, zzChewbacca",1
"Newhawk",1,1,94628,NS,"zzMT zzAV zDaka Zombie Spirit G5",0
"Newhawk",1,1,50658,Carth,"Carth Onasi 5* G7, Mission G7, Zaalbar G8, Juhani 5* G7, Canderous 3* G5",0
"Newhawk",1,1,81555,zEP,"zzEP G9, zzzVader Tarkin G8, IPD 6* G7, TFP G8",0
"Newhawk",1,0,61389,Troopers,"Veers G9, Starck G6, Snowtrooper G6, Magma G7, Stormtrooper G9",0
"Newhawk",0,1,63946,Phoenix,"Hera G8, Kanan G8, Sabine 5* G7, Chopper G9, Zeb G8",0
"Newhawk",0,1,74439,FO,"zzKRU G9, Kylo G7, FOTP G8, FOO G8, FOE",0
"Newhawk",1,0,8746,SionSolo (Counter),"Sion 5* G8",0
"neyde jean",0,1,112728,DRMalak,"zzzDR zHK-47 zBSF zzMalak Sith Assassin G8",1
"neyde jean",0,1,104181,padme,"zzPadme GK zJKA zAhsoka zzC-3PO",1
"neyde jean",1,1,93792,NS_Alt,"zzMT zzAV Daka Talia Zombie",1
"neyde jean",0,1,88969,Geonosians,"zzGBA Poggle Geo Soldier, Geo Spy, Sun Fac G9",1
"neyde jean",1,1,108763,JTR,"zzzJTR Scav Rey, zBB-8 zzR2-D2 RT",1
"neyde jean",0,1,93442,Grievous,"zzGG B2 zDroideka G9, MagnaGuard G8, zNute",1
"neyde jean",1,1,119774,Revan Offense,"zzzJKR zGMY zBS zJolee zzHYoda",1
"neyde jean",1,1,90031,Ewoks,"zChirpa Elder zPaploo zWicket zLogray",1
"neyde jean",1,1,95167,Carth,"zCarth Onasi, zMission zZaalbar zJuhani Canderous",1
"neyde jean",0,1,94113,BH,"zBossk Jango Boba Zam Dengar",1
"neyde jean",1,1,95455,zEP,"zzEP zzzVader Tarkin G9, Krennic TFP G9",1
"neyde jean",0,1,76163,Phoenix,"Hera G9, zEzra Kanan Sabine G8, Zeb G8",1
"neyde jean",1,0,103652,Wampa (Counter),"zRex zzWampa zVisas Jyn G9, FOO",1
"neyde jean",1,0,73844,Troopers,"zVeers Starck G9, DT G9, Snowtrooper G9, Shoretrooper G9",1
"neyde jean",1,0,104030,CLS,"zzzCLS zHan Leia Old Ben G9, zzChewbacca",1
"neyde jean",0,1,85787,FO,"zzKRU zKylo FOTP zFOST G9, Phasma G8",1
"neyde jean",1,0,72832,Wiggs,"Wedge G9, Biggs G8, Fulcrum G9, Chirrut G9, Baze",1
"neyde jean",1,0,18234,NestSolo (Counter),"zNest",1
"neyde jean",1,0,14677,SionSolo (Counter),"Sion G8",1
"neyde jean",1,0,65731,Jawas,"Nebit G9, Jawa Engineer G9, Jawa Scavenger G8, Jawa G7, Dathcha G8",0
"Hollow Child",0,1,114457,padme,"zzPadme zGK JKA zAhsoka zC-3PO",1
"Hollow Child",0,1,113079,DRMalak,"zzDR zHK-47 zBSF zzMalak Sith Empire Trooper G8",1
"Hollow Child",1,1,103943,NS_Alt,"zzMT zAV Daka Talia Zombie",1
"Hollow Child",,,388943,HansMF,"Home One, Han's MF, HT Biggs X-wing, Phantom Ghost Cassian's U-wing, Bistan's U-wing",1
"Hollow Child",0,1,93529,Geonosians,"zzGBA Poggle Geo Soldier, Geo Spy, Sun Fac",1
"Hollow Child",0,1,105727,Grievous,"zzGG zB2 zB1 zDroideka MagnaGuard",1
"Hollow Child",1,1,99972,JTR,"zzJTR Scav Rey, zBB-8 zzR2-D2 Finn",1
"Hollow Child",1,1,108968,Revan Offense,"zzzJKR zGMY zBS zJolee HYoda G9",1
"Hollow Child",1,1,87179,Ewoks,"zChirpa G9, Elder zPaploo zWicket zLogray G9",1
"Hollow Child",1,0,100493,ShaakClones,"zzShaak Ti, Rex Echo zFives zARC Trooper G9",1
"Hollow Child",1,1,94237,Carth,"zCarth Onasi, zMission zZaalbar zJuhani Canderous",1
"Hollow Child",0,1,94528,BH,"zzBossk Greedo Boba Zam Dengar G8",1
"Hollow Child",1,1,96650,zEP,"zzEP zzVader zTarkin DT G8, TFP",1
"Hollow Child",0,1,86118,FO,"zKRU Kylo G9, zFOTP FOO FOE",1
"Hollow Child",0,1,84124,Phoenix,"Hera Ezra Kanan zSabine Zeb G8",1
"Hollow Child",1,0,93059,CLS,"zzCLS zHan Leia Old Ben G9, Chewbacca",1
"Hollow Child",1,0,20119,SionSolo (Counter),"zSion",1
"Hollow Child",1,0,16452,NestSolo (Counter),"Nest",1
"Hollow Child",,,338251,Executrix,"Executrix Tie Adv, Emperor's Shuttle 4*, TIE Reaper 4*, Imperial TIE Fighter, Gauntlet Starfighter, First Order SF TIE Fighter 5*, First Order TIE Fighter",0
"Hollow Child",1,0,56142,Troopers,"Veers G8, Starck 6* G7, Range Trooper 3* G7, Snowtrooper G8, Stormtrooper G8",0
"Hollow Child",0,1,77276,BH,"Jango IG-88 Aurra G8, Cad The Mandalorian 5* G8",0
"Hollow Child",1,1,67992,Rogue1,"Jyn G8, Chirrut G8, Baze 5* G8, Cassian G9, K-2SO G8",0
"Hollow Child",1,0,99340,zMaul,"Maul zDooku zDN zSidious zSavage",0
"Hollow Child",1,0,65035,Jawas,"Nebit G8, Jawa Engineer 6* G8, Jawa Scavenger G7, Jawa G8, Dathcha",0
"TorenCalduris",0,1,122723,padme,"zzPadme zGK zJKA zAhsoka zzC-3PO",1
"TorenCalduris",0,1,104725,DR,"zzzDR zzHK-47 zBSF Sith Empire Trooper, Sith Assassin G8",1
"TorenCalduris",1,1,97699,NS_Alt,"zzMT zzAV Daka Talia Zombie",1
"TorenCalduris",,,421331,HansMF,"Home One, Han's MF, HT Biggs X-wing, Phantom Ghost Cassian's U-wing, Bistan's U-wing",1
"TorenCalduris",0,1,96061,Geonosians,"zzGBA Poggle Geo Soldier, Geo Spy, Sun Fac",1
"TorenCalduris",0,1,136435,Grievous,"zzGG zB2 zB1 zDroideka MagnaGuard",1
"TorenCalduris",1,1,102941,JTR,"zzJTR Scav Rey, zBB-8 zzR2-D2 Finn",1
"TorenCalduris",,,99801,Nute-OR,"zNute zDooku zJango zZaalbar zMission",1
"TorenCalduris",1,1,141021,GAS,"zzzzGAS zRex zEcho zzFives zARC Trooper",1
"TorenCalduris",1,1,117062,Revan Offense,"zzzJKR zGMY zBS zJolee zzHYoda",1
"TorenCalduris",1,1,83874,Ewoks,"zChirpa Elder Paploo Wicket Logray G8",1
"TorenCalduris",0,1,99434,BH,"zzBossk Greedo Boba IG-88 Dengar",1
"TorenCalduris",1,1,104935,zEP,"zzEP zzzVader Tarkin DT TFP",1
"TorenCalduris",0,1,86977,FO,"zKRU zKylo FOO FOST G9, FOE",1
"TorenCalduris",1,0,84988,Troopers,"zVeers Starck Range Trooper G9, Snowtrooper Shoretrooper",1
"TorenCalduris",1,0,112096,CLS,"zzzCLS zHan Wedge Biggs zzChewbacca",1
"TorenCalduris",0,1,75985,Phoenix,"Hera G9, zEzra Kanan G8, Sabine G8, Zeb G8",1
"TorenCalduris",1,1,89461,Rogue1,"zzJyn Chirrut G9, Baze zCassian zK-2SO G9",1
"TorenCalduris",1,0,70818,Jawas,"Nebit G8, Jawa Engineer G9, Jawa Scavenger G8, Jawa G9, Dathcha G9",1
"TorenCalduris",1,0,20212,SionSolo (Counter),"zSion",1
"TorenCalduris",1,0,16731,NestSolo (Counter),"Nest",1
"TorenCalduris",,,373648,Executrix,"Executrix Tie Adv, Emperor's Shuttle, TIE Reaper, Imperial TIE Fighter, Gauntlet Starfighter, First Order SF TIE Fighter 3*, First Order TIE Fighter",0
"Wolfie",0,1,94127,padme,"zzPadme G8, zGK JKA Ahsoka zzC-3PO G8",1
"Wolfie",,,343663,Negotiator,"Negotiator 6* HT Anakin's Eta-2 Starfighter, Umbaran Starfighter, Ahsoka Tano's Jedi Starfighter, Clone Sergeant's ARC-170, Jedi Consular's Starfighter, Plo Koon's Jedi Starfighter",1
"Wolfie",0,1,85726,Geonosians,"zzGBA Poggle G8, Geo Soldier, Geo Spy, Sun Fac G8",1
"Wolfie",1,1,103829,JTR,"zzzJTR zScav Rey, BB-8 G9, zzR2-D2 zFinn",1
"Wolfie",1,1,120559,Revan Offense,"zzzJKR zzGMY zBS zJolee Ezra G8",1
"Wolfie",1,1,104217,Ewoks,"zChirpa Elder zPaploo Teebo zWicket",1
"Wolfie",1,1,99978,Carth,"zCarth Onasi, zMission zZaalbar zJuhani zCanderous",1
"Wolfie",0,1,108869,BH,"zzJango zBoba zIG-88 Cad zzBossk",1
"Wolfie",1,0,99213,CLS,"zzzCLS zHan G9, Leia Old Ben G9, zzChewbacca",1
"Wolfie",1,0,13249,SionSolo (Counter),"Sion G8",1
"Wolfie",0,1,97273,DR,"zzzDR zzHK-47 zBSF Sith Empire Trooper G8, Thrawn 6* G8",0
"Wolfie",0,1,70959,Grievous,"GG B2 G8, Nute G9, Dooku G6, T3-M4 G7",0
"Wolfie",1,1,74552,NS_Alt,"MT G8, AV Daka G8, Talia G8, Zombie",0
"Wolfie",1,0,80301,ShaakClones,"Shaak Ti G8, zRex G8, Echo G9, zFives Clone Sergeant",0
"Wolfie",0,1,68884,Phoenix,"Hera G8, Kanan G8, Sabine 6* G8, Chopper Zeb G9",0
"Wolfie",0,1,63762,FO,"KRU G8, Kylo G9, FOTP G8, FOO G8, FOST G8",0
"Wolfie",1,0,62656,Wiggs,"Wedge G8, Biggs G8, Fulcrum G6, Chirrut G8, Baze G8",0
"Wolfie",1,0,81948,Zader (Counter),"zzzVader Wampa 6* G7, zzTarkin Sidious G9, Stormtrooper G1",0
"Teg",0,1,128519,padme,"zzPadme zGK zJKA zAhsoka zzC-3PO",1
"Teg",0,1,106451,DRMalak,"zzzDR zHK-47 zBSF zzMalak Sith Empire Trooper G8",1
"Teg",,,334823,Malevolence,"Malevolence 6* Sun Fac SF, Soldier SF, Spy SF, Hyena Bomber, Vulture Droid, IG-2000",1
"Teg",,,391677,HansMF,"Home One, Han's MF, HT Biggs X-wing, Phantom Ghost Cassian's U-wing, Bistan's U-wing",1
"Teg",0,1,94405,Geonosians,"zzGBA Poggle Geo Soldier, Geo Spy, Sun Fac",1
"Teg",0,1,114340,Grievous,"zzGG zB2 zB1 zDroideka zMagnaGuard",1
"Teg",1,1,118543,JTR,"zzzJTR Scav Rey, zBB-8 zzR2-D2 zFinn",1
"Teg",1,1,116032,GAS,"zzzzGAS zRex zEcho zzFives zARC Trooper",1
"Teg",1,1,108443,Revan Offense,"zzzJKR zGMY BS zJolee HYoda",1
"Teg",1,1,80051,Ewoks,"zChirpa Elder Paploo G9, Wicket Logray G9",1
"Teg",1,1,91182,Carth,"zCarth Onasi, zMission Zaalbar Juhani Canderous",1
"Teg",0,1,99748,BH,"zzBossk Greedo Boba zIG-88 Dengar",1
"Teg",1,1,95651,zEP,"zzEP zzVader Tarkin DT G8, TFP G8",1
"Teg",0,1,102633,FO,"zzKRU zKylo FOO zHux FOE",1
"Teg",0,1,82153,Phoenix,"Hera G9, zEzra Kanan G8, zSabine zZeb G8",1
"Teg",1,0,111252,Wiggs,"Wedge G9, Biggs G8, zzzCLS zHan zzChewbacca",1
"Teg",1,1,72539,Rogue1,"Jyn G8, Chirrut G8, Baze G8, Cassian K-2SO G8",1
"Teg",1,0,66125,Jawas,"Nebit G8, Jawa Engineer G8, Jawa Scavenger G8, Jawa G8, Dathcha G8",1
"Teg",1,0,14740,NestSolo (Counter),"Nest G9",1
"Teg",1,0,13777,SionSolo (Counter),"Sion G8",1
"Teg",1,1,91656,NS_Alt,"zzMT G9, zzAV zDaka Talia G9, Zombie",0
"Teg",,,324151,Executrix,"Executrix Tie Adv, Emperor's Shuttle, TIE Reaper 6*, Imperial TIE Fighter, Gauntlet Starfighter, First Order SF TIE Fighter 5*, First Order TIE Fighter",0
"Teg",0,1,79379,BH,"Jango G9, Aurra 6* G8, Cad The Mandalorian, Zam G9",0
"Teg",1,0,59786,Troopers,"Veers G9, Starck G8, Snowtrooper G8, Shoretrooper G8, Stormtrooper G5",0
"Drcct",1,1,116838,NS,"zzMT zzAV zDaka Zombie Spirit",1
"Drcct",0,1,117341,padme,"zzPadme zGK zJKA zAhsoka zzC-3PO",1
"Drcct",,,439838,HansMF,"Home One, Han's MF 6*, HT Biggs X-wing, Phantom Ghost Cassian's U-wing, Bistan's U-wing",1
"Drcct",0,1,101117,Geonosians,"zzGBA Poggle Geo Soldier, Geo Spy, Sun Fac",1
"Drcct",0,1,96695,Grievous,"zzGG zB2 zB1 zDroideka MagnaGuard G9",1
"Drcct",1,1,114464,JTR,"zzzJTR zScav Rey, zzBB-8 zzR2-D2 zFinn",1
"Drcct",1,1,104803,Ewoks,"zChirpa Elder zPaploo zWicket zLogray",1
"Drcct",0,1,122476,BH,"zzJango zBoba zIG-88 zDengar zzBossk",1
"Drcct",1,0,102831,ShaakClones,"zzShaak Ti, zRex zEcho zzFives Clone Sergeant",1
"Drcct",0,1,100488,Phoenix,"zHera zEzra zKanan zSabine zZeb",1
"Drcct",1,0,95585,Wiggs,"Wedge Biggs zzzCLS Han zLeia",1
"Drcct",1,1,113400,zEP,"zzEP zzzVader zzTarkin zDooku TFP G9",1
"Drcct",0,1,99125,FO,"zzKRU zKylo FOO zFOST zPhasma",1
"Drcct",1,0,69411,Jawas,"Nebit G9, Jawa Engineer G9, Jawa Scavenger G9, Jawa G9, Dathcha",1
"Drcct",1,0,69564,Troopers,"Veers Starck G8, Snowtrooper Magma G8, Stormtrooper G8",0
"Eanid September",0,1,110834,padme,"zzPadme zGK zJKA zAhsoka zBarriss",1
"Eanid September",,,369736,Negotiator,"Negotiator 6* HT Anakin's Eta-2 Starfighter, Umbaran Starfighter, Ahsoka Tano's Jedi Starfighter, BTL-B Y-wing Starfighter, Clone Sergeant's ARC-170, Plo Koon's Jedi Starfighter",1
"Eanid September",0,1,103082,DR,"zzzDR zHK-47 zBSF Sith Empire Trooper, Sith Assassin G8",1
"Eanid September",0,1,93946,Geonosians,"zzGBA Poggle Geo Soldier, Geo Spy, Sun Fac",1
"Eanid September",,,369534,HansMF,"Home One, Han's MF, Biggs X-wing, Bistan's U-wing, Phantom Ghost Cassian's U-wing, Wedge X-wing",1
"Eanid September",0,1,93811,Grievous,"zGG B2 zB1 zDroideka MagnaGuard",1
"Eanid September",1,0,107636,Traya,"zzTraya zDN zSion zzEP zThrawn",1
"Eanid September",1,1,101700,JTR,"zzzJTR Scav Rey, BB-8 zR2-D2 Finn",1
"Eanid September",,,311900,Executrix,"Executrix Tie Adv, Emperor's Shuttle, TIE Reaper, Imperial TIE Fighter, Gauntlet Starfighter, First Order SF TIE Fighter, First Order TIE Fighter",1
"Eanid September",1,0,109733,CLS,"zzzCLS zHan zzChewbacca zLeia C-3PO",1
"Eanid September",1,1,121335,Revan Offense,"zzzJKR zGMY zBS zJolee Ezra",1
"Eanid September",1,1,90353,Ewoks,"zChirpa Elder Paploo zWicket Logray G9",1
"Eanid September",1,1,94102,Carth,"zCarth Onasi, zMission zZaalbar Juhani Canderous",1
"Eanid September",0,1,105559,BH,"zBossk zJango zBoba zAurra Dengar",1
"Eanid September",0,1,92819,FO,"zzKRU Kylo FOO zHux FOE",1
"Eanid September",0,1,73404,Phoenix,"Hera G9, Kanan Sabine G9, Chopper G8, Zeb G9",1
"Eanid September",1,1,75890,Rogue1,"Jyn G9, Chirrut G9, Baze G8, Cassian K-2SO G9",1
"Eanid September",1,0,84341,Zader (Counter),"zzzVader Tarkin Sidious G9, Shoretrooper G8, Stormtrooper G8",1
"Eanid September",1,0,15181,NestSolo (Counter),"Nest",1
"Eanid September",1,1,89963,NS,"zMT zAV Daka Zombie Spirit G9",0
"Eanid September",1,0,77186,ShaakClones,"Shaak Ti, Rex Echo G9, Fives ARC Trooper G8",0
"Eanid September",1,0,68399,Jawas,"Nebit G8, Jawa Engineer G9, Jawa Scavenger G8, Jawa G7, Dathcha G9",0
"JuanQue NoloVi",0,1,112375,DR,"zzzDR zzHK-47 zBSF Sith Empire Trooper, Sith Assassin",1
"JuanQue NoloVi",1,1,143166,NS_Alt,"zzMT zzAV zDaka Talia Zombie",1
"JuanQue NoloVi",0,1,92058,Geonosians,"zzGBA Poggle Geo Soldier, Geo Spy, Sun Fac",1
"JuanQue NoloVi",1,1,127083,Revan,"zzzJKR zBS zzGMY zJolee zGK",1
"JuanQue NoloVi",1,1,99914,Carth,"zCarth Onasi, zMission zZaalbar zJuhani zCanderous",1
"JuanQue NoloVi",0,1,94900,BH,"zzBossk zBoba IG-88 Zam Dengar G8",1
"JuanQue NoloVi",0,1,104254,Phoenix,"zHera zEzra zKanan zSabine zZeb",1
"JuanQue NoloVi",1,0,68756,Jawas,"Nebit G8, Jawa Engineer G9, Jawa Scavenger G8, Jawa G9, Dathcha",1
"JuanQue NoloVi",1,0,70605,EP (trio),"EP Traya G8, DN G8, Sion G8, Thrawn G8",1
"JuanQue NoloVi",0,1,64087,Grievous,"GG G8, B2 6* G8, Nute G8, Dooku T3-M4 G8",0
"JuanQue NoloVi",1,1,58023,Ewoks,"Chirpa G8, Elder Paploo G8, Teebo G7, Scout G8",0
"JuanQue NoloVi",1,0,64642,ShaakClones,"Shaak Ti 5* G8, Rex G8, Echo G8, Fives G8, Clone Sergeant G8",0
"JuanQue NoloVi",1,0,85002,Wiggs,"Wedge 6* G8, Biggs G8, zzzCLS Han Fulcrum",0
"JuanQue NoloVi",1,0,63169,Troopers,"Veers G8, Starck G9, DT 5* G8, Snowtrooper G8, Stormtrooper",0
"JuanQue NoloVi",1,1,64900,Rogue1,"Jyn G8, Chirrut G8, Baze 5* G8, Cassian G8, K-2SO G8",0
"JuanQue NoloVi",0,1,64547,FO,"KRU G8, Kylo G8, FOO G8, FOSFTP G7, Phasma G8",0
"Scuba Bill23",0,1,113985,DRMalak,"zzzDR zzHK-47 zBSF zzMalak Sith Empire Trooper",1
"Scuba Bill23",0,1,116936,padme,"zzPadme zGK zJKA zAhsoka zzC-3PO",1
