Player,Offense,Defense,GP,Name,Squad,Viable
"Aarst Hoedm",0,1,73344,BH,"Jango 4* G8 zBoba G9 Dengar G8 Greedo G8 IG-88 G9",0
"Aarst Hoedm",1,1,104145,zEP,"zzEP zzVader Tarkin zDooku TFP G8",1
"Aarst Hoedm",0,1,69456,Phoenix,"Hera G8 Chopper G8 Ezra G8 Zeb G8 zKanan G8",1
"Aarst Hoedm",0,1,65040,FO,"zKRU G8 Kylo Phasma G7 FOST G8 FOTP G8",0
"Aarst Hoedm",1,0,57383,Jawas,"Nebit 5* G8 Jawa Engineer 5* G9, Jawa Scavenger G7, Jawa G8 Dathcha G8",0
"Krupten",1,1,93943,NS_Alt,"zzMT zAV Initiate Zombie zDaka",0
"Krupten",1,0,96089,Traya,"zzTraya DN G9 Sion G9 zzEP zThrawn",1
"Krupten",1,1,115418,JTR,"zzzJTR Scav Rey, zzBB-8 zzR2-D2 zFinn",1
"Krupten",1,1,118693,Revan,"zzzJKR BS zGMY zJolee GK G8",1
"Krupten",1,0,109206,CLS,"zzzCLS Han zzChewbacca Leia zzC-3PO",1
"Krupten",1,1,80722,Ewoks,"zChirpa Elder Paploo Scout zLogray",1
"Krupten",1,1,74821,Carth,"zCarth Onasi, Mission Zaalbar Juhani 6* Canderous",0
"Krupten",0,1,106245,BH,"zzBossk zBoba zDengar zJango Zam",1
"Krupten",1,0,62892,Clones,"Cody G7 Rex G7 Echo G7 Fives G8 Clone Sergeant G8,",0
"Krupten",0,1,96175,FO,"zzKRU zKylo Phasma FOE FOO",1
"Krupten",0,1,74348,Phoenix,"Hera Chopper Ezra Zeb Kanan",1
"Krupten",1,0,71396,zMaul,"Maul G6 BSF 6* Sidious zzVader Sith Empire Trooper 6* G7,",0
"Upgreyd",1,0,94629,padme,"zPadme GK JKA zAhsoka C-3PO G9",1
"Upgreyd",1,1,90984,NS,"zMT zAV zDaka Zombie Spirit",0
"Upgreyd",0,1,85825,Geonosians,"zzGBA Poggle Geo Soldier, Geo Spy, Sun Fac G9,",1
"Upgreyd",1,1,88734,JTR,"JTR Scav Rey, BB-8 zR2-D2 zFinn",0
"Upgreyd",1,1,85309,Ewoks,"zChirpa Elder Paploo Wicket Logray",1
"Upgreyd",1,1,87128,Revan Offense,"JKR G6 zzGMY BS G8 Jolee G8 Ezra",0
"Upgreyd",0,1,102244,BH,"zBossk Boba Dengar Greedo Zam",1
"Upgreyd",1,0,57703,ShaakClones,"Shaak Ti 4* G7, Rex G7 Echo 6* G7 Fives G8 Clone Sergeant G7,",0
"Upgreyd",1,1,62711,Carth,"Carth Onasi 6* G9, Mission G8 Zaalbar G7 Juhani 5* G8 Canderous G7",0
"Upgreyd",0,1,71362,Grievous,"GG G8 B2 5* G8 Dooku G8 IG-88 T3-M4 G9",0
"Upgreyd",1,0,70522,Wiggs,"Wedge 6* G7 Biggs G8 CLS G9 Han Chewbacca G9",0
"Upgreyd",0,1,137216,Phoenix,"zHera Chopper zZeb zKanan zSabine",1
"Upgreyd",0,1,67105,FO,"KRU G8 Kylo G8 Phasma G8 FOO G8 FOTP G8",0
"Upgreyd",1,0,75300,zMaul,"Maul G8 Sidious G8 Vader EP Savage G8",0
"Upgreyd",1,0,28357,QiraNest,"Qira 3* G7 Nest 3* G7 HYoda G6",0
"Upgreyd",1,0,11712,SionSolo,"Sion 6* G8",0
"Syn",0,1,72642,padme,"Padme 6* G7 GK JKA Ahsoka Barriss G8",0
"Syn",1,1,92850,NestSisters,"zAV zzMT Daka Zombie Nest 6*",0
"Syn",0,1,65287,Geonosians,"GBA 6* G9 Poggle G8 Geo Soldier G8, Geo Spy G9, Sun Fac G8,",0
"Syn",1,1,96908,JTR,"zJTR Scav Rey, BB-8 zzR2-D2 Finn",0
"Syn",1,0,93215,Traya,"Traya 6* DN Sion zzEP zThrawn",0
"Syn",1,1,98407,Revan Offense,"JKR zGMY zBS zJolee HYoda G9",0
"Syn",0,1,95083,BH,"zBossk Boba Dengar Greedo Jango",1
"Syn",1,1,68247,Ewoks,"Chirpa 5* Elder Paploo 6* Teebo G8 Scout",0
"Syn",1,0,97798,Wiggs,"Wedge Biggs zzCLS zHan zEzra",1
"Syn",1,0,69734,Wampa,"Rex G8 Wampa DT G9 Visas G8 Jyn G8",1
"Syn",1,0,57365,Troopers,"Veers Starck G8 Shoretrooper G8 Snowtrooper G8 Stormtrooper G5",0
"Syn",0,1,65594,Phoenix,"Hera G8 Chopper Zeb G8 Kanan G8 Sabine 5* G8",0
"Syn",1,0,89915,zMaul,"Maul BSF Dooku zVader Savage",0
"Syn",0,1,78957,FO,"KRU zKylo Phasma G8 FOST G8 FOTP",0
"Wolfie",0,1,81797,padme,"zzPadme G8 GK JKA Ahsoka CW Chewbacca G8,",1
"Wolfie",0,1,83430,Geonosians,"zzGBA Poggle G8 Geo Soldier, Geo Spy G8, Sun Fac G8,",1
"Wolfie",1,1,98002,JTR,"zzzJTR zScav Rey, BB-8 G9 R2-D2 zFinn",1
"Wolfie",1,1,70367,NS_Alt,"MT G8 AV Initiate G8 Zombie Daka G8",0
"Wolfie",1,0,70914,Traya,"Traya 6* G7 DN 4* G8 Sion G8 zBSF EP",0
"Wolfie",1,1,112695,Revan Offense,"zzzJKR zzGMY zBS zJolee Ezra G8",1
"Wolfie",1,1,83362,Carth,"zCarth Onasi, Mission G8 Zaalbar G8 zJuhani zCanderous",1
"Wolfie",0,1,78405,BH,"Bossk G9 Boba G8 Cad G8 Greedo G8 IG-88",0
"Wolfie",1,0,83147,Wiggs,"Wedge G8 Biggs G8 zzzCLS Han G7 Leia",1
"Wolfie",1,0,77491,Clones,"Cody G8 zRex G8 Echo 6* G9 zFives Clone Sergeant,",0
"Wolfie",0,1,68884,Phoenix,"Hera G8 Chopper Zeb G9 Kanan G8 Sabine 6* G8",0
"Wolfie",0,1,63762,FO,"KRU G8 Kylo G9 FOO G8 FOST G8 FOTP G8",0
"Wolfie",1,0,69951,zMaul,"Maul G8 Sidious G9 zzVader Savage G7 Sith Empire Trooper 4* G8,",0
"Tzoid",0,1,72132,padme,"Padme 5* G8 zGK JKA G8 Ahsoka G8 CW Chewbacca G8,",0
"Tzoid",0,1,122431,DRMalak,"zzzDR zzHK-47 zBSF zzMalak 6* zThrawn",1
"Tzoid",,,376780,HansMF,"Home One, Han's MF, HT Biggs X-wing, Phantom Ghost Cassian's U-wing 6*, Bistan's U-wing 4*,",0
"Tzoid",1,1,70439,NestSisters,"AV MT Daka Zombie Nest 4* G6",0
"Tzoid",1,0,88917,CLS,"CLS zHan Chewbacca zzR2-D2 C-3PO 6* G7",0
"Tzoid",1,0,98305,Traya,"Traya 6* G8 zzDN zSion zDooku zzEP",0
"Tzoid",1,1,135666,Revan Offense,"zzzJKR zzGMY zBS zJolee zEzra",1
"Tzoid",1,1,92663,Ewoks,"zChirpa Elder zPaploo Teebo zWicket",1
"Tzoid",1,1,93378,Carth,"zCarth Onasi, zMission zZaalbar zJuhani zCanderous",1
"Tzoid",0,1,100157,BH,"zzBossk zBoba Cad Dengar Greedo",1
"Tzoid",1,0,65063,Wampa,"Rex G8 zzWampa HYoda 5* G2 Jyn 5* G8 FOO",0
"Tzoid",1,0,51648,Troopers,"Veers 6* G8 Starck G8 DT 5* G8 Snowtrooper G8 Stormtrooper G8",0
"Tzoid",0,1,79232,FO,"zzKRU Kylo FOE FOSFTP G9 FOTP G9",1
"Tzoid",0,1,87559,Phoenix,"zHera Chopper zZeb zKanan Sabine 5*",0
"Tzoid",1,0,58100,Wiggs,"Wedge G8 Biggs Leia Chirrut 5* G8 Baze 5* G8",0
"Tzoid",1,0,81700,zMaul,"Maul Sidious G8 zzVader Savage G8 Sith Empire Trooper,",0
"Teg",1,0,104226,padme,"zzPadme GK zJKA zAhsoka zC-3PO",1
"Teg",0,1,108818,DRMalak,"zzzDR zHK-47 BSF zzMalak zThrawn",1
"Teg",1,1,83028,NestSisters,"zAV zzMT G9 Daka G9 Zombie Nest G8",0
"Teg",,,377163,HansMF,"Home One, Han's MF, HT Biggs X-wing, Phantom Ghost Cassian's U-wing, Bistan's U-wing,",1
"Teg",0,1,84476,Geonosians,"zGBA Poggle Geo Soldier, Geo Spy, Sun Fac,",0
"Teg",1,1,102626,JTR,"zzJTR Scav Rey, zBB-8 zzR2-D2 zFinn",1
"Teg",1,0,80846,Traya,"Traya 6* G9 DN G8 Sion G8 Dooku zzEP",0
"Teg",1,1,103770,Revan Offense,"zzzJKR zGMY BS zJolee HYoda",1
"Teg",1,1,79440,Ewoks,"zChirpa Elder Paploo G9 Wicket Logray G9",1
"Teg",0,1,73894,Grievous,"zGG B2 G8 B1 G9 Droideka G8 MagnaGuard G8",0
"Teg",1,1,91272,Carth,"zCarth Onasi, zMission Zaalbar Juhani Canderous",1
"Teg",0,1,96845,BH,"zzBossk Boba Cad Dengar Greedo",1
"Teg",1,0,82980,ShaakClones,"zShaak Ti, Rex zEcho G9 zFives G9 ARC Trooper G8,",0
"Teg",0,1,81339,Phoenix,"Hera G9 zEzra zZeb G8 Kanan G8 zSabine",1
"Teg",1,0,106064,Wiggs,"Wedge G9 Biggs G8 zzzCLS zHan zzChewbacca",1
"Teg",1,0,59386,Troopers,"Veers G9 Starck G8 Shoretrooper G8 Snowtrooper G8 Stormtrooper G5",0
"Teg",1,1,71849,Rogue1,"Jyn G8 Chirrut G8 Baze G8 K-2SO G8 Cassian",1
"Teg",0,1,67487,FO,"KRU G8 Kylo G8 FOE G9 FOO G8 FOST G8",0
"Teg",1,0,70563,zMaul,"Maul G9 Sidious G8 zVader Savage G8 Sith Empire Trooper 6* G7,",0
"Teg",1,0,65407,Jawas,"Nebit G8 Jawa Engineer G8, Jawa Scavenger G8, Jawa G8 Dathcha G8",1
"Sena",0,1,97775,padme,"zzPadme GK zJKA zAhsoka zBarriss",1
"Sena",1,1,96857,NS_Alt,"zzMT zzAV Initiate G8 Zombie zDaka",1
"Sena",0,1,68572,Geonosians,"zzGBA 6* G9 Poggle G9 Geo Soldier 6* G9, Geo Spy 6* G9, Sun Fac G8,",0
"Sena",1,0,96842,Traya,"zTraya 5* G8 DN zSion zzEP zThrawn",0
"Sena",1,1,108834,Revan Offense,"zzzJKR zGMY zBS zJolee zHYoda G9",1
"Sena",0,1,95731,Grievous,"zzGG B2 G9 zB1 G9 MagnaGuard zIG-88",1
"Sena",0,1,85590,BH,"zzBossk Boba G9 Cad G9 Greedo G8 Jango",1
"Sena",1,0,79521,Troopers,"zVeers zStarck DT Range Trooper 5* G6, Snowtrooper",0
"Sena",0,1,95199,FO,"zzKRU zKylo FOE FOO zFOST",1
"Sena",1,0,87782,Wiggs,"Wedge G8 Biggs zCLS zHan zLeia",1
"Sena",1,0,64873,Clones,"Cody G8 Rex G9 Echo 6* G5 Fives G9 Clone Sergeant G8,",0
"Sena",0,1,73818,Phoenix,"Hera Chopper Ezra Zeb G8 Kanan G8",1
"Sena",1,0,102171,zMaul,"zMaul zDooku zSidious zzVader zSavage",1
"Ryu Herr",0,1,66908,Qira,"Qira 6* L3-37 4* G7 Vandor Chewbacca 3* G7, zMission zZaalbar",0
"Ryu Herr",1,0,103566,padme,"zzPadme zGK zJKA zAhsoka C-3PO",1
"Ryu Herr",1,1,90794,NestSisters,"zzAV zMT zDaka Zombie G8 Nest",0
"Ryu Herr",0,1,101989,DRMalak,"zzDR zHK-47 zBSF zMalak 5* G8 zThrawn",0
"Ryu Herr",0,1,78614,Geonosians,"zGBA Poggle Geo Soldier, Geo Spy G8, Sun Fac G9,",1
"Ryu Herr",1,1,101700,JTR,"zzJTR Scav Rey, zBB-8 zzR2-D2 RT",1
"Ryu Herr",1,1,115487,Revan Offense,"zzJKR zzGMY zBS zJolee zEzra",1
"Ryu Herr",1,1,84532,Ewoks,"zChirpa G9 Elder Paploo Wicket zLogray",1
"Ryu Herr",0,1,95601,Grievous,"zzGG zB2 Droideka G8 MagnaGuard G8 zDooku",1
"Ryu Herr",1,0,81889,ShaakClones,"zShaak Ti G9, Rex Echo Fives G9 Clone Sergeant,",0
"Ryu Herr",0,1,98001,BH,"zBossk zBoba Dengar G9 zGreedo IG-88",1
"Ryu Herr",1,1,88873,zEP,"zEP zVader Tarkin DT TFP G9",1
"Ryu Herr",1,0,79481,Troopers,"zVeers Starck Range Trooper, Shoretrooper Snowtrooper",1
"Ryu Herr",1,0,100317,CLS,"zzCLS zHan Wedge Biggs zChewbacca",1
"Ryu Herr",0,1,83821,FO,"zKRU zKylo FOE FOO FOST G8",1
"Ryu Herr",0,1,75074,Phoenix,"Hera G9 Chopper G8 Zeb G8 Kanan G9 zSabine",1
"Ryu Herr",1,1,67907,Rogue1,"Jyn 4* G7 Chirrut Baze Cassian G8 Scarif G8",0
"Ryu Herr",1,0,81832,zMaul,"Maul zDN Sidious Sion G9 Savage",0
"Kokon159",0,1,57380,Phoenix,"Hera 5* G7 Chopper G7 zEzra Zeb G8 Kanan G8",0
"Kokon159",1,1,63304,zEP,"EP G8 Vader G9 Tarkin G8 Dooku G8 TFP 5* G9",0
"Kokon159",0,1,109940,BS,"zBS zzGMY zJolee zzOld Ben, JKA",1
"Oremor",1,1,60678,NS,"MT G8 AV G8 Daka G9 Zombie G8 Spirit G1",0
"Oremor",1,1,61815,Revan Offense,"JKR G1 GMY G9 HYoda G7 Jolee G8 JKA G8",0
"Oremor",1,1,67168,Ewoks,"zChirpa G8 Elder G9 Paploo G7 Scout G8 Wicket G9",0
"Oremor",0,1,101120,BH,"zzBossk zAurra zBoba zDengar zZam",1
"Oremor",0,1,68127,Grievous,"GG G8 B2 G8 Dooku IG-88 G8 T3-M4 G7",0
"Oremor",1,0,67690,501st,"Rex G8 Clone Sergeant G9, Echo G7 Fives G9 Ahsoka",0
"Oremor",1,0,78988,Wiggs,"Wedge Biggs CLS Ezra G7 Leia",1
"Oremor",0,1,61836,FO,"KRU G1 Kylo G8 Phasma G9 FOO FOST G8",0
"Oremor",1,0,77293,zMaul,"zMaul DN G8 Vader EP Savage G8",1
"Oremor",0,1,64846,Phoenix,"Hera G7 Chopper G7 Zeb G7 Kanan G8 Sabine G7",0
"DarthBrigante",1,1,97316,NS,"zzMT zzAV zDaka Zombie Spirit 6* G9",0
"DarthBrigante",0,1,68985,padme,"Padme 6* G7 GK G8 JKA Ahsoka CW Chewbacca G8,",0
"DarthBrigante",0,1,74537,Geonosians,"GBA 4* G9 Poggle Geo Soldier, Geo Spy, Sun Fac G9,",0
"DarthBrigante",1,1,113340,JTR,"zzzJTR Scav Rey, zzBB-8 zzR2-D2 zFinn",1
"DarthBrigante",1,0,99119,Traya,"Traya 6* G8 zzDN Sion zzEP zzThrawn",0
"DarthBrigante",1,0,104898,CLS,"zzzCLS zHan zzChewbacca zLeia C-3PO 5* G9",0
"DarthBrigante",1,1,89391,Ewoks,"zChirpa Elder zPaploo Teebo G9 Scout",1
"DarthBrigante",0,1,92020,Grievous,"zzGG B2 G8 MagnaGuard G8 zNute zDooku",1
"DarthBrigante",1,0,69890,ShaakClones,"Shaak Ti 3* G8, Rex Echo G9 Fives G9 Clone Sergeant G9,",0
"DarthBrigante",0,1,118089,BH,"zzBossk zBoba zGreedo zzJango zZam",1
"DarthBrigante",1,1,53596,Carth,"Carth Onasi 4* G8, zMission 6* G9 Zaalbar 6* G8 Juhani 4* G7 Canderous 4* G7",0
"DarthBrigante",1,0,74867,Troopers,"zVeers Starck Range Trooper 3* G8, Snowtrooper Stormtrooper G9",0
"DarthBrigante",0,1,97638,Phoenix,"zHera zEzra zZeb zKanan zSabine",1
"DarthBrigante",1,1,75088,Rogue1,"Jyn 6* G8 Chirrut G9 Baze K-2SO G9 Cassian",0
"DarthBrigante",1,0,93170,zMaul,"zMaul zSidious zzVader Savage Sith Assassin 6* G8,",0
"DarthBrigante",0,1,78495,FO,"KRU G8 Kylo zPhasma FOO FOTP G9",0
"DarthBrigante",0,1,88647,BS,"zBS zzGMY zJolee 5* Old Ben G9, HYoda 5* G8",0
"This Is The Way",0,1,43981,Qira,"Qira G8 L3-37 4* G8 Vandor Chewbacca 3* G8, Mission 5* G8 Zaalbar 4* G7",0
"This Is The Way",1,0,133163,padme,"zzPadme zGK zJKA zAhsoka zzC-3PO",1
"This Is The Way",,,363229,HansMF,"Home One, Han's MF, HT Biggs X-wing, Phantom Ghost Cassian's U-wing, Bistan's U-wing 4*,",0
"This Is The Way",0,1,93436,Geonosians,"zzGBA Poggle Geo Soldier, Geo Spy, Sun Fac,",1
"This Is The Way",1,1,72111,NestSisters,"AV MT G8 Daka G9 Zombie 6* G5 zNest",0
"This Is The Way",1,1,112421,JTR,"zzzJTR zScav Rey, zzBB-8 zzR2-D2 zFinn",1
"This Is The Way",1,0,90191,Traya,"Traya 6* G8 DN G9 Sion G9 zzEP zzThrawn",0
"This Is The Way",1,1,96259,Ewoks,"zChirpa Elder zPaploo zWicket zLogray",1
"This Is The Way",0,1,119625,Grievous,"zzGG zB2 zB1 zDroideka zMagnaGuard",1
"This Is The Way",1,0,95892,ShaakClones,"zShaak Ti G9, zRex zEcho zzFives Clone Sergeant,",1
"This Is The Way",0,1,116538,BH,"zzBossk zzAurra zBoba zDengar zzJango",1
"This Is The Way",0,1,93568,FO,"zzKRU zKylo FOE FOO G9 zFOST",1
"This Is The Way",1,0,102839,CLS,"zzzCLS zHan Leia Old Ben, zzChewbacca",1
"This Is The Way",0,1,76171,Phoenix,"Hera Chopper Ezra Zeb G9 Kanan G8",1
"This Is The Way",1,0,93924,zMaul,"zMaul zDooku zzVader Savage Sith Assassin G8,",1
"This Is The Way",1,0,62953,Jawas,"Nebit G8 Jawa Engineer G9, Jawa Scavenger G8, Jawa G9 Dathcha G8",1
"The senate",0,1,98456,padme,"zzPadme zGK zJKA zAhsoka Barriss 4* G8",0
"The senate",0,1,91480,Geonosians,"zzGBA Poggle Geo Soldier, Geo Spy, Sun Fac,",1
"The senate",1,0,92899,Traya,"Traya 6* G8 zzDN zSion zEP Thrawn G9",0
"The senate",1,1,120693,Revan Offense,"zzzJKR zzGMY zBS zJolee zzHYoda",1
"The senate",0,1,91175,Grievous,"zzGG B2 G8 zB1 zDroideka MagnaGuard",1
"The senate",1,0,104133,ShaakClones,"zzShaak Ti, zRex zEcho zzFives Clone Sergeant,",1
"The senate",0,1,108058,BH,"zzBossk zBoba Dengar G8 zGreedo zzJango",1
"The senate",1,1,58559,Ewoks,"Chirpa 4* G7 Elder Paploo 5* G7 Teebo G8 Scout G8",0
"The senate",0,1,95996,Phoenix,"zHera zEzra zZeb zKanan zSabine",1
"The senate",1,0,76683,Wiggs,"Wedge G8 Biggs G8 zCLS Han Leia",1
"The senate",1,0,73079,zMaul,"Maul G7 BSF G8 Vader Sith Assassin G8, Sith Marauder G9,",0
"The senate",0,1,51263,FO,"KRU 6* G7 Kylo 5* G8 Phasma G7 FOO G7 FOSFTP 4* G6",0
"The senate",1,0,6715,NestSolo,"Nest 3* G5",0
"Lala",1,0,78239,padme,"Padme G8 zGK G8 JKA Ahsoka G9 C-3PO G8",0
"Lala",1,1,105832,JTR,"zzzJTR zScav Rey, zBB-8 zzR2-D2 Finn",1
"Lala",1,1,66395,NS,"MT G8 zAV Daka G9 Zombie 6* G7 Spirit 6* G8",0
"Lala",1,1,105748,Revan Offense,"zzzJKR zzGMY zBS zJolee Ezra",1
"Lala",1,1,91012,Ewoks,"zChirpa Elder zPaploo zWicket zLogray",1
"Lala",1,1,87527,Carth,"zCarth Onasi, Mission Zaalbar Juhani zCanderous",1
"Lala",0,1,111205,BH,"zzBossk zBoba zDengar zzJango zZam",1
"Lala",0,1,89952,Grievous,"zzGG B2 G8 MagnaGuard zNute Dooku",1
"Lala",1,0,119136,CLS,"zzzCLS zHan Leia G9 zzOld Ben, zzChewbacca",1
"Lala",1,0,69999,Clones,"Cody G8 Rex G7 Echo G7 Fives Clone Sergeant G9,",0
"Lala",0,1,72325,Phoenix,"Hera Chopper Zeb G9 Kanan G9 Sabine G8",1
"Lala",0,1,71819,FO,"KRU Kylo G9 FOO G8 FOST G9 FOTP G9",0
"Lala",1,0,76209,Wiggs,"Wedge G8 Biggs G8 Fulcrum Chirrut Baze",1
"Lala",1,0,90579,zMaul,"Maul G8 zBSF zzVader zEP Savage G8",0
"Lala",1,0,7992,NestSolo,"Nest 5* G8",0
"Boandle",1,1,98593,JTR,"zzzJTR Scav Rey, BB-8 zzR2-D2 Finn G9",1
"Boandle",1,0,82562,Traya,"zzTraya 5* DN G8 Sion 4* G7 zEP zThrawn",0
"Boandle",1,1,61350,NS_Alt,"MT 4* G8 AV Initiate G7 Daka G9 Talia 6* G8",0
"Boandle",1,1,129535,Revan,"zzzJKR zBS zzGMY zJolee GK",1
"Boandle",1,1,89767,Ewoks,"zChirpa Elder Paploo zWicket zLogray",1
"Boandle",1,0,91958,CLS,"zzzCLS zHan Chewbacca 6* G8 zLeia C-3PO 5* G7",0
"Boandle",1,1,72119,Carth,"Carth Onasi 6*, Mission Zaalbar G8 Juhani 5* G8 Canderous",0
"Boandle",0,1,94851,BH,"zBossk Boba Dengar G8 zJango Zam",1
"Boandle",1,0,72247,ShaakClones,"Shaak Ti 3* G8, Rex Echo Fives Clone Sergeant,",0
"Boandle",0,1,75387,Grievous,"zGG B2 5* G7 MagnaGuard G8 Dooku IG-88",0
"Boandle",0,1,83423,Phoenix,"Hera zEzra Zeb G8 zKanan Sabine",1
"Boandle",1,0,57481,Troopers,"Veers 5* G9 Starck G7 Shoretrooper G8 Snowtrooper G8 Stormtrooper G8",0
"Boandle",0,1,81907,FO,"zzKRU zKylo Phasma G8 FOO G8 FOTP G9",1
"Boandle",1,1,72025,Rogue1,"Jyn G8 Chirrut Baze G8 K-2SO G8 Cassian G8",1
"Boandle",1,0,84673,zMaul,"Maul Sidious zVader zSavage Sith Assassin G8,",0
"Boandle",1,0,77420,QGJ,"zQGJ Aayla 4* G5 JKA Old Ben G9, Ahsoka",0
"Boandle",1,0,68957,Jawas,"Nebit G8 Jawa Engineer G9, Jawa Scavenger G9, Jawa G9 Dathcha",1
"Soresu Master12",0,1,75612,BH,"Jango 3* G7 Boba Cad Dengar IG-88",0
"Soresu Master12",1,0,57105,501st,"Rex 4* Clone Sergeant 5* G8, Echo 4* G9 zFives 5* G8 Ahsoka",0
"Soresu Master12",1,0,109316,CLS,"zzzCLS zHan Leia G9 Old Ben G9, zzChewbacca",1
"Soresu Master12",0,1,69713,Phoenix,"Hera G9 Chopper G8 Ezra Zeb G8 Kanan G8",1
"Soresu Master12",0,1,74208,FO,"zKRU Kylo Phasma G8 FOE 6* FOTP 6*",0
"Jahen Corl",1,1,114372,Revan,"zzzJKR zBS zzGMY zJolee zGK",1
"Jahen Corl",0,1,109705,BH,"zzBossk zBoba zDengar zGreedo zIG-88",1
"Jahen Corl",1,1,48413,Ewoks,"Chirpa G6 Elder G4 Paploo G3 Scout G5 Logray G3",0
"Jahen Corl",1,0,70949,501st,"Rex G8 Clone Sergeant, Echo G8 Fives G8 Ahsoka",0
"Jahen Corl",1,0,108295,CLS,"zzzCLS zHan Leia zzOld Ben, zzChewbacca",1
"Jahen Corl",1,0,41334,Troopers,"Veers G5 Starck G6 DT G1 Snowtrooper G7 Stormtrooper G3",0
"Jahen Corl",0,1,96757,Phoenix,"zHera Chopper zEzra zZeb zKanan",1
"Jahen Corl",0,1,76415,FO,"zzKRU Kylo Phasma G8 FOE FOO G8",1
"Jahen Corl",1,0,94891,zMaul,"Maul G8 zDooku zDN G8 zzVader zzEP",0
"Jahen Corl",1,0,84905,Jawas,"Nebit Jawa Engineer, Jawa Scavenger, Jawa Dathcha",1
"SHOOTER",1,0,111345,padme,"zzPadme zGK zJKA zAhsoka zzC-3PO G9",1
"SHOOTER",1,1,96533,NestSisters,"zAV MT Daka Zombie zNest",0
"SHOOTER",,,390221,HansMF,"Home One, Han's MF, HT Biggs X-wing, Phantom Ghost Cassian's U-wing, Bistan's U-wing,",1
"SHOOTER",0,1,71008,Geonosians,"GBA 5* Poggle Geo Soldier, Geo Spy G8, Sun Fac G8,",0
"SHOOTER",1,1,105968,JTR,"zzJTR Scav Rey, zBB-8 zzR2-D2 Finn",1
"SHOOTER",1,0,105047,Traya,"Traya 6* zDN zSion zzEP zzThrawn",0
"SHOOTER",1,1,90329,Ewoks,"zChirpa Elder Paploo G8 zWicket zLogray",1
"SHOOTER",0,1,79754,Grievous,"zzGG B2 5* G8 Droideka G9 MagnaGuard G8 zDooku",0
"SHOOTER",1,0,70367,ShaakClones,"Shaak Ti 4* G8, Rex Echo G9 Fives G8 Clone Sergeant G9,",0
"SHOOTER",0,1,105332,BH,"zzBossk zBoba Cad zJango Zam",1
"SHOOTER",1,1,44192,Carth,"Carth Onasi 3* G7, Mission 5* G8 Zaalbar G8 Juhani 4* G6 Canderous 3* G7",0
"SHOOTER",1,0,117813,Wiggs,"Wedge Biggs zzzCLS zHan zzChewbacca",1
"SHOOTER",0,1,86520,FO,"zzKRU Kylo FOE FOO FOST G8",1
"SHOOTER",0,1,80277,Phoenix,"Hera Chopper Ezra Zeb G8 Kanan",1
"SHOOTER",0,1,107284,BS,"zBS zzGMY zJolee zzOld Ben, HYoda 5* G6",0
"SHOOTER",1,0,86008,zMaul,"Maul G8 zBSF Sidious zzVader Savage G5",0
"Jameg",0,1,80078,BH,"Jango 6* G8 zBoba Cad G8 Greedo G9 IG-88 G8",0
"Jameg",1,0,57972,501st,"Rex 5* G8 Clone Sergeant 6* G8, Echo 4* G8 Fives G8 Ahsoka G8",0
"Jameg",0,1,73223,Phoenix,"Hera G9 Ezra Zeb G8 Kanan Sabine G8",1
"Jameg",1,0,98875,Wiggs,"Wedge Biggs G8 zzzCLS zHan zLeia",1
"Jameg",1,1,82843,zEP,"zEP zzVader Tarkin Dooku G8 TFP 4* G7",0
"Jameg",0,1,69466,FO,"KRU G8 Kylo G9 Phasma G8 FOO G8 FOTP G8",0
"Wagg Doha",0,1,89876,padme,"zzPadme 6* GK JKA zAhsoka Fives 4* G8",0
"Wagg Doha",1,1,83722,NestSisters,"zAV zMT Daka G9 Zombie 6* zNest 3*",0
"Wagg Doha",1,0,80715,CLS,"CLS Han Leia G9 Old Ben, zzChewbacca 5*",0
"Wagg Doha",0,1,61977,BH,"zBossk 5* G8 Boba 6* G9 Cad G9 Greedo 6* G8 Jango 4* G8",0
"Wagg Doha",0,1,66374,Phoenix,"Hera G8 Chopper G8 zEzra Zeb G8 Kanan G8",1
"Wagg Doha",0,1,57948,FO,"KRU G7 Kylo Phasma G7 FOO G6 FOSFTP G7",0
"Wagg Doha",1,0,9339,SionSolo,"Sion 4* G9",0
"Jazzy",0,1,52511,Qira,"Qira 5* G8 L3-37 4* G8 Vandor Chewbacca 4* G6, Mission G9 Zaalbar G8",0
"Jazzy",1,1,89722,NS,"zzMT G8 zzAV zDaka Zombie Spirit G9",1
"Jazzy",0,1,78150,padme,"Padme 6* G7 zGK G9 JKA Ahsoka zBarriss",0
"Jazzy",,,339272,HansMF,"Home One, Han's MF 6*, HT Biggs X-wing, Phantom Ghost Cassian's U-wing, Bistan's U-wing,",1
"Jazzy",0,1,74269,Geonosians,"GBA 6* Poggle Geo Soldier, Geo Spy G8, Sun Fac G8,",0
"Jazzy",1,1,92816,JTR,"zzJTR G9 Scav Rey, zBB-8 G8 zzR2-D2 zFinn",1
"Jazzy",1,0,96930,Traya,"Traya 6* G8 zzDN Sion G9 zzEP zzThrawn",0
"Jazzy",1,1,98492,Revan Offense,"zJKR G9 zzGMY zBS zJolee HYoda G8",0
"Jazzy",1,1,87442,Ewoks,"zChirpa Elder zPaploo zWicket zLogray G8",1
"Jazzy",1,0,89728,CLS,"zzzCLS zHan Chewbacca 6* G9 zLeia C-3PO 6* G7",0
"Jazzy",0,1,104465,BH,"zzBossk zBoba Dengar G9 zIG-88 zZam",1
"Jazzy",0,1,77382,Grievous,"GG G9 B2 G8 MagnaGuard G8 Nute G9 zDooku",0
"Jazzy",1,0,75256,ShaakClones,"Shaak Ti 5* G8, Rex Echo G9 Fives Clone Sergeant,",0
"Jazzy",0,1,75163,Phoenix,"Hera G8 zEzra Zeb G8 zKanan G8 Sabine G8",1
"Jazzy",1,0,61584,Troopers,"Veers G9 Starck G7 Shoretrooper 5* G7 Snowtrooper G7 Stormtrooper G9",0
"Jazzy",0,1,80973,FO,"zzKRU zKylo G9 FOO G8 FOST G9 FOTP G9",1
"Jazzy",1,1,60456,Rogue1,"Jyn G7 Chirrut G7 Baze G7 K-2SO G8 Cassian G8",0
"Jazzy",1,0,92182,zMaul,"zMaul Sidious zzVader zSavage Sith Assassin G8,",1
"Jazzy",1,0,67519,Jawas,"Nebit G8 Jawa Engineer G9, Jawa Scavenger G7, Jawa G8 Dathcha G8",0
"2xN",1,1,57579,NS_Alt,"MT G8 AV G8 Zombie 6* Daka G8 Talia 5* G8",0
"2xN",0,1,81933,BH,"zBossk G9 Boba Cad Dengar G9 Greedo G9",1
"2xN",1,1,42533,GK,"GK 5* G7 Barriss 5* G8 Ahsoka G4 JKA 4* G5 GMY G9",0
"2xN",1,0,77622,Wiggs,"Wedge G8 Biggs zzCLS Han G9 Ezra",1
"2xN",1,0,68252,Rex,"Rex 6* G7 zDN Chirrut G9 Baze G8 R2-D2 G9",0
"2xN",0,1,66881,Phoenix,"Hera Chopper Zeb Kanan Sabine 5* G8",0
"2xN",0,1,63474,FO,"KRU Kylo G9 Phasma G8 FOO G8 FOTP G9",0
"2xN",1,0,19825,SionSolo,"zSion",1
"Sutti",1,0,121156,padme,"zzPadme zGK zJKA zAhsoka zC-3PO",1
"Sutti",1,1,93318,NestSisters,"zzAV zzMT Daka G9 Zombie Nest",0
"Sutti",0,1,136175,DRMalak,"zzzDR zzHK-47 zBSF zzMalak zzThrawn",1
"Sutti",,,354082,HansMF,"Home One, Han's MF, HT Biggs X-wing, Phantom Ghost Cassian's U-wing, Bistan's U-wing 5*,",0
"Sutti",0,1,93442,Geonosians,"zzGBA Poggle Geo Soldier, Geo Spy, Sun Fac,",1
"Sutti",1,1,95147,JTR,"zzJTR Scav Rey, BB-8 zR2-D2 Finn",1
"Sutti",1,0,90388,Traya,"zTraya 6* DN Sion Dooku zEP",0
"Sutti",1,1,115980,Revan Offense,"zzzJKR zGMY zBS zJolee HYoda",1
"Sutti",1,1,78113,Ewoks,"zChirpa G9 Elder Paploo G9 Wicket Logray G9",1
"Sutti",1,1,80133,GAS,"GAS 5* G7 Rex Echo zFives ARC Trooper G8,",0
"Sutti",0,1,121935,Grievous,"zzGG zB2 zB1 zDroideka zMagnaGuard",1
"Sutti",1,1,86473,Carth,"zCarth Onasi, zMission Zaalbar Juhani G8 Canderous",1
"Sutti",0,1,103437,BH,"zzBossk zBoba Dengar Greedo zJango",1
"Sutti",0,1,81434,FO,"zzKRU Kylo G9 FOE G9 FOO FOST G9",1
"Sutti",0,1,70858,Phoenix,"Hera G8 Ezra Zeb G8 Kanan G8 Sabine G8",1
"Sutti",1,0,100622,Wiggs,"Wedge G9 Biggs zzzCLS zHan Chewbacca",1
"Sutti",1,0,69828,Troopers,"Veers Starck G9 DT G9 Shoretrooper G8 Snowtrooper G8",1
"Sutti",1,1,66013,Rogue1,"Jyn 6* G8 Chirrut G8 Baze G8 K-2SO G8 Cassian G9",0
"Sutti",1,0,76772,zMaul,"Maul Sidious G8 zVader Savage G8 Sith Empire Trooper,",0
"Dalziel",1,0,94347,padme,"Padme G8 zGK JKA Ahsoka zzC-3PO",0
"Dalziel",1,1,92941,NestSisters,"zAV zMT Daka Zombie zNest",0
"Dalziel",,,388120,HansMF,"Home One, Han's MF, HT Biggs X-wing, Phantom Ghost Cassian's U-wing, Bistan's U-wing,",1
"Dalziel",0,1,98208,DR,"zzzDR zHK-47 zBSF Sith Assassin 6* G6, zThrawn",0
"Dalziel",1,1,111446,JTR,"zzzJTR Scav Rey, zzBB-8 zzR2-D2 Finn",1
"Dalziel",1,0,95688,Traya,"zzTraya 6* G9 zDN Sion 6* G8 zDooku zzEP",0
"Dalziel",1,1,120729,Revan Offense,"zzzJKR zzGMY zBS zJolee zzHYoda",1
"Dalziel",1,1,86627,Ewoks,"zChirpa Elder zPaploo zWicket Logray G9",1
"Dalziel",1,1,93072,Carth,"zCarth Onasi, zMission zZaalbar Juhani zCanderous",1
"Dalziel",0,1,74332,Grievous,"GG 6* G7 zB2 B1 G8 Droideka G8 IG-88",0
"Dalziel",0,1,102926,BH,"zzBossk zBoba Dengar Jango Zam",1
"Dalziel",1,0,89855,ShaakClones,"Shaak Ti 4* G8, zRex zEcho zFives Clone Sergeant,",0
"Dalziel",1,0,89420,Troopers,"zVeers zStarck DT Range Trooper, Shoretrooper",1
"Dalziel",0,1,88786,FO,"zKRU zKylo FOE FOO FOST G9",1
"Dalziel",1,0,112899,CLS,"zzzCLS zHan Wedge Biggs zzChewbacca",1
"Dalziel",0,1,71653,Phoenix,"Hera G9 Chopper Ezra G8 Zeb G8 Kanan G8",1
"Dalziel",1,1,59379,Rogue1,"Jyn 5* G7 Chirrut G8 Baze 4* G6 Cassian G8 Pao G8",0
"Dalziel",1,0,89113,zMaul,"zMaul Sidious zzVader Savage Sith Empire Trooper G8,",1
"Dalziel",1,0,71543,Jawas,"Nebit G9 Jawa Engineer G9, Jawa Scavenger G8, Jawa G9 Dathcha",1
"RedWolf",0,1,79893,Qira,"Qira G9 L3-37 G8 Vandor Chewbacca G4, zMission zZaalbar",0
"RedWolf",1,0,107765,padme,"zzPadme zGK zJKA zAhsoka zC-3PO G9",1
"RedWolf",0,1,113444,DRMalak,"zzzDR zzHK-47 zBSF zzMalak 6* Thrawn G9",1
"RedWolf",1,1,85449,NestSisters,"zzAV MT G8 Daka G9 Zombie Nest",0
"RedWolf",,,379554,HansMF,"Home One, Han's MF, HT Biggs X-wing, Phantom Ghost Cassian's U-wing, Bistan's U-wing,",1
"RedWolf",0,1,77458,Geonosians,"zzGBA Poggle Geo Soldier G8, Geo Spy G7, Sun Fac G7,",1
"RedWolf",1,1,102470,JTR,"zzzJTR Scav Rey, zBB-8 G9 zzR2-D2 Finn G8",1
"RedWolf",1,0,83122,Traya,"Traya 6* G6 DN G8 Sion G9 zDooku zzEP",0
"RedWolf",1,1,112329,Revan Offense,"zzzJKR zzGMY BS zJolee zzHYoda",1
"RedWolf",1,1,87475,Ewoks,"zChirpa Elder zPaploo zWicket Logray G8",1
"RedWolf",0,1,86806,Grievous,"zGG B2 G8 B1 G9 Droideka G8 zNute",0
"RedWolf",0,1,98796,BH,"zzBossk zBoba Dengar G8 Greedo Jango",1
"RedWolf",1,0,72577,ShaakClones,"Shaak Ti G8, Rex Echo G7 Fives G9 Clone Sergeant G8,",0
"RedWolf",1,0,57363,Troopers,"Veers Starck G6 Range Trooper G7, Shoretrooper G7 Stormtrooper G7",0
"RedWolf",0,1,69723,Phoenix,"Hera G9 Ezra G8 Zeb G8 Kanan G8 Sabine G8",1
"RedWolf",1,0,89848,Wiggs,"Wedge G8 Biggs G8 zzzCLS Fulcrum Leia",1
"RedWolf",0,1,82991,FO,"zzKRU zKylo FOO G8 FOST G8 FOTP",1
"RedWolf",1,1,95587,Rogue1,"zJyn Chirrut Baze zK-2SO Cassian",1
"RedWolf",1,0,74331,zMaul,"Maul G7 Sidious G9 zzVader Sith Marauder G8, Sith Empire Trooper G5,",0
"RedWolf",1,0,62107,Jawas,"Nebit G7 Jawa Engineer G7, Jawa Scavenger G8, Jawa G7 Dathcha G8",0
"Tanner",1,0,86817,padme,"zzPadme G9 zGK zJKA zAhsoka C-3PO 5* G7",0
"Tanner",0,1,73872,Geonosians,"zzGBA 5* Poggle Geo Soldier G9, Geo Spy 6* G9, Sun Fac,",0
"Tanner",1,1,62960,NestSisters,"AV zMT 5* G9 Daka G9 Zombie 4* zNest 3* G7",0
"Tanner",1,0,112026,ShaakClones,"zzShaak Ti 5*, zRex zEcho zzFives Clone Sergeant,",0
"Tanner",0,1,92036,Grievous,"zzGG zB2 6* G9 zMagnaGuard G9 zNute zDooku",0
"Tanner",1,1,67705,Ewoks,"zChirpa 5* Elder 5* Paploo 5* Teebo G9 Scout",0
"Tanner",1,1,36102,Carth,"Carth Onasi 3* G7, Mission 5* G8 Zaalbar 5* G7 Juhani 3* G7 Canderous 3* G7",0
"Tanner",1,1,87081,zEP,"zEP zVader Tarkin zDT IPD G8",0
"Tanner",0,1,93208,BH,"zzJango 4* zBoba Cad zGreedo zIG-88",0
