Player,Offense,Defense,GP,Name,Squad,Viable
"Scuba Bill23",1,1,72376,JTR,"JTR G8, Scav Rey, BB-8 G9, zR2-D2 Finn G9",0
"Scuba Bill23",1,0,71677,Wiggs,"Wedge G1, Biggs G8, zCLS zHan Ezra",0
"Scuba Bill23",0,1,59307,FO,"KRU Kylo G9, FOE 4* Sith Trooper 6* G7, Hux 6* G8",0
"Jazzy",0,1,101916,padme,"zzPadme zGK zJKA zAhsoka zBarriss",1
"Jazzy",,,372202,HansMF,"Home One, Han's MF, HT Biggs X-wing, Phantom Ghost Cassian's U-wing, Bistan's U-wing",1
"Jazzy",1,1,99330,JTR,"zzzJTR Scav Rey, zBB-8 G9, zzR2-D2 zFinn",1
"Jazzy",0,1,84246,Grievous,"zGG B2 G9, Droideka G9, MagnaGuard G9, zDooku",1
"Jazzy",1,1,108409,Revan Offense,"zzzJKR zzGMY zBS zJolee HYoda G9",1
"Jazzy",1,0,107485,CLS,"zzzCLS zHan zChewbacca zLeia zC-3PO G9",1
"Jazzy",1,1,91970,Ewoks,"zChirpa Elder zPaploo zWicket zLogray",1
"Jazzy",1,1,82775,Carth,"zCarth Onasi, Mission Zaalbar G8, zJuhani Canderous",1
"Jazzy",1,0,84849,Clones,"zCody Rex Echo Fives Clone Sergeant",1
"Jazzy",1,0,81872,Thragma (Counter),"zzThrawn Magma G7, Krennic G7, zTarkin Stormtrooper G9",1
"Jazzy",1,0,99427,zMaul,"zMaul zBSF zzDN Sidious zSavage",1
"Jazzy",1,0,87696,IG88,"zIG-88 Wampa G8, Cassian G8, zBoba zKylo",1
"Jazzy",1,0,17667,SionSolo (Counter),"Sion",1
"Jazzy",1,1,90496,NS,"zzMT G8, zzAV zDaka Zombie Spirit G9",0
"Jazzy",0,1,76510,Geonosians,"GBA Poggle Geo Soldier, Geo Spy G8, Sun Fac G8",0
"Jazzy",,,340772,Executrix,"Executrix Tie Adv, Emperor's Shuttle 5*, TIE Reaper 5*, Imperial TIE Fighter, Gauntlet Starfighter, First Order SF TIE Fighter, First Order TIE Fighter",0
"Jazzy",1,1,65491,Rogue1,"Jyn G7, Chirrut G8, Baze G7, Bodhi Rook G8, K-2SO G8",0
"Jazzy",1,0,68995,Jawas,"Nebit G8, Jawa Engineer G9, Jawa Scavenger G7, Jawa G9, Dathcha G9",0
"Jazzy",1,0,67490,EP (Counter, Rebel),"zzEP Shoretrooper 6* G8, DT 5* G8, Nest 5* G7, Starck G7",0
"Chubbs Peterson",0,1,145011,DRMalak,"zzzDR zzHK-47 zBSF zzMalak Sith Empire Trooper",1
"Chubbs Peterson",0,1,129781,padme,"zzPadme zGK zJKA zAhsoka zzC-3PO",1
"Chubbs Peterson",,,367671,HansMF,"Home One, Han's MF, HT Biggs X-wing, Phantom Ghost Cassian's U-wing, Bistan's U-wing",1
"Chubbs Peterson",0,1,102515,Geonosians,"zzGBA Poggle Geo Soldier, Geo Spy, Sun Fac",1
"Chubbs Peterson",1,0,113369,Traya,"zzTraya zDN zSion zzEP zThrawn",1
"Chubbs Peterson",0,1,107947,Grievous,"zzGG zB2 zB1 zDroideka zMagnaGuard",1
"Chubbs Peterson",1,1,113561,JTR,"zzzJTR Scav Rey, zzBB-8 zzR2-D2 Finn",1
"Chubbs Peterson",1,1,119055,Revan Offense,"zzzJKR zzGMY zBS zJolee zHYoda",1
"Chubbs Peterson",,,97431,Nute-Sep,"zNute Dooku zJango zNest zAV",1
"Chubbs Peterson",1,0,108964,ShaakClones,"zzShaak Ti, zRex zEcho zzFives zARC Trooper",1
"Chubbs Peterson",1,1,81824,Ewoks,"zChirpa Elder Paploo Scout Logray",1
"Chubbs Peterson",1,1,89328,Carth,"zCarth Onasi, zMission Zaalbar Juhani Canderous G8",1
"Chubbs Peterson",1,0,113433,CLS,"zzzCLS zHan Leia G8, zOld Ben, zzChewbacca",1
"Chubbs Peterson",1,0,84168,Wiggs,"Wedge G8, Biggs Fulcrum Chirrut Baze",1
"Chubbs Peterson",,,83606,Disintegration,"Aurra 4* G7, Greef Karga 5* G8, Boba zzBossk The Mandalorian 6* G9",0
"Chubbs Peterson",0,1,95694,FO,"zzKRU zKylo FOE G9, Sith Trooper 6* G4, zHux",0
"JuanQue NoloVi",0,1,110415,DR,"zzzDR zzHK-47 zBSF Sith Empire Trooper, Sith Assassin",1
"JuanQue NoloVi",0,1,88395,Geonosians,"zzGBA Poggle Geo Soldier, Geo Spy, Sun Fac G8",1
"JuanQue NoloVi",1,1,122262,Revan,"zzzJKR zBS zzGMY zJolee GK",1
"JuanQue NoloVi",1,1,99939,Carth,"zCarth Onasi, zMission zZaalbar zJuhani zCanderous",1
"JuanQue NoloVi",1,0,101058,Zader (Counter),"zzzVader Tarkin Sidious zBoba Stormtrooper",1
"JuanQue NoloVi",1,0,68756,Jawas,"Nebit G8, Jawa Engineer G9, Jawa Scavenger G8, Jawa G9, Dathcha",1
"JuanQue NoloVi",1,1,120292,NS,"zzMT zzAV zDaka Zombie 6* Spirit G9",0
"JuanQue NoloVi",1,0,67365,Traya,"Traya G8, DN G8, Sion 6* G8, EP Thrawn G8",0
"JuanQue NoloVi",1,0,62859,ShaakClones,"Shaak Ti 4* G7, Rex G8, Echo G8, Fives G8, Clone Sergeant G8",0
"JuanQue NoloVi",1,0,81948,Wiggs,"Wedge 6* G8, Biggs G8, zCLS Fulcrum zEzra",0
"JuanQue NoloVi",1,1,64477,Rogue1,"Jyn G8, Chirrut G8, Baze 5* G8, Cassian G8, K-2SO G8",0
"JuanQue NoloVi",1,0,62592,IG88,"IG-88 GG G8, BB-8 G8, T3-M4 G8, L3-37 5* G8",0
"Senat0r Lipost",0,1,106474,padme,"zzPadme zGK JKA Ahsoka zzC-3PO",1
"Senat0r Lipost",1,1,101560,NS_Alt,"zzMT Acolyte zDaka zzAV Zombie",1
"Senat0r Lipost",0,1,89070,Geonosians,"zzGBA Poggle Geo Soldier, Geo Spy, Sun Fac G9",1
"Senat0r Lipost",,,385202,HansMF,"Home One, Han's MF, HT Biggs X-wing, Phantom Ghost Cassian's U-wing, Rey's Millennium Falcon",1
"Senat0r Lipost",0,1,89363,Grievous,"zzGG B2 G8, B1 Droideka G8, MagnaGuard G8",1
"Senat0r Lipost",1,1,114203,JTR,"zzzJTR Scav Rey, zzBB-8 zzR2-D2 zFinn",1
"Senat0r Lipost",1,1,115260,Revan Offense,"zzzJKR zzGMY zBS zJolee Ezra",1
"Senat0r Lipost",1,1,91986,Ewoks,"zChirpa Elder zPaploo zWicket zLogray G9",1
"Senat0r Lipost",1,0,85442,Wiggs,"Wedge G8, Biggs G8, zzzCLS Han Chewbacca G9",1
"Senat0r Lipost",1,1,103634,zEP,"zzEP zzzVader Tarkin Dooku TFP G9",1
"Senat0r Lipost",1,0,13750,SionSolo (Counter),"Sion G9",1
"Senat0r Lipost",0,1,66375,Qira,"Qira 6* G8, L3-37 5* G8, Vandor Chewbacca 3* G7, zMission zZaalbar",0
"Senat0r Lipost",0,1,110548,DRMalak,"zzzDR zzHK-47 zBSF Malak G8, zThrawn",0
"Senat0r Lipost",,,333074,Executrix,"Executrix Tie Adv, Emperor's Shuttle, TIE Reaper, Imperial TIE Fighter, Gauntlet Starfighter 5*, First Order SF TIE Fighter 1*, First Order TIE Fighter",0
"Senat0r Lipost",,,75824,Disintegration,"Aurra 3* G8, Greef Karga 4* G7, zBoba zzBossk The Mandalorian 5* G8",0
"Senat0r Lipost",1,0,78336,ShaakClones,"Shaak Ti G9, Rex Echo Fives G9, ARC Trooper G8",0
"Senat0r Lipost",1,1,52445,Rogue1,"Jyn 5* G7, Chirrut 4* G8, Baze 4* G7, Cassian G8, K-2SO G8",0
"Senat0r Lipost",1,0,58968,Krennic,"Krennic 4* G8, DT 4* G8, Shoretrooper G8, Range Trooper G8, Starck G9",0
"Senat0r Lipost",0,1,68514,FO,"KRU Kylo FOE 5* Sith Trooper 3* G7, Hux 5* G8",0
"Senat0r Lipost",1,0,61978,Jawas,"Nebit G7, Jawa Engineer 4* G9, Jawa Scavenger G8, Jawa G9, Dathcha",0
"Senat0r Lipost",1,0,14095,NestSolo (Counter),"Nest 6*",0
"Blades",1,0,98184,CLS,"zzCLS zHan Leia G9, Old Ben, zChewbacca",1
"Blades",1,0,89681,Zader (Counter),"zzzVader Tarkin G8, Sidious G8, zBoba Stormtrooper G9",1
"Blades",1,1,66701,Ewoks,"zChirpa G8, Elder Paploo Wicket 4* G8, Logray 5*",0
"Blades",0,1,71097,BS,"BS G9, GMY Ahsoka G8, GK G9, Ezra",0
"Michl Johso",0,1,147405,DRMalak,"zzzDR zzHK-47 zBSF zzMalak Sith Empire Trooper",1
"Michl Johso",0,1,107317,padme,"zzPadme zGK zJKA zAhsoka CW Chewbacca G9",1
"Michl Johso",,,398698,Negotiator,"Negotiator 5* HT Anakin's Eta-2 Starfighter, Umbaran Starfighter, Ahsoka Tano's Jedi Starfighter, Clone Sergeant's ARC-170, Jedi Consular's Starfighter, Plo Koon's Jedi Starfighter",1
"Michl Johso",0,1,93085,Geonosians,"zzGBA Poggle Geo Soldier, Geo Spy, Sun Fac",1
"Michl Johso",1,0,123708,Traya,"zzTraya zzDN zSion zzEP zThrawn",1
"Michl Johso",1,1,103533,JTR,"zzzJTR Scav Rey, zBB-8 zzR2-D2 zFinn",1
"Michl Johso",,,101876,Nute-OR,"zNute zDooku zJango zZaalbar zMission",1
"Michl Johso",1,1,114974,Revan Offense,"zzzJKR zGMY zBS zJolee zEzra",1
"Michl Johso",1,1,92381,Ewoks,"zChirpa Elder zPaploo Scout zWicket",1
"Michl Johso",1,0,92315,Clones,"zCody Rex zEcho zFives Clone Sergeant",1
"Michl Johso",1,0,108857,CLS,"zzzCLS zHan zLeia Old Ben, zzChewbacca",1
"Michl Johso",1,0,97852,Zader (Counter),"zzzVader Tarkin Sidious zBoba Stormtrooper G8",1
"Michl Johso",1,0,74389,Jawas,"Nebit G8, Jawa Engineer G9, Jawa Scavenger G9, Jawa G9, Dathcha",1
"Michl Johso",1,1,80539,NS,"zMT G8, zAV Daka Zombie G9, Spirit G8",0
"Michl Johso",0,1,96014,Grievous,"GG zB2 zB1 zMagnaGuard zT3-M4",0
"Michl Johso",1,1,58565,Rogue1,"Jyn 4* G8, Chirrut 4* G7, Baze 3* G7, zCassian G8, K-2SO G8",0
"Michl Johso",1,0,10257,NestSolo (Counter),"Nest 5* G8",0
"Upgreyd",1,1,98138,NS,"zMT zAV zDaka Zombie Spirit",1
"Upgreyd",0,1,109106,padme,"zzPadme GK JKA zAhsoka zC-3PO",1
"Upgreyd",0,1,99024,DR,"zzzDR zHK-47 zBSF Sith Empire Trooper G8, Sith Assassin G8",1
"Upgreyd",,,394242,HansMF,"Home One, Han's MF, HT Biggs X-wing, Phantom Ghost Cassian's U-wing, Bistan's U-wing",1
"Upgreyd",0,1,99574,Geonosians,"zzGBA Poggle Geo Soldier, Geo Spy, Sun Fac",1
"Upgreyd",0,1,84239,Grievous,"zGG zB2 G9, zB1 Droideka G8, MagnaGuard G8",1
"Upgreyd",1,1,106077,JTR,"zJTR Scav Rey, BB-8 zzR2-D2 zFinn",1
"Upgreyd",1,1,122137,Revan Offense,"zzzJKR zzGMY HYoda zJolee Ezra",1
"Upgreyd",1,1,86057,Ewoks,"zChirpa Elder Paploo Wicket Logray",1
"Upgreyd",1,1,90061,Carth,"zCarth Onasi, Mission Zaalbar Juhani Canderous",1
"Upgreyd",1,0,78327,Wiggs,"Wedge G8, Biggs G8, CLS Han Chewbacca",1
"Upgreyd",1,0,67963,Wampa (Counter),"Rex G7, Wampa G8, DT G8, Jyn G8, FOO G8",1
"Upgreyd",1,0,88628,Zader (Counter),"Vader Tarkin Sidious G8, Boba Stormtrooper G8",1
"Upgreyd",1,0,17574,SionSolo (Counter),"Sion",1
"Upgreyd",1,0,16303,NestSolo (Counter),"Nest",1
"Upgreyd",,,296517,Executrix,"Executrix Tie Adv, Emperor's Shuttle 5*, TIE Reaper 5*, Imperial TIE Fighter, Gauntlet Starfighter, First Order SF TIE Fighter 4*, First Order TIE Fighter",0
"Upgreyd",0,1,64022,FO,"zKRU G8, Kylo G8, FOE Sith Trooper 3* G7, Hux 4* G7",0
"Upgreyd",1,0,64866,Jawas,"Nebit G8, Jawa Engineer 6* G9, Jawa Scavenger G7, Jawa G9, Dathcha G9",0
"Upgreyd",1,0,59579,EP (Counter, Rebel),"EP Shoretrooper 6* G7, Krennic 5* G7, Range Trooper 5* G6, Starck G9",0
"Drcct",1,1,116796,NS,"zzMT zzAV zDaka Zombie Spirit",1
"Drcct",0,1,105260,padme,"zzPadme zGK zJKA zAhsoka C-3PO G8",1
"Drcct",0,1,101119,Geonosians,"zzGBA Poggle Geo Soldier, Geo Spy, Sun Fac",1
"Drcct",0,1,91104,Grievous,"zzGG B2 G9, zB1 zDroideka MagnaGuard G8",1
"Drcct",1,1,114440,JTR,"zzzJTR zScav Rey, zzBB-8 zzR2-D2 zFinn",1
"Drcct",1,1,104803,Ewoks,"zChirpa Elder zPaploo zWicket zLogray",1
"Drcct",1,0,102810,ShaakClones,"zzShaak Ti, zRex zEcho zzFives Clone Sergeant",1
"Drcct",1,0,100655,Wiggs,"Wedge Biggs zzzCLS zEzra zLeia",1
"Drcct",1,1,112338,zEP,"zzEP zzzVader zzTarkin zDooku TFP G9",1
"Drcct",1,0,69411,Jawas,"Nebit G9, Jawa Engineer G9, Jawa Scavenger G9, Jawa G9, Dathcha",1
"Drcct",,,441116,Raddus,"Raddus 4* Sun Fac SF, Rey's Millennium Falcon, Poe Dameron's X-wing, Resistance X-wing, Biggs X-wing, Wedge X-wing, Phantom Ghost",0
"Rouge 5hadow",1,1,122480,Revan,"zzzJKR zBS zGMY zJolee GK",1
"Rouge 5hadow",1,0,93324,Zader (Counter),"zzVader zMission G8, Zaalbar G8, zzWampa zBoba G9",1
"Rouge 5hadow",1,0,20038,SionSolo (Counter),"zSion",1
"Rouge 5hadow",0,1,64988,Geonosians,"zGBA Poggle G6, Geo Soldier G4, Geo Spy G5, Sun Fac G4",0
"Rouge 5hadow",1,1,71643,NS,"zMT AV Daka G8, Zombie 5* Spirit 5* G8",0
"Rouge 5hadow",1,0,12697,NestSolo (Counter),"zNest 3*",0
"Squirty",1,1,124904,GL Rey,"zzzzzzRey Holdo zGK zResistance Hero Poe, zResistance Hero Finn",1
"Squirty",1,1,100474,NestSisters,"zzAV zMT zDaka Zombie zNest",1
"Squirty",0,1,107129,DR,"zzzDR zHK-47 zBSF Sith Empire Trooper G8, zThrawn",1
"Squirty",,,374699,HansMF,"Home One, Han's MF, HT Biggs X-wing, Phantom Ghost Cassian's U-wing, Bistan's U-wing",1
"Squirty",0,1,93996,Geonosians,"zzGBA Poggle Geo Soldier, Geo Spy, Sun Fac",1
"Squirty",0,1,109522,Grievous,"zGG zB2 zB1 zDroideka MagnaGuard",1
"Squirty",1,1,138977,JTR,"zzzJTR Scav Rey, zBB-8 zzR2-D2 Finn",1
"Squirty",1,1,104871,Revan Offense,"zzJKR zGMY HYoda zJolee zJKA",1
"Squirty",1,0,107321,CLS,"zzCLS zHan zChewbacca Leia zzC-3PO",1
"Squirty",1,1,84275,Carth,"Carth Onasi, Mission Zaalbar Juhani G8, Canderous",1
"Squirty",1,1,104009,zEP,"zzEP zzzVader Tarkin DT TFP",1
"Squirty",0,1,108761,FO,"zzKRU zKylo FOE Sith Trooper, zHux",1
"Squirty",1,0,13324,SionSolo (Counter),"Sion G8",1
"Squirty",,,242770,Malevolence,"Malevolence 5* Sun Fac SF, Soldier SF, Spy SF, Hyena Bomber 5*, Vulture Droid 6*, IG-2000",0
"Squirty",,,345873,Executrix,"Executrix Tie Adv, Emperor's Shuttle 5*, TIE Reaper, Imperial TIE Fighter, Gauntlet Starfighter, First Order SF TIE Fighter, First Order TIE Fighter",0
"Squirty",,,70865,Disintegration,"Aurra 6* G7, Greef Karga 5* G8, zBoba zBossk The Mandalorian 5* G8",0
"Squirty",1,1,74146,GAS,"GAS 6* G8, zRex Echo G9, Fives G9, ARC Trooper G8",0
"Squirty",1,1,76984,Ewoks,"zChirpa Elder Paploo 6* Wicket Logray G9",0
"Squirty",1,1,67821,Rogue1,"Jyn G8, Chirrut G8, Baze G7, Cassian G8, K-2SO G8",0
"Squirty",1,0,46912,Jawas,"Nebit G7, Jawa Engineer G7, Jawa Scavenger G7, Jawa G8, Dathcha G7",0
"Sutti",0,1,146075,DRMalak,"zzzDR zzHK-47 zBSF zzMalak Sith Empire Trooper",1
"Sutti",0,1,125733,padme,"zzPadme zGK zJKA zAhsoka zC-3PO",1
"Sutti",0,1,94573,Geonosians,"zzGBA Poggle Geo Soldier, Geo Spy, Sun Fac",1
"Sutti",1,1,96303,NS_Alt,"zzMT Acolyte Daka zzAV Zombie",1
"Sutti",0,1,125605,Grievous,"zzGG zB2 zB1 zDroideka zMagnaGuard",1
"Sutti",1,0,110129,Traya,"zzTraya zDN Sion zzEP zzThrawn",1
"Sutti",1,1,95672,JTR,"zzJTR Scav Rey, BB-8 zR2-D2 Finn",1
"Sutti",,,405013,HansMF,"Home One, Han's MF, HT Biggs X-wing, Phantom Ghost Cassian's U-wing, Wedge X-wing",1
"Sutti",1,1,140440,GAS,"zzzzGAS zRex zEcho zzFives zARC Trooper",1
"Sutti",1,1,125250,Revan Offense,"zzzJKR zGMY zBS zJolee zHYoda",1
"Sutti",1,1,78663,Ewoks,"zChirpa G9, Elder Paploo G9, Wicket Logray G9",1
"Sutti",1,1,87429,Carth,"zCarth Onasi, zMission Zaalbar Juhani G8, Canderous",1
"Sutti",1,0,114536,Wiggs,"Wedge Biggs zzzCLS zHan zzChewbacca",1
"Sutti",1,1,69783,Rogue1,"Jyn G8, Chirrut G8, Baze G8, Cassian G9, K-2SO G8",1
"Sutti",1,0,110714,Zader (Counter),"zzzVader zWampa Tarkin zBoba Shoretrooper G8",1
"Sutti",1,0,15526,NestSolo (Counter),"Nest",1
"Sutti",,,308658,Executrix,"Executrix Tie Adv, Emperor's Shuttle 6*, TIE Reaper 6*, Imperial TIE Fighter, Gauntlet Starfighter 5*, First Order SF TIE Fighter 4*, First Order TIE Fighter",0
"Sutti",0,1,81591,FO,"zzKRU Kylo G9, FOE G9, Sith Trooper 4* G8, zHux",0
"LordJarJar",0,1,134502,DR,"zzzDR zzHK-47 zBSF Sith Empire Trooper, zThrawn",1
"LordJarJar",1,1,93257,Carth,"zCarth Onasi, zMission zZaalbar zJuhani Canderous",1
"LordJarJar",1,0,82073,Wiggs,"Wedge G8, Biggs G8, zCLS zHan Ezra",1
"LordJarJar",1,1,98638,zEP,"zzEP zzzVader Tarkin zDooku TFP",1
"LordJarJar",0,1,53502,padme,"Padme G9, GK 6* G8, JKA 5* G6, Ahsoka G8, CW Chewbacca G8",0
"LordJarJar",1,0,9277,SionSolo (Counter),"Sion 3* G8",0
"StarKiller316",0,1,117426,padme,"zzPadme zGK JKA zAhsoka zzC-3PO",1
"StarKiller316",1,1,96573,NestSisters,"zzAV zzMT Daka Zombie zNest",1
"StarKiller316",0,1,112340,DR,"zzzDR zzHK-47 zBSF Sith Empire Trooper, Sith Assassin G8",1
"StarKiller316",,,403158,HansMF,"Home One, Han's MF, HT Biggs X-wing, Phantom Ghost Cassian's U-wing, Bistan's U-wing",1
"StarKiller316",0,1,85384,Geonosians,"zzGBA Poggle Geo Soldier, Geo Spy, Sun Fac",1
"StarKiller316",0,1,118164,Grievous,"zzGG zB2 zB1 zDroideka MagnaGuard",1
"StarKiller316",1,1,106249,JTR,"zzzJTR Scav Rey, zzBB-8 zzR2-D2 Finn",1
"StarKiller316",1,1,128030,GAS,"zzzzGAS zRex Echo zzFives zARC Trooper",1
"StarKiller316",1,1,119906,Revan Offense,"zzzJKR zGMY zBS zJolee zzHYoda",1
"StarKiller316",1,1,82074,Ewoks,"zChirpa G9, Elder Paploo zWicket Logray",1
"StarKiller316",0,1,134276,FO,"zzKRU zKylo FOE zSith Trooper, zHux",1
"StarKiller316",1,0,103877,CLS,"zzzCLS zHan Leia Old Ben, zzChewbacca",1
"StarKiller316",1,1,106647,zEP,"zzEP zzzVader Tarkin Dooku TFP",1
"StarKiller316",1,0,78013,Wiggs,"Wedge Biggs Fulcrum G8, Chirrut Baze",1
"StarKiller316",1,0,74484,Jawas,"Nebit Jawa Engineer, Jawa Scavenger G9, Jawa G9, Dathcha",1
"StarKiller316",1,0,16236,SionSolo (Counter),"Sion",1
"StarKiller316",0,1,66480,Qira,"Qira 6* G9, L3-37 4* G8, Vandor Chewbacca 5* G7, zMission zZaalbar",0
"StarKiller316",,,359641,Executrix,"Executrix Tie Adv, Emperor's Shuttle 5*, TIE Reaper 6*, Imperial TIE Fighter, Gauntlet Starfighter 5*, First Order SF TIE Fighter, First Order TIE Fighter",0
"StarKiller316",,,81296,Disintegration,"Aurra 5* G8, Greef Karga 5* G8, zBoba zBossk zThe Mandalorian 6* G9",0
"StarKiller316",1,0,70528,Thragma (Counter),"zThrawn Magma G7, DT 6* G9, Stormtrooper G9, Shoretrooper G8",0
"MetalPrawn",1,1,75219,Ewoks,"zChirpa G9, Elder Paploo G9, Wicket Logray G9",1
"MetalPrawn",1,0,124356,ShaakClones,"zzShaak Ti, zRex zEcho zzFives zARC Trooper",1
"MetalPrawn",1,1,82234,zEP,"zEP zzVader Tarkin G9, Dooku TFP G8",1
"MetalPrawn",0,1,88603,padme,"zzPadme zGK JKA G9, zAhsoka C-3PO 6* G7",0
"MetalPrawn",0,1,88590,Geonosians,"zGBA Poggle Geo Soldier, Geo Spy, Sun Fac",0
"MetalPrawn",0,1,79540,Grievous,"zGG 6* G8, zB2 G9, MagnaGuard G8, Nute IG-88",0
"MetalPrawn",,,305899,HansMF,"Home One 6*, Han's MF 5*, HT Biggs X-wing, Phantom Ghost Tie Adv, Wedge X-wing",0
"MetalPrawn",1,1,56329,NS,"MT 6* G8, AV G9, Daka G9, Zombie 5* G8, Spirit 5* G8",0
"MetalPrawn",1,0,64251,Wiggs,"Wedge 6* G8, Biggs G8, CLS G8, Han Chewbacca G8",0
"MetalPrawn",1,1,42072,Rogue1,"Jyn 5* G8, Chirrut 6* G8, Baze 5* G8, Cassian G8, K-2SO G8",0
"MetalPrawn",1,0,7842,NestSolo (Counter),"Nest 2* G7",0
"Dalziel",0,1,133662,DRMalak,"zzzDR zzHK-47 zBSF zzMalak Sith Empire Trooper",1
"Dalziel",0,1,115332,padme,"zzPadme zGK zJKA zAhsoka zzC-3PO",1
"Dalziel",,,396959,HansMF,"Home One, Han's MF, HT Biggs X-wing, Phantom Ghost Cassian's U-wing, Bistan's U-wing",1
"Dalziel",0,1,83814,Geonosians,"zzGBA G9, Poggle Geo Soldier, Geo Spy, Sun Fac G9",1
"Dalziel",1,0,107525,Traya,"zzTraya zDN zSion zzEP zThrawn",1
"Dalziel",1,1,111914,JTR,"zzzJTR Scav Rey, zzBB-8 zzR2-D2 Finn",1
"Dalziel",,,97087,Nute-OR,"zNute zDooku Jango zZaalbar zMission",1
"Dalziel",1,1,121446,Revan Offense,"zzzJKR zzGMY zBS zJolee zzHYoda",1
"Dalziel",1,1,87023,Ewoks,"zChirpa Elder zPaploo zWicket Logray G9",1
"Dalziel",1,0,107542,ShaakClones,"zzShaak Ti, zRex zEcho zzFives zARC Trooper",1
"Dalziel",1,0,113915,CLS,"zzzCLS zHan Wedge Biggs zzChewbacca",1
"Dalziel",1,0,101666,Zader (Counter),"zzzVader Wampa Tarkin Sidious zBoba",1
"Dalziel",1,0,71856,Jawas,"Nebit G9, Jawa Engineer G9, Jawa Scavenger G8, Jawa G9, Dathcha",1
"Dalziel",1,0,18588,NestSolo (Counter),"zNest",1
"Dalziel",1,1,86342,NS,"zMT zAV Daka Zombie Spirit G7",0
"Dalziel",0,1,98590,Grievous,"zGG zB2 zB1 zDroideka zMagnaGuard",0
"Dalziel",0,1,84620,FO,"zKRU zKylo FOE Sith Trooper 6* G7, Hux G8",0
"Dalziel",1,1,62387,Rogue1,"Jyn 5* G7, Chirrut G8, Baze 5* G7, Cassian G8, K-2SO G8",0
"Dalziel",1,0,78603,Krennic,"Krennic 5* G7, DT Shoretrooper Range Trooper, zStarck",0
"Grand M'uff Talkin",0,1,94376,DR,"zzzDR HK-47 zBSF Sith Empire Trooper, Sith Assassin G8",1
"Grand M'uff Talkin",0,1,92446,Geonosians,"zzGBA Poggle Geo Soldier, Geo Spy, Sun Fac",1
"Grand M'uff Talkin",1,0,110538,Traya,"zzTraya zDN zSion zzEP zThrawn",1
"Grand M'uff Talkin",1,1,115944,JTR,"zzzJTR Scav Rey, zzBB-8 zzR2-D2 zFinn",1
"Grand M'uff Talkin",0,1,87627,Grievous,"zzGG B2 MagnaGuard G9, Dooku T3-M4",1
"Grand M'uff Talkin",1,1,116482,Revan,"zzzJKR zBS zzGMY zJolee GK",1
"Grand M'uff Talkin",1,0,118208,CLS,"zzzCLS zHan zzChewbacca Leia zzC-3PO",1
"Grand M'uff Talkin",1,1,87893,Ewoks,"zChirpa Elder Paploo zWicket zLogray",1
"Grand M'uff Talkin",1,1,95902,Carth,"zCarth Onasi, zMission zZaalbar Juhani zCanderous",1
"Grand M'uff Talkin",1,0,99618,501st,"zRex Clone Sergeant, zEcho zzFives zAhsoka",1
"Grand M'uff Talkin",1,1,76783,Rogue1,"Jyn G8, Chirrut Baze Cassian K-2SO",1
"Grand M'uff Talkin",1,0,81161,QGJ,"QGJ G8, Aayla G9, zJKA zzHYoda Ezra G8",1
"Grand M'uff Talkin",1,0,105626,Zader (Counter),"zzzVader zzWampa Tarkin zBoba Stormtrooper G8",1
"Grand M'uff Talkin",1,0,67682,Jawas,"Nebit G8, Jawa Engineer G9, Jawa Scavenger G8, Jawa G9, Dathcha G8",1
"Grand M'uff Talkin",1,0,15192,NestSolo (Counter),"Nest",1
"Grand M'uff Talkin",1,1,92580,NS,"zzMT zAV zDaka Zombie Spirit G9",0
"Eanid September",0,1,110834,padme,"zzPadme zGK zJKA zAhsoka zBarriss",1
"Eanid September",,,323763,Negotiator,"Negotiator 6* HT Anakin's Eta-2 Starfighter, Umbaran Starfighter, Ahsoka Tano's Jedi Starfighter, BTL-B Y-wing Starfighter 6*, Clone Sergeant's ARC-170, Plo Koon's Jedi Starfighter",1
"Eanid September",0,1,100955,DR,"zzzDR zHK-47 zBSF Sith Empire Trooper, Sith Assassin G8",1
"Eanid September",0,1,93856,Geonosians,"zzGBA Poggle Geo Soldier, Geo Spy, Sun Fac",1
"Eanid September",,,369538,HansMF,"Home One, Han's MF, Biggs X-wing, Bistan's U-wing, Phantom Ghost Cassian's U-wing, Wedge X-wing",1
"Eanid September",0,1,93811,Grievous,"zGG B2 zB1 zDroideka MagnaGuard",1
"Eanid September",1,0,107636,Traya,"zzTraya zDN zSion zzEP zThrawn",1
"Eanid September",1,1,101700,JTR,"zzzJTR Scav Rey, BB-8 zR2-D2 Finn",1
"Eanid September",1,0,109733,CLS,"zzzCLS zHan zzChewbacca zLeia C-3PO",1
"Eanid September",1,1,120440,Revan Offense,"zzzJKR zGMY zBS zJolee Ezra",1
"Eanid September",1,1,90353,Ewoks,"zChirpa Elder Paploo zWicket Logray G9",1
"Eanid September",1,1,83192,Carth,"zCarth Onasi, Mission Zaalbar G8, Juhani Canderous",1
"Eanid September",1,1,75890,Rogue1,"Jyn G9, Chirrut G9, Baze G8, Cassian K-2SO G9",1
"Eanid September",1,0,92968,Zader (Counter),"zzzVader Tarkin Sidious G9, zBoba Stormtrooper G8",1
"Eanid September",1,0,15181,NestSolo (Counter),"Nest",1
"Eanid September",1,1,82908,NS,"zMT zAV Daka Zombie Spirit G7",0
"Eanid September",,,303969,Executrix,"Executrix Tie Adv, Emperor's Shuttle, TIE Reaper 6*, Imperial TIE Fighter, Gauntlet Starfighter, First Order SF TIE Fighter, First Order TIE Fighter",0
"Eanid September",1,0,77186,ShaakClones,"Shaak Ti, Rex Echo G9, Fives ARC Trooper G8",0
"Eanid September",0,1,84402,FO,"zzKRU Kylo FOE Sith Trooper 5* G8, Hux",0
"Eanid September",1,0,68399,Jawas,"Nebit G8, Jawa Engineer G9, Jawa Scavenger G8, Jawa G7, Dathcha G9",0
"Mandaloian Ophace",1,1,100036,NS,"zzMT zzAV zDaka Zombie Spirit",1
"Mandaloian Ophace",1,0,106102,Traya,"zzTraya zzDN zSion zzEP Thrawn G9",1
"Mandaloian Ophace",1,1,95811,JTR,"zzzJTR Scav Rey, BB-8 R2-D2 Finn",1
"Mandaloian Ophace",1,0,97909,501st,"zRex zARC Trooper, Echo zFives zAhsoka",1
"Mandaloian Ophace",1,0,94047,Wiggs,"Wedge G8, Biggs G8, zzzCLS zFulcrum zEzra",1
"Mandaloian Ophace",0,1,110959,BS,"zBS zzGMY zJolee GK HYoda",1
"Mandaloian Ophace",1,0,116586,Zader (Counter),"zzzVader zzWampa Tarkin G8, zSidious zBoba",1
"Mandaloian Ophace",1,0,86417,Jawas,"Nebit Jawa Engineer, Jawa Scavenger, Jawa Dathcha",1
"Mandaloian Ophace",,,351905,Negotiator,"Negotiator 5* HT 3* Anakin's Eta-2 Starfighter, Umbaran Starfighter, Ahsoka Tano's Jedi Starfighter, Clone Sergeant's ARC-170, Plo Koon's Jedi Starfighter, Rex's ARC-170",0
"Mandaloian Ophace",0,1,71067,Geonosians,"GBA 5* G9, Poggle G9, Geo Soldier G8, Geo Spy, Sun Fac G8",0
"Mandaloian Ophace",0,1,71227,Grievous,"GG B2 5* G7, MagnaGuard 5* G7, zDooku IG-88",0
"Kaervek",1,1,112279,NS,"zzMT zzAV zDaka Zombie Spirit",1
"Kaervek",0,1,121721,padme,"zzPadme zGK zJKA zAhsoka zC-3PO",1
"Kaervek",0,1,95645,Geonosians,"zzGBA Poggle Geo Soldier, Geo Spy, Sun Fac",1
"Kaervek",1,0,107997,Traya,"zzTraya DN zSion zNest zThrawn",1
"Kaervek",1,1,109877,JTR,"zzzJTR Scav Rey, zzBB-8 zzR2-D2 Finn",1
"Kaervek",0,1,105147,Grievous,"zzGG zB2 zB1 MagnaGuard zNute",1
"Kaervek",1,1,113064,Revan Offense,"zzzJKR zGMY zBS zJolee zHYoda",1
"Kaervek",1,1,84079,Ewoks,"zChirpa Elder Paploo Wicket zLogray",1
"Kaervek",1,1,97300,zEP,"zEP zzVader zTarkin DT TFP",1
"Kaervek",1,0,115455,CLS,"zzzCLS zHan Leia Old Ben, zzChewbacca",1
"Kaervek",1,1,80748,Rogue1,"zJyn G8, Chirrut Baze Bistan G8, Cassian G9",1
"Kaervek",1,0,46918,Jawas,"Nebit G8, Jawa Engineer 5* G7, Jawa Scavenger G7, Jawa 5* G8, Dathcha G8",0
"KingZach",1,1,92679,NS,"zzMT zzAV Daka Zombie Spirit",1
"KingZach",0,1,111426,padme,"zzPadme zGK zJKA zAhsoka zzC-3PO",1
"KingZach",,,411460,HansMF,"Home One, Han's MF, HT Biggs X-wing, Phantom Ghost Cassian's U-wing, Bistan's U-wing",1
"KingZach",1,0,106717,Traya,"zzTraya zDN zSion zzEP zThrawn",1
"KingZach",1,1,112180,JTR,"zzzJTR Scav Rey, zBB-8 zzR2-D2 RT",1
"KingZach",1,1,112994,Revan Offense,"zzzJKR zGMY zzHYoda zJolee zEzra",1
"KingZach",1,1,86576,Ewoks,"zChirpa Elder Paploo zWicket zLogray",1
"KingZach",1,1,80385,Carth,"zCarth Onasi, Mission G8, Zaalbar G8, Juhani zCanderous",1
"KingZach",1,0,143162,CLS,"zzzCLS zHan zLeia zzOld Ben, zzChewbacca",1
"KingZach",1,0,97323,Wampa (Counter),"zRex zzWampa DT zzJyn FOO G9",1
"KingZach",1,0,104351,zMaul,"zMaul zBSF zDooku zzzDR zSavage",1
"KingZach",1,0,97100,Zader (Counter),"zzzVader Tarkin G9, zSidious Boba Shoretrooper",1
"KingZach",1,0,18660,NestSolo (Counter),"zNest",1
"KingZach",0,1,79356,Grievous,"GG G9, B2 G8, zNute IG-88 T3-M4 G9",0
"KingZach",1,0,72965,Wiggs,"Wedge Biggs Fulcrum G6, Chirrut G8, Baze G8",0
"KingZach",1,0,61085,Jawas,"Nebit G8, Jawa Engineer G8, Jawa Scavenger G7, Jawa G7, Dathcha",0
"Michael Wulf",0,1,99943,padme,"zzPadme GK JKA zAhsoka zC-3PO G9",1
"Michael Wulf",0,1,112973,DRMalak,"zzzDR zzHK-47 zBSF zzMalak Sith Empire Trooper",1
"Michael Wulf",,,368476,Negotiator,"Negotiator 5* HT Anakin's Eta-2 Starfighter, Umbaran Starfighter, Ahsoka Tano's Jedi Starfighter, Clone Sergeant's ARC-170, Plo Koon's Jedi Starfighter, Rex's ARC-170",1
"Michael Wulf",1,0,120679,Traya,"zzTraya zDN zSion zzEP zThrawn",1
"Michael Wulf",0,1,84242,Grievous,"zzGG G9, zB2 G8, zB1 Droideka G8, MagnaGuard G8",1
"Michael Wulf",1,1,96051,JTR,"zJTR Scav Rey, zBB-8 zzR2-D2 Finn",1
"Michael Wulf",1,1,107696,Revan Offense,"zzzJKR zGMY zBS zJolee HYoda",1
"Michael Wulf",1,1,89986,Ewoks,"zChirpa Elder zPaploo zWicket zLogray G9",1
"Michael Wulf",0,1,136733,FO,"zzKRU zKylo FOE zSith Trooper, zHux",1
"Michael Wulf",1,0,84839,CLS,"zzCLS zHan Leia Old Ben G9, Chewbacca G8",1
"Michael Wulf",1,0,92910,zMaul,"zMaul Dooku Sidious zSavage Sith Marauder",1
"Michael Wulf",1,0,102426,Zader (Counter),"zzzVader zMission zZaalbar Tarkin Boba",1
"Michael Wulf",1,1,81890,NS,"zMT zzAV Daka Zombie Spirit 6* G6",0
"Michael Wulf",,,279961,HansMF,"Home One, Han's MF 5*, Biggs X-wing, Bistan's U-wing 4*, Phantom Ghost Cassian's U-wing, Wedge X-wing",0
"Michael Wulf",0,1,77785,Geonosians,"zGBA 5* Poggle Geo Soldier, Geo Spy G9, Sun Fac G8",0
"Michael Wulf",1,0,89794,ShaakClones,"zzShaak Ti G8, Rex Echo zzFives G9, Clone Sergeant",0
"Michael Wulf",1,0,9729,NestSolo (Counter),"Nest 4* G8",0
"Lala",0,1,109360,padme,"zzPadme zGK zJKA zAhsoka zzC-3PO",1
