Player,Offense,Defense,GP,Name,Squad,Viable
"Tanner",1,0,64883,Troopers,"zVeers zStarck G8 Range Trooper 4* G9, Snowtrooper G8 Stormtrooper",0
"Tanner",0,1,120768,Phoenix,"zHera zEzra zZeb zKanan zSabine",1
"Tanner",1,0,73793,Wiggs,"Wedge G8 Biggs zCLS G9 zHan Leia G8",1
"Tanner",0,1,58786,FO,"KRU G8 Kylo G8 Phasma G8 FOE FOO G8",0
"Tanner",1,1,52727,Rogue1,"Jyn 5* G8 Chirrut G8 Baze 5* G8 K-2SO 5* G8 Cassian G8",0
"Tanner",1,0,53451,zMaul,"Maul BSF 3* G8 DN 5* G8 Savage Sith Empire Trooper 5* G8,",0
"Tanner",0,1,74188,BS,"BS 5* G8 zzGMY zJolee 5* Old Ben G9, HYoda",0
"Tanner",1,0,6468,SionSolo,"Sion 3* G8",0
"Hollow Child",0,1,59853,Qira,"Qira 5* G8 L3-37 4* G7 Vandor Chewbacca 3* G6, Mission zZaalbar",0
"Hollow Child",0,1,86875,padme,"Padme G9 GK JKA Ahsoka zBarriss",0
"Hollow Child",1,1,94810,NS,"zzMT zAV Daka Zombie Spirit G8",0
"Hollow Child",0,1,104554,DR,"zzDR zHK-47 zBSF Sith Marauder G8, zThrawn",1
"Hollow Child",0,1,86681,Geonosians,"zzGBA Poggle Geo Soldier, Geo Spy, Sun Fac G9,",1
"Hollow Child",1,1,99972,JTR,"zzJTR Scav Rey, zBB-8 zzR2-D2 Finn",1
"Hollow Child",1,0,99337,Traya,"zTraya 6* G8 zDN zSion zDooku zzEP",0
"Hollow Child",1,1,108853,Revan Offense,"zzzJKR zGMY zBS zJolee HYoda G9",1
"Hollow Child",1,1,87036,Ewoks,"zChirpa G9 Elder zPaploo zWicket zLogray G9",1
"Hollow Child",1,0,85826,CLS,"zzCLS zHan Chewbacca 6* G8 Leia C-3PO 6* G8",0
"Hollow Child",0,1,77694,Grievous,"GG B2 G8 MagnaGuard G8 IG-88 T3-M4",0
"Hollow Child",1,0,82914,ShaakClones,"zzShaak Ti G8, Rex Echo zFives G9 ARC Trooper G8,",0
"Hollow Child",0,1,92924,BH,"Bossk Boba Greedo Jango Zam",0
"Hollow Child",0,1,84124,Phoenix,"Hera Ezra Zeb G8 Kanan zSabine",1
"Hollow Child",1,0,57820,Troopers,"Veers G8 Starck 6* G7 DT 6* G7 Snowtrooper G8 Stormtrooper G8",0
"Hollow Child",0,1,83511,FO,"zKRU Kylo G9 FOE G9 FOO zFOTP",1
"Hollow Child",1,1,65340,Rogue1,"Jyn G8 Chirrut G8 Baze 4* G7 K-2SO G8 Cassian G8",0
"Hollow Child",1,0,90804,zMaul,"Maul zSidious zVader zSavage Sith Empire Trooper G8,",0
"Hollow Child",1,0,58949,Jawas,"Nebit G8 Jawa Engineer 6* G8, Jawa Scavenger G7, Jawa 5* G8 Dathcha",0
"Hollow Child",1,0,13665,NestSolo,"Nest G9",1
"Logan Ceti",,,401734,HansMF,"Home One, Han's MF 6*, HT 6* Biggs X-wing, Phantom Ghost Cassian's U-wing, Bistan's U-wing,",1
"Logan Ceti",1,1,117373,JTR,"zzzJTR zScav Rey, zzBB-8 zzR2-D2 zFinn",1
"Logan Ceti",1,1,49908,NS,"MT 6* G6 AV Daka G4 Zombie 6* G2 Spirit G3",0
"Logan Ceti",1,1,111819,Revan,"zzzJKR zBS zzGMY zJolee zGK G9",1
"Logan Ceti",1,0,147904,CLS,"zzzCLS zHan zzChewbacca zLeia G9 zzC-3PO",1
"Logan Ceti",1,1,91713,Ewoks,"zChirpa Elder zPaploo zWicket zLogray",1
"Logan Ceti",0,1,112917,BH,"zzBossk zBoba zDengar zGreedo zZam",1
"Logan Ceti",0,1,76709,Grievous,"zGG G7 B2 5* G5 zDooku G9 zIG-88 T3-M4",0
"Logan Ceti",1,0,62909,501st,"Rex G6 Clone Sergeant G5, Echo G2 zFives G8 zAhsoka G9",0
"Logan Ceti",1,0,116973,Troopers,"zVeers zStarck Magma Snowtrooper zStormtrooper",1
"Logan Ceti",0,1,79385,Phoenix,"zHera Chopper Ezra G8 zZeb G9 Kanan G8",1
"Logan Ceti",0,1,92394,FO,"zzKRU zKylo Phasma FOO zFOTP",1
"Logan Ceti",1,0,93666,zMaul,"zMaul zzDN G8 zzVader zzEP Savage G8",1
"Logan Ceti",1,0,50576,Jawas,"Nebit G7 Jawa Engineer G5, Jawa Scavenger G6, Jawa G5 Dathcha G7",0
"Logan Ceti",1,0,8233,NestSolo,"Nest 3* G6",0
"DarkKnightDan80",0,1,102027,padme,"zPadme zGK zJKA Ahsoka CW Chewbacca,",1
"DarkKnightDan80",1,1,95208,NS,"zMT zzAV Daka Zombie Spirit",0
"DarkKnightDan80",,,416559,HansMF,"Home One, Han's MF, HT Biggs X-wing, Phantom Ghost Cassian's U-wing, Bistan's U-wing 6*,",0
"DarkKnightDan80",0,1,84659,Geonosians,"zGBA Poggle Geo Soldier, Geo Spy, Sun Fac,",1
"DarkKnightDan80",1,1,104842,JTR,"zzJTR Scav Rey, zBB-8 zzR2-D2 zFinn",1
"DarkKnightDan80",1,0,98673,Traya,"Traya DN Sion zzEP zzThrawn",0
"DarkKnightDan80",1,1,137075,Revan Offense,"zzzJKR zGMY zBS zJolee zHYoda",1
"DarkKnightDan80",1,0,102972,CLS,"zzzCLS zHan zzChewbacca Leia C-3PO 6*",0
"DarkKnightDan80",1,1,86433,Ewoks,"zChirpa Elder Paploo Wicket zLogray",1
"DarkKnightDan80",0,1,106316,BH,"zzBossk zBoba Dengar IG-88 zzJango",1
"DarkKnightDan80",0,1,84313,Grievous,"GG B2 MagnaGuard Nute Dooku",0
"DarkKnightDan80",0,1,95697,FO,"zzKRU zKylo FOE FOO zFOST",1
"DarkKnightDan80",0,1,92417,Phoenix,"zHera zEzra Zeb zKanan Sabine",1
"DarkKnightDan80",1,0,81791,Clones,"Cody Rex Echo Fives Clone Sergeant,",1
"DarkKnightDan80",1,0,85423,Troopers,"zVeers zStarck DT Snowtrooper Stormtrooper",1
"DarkKnightDan80",1,1,62900,Rogue1,"Jyn Chirrut 5* G8 Baze 5* G8 K-2SO Cassian",0
"DarkKnightDan80",1,0,83105,zMaul,"Maul Sidious zVader Savage G9 Sith Empire Trooper,",0
"DarkKnightDan80",1,0,17418,NestSolo,"Nest",1
"Qui Won Ton",1,1,108100,NS,"zzMT zzAV zDaka Zombie Spirit",1
"Qui Won Ton",0,1,76571,padme,"Padme 5* G8 zGK JKA Ahsoka CW Chewbacca G8,",0
"Qui Won Ton",1,1,90402,JTR,"zzzJTR Scav Rey, BB-8 G9 R2-D2 zFinn",1
"Qui Won Ton",1,0,80400,Traya,"Traya 5* G8 DN 6* G8 Sion G9 zzEP zzThrawn",0
"Qui Won Ton",1,1,82593,Ewoks,"zChirpa G9 Elder Paploo G9 Teebo zWicket",1
"Qui Won Ton",1,0,67907,ShaakClones,"Shaak Ti 4* G7, Rex G9 Echo G8 Fives Clone Sergeant,",0
"Qui Won Ton",0,1,93694,BH,"Bossk G8 zBoba zDengar G9 zGreedo G9 zIG-88",0
"Qui Won Ton",0,1,96579,Phoenix,"zHera zEzra zZeb zKanan zSabine",1
"Qui Won Ton",1,0,98908,Wiggs,"Wedge Biggs zzzCLS zHan zLeia",1
"Qui Won Ton",1,0,61444,Troopers,"Veers 6* G9 Starck G8 Shoretrooper 5* G8 Snowtrooper G7 Stormtrooper G8",0
"Qui Won Ton",1,1,84081,Rogue1,"zzJyn Chirrut G9 Baze G9 zK-2SO G9 Cassian G9",1
"Qui Won Ton",1,0,99899,zMaul,"zMaul zDooku Sidious zzVader zSavage",1
"Qui Won Ton",0,1,84870,FO,"zzKRU G9 zKylo Phasma FOO FOTP",0
"Qui Won Ton",1,0,82702,Jawas,"Nebit Jawa Engineer, Jawa Scavenger, Jawa Dathcha",1
"Weiser",1,1,96989,Revan Offense,"zJKR G8 GMY zBS zJolee zEzra",0
"Weiser",1,1,34520,NS_Alt,"MT 5* G8 AV 5* G8 Spirit 5* G8 Daka 6* G8 Talia 5* G8",0
"Weiser",0,1,45453,Grievous,"GG 6* G8 B2 4* G8 Dooku 5* G8 IG-88 5* G8 T3-M4 G9",0
"Weiser",1,1,65451,zEP,"EP zVader G8 Tarkin G9 DT 5* G8 TFP G9",0
"Weiser",0,1,51601,BH,"Jango 3* G9 Boba G9 Cad G8 Embo 4* G8 Greedo 6* G8",0
"Weiser",1,0,38273,501st,"Rex 5* G8 Clone Sergeant 6* G8, Echo 5* G8 Fives 6* G8 Ahsoka 5* G8",0
"Weiser",0,1,71471,Phoenix,"Hera Chopper Zeb Kanan G9 Sabine 5* G8",0
"Weiser",1,0,43967,Wiggs,"Wedge 5* G8 Biggs G8 Leia G9 Chirrut 5* G8 Baze 5* G8",0
"Weiser",0,1,50921,FO,"KRU G9 Kylo 6* G8 Phasma G8 FOE 5* G8 FOO G8",0
"Esaascar",1,1,83477,NS,"zMT zzAV Daka Zombie Spirit G8",1
"Esaascar",1,0,108089,padme,"zzPadme zGK zJKA zAhsoka zzC-3PO",1
"Esaascar",1,1,113078,JTR,"zzzJTR Scav Rey, zzBB-8 zzR2-D2 Finn",1
"Esaascar",1,1,102248,Revan Offense,"zzzJKR zGMY zBS zJolee HYoda G9",1
"Esaascar",1,1,84252,Ewoks,"zChirpa Elder Paploo zWicket Logray",1
"Esaascar",0,1,100220,Grievous,"zzGG zB2 zDroideka MagnaGuard Nute",1
"Esaascar",0,1,88191,BH,"zBossk Boba Cad Dengar IG-88",1
"Esaascar",1,0,102438,CLS,"zzzCLS zHan Wedge Biggs zChewbacca",1
"Esaascar",1,0,68970,Troopers,"zVeers Starck G9 Shoretrooper 4* G8 Snowtrooper Stormtrooper",0
"Esaascar",1,0,68284,Clones,"Cody G7 Rex Echo G8 zFives G9 Clone Sergeant G8,",0
"Esaascar",0,1,90699,FO,"zzKRU zKylo FOO FOST G9 FOTP",1
"Esaascar",1,1,89577,zEP,"zzEP zVader Tarkin Dooku TFP G8",1
"Esaascar",0,1,73275,Phoenix,"Hera G9 Chopper G9 Ezra Zeb G8 Kanan G9",1
"Esaascar",1,1,56416,Rogue1,"Jyn 5* G8 Chirrut G8 Baze 4* G7 Cassian G7 Bistan G8",0
"Esaascar",1,0,67111,zMaul,"Maul Sidious G9 zSion Savage G5 Sith Assassin G7,",0
"Esaascar",1,0,55916,Jawas,"Nebit G7 Jawa Engineer G9, Jawa Scavenger G8, Jawa 5* G8 Dathcha G7",0
"Snow",1,1,34808,NS_Alt,"MT 5* G8 AV 5* G8 Spirit 5* G8 Daka 5* G8 Talia 5* G8",0
"Snow",1,1,76116,zEP,"zzEP zVader Tarkin 6* Dooku 5* DT 5* G8",0
"Snow",0,1,49718,BH,"Bossk 4* G8 zBoba G9 Cad 5* G8 Greedo 5* G8 IG-88 5* G9",0
"Snow",1,0,41005,501st,"Rex 5* G8 Clone Sergeant 5* G8, Echo 5* G8 Fives 6* G8 Ahsoka",0
"Snow",0,1,60033,Phoenix,"Hera G8 Chopper G8 Ezra G8 Zeb G8 Kanan G8",1
"Snow",1,0,37646,Wiggs,"Wedge 5* G8 Biggs 5* G8 Leia G8 Chirrut 5* G8 Baze 5* G8",0
"Snow",0,1,32609,FO,"KRU 5* G8 Kylo 5* G8 Phasma 5* G8 FOE 5* G8 FOST 5* G8",0
"Snow",1,0,52352,zMaul,"Maul 5* G8 BSF zDN 5* Sidious 5* G8 Sion 3* G8",0
"JacenSolo",0,1,108093,padme,"zzPadme zGK zJKA zAhsoka zBarriss",1
"JacenSolo",0,1,136490,DRMalak,"zzzDR zzHK-47 zBSF zzMalak 6* zThrawn",1
"JacenSolo",1,1,97806,NS,"zzMT zAV zDaka Zombie Spirit",0
"JacenSolo",,,364355,HansMF,"Home One, Han's MF 5*, HT Biggs X-wing, Phantom Ghost Cassian's U-wing, Bistan's U-wing 5*,",0
"JacenSolo",0,1,85816,Geonosians,"zzGBA Poggle Geo Soldier, Geo Spy, Sun Fac,",1
"JacenSolo",1,0,115806,Traya,"zTraya zzDN zSion zDooku zzEP",0
"JacenSolo",1,1,132344,Revan Offense,"zzzJKR zzGMY zBS zJolee zEzra",1
"JacenSolo",1,1,94329,Carth,"zCarth Onasi, Mission Zaalbar zJuhani zCanderous",1
"JacenSolo",0,1,101752,BH,"zzBossk zBoba Cad IG-88 Jango",1
"JacenSolo",1,0,97684,Wiggs,"Wedge Biggs zzzCLS zHan Fulcrum",1
"JacenSolo",1,0,76824,Clones,"Cody G9 Rex Echo G9 Fives Clone Sergeant G9,",0
"JacenSolo",0,1,90894,FO,"zKRU zKylo Phasma FOO FOTP",1
"JacenSolo",0,1,73966,Phoenix,"Hera Chopper Zeb Kanan Sabine 4* G7",0
"JacenSolo",1,0,92357,zMaul,"Maul Sidious zVader Savage Sith Empire Trooper,",0
"Cano Cana",1,0,109041,padme,"zzPadme GK zJKA zAhsoka C-3PO",1
"Cano Cana",0,1,140775,DRMalak,"zzzDR zzHK-47 zBSF zzMalak zzThrawn",1
"Cano Cana",1,1,79928,NestSisters,"zAV MT G8 Daka G8 Zombie G8 zNest",0
"Cano Cana",,,359632,HansMF,"Home One, Han's MF, HT Biggs X-wing, Phantom Ghost Cassian's U-wing, Bistan's U-wing 4*,",0
"Cano Cana",0,1,85529,Geonosians,"zzGBA Poggle Geo Soldier, Geo Spy G9, Sun Fac G8,",1
"Cano Cana",1,1,111772,JTR,"zzzJTR zScav Rey, zzBB-8 zzR2-D2 Finn G9",1
"Cano Cana",1,0,92764,Traya,"Traya G8 zDN Sion G9 zDooku zzEP",0
"Cano Cana",1,1,114517,Revan Offense,"zzzJKR zzGMY zBS zJolee zEzra",1
"Cano Cana",1,1,93500,Ewoks,"zChirpa Elder zPaploo Scout zWicket",1
"Cano Cana",0,1,103668,Grievous,"zzGG zB2 zB1 zDroideka MagnaGuard G8",1
"Cano Cana",1,1,92585,Carth,"zCarth Onasi, Mission zZaalbar zJuhani Canderous",1
"Cano Cana",0,1,98582,BH,"zzBossk Boba Cad Dengar G9 zJango",1
"Cano Cana",1,0,50712,ShaakClones,"Shaak Ti 5* G7, Rex G7 Echo G7 Fives G8 ARC Trooper 5* G8,",0
"Cano Cana",1,0,54490,Troopers,"Veers 6* Starck G6 DT G8 Range Trooper 4* G7, Stormtrooper G8",0
"Cano Cana",1,0,110091,CLS,"zzzCLS zHan Wedge Biggs zzChewbacca",1
"Cano Cana",0,1,107801,FO,"zzKRU zKylo FOE FOO FOTP",1
"Cano Cana",0,1,67345,Phoenix,"Hera G8 Chopper Zeb G8 Kanan G8 Sabine 6* G8",0
"Cano Cana",1,1,67146,Rogue1,"Jyn G7 Chirrut Baze G9 K-2SO G8 Bodhi Rook G8,",0
"Cano Cana",1,0,85018,zMaul,"Maul Sidious G8 zzVader Savage G8 Sith Empire Trooper,",0
"Cano Cana",1,0,54492,Jawas,"Nebit G6 Jawa Engineer 4* G7, Jawa Scavenger G7, Jawa 6* G7 Dathcha",0
"bellojack",1,0,94011,padme,"Padme G8 zGK JKA Ahsoka zzC-3PO",0
"bellojack",,,422281,HansMF,"Home One, Han's MF, HT Biggs X-wing, Phantom Ghost Cassian's U-wing, Bistan's U-wing,",1
"bellojack",0,1,111071,DRMalak,"zzzDR zzHK-47 zBSF Malak 6* zzThrawn",0
"bellojack",1,1,83521,JTR,"JTR G8 Scav Rey, BB-8 G9 zzR2-D2 Finn",0
"bellojack",1,1,58492,NS_Alt,"MT G2 zAV Initiate G8 Zombie G1 Daka G8",0
"bellojack",1,1,113832,Revan Offense,"zzzJKR zGMY zBS zJolee zEzra",1
"bellojack",1,1,93268,Ewoks,"zChirpa Elder zPaploo zWicket zLogray",1
"bellojack",0,1,101762,Grievous,"zzGG zB2 zB1 zDroideka MagnaGuard",1
"bellojack",1,1,88444,Carth,"Carth Onasi, zMission zZaalbar zJuhani Canderous",1
"bellojack",1,0,97511,ShaakClones,"zzShaak Ti, zRex zEcho zzFives Clone Sergeant G8,",0
"bellojack",0,1,110053,BH,"zzBossk zBoba zGreedo zIG-88 zZam",1
"bellojack",1,0,107280,CLS,"zzzCLS zHan Leia zzOld Ben, zzChewbacca",1
"bellojack",1,1,103218,zEP,"zzEP zzVader zTarkin zDooku TFP",1
"bellojack",0,1,95624,Phoenix,"zHera Chopper zZeb zKanan zSabine",1
"bellojack",1,1,70262,Rogue1,"Jyn G8 Chirrut G8 Baze G8 K-2SO G9 Cassian G9",1
"bellojack",0,1,72545,FO,"KRU G8 Kylo Phasma FOO FOST",0
"bellojack",1,0,85162,zMaul,"Maul G8 zDN zSion Savage Sith Empire Trooper,",0
"JaidenHawk",0,1,57642,Qira,"Qira 5* G7 L3-37 4* G8 Vandor Chewbacca 3* G5, zMission G9 Zaalbar G8",0
"JaidenHawk",1,1,87095,NS,"zzMT AV zDaka Zombie Spirit 6* G7",0
"JaidenHawk",1,0,84510,Traya,"Traya 5* G8 DN 5* G8 zSion G8 zBSF zzEP",0
"JaidenHawk",1,1,129757,Revan,"zzzJKR zBS zzGMY zJolee zGK",1
"JaidenHawk",0,1,78899,Grievous,"zzGG B2 5* G7 Dooku 6* G9 zIG-88 T3-M4 G9",0
"JaidenHawk",0,1,99268,BH,"zzBossk 4* G9 zBoba Cad zDengar zGreedo",0
"JaidenHawk",1,0,102577,Wiggs,"Wedge Biggs zzzCLS zHan Leia",1
"JaidenHawk",1,0,63593,Magma,"Thrawn 5* G8 Magma G6 Krennic 5* G7 zzTarkin Stormtrooper G4",0
"JaidenHawk",0,1,64421,Phoenix,"Hera 5* G8 Chopper G9 Ezra G8 Zeb G8 Kanan G8",0
"JaidenHawk",0,1,66533,FO,"KRU G8 Kylo G9 Phasma FOST 5* G8 FOTP G8",0
"JaidenHawk",1,0,75107,zMaul,"Maul Sidious G9 zzVader Savage G7 Sith Assassin 5* G6,",0
"Bastilacica",,,266548,HansMF,"Home One 6*, Han's MF 5*, HT 6* TIE Silencer, Phantom 5* Ghost Tie Adv, Biggs X-wing,",0
"Bastilacica",1,1,112928,Revan,"zzzJKR zBS zGMY zJolee GK 6*",0
"Bastilacica",0,1,82678,BH,"zBossk 5* Boba Cad IG-88 Jango 5*",0
"Bastilacica",0,1,77634,FO,"zKRU Kylo FOE FOO FOST",1
"Bastilacica",0,1,68975,Phoenix,"Hera G8 Chopper G9 Ezra Zeb G8 Kanan G8",1
"Bastilacica",1,0,55277,Zader,"Vader Mission G7 Zaalbar G7 Tarkin G8 Stormtrooper G7",0
"Btr Nut",0,1,60674,Qira,"Qira 6* G9 L3-37 4* G8 Vandor Chewbacca 4* G8, Mission G8 Zaalbar G8",0
"Btr Nut",0,1,96788,padme,"zPadme zGK zJKA Ahsoka CW Chewbacca,",1
"Btr Nut",0,1,73941,Geonosians,"GBA 5* Poggle Geo Soldier G9, Geo Spy G9, Sun Fac G8,",0
"Btr Nut",1,1,77893,NestSisters,"zAV MT G9 Daka G9 Zombie G9 Nest 5*",0
"Btr Nut",1,1,106697,JTR,"zzzJTR Scav Rey, zBB-8 zR2-D2 zFinn",1
"Btr Nut",1,1,108963,Revan Offense,"zzzJKR zGMY zBS zJolee HYoda G9",1
"Btr Nut",1,1,86692,Ewoks,"zChirpa Elder Paploo Wicket zLogray",1
"Btr Nut",1,0,90123,CLS,"zzzCLS Han G9 Chewbacca 6* G9 Leia zC-3PO 6*",0
"Btr Nut",1,0,92227,ShaakClones,"zShaak Ti 5*, Rex zEcho zzFives Clone Sergeant,",0
"Btr Nut",0,1,85287,Grievous,"zGG B2 5* G8 MagnaGuard G8 zNute zDooku",0
"Btr Nut",1,1,94877,zEP,"zEP zzVader zTarkin zKrennic 6* G9 TFP G9",0
"Btr Nut",0,1,94737,BH,"zJango G9 zBoba Cad Dengar IG-88",0
"Btr Nut",1,0,63693,Troopers,"Veers Starck 6* G9 Range Trooper 4* G8, Shoretrooper G8 Stormtrooper G9",0
"Btr Nut",0,1,74097,Phoenix,"Hera Ezra G9 Zeb G8 Kanan G8 Sabine G9",1
"Btr Nut",0,1,69837,BH,"Bossk 6* G9 Aurra 5* G9 Embo 4* G8 Greedo G9 Zam G9",0
"Btr Nut",1,1,81870,Rogue1,"zJyn Chirrut G8 Baze G8 K-2SO G9 Cassian",1
"Btr Nut",1,0,82925,zMaul,"zMaul BSF G8 zDN Savage Sith Assassin G8,",1
"Btr Nut",0,1,78425,FO,"zKRU 6* G8 Kylo G9 FOE FOO FOTP",0
"Btr Nut",1,0,68907,Jawas,"Nebit G8 Jawa Engineer 6* G9, Jawa Scavenger G8, Jawa G9 Dathcha",0
"Btr Nut",1,0,13555,SionSolo,"Sion 6* G9",0
"Mandaloian Ophace",1,1,99974,NS,"zzMT zzAV zDaka Zombie Spirit",1
"Mandaloian Ophace",1,1,93039,JTR,"zzzJTR Scav Rey, BB-8 R2-D2 Finn",1
"Mandaloian Ophace",1,0,79570,Traya,"Traya 6* G9 DN 6* G8 Sion zDooku Thrawn G9",0
"Mandaloian Ophace",1,0,81404,ShaakClones,"Shaak Ti 3* G7, zRex Echo Fives Clone Sergeant,",0
"Mandaloian Ophace",1,1,105059,GK,"GK Barriss zAhsoka zJKA zzGMY",0
"Mandaloian Ophace",0,1,70015,BH,"Jango 3* G7 zBoba Cad Greedo G7 IG-88 G8",0
"Mandaloian Ophace",0,1,80996,Phoenix,"zHera zEzra Zeb G8 Kanan G8 Sabine G8",1
"Mandaloian Ophace",1,0,94270,Wiggs,"Wedge G8 Biggs G8 zzzCLS zHan zLeia",1
"Mandaloian Ophace",1,0,51134,Troopers,"Veers 6* G7 Starck G7 Magma G7 Snowtrooper G8 Stormtrooper G7",0
"Mandaloian Ophace",0,1,68418,FO,"KRU G8 Kylo G8 Phasma G8 FOO G9 FOSFTP G7",0
"Mandaloian Ophace",1,0,79290,zMaul,"Maul G7 Sidious G7 zVader zEP Savage G7",0
"Mandaloian Ophace",1,0,77586,Jawas,"Nebit Jawa Engineer, Jawa Scavenger, Jawa Dathcha",1
"Drcct",1,1,112815,NS,"zzMT zzAV zDaka Zombie Spirit",1
"Drcct",0,1,97469,padme,"zzPadme zGK zJKA zAhsoka CW Chewbacca G8,",1
"Drcct",0,1,96838,Geonosians,"zzGBA Poggle Geo Soldier, Geo Spy, Sun Fac,",1
"Drcct",1,1,114038,JTR,"zzzJTR zScav Rey, zzBB-8 zzR2-D2 zFinn",1
"Drcct",0,1,114527,BH,"zzBossk zBoba zDengar zIG-88 zzJango",1
"Drcct",1,1,78627,Ewoks,"Chirpa 6* G8 Elder zPaploo Teebo G9 Scout",0
"Drcct",1,0,75320,ShaakClones,"Shaak Ti 6* G7, Rex Echo Fives Clone Sergeant,",0
"Drcct",0,1,100464,Phoenix,"zHera zEzra zZeb zKanan zSabine",1
"Drcct",1,0,95352,Wiggs,"Wedge Biggs zzzCLS Han zLeia",1
"Drcct",0,1,98936,FO,"zzKRU zKylo zPhasma FOO zFOST",1
"Drcct",1,1,104980,zEP,"zzEP zzVader zzTarkin zDooku TFP G9",1
"Drcct",1,0,68213,Troopers,"Veers Starck G8 Magma G8 Snowtrooper G9 Stormtrooper G8",1
"Drcct",1,0,69411,Jawas,"Nebit G9 Jawa Engineer G9, Jawa Scavenger G9, Jawa G9 Dathcha",1
"Baseline",1,0,63780,padme,"Padme 6* G7 GK G8 JKA G9 Ahsoka G8 C-3PO G8",0
"Baseline",1,1,73321,NS,"MT G9 zzAV Daka G8 Zombie G9 Spirit 5* G7",0
"Baseline",0,1,86585,Geonosians,"zzGBA 6* Poggle Geo Soldier, Geo Spy, Sun Fac,",1
"Baseline",1,1,97311,JTR,"JTR G8 zScav Rey, zzBB-8 zzR2-D2 zFinn",0
"Baseline",1,1,98291,Ewoks,"zChirpa Elder zPaploo zWicket zLogray",1
"Baseline",0,1,116301,BH,"zzBossk zBoba zDengar zzEmbo zzJango",1
"Baseline",0,1,77632,Grievous,"GG B2 6* G8 zDroideka G9 MagnaGuard G8 zIG-88",0
"Baseline",1,1,86554,zEP,"zEP zzVader Tarkin zIPD 5* G8 TFP G9",0
"Baseline",1,0,63274,Troopers,"Veers G8 Starck G8 Range Trooper 3* G7, Shoretrooper Snowtrooper",0
"Baseline",0,1,88337,Phoenix,"Hera zEzra zZeb zKanan Sabine G8",1
"Baseline",1,0,98117,Wiggs,"Wedge Biggs zzzCLS zHan zLeia",1
"Baseline",1,0,81589,Clones,"zCody G9 Rex Echo Fives Clone Sergeant,",0
"Baseline",1,1,76884,Rogue1,"Jyn G9 Chirrut Baze K-2SO G8 Cassian G8",1
"Baseline",0,1,71656,FO,"KRU 5* G7 zKylo FOO G8 FOST zFOTP",0
"Baseline",1,0,74069,zMaul,"zMaul Dooku DN G8 Sidious G7 Sion G9",0
"Baseline",0,1,86605,BS,"zBS zzGMY Jolee G8 Old Ben, HYoda G7",0
"Baseline",1,0,74605,Jawas,"Nebit Jawa Engineer G9, Jawa Scavenger G9, Jawa Dathcha",1
"Baseline",1,0,8184,NestSolo,"Nest 4* G7",0
"Sal",0,1,64496,Qira,"Qira L3-37 4* G8 Vandor Chewbacca 3* G6, Mission Zaalbar",0
"Sal",1,0,110121,padme,"zzPadme G8 zGK zJKA zAhsoka zzC-3PO",1
"Sal",0,1,89796,DR,"zzDR G9 HK-47 zBSF Sith Assassin 6* G7, zThrawn",0
"Sal",0,1,76038,Geonosians,"GBA G8 Poggle Geo Soldier, Geo Spy G9, Sun Fac G8,",0
"Sal",1,1,114269,JTR,"zzzJTR Scav Rey, zzBB-8 zzR2-D2 zFinn",1
"Sal",1,1,60168,NS,"MT 6* G8 AV G8 Daka G7 Zombie 6* G8 Spirit G8",0
"Sal",1,0,102652,Traya,"zzTraya 6* zDN zSion Dooku zzEP",0
"Sal",1,1,117789,Revan Offense,"zzzJKR zzGMY zBS zJolee zzHYoda",1
"Sal",1,1,95165,Ewoks,"zChirpa Elder zPaploo Scout zWicket",1
"Sal",1,0,73036,ShaakClones,"Shaak Ti 3* G8, Rex Echo G9 Fives Clone Sergeant,",0
"Sal",0,1,110517,BH,"zzBossk zBoba Cad zGreedo zzJango",1
"Sal",0,1,79269,Grievous,"zGG B2 6* G7 Nute IG-88 T3-M4",0
"Sal",0,1,76393,Phoenix,"Hera G9 Ezra Zeb G9 Kanan Sabine",1
"Sal",1,0,117723,CLS,"zzzCLS zHan Wedge Biggs zzChewbacca",1
"Sal",1,0,64463,Troopers,"Veers Starck 5* G7 Shoretrooper Snowtrooper G8 Stormtrooper G8",0
"Sal",1,1,68766,Rogue1,"zJyn Chirrut G8 Baze 5* G8 K-2SO G8 Cassian G8",0
"Sal",0,1,67667,FO,"KRU 4* G6 Kylo FOO G9 FOST G9 FOTP",0
"Sal",1,0,78465,zMaul,"Maul Sidious G8 zVader Savage Sith Empire Trooper G8,",0
"Sal",1,0,57922,Jawas,"Nebit G8 Jawa Engineer 5* G9, Jawa Scavenger G7, Jawa 6* G9 Dathcha G7",0
"Sal",1,0,6117,NestSolo,"Nest 3* G7",0
"neyde jean",1,0,93668,padme,"zPadme GK JKA G9 zAhsoka zzC-3PO",1
"neyde jean",1,1,90397,NS_Alt,"zMT zzAV Zombie Daka Talia",1
"neyde jean",0,1,91154,DR,"zzzDR G9 zHK-47 zBSF Sith Assassin G8, Thrawn G9",0
"neyde jean",0,1,75981,Geonosians,"zzGBA G9 Poggle Geo Soldier G8, Geo Spy G9, Sun Fac G8,",1
"neyde jean",1,1,105435,JTR,"zzzJTR Scav Rey, zBB-8 zzR2-D2 RT",1
"neyde jean",1,0,81824,Traya,"zzTraya 6* G8 DN G8 Sion G8 Dooku zEP",0
"neyde jean",1,1,112094,Revan Offense,"zzzJKR zGMY zBS zJolee zHYoda",1
"neyde jean",1,1,89983,Ewoks,"zChirpa Elder zPaploo zWicket zLogray",1
"neyde jean",1,1,87589,Carth,"zCarth Onasi, Mission G8 zZaalbar zJuhani Canderous",1
"neyde jean",1,0,80343,ShaakClones,"zzShaak Ti G9, Rex Echo G8 Fives G9 Clone Sergeant,",0
"neyde jean",0,1,94067,BH,"zBossk Boba Dengar Jango Zam",1
"neyde jean",0,1,93779,Grievous,"zzGG B2 MagnaGuard G8 zNute T3-M4",1
"neyde jean",0,1,75914,Phoenix,"Hera G9 zEzra Zeb G8 Kanan Sabine G8",1
"neyde jean",1,0,73775,Troopers,"zVeers Starck G9 DT G9 Shoretrooper G9 Snowtrooper G9",1
"neyde jean",1,0,93791,CLS,"zzCLS zHan Leia Old Ben G9, zChewbacca",1
"neyde jean",0,1,86273,FO,"zKRU zKylo FOO zFOST G9 FOTP",1
"neyde jean",1,1,74307,Rogue1,"Jyn G9 Chirrut G9 Baze K-2SO G8 Cassian",1
"neyde jean",1,0,77708,Zader,"Vader G8 zzWampa Tarkin G9 Sidious G8 Stormtrooper G6",0
"neyde jean",1,0,53961,Jawas,"Nebit G8 Jawa Engineer G9, Jawa Scavenger G8, Jawa G7 Dathcha G8",0
"Grand M'uff Talkin",1,0,86947,padme,"Padme GK JKA 5* Ahsoka zC-3PO",0
"Grand M'uff Talkin",1,1,92490,NS,"zzMT zAV zDaka Zombie Spirit G9",0
"Grand M'uff Talkin",1,1,113930,JTR,"zzzJTR Scav Rey, zzBB-8 zzR2-D2 zFinn",1
"Grand M'uff Talkin",1,0,103739,Traya,"zzTraya zDN zSion G9 zzEP zThrawn",0
"Grand M'uff Talkin",1,1,116550,Revan Offense,"zzzJKR zzGMY zBS zJolee zzHYoda",1
"Grand M'uff Talkin",1,1,85487,Ewoks,"zChirpa Elder Paploo Wicket zLogray",1
"Grand M'uff Talkin",0,1,102413,BH,"zzBossk Boba Dengar Greedo zZam",1
"Grand M'uff Talkin",0,1,86304,Grievous,"zzGG B2 MagnaGuard G9 Nute Dooku",1
"Grand M'uff Talkin",1,1,56758,Carth,"Carth Onasi G7, Mission G8 Zaalbar G8 Juhani 5* G7 Canderous 6* G7",0
"Grand M'uff Talkin",1,0,106464,CLS,"zzzCLS zHan Wedge Biggs zzChewbacca",1
"Grand M'uff Talkin",1,0,93171,Clones,"Cody Rex zEcho zzFives Clone Sergeant,",1
"Grand M'uff Talkin",0,1,73359,Phoenix,"Hera Chopper Ezra G8 Zeb G8 Kanan",1
"Grand M'uff Talkin",1,1,74471,Rogue1,"Jyn 6* G8 Chirrut Baze K-2SO Cassian",0
"Grand M'uff Talkin",0,1,70363,FO,"KRU G9 Kylo FOE FOST G8 FOTP",0
"Grand M'uff Talkin",1,0,71042,zMaul,"Maul Sidious G2 zzVader Savage Sith Assassin G7,",0
"Grand M'uff Talkin",1,0,66377,Jawas,"Nebit G8 Jawa Engineer G9, Jawa Scavenger G8, Jawa G9 Dathcha G8",1
"Grand M'uff Talkin",1,0,7374,NestSolo,"Nest 5* G6",0
"DarthCarrickPettinger",0,1,70757,padme,"Padme G8 GK G8 JKA G9 Ahsoka CW Chewbacca G8,",0
"DarthCarrickPettinger",0,1,90691,Geonosians,"zzGBA Poggle Geo Soldier, Geo Spy, Sun Fac G9,",1
"DarthCarrickPettinger",1,1,82378,NS,"zzMT AV zDaka Zombie 6* G8 Spirit G7",0
"DarthCarrickPettinger",1,0,75020,Traya,"Traya 6* G7 DN 5* G7 zSion G9 zzEP Thrawn G9",0
"DarthCarrickPettinger",0,1,103512,BH,"zzBossk zBoba Dengar G9 zIG-88 Zam",1
"DarthCarrickPettinger",1,1,72649,Ewoks,"Chirpa 5* G8 Elder Paploo Teebo G9 Scout",0
"DarthCarrickPettinger",1,0,88408,Wiggs,"Wedge G9 Biggs G8 zzzCLS Ezra Leia G9",1
"DarthCarrickPettinger",1,0,65273,Clones,"Cody G7 Rex G8 Echo G7 Fives G8 Clone Sergeant G9,",0
"DarthCarrickPettinger",1,0,103241,zMaul,"zMaul zDooku zzVader zSavage Sith Assassin G8,",1
"DarthCarrickPettinger",0,1,75770,Phoenix,"zHera Chopper G9 Zeb G8 zKanan Sabine 5* G7",0
"DarthCarrickPettinger",0,1,70944,FO,"KRU zKylo Phasma G7 FOSFTP G7 FOTP G7",0
"Kyrie Unobii",1,0,102701,padme,"zzPadme GK JKA 5* Ahsoka zzC-3PO",0
"Kyrie Unobii",1,1,114288,JTR,"zzzJTR Scav Rey, zzBB-8 zzR2-D2 zFinn",1
"Kyrie Unobii",1,1,91238,Ewoks,"zChirpa Elder zPaploo Teebo zWicket",1
"Kyrie Unobii",0,1,103615,BH,"zzBossk zBoba Greedo zIG-88 Zam",1
"Kyrie Unobii",1,1,86013,zEP,"zzEP zVader zTarkin IPD 4* G7 TFP G9",0
"Kyrie Unobii",1,0,129392,CLS,"zzzCLS zHan zLeia zzOld Ben, zzChewbacca",1
"Kyrie Unobii",0,1,79924,Phoenix,"Hera G9 Chopper zEzra Zeb G8 Kanan",1
"Kyrie Unobii",0,1,96068,FO,"zzKRU zKylo Phasma FOO zFOTP",1
"Kyrie Unobii",1,0,93499,zMaul,"zMaul zDooku zSion Savage Sith Empire Trooper,",1
"Maverick",0,1,92320,padme,"zzPadme G9 zGK zJKA Ahsoka G8 zBarriss",1
"Maverick",1,1,84920,NestSisters,"zzAV zMT Daka Zombie Nest 5* G7",0
"Maverick",1,1,106195,JTR,"zzzJTR Scav Rey, zzBB-8 zzR2-D2 Finn G9",1
"Maverick",1,1,93347,Revan Offense,"JKR G6 zGMY zBS zJolee zHYoda",0
"Maverick",1,0,90833,CLS,"zCLS zHan zChewbacca 6* zThrawn C-3PO 5* G7",0
"Maverick",0,1,90061,BH,"zzJango zBoba Greedo G8 IG-88 Zam G9",1
"Maverick",1,1,64219,Ewoks,"zChirpa 5* G9 Elder G8 Paploo 6* G8 Teebo G7 Wicket 6* G9",0
"Maverick",1,1,89362,zEP,"zzEP zVader Tarkin G8 DT TFP",1
"Maverick",1,0,68738,Wiggs,"Wedge Biggs Fulcrum G6 Ezra Leia G8",0
"Maverick",1,0,65370,Troopers,"Veers Starck G8 Shoretrooper Snowtrooper G7 Stormtrooper G7",1
"Maverick",1,1,75872,Rogue1,"Jyn G8 Chirrut Baze K-2SO G8 Cassian G8",1
"Maverick",0,1,67328,Phoenix,"Hera G8 Chopper Zeb G8 Kanan G8 Sabine G7",0
"Maverick",0,1,76175,FO,"KRU G8 zKylo FOO G8 FOST G8 FOTP",0
"Maverick",1,0,74397,zMaul,"Maul Dooku DN Sion G8 Sith Empire Trooper G8,",0
"Maverick",1,0,51974,Jawas,"Nebit G7 Jawa Engineer 6* G8, Jawa Scavenger G7, Jawa 6* G8 Dathcha G7",0
