Player,Offense,Defense,GP,Name,Squad,Viable
"Eckle Merasska",1,0,95060,Wiggs,"Wedge Biggs zHan zEzra zLeia",1
"Eckle Merasska",1,1,112344,zEP,"zzEP zzzVader zzTarkin zDooku TFP G8",1
"Eckle Merasska",0,1,98514,Phoenix,"zHera zKanan zZeb zSabine Chopper",1
"Eckle Merasska",0,1,102221,BS,"zBS G8, zzGMY zzHYoda zGK Ahsoka G9",1
"Eckle Merasska",,,246562,Negotiator,"Negotiator 5* HT 5* Anakin's Eta-2 Starfighter, Umbaran Starfighter, Ahsoka Tano's Jedi Starfighter, Clone Sergeant's ARC-170, Jedi Consular's Starfighter, Plo Koon's Jedi Starfighter",0
"Eckle Merasska",1,1,77959,NS,"MT 6* G6, zzAV zDaka Zombie G4, Spirit G8",0
"Eckle Merasska",0,1,63781,Grievous,"GG G9, B2 6* G3, MagnaGuard G3, Nute G5, zIG-88",0
"Eckle Merasska",1,0,72977,Rex (Counter),"Rex G4, Wampa G4, Chirrut G8, Baze G8, zzR2-D2",0
"Eckle Merasska",1,0,50116,Troopers,"Veers 6* G4, Starck G5, Snowtrooper G8, Magma G2, Stormtrooper G4",0
"Eckle Merasska",0,1,88770,FO,"KRU G8, zKylo zFOTP zPhasma FOO",0
"Eckle Merasska",1,0,67312,Jawas,"Nebit G6, Jawa Engineer G7, Jawa Scavenger G8, Jawa G7, Dathcha",0
"Toadmushe",1,1,114225,Revan Offense,"zzzJKR zzGMY zBS zJolee Ezra",1
"Toadmushe",1,1,86439,Ewoks,"zChirpa Elder zPaploo Teebo G9, zWicket",1
"Toadmushe",1,1,97291,Carth,"zCarth Onasi, zMission zZaalbar zJuhani zCanderous",1
"Toadmushe",0,1,105469,BH,"zzJango zGreedo G9, Cad zzBossk zBoba",1
"Toadmushe",1,0,104114,Wiggs,"Wedge Biggs zzzCLS zHan zLeia",1
"Toadmushe",1,0,87653,Rex (Counter),"zRex DN G8, Chirrut Baze zR2-D2",1
"Toadmushe",0,1,80339,Phoenix,"zHera zKanan G8, zZeb Sabine G8, Chopper G7",0
"Toadmushe",1,0,64485,QGJ,"QGJ G7, Aayla G2, JKA Old Ben G9, Ahsoka G8",0
"Toadmushe",0,1,62817,FO,"KRU G8, Kylo 5* G8, zPhasma G8, FOE G7, FOO G8",0
"Toadmushe",1,0,9331,SionSolo (Counter),"Sion 5* G6",0
"Iglooz R Cool",0,1,97235,Geonosians,"zzGBA Poggle Geo Soldier, Geo Spy, Sun Fac",1
"Iglooz R Cool",0,1,102691,BH,"zzBossk zIG-88 G8, zJango zDengar G9, zBoba",1
"Iglooz R Cool",1,0,96638,Troopers,"zVeers zStarck Range Trooper, zDT Shoretrooper",1
"Iglooz R Cool",1,0,77572,Wiggs,"Wedge G9, Biggs zLeia G9, Chirrut Baze G9",1
"Iglooz R Cool",1,0,17958,SionSolo (Counter),"zSion G9",1
"Iglooz R Cool",0,1,67752,Grievous,"GG G8, B2 G8, Nute G9, zDooku T3-M4 5* G7",0
"Iglooz R Cool",,,265404,Executrix,"Executrix Tie Adv, Emperor's Shuttle 4*, TIE Reaper 6*, Imperial TIE Fighter, Gauntlet Starfighter 3*, First Order SF TIE Fighter 2*, First Order TIE Fighter",0
"Iglooz R Cool",1,1,65784,NestSisters,"zAV G9, MT 6* G7, Daka G8, Zombie 6* G7, zNest 6* G8",0
"Iglooz R Cool",1,1,48681,Carth,"Carth Onasi G7, Mission 4* G7, Zaalbar 5* G7, Juhani 4* G7, Canderous 5* G7",0
"Iglooz R Cool",0,1,79974,FO,"zzKRU 4* G8, zKylo zPhasma FOO G8, FOST G9",0
"Iglooz R Cool",0,1,67767,BS,"zBS 6* G8, zGMY G9, Ahsoka G8, Old Ben G9, Ezra G5",0
"FoldupManatee",0,1,54512,Phoenix,"Hera G8, Kanan G8, Zeb G8, Ezra G9, Chopper G8",0
"Jason Austin",1,1,102252,zEP,"zzEP zzzVader Tarkin G9, zDooku TFP G8",1
"Jason Austin",0,1,67341,BH,"Bossk 3* G6, Jango 3* G8, Greedo G8, Cad G9, Boba",0
"Jason Austin",1,0,78221,Wiggs,"Wedge G9, Biggs G9, zzzCLS Fulcrum G6, Leia",0
"Cvc1515",1,1,87246,JTR,"zzzJTR Scav Rey, BB-8 G8, R2-D2 G9, zFinn",1
"Cvc1515",0,1,102771,FO,"zzKRU zKylo zFOTP FOE FOO G8",1
"Cvc1515",0,1,72354,Phoenix,"Hera Kanan Zeb G8, Sabine G8, Ezra",1
"Cvc1515",1,0,75029,Troopers,"zVeers zStarck G8, Snowtrooper G8, DT G7, Stormtrooper G9",1
"Cvc1515",1,0,79852,Wiggs,"Wedge G9, Biggs G8, zzzCLS Han G8, Leia G8",1
"Cvc1515",0,1,86588,BS,"zBS G9, zzGMY zJKA Old Ben, Ahsoka G8",1
"Cvc1515",1,1,55742,NS,"MT 4* G8, AV G8, Daka G7, Zombie 5* G7, Spirit 6* G8",0
"Cvc1515",1,1,51632,Ewoks,"Chirpa 4* G7, Elder 5* G8, Paploo 5* G5, Teebo G8, Scout G8",0
"Cvc1515",1,1,77318,zEP,"EP zVader Tarkin G8, Krennic G8, TFP G8",0
"Cvc1515",1,0,66679,Clones,"Cody G8, Rex G8, Echo G8, Fives G9, Clone Sergeant G9",0
"Cvc1515",1,1,63140,Rogue1,"Jyn 6* G7, Chirrut Baze 5* G9, K-2SO G8, Bodhi Rook G7",0
"Mousechowder",1,1,124843,JTR,"zzzJTR zScav Rey, zzBB-8 zzR2-D2 zFinn",1
"Mousechowder",1,1,108872,Revan Offense,"zzzJKR zzGMY zBS zJolee zEzra",1
"Mousechowder",1,1,87094,Ewoks,"zChirpa Elder zPaploo G9, Teebo zWicket",1
"Mousechowder",1,1,84101,Carth,"zCarth Onasi, Mission G9, Zaalbar G9, zJuhani zCanderous",1
"Mousechowder",0,1,111333,BH,"zzBossk zIG-88 Cad zBoba zzAurra",1
"Mousechowder",1,0,96524,Wiggs,"Wedge G8, Biggs G8, zzzCLS zFulcrum zzC-3PO",1
"Mousechowder",1,1,104618,zEP,"zzEP zzzVader zTarkin zDooku TFP G9",1
"Mousechowder",0,1,90494,FO,"zzKRU zKylo FOTP Phasma FOO",1
"Mousechowder",0,1,67629,padme,"Padme G7, GK 5* G8, JKA G9, Ahsoka CW Chewbacca G8",0
"Mousechowder",0,1,86076,DR,"DR G9, zzHK-47 zBSF Sith Assassin 5* G7, zThrawn",0
"Mousechowder",1,1,72853,NS_Alt,"MT G8, AV Daka G9, Zombie Talia G9",0
"Mousechowder",0,1,63205,BH,"Jango 5* G8, Greedo G9, The Mandalorian 3* G8, Zam G9, Embo 3* G8",0
"Mousechowder",1,0,73050,Clones,"Cody G8, Rex Echo G9, Fives Clone Sergeant G8",0
"Mousechowder",0,1,71838,Phoenix,"Hera Kanan zZeb G9, Sabine 4* G7, Chopper",0
"Mousechowder",1,1,60173,Rogue1,"Jyn 4* G7, Chirrut Baze 4* G5, K-2SO G8, Cassian G7",0
"Mousechowder",1,0,23787,QiraNest,"Qira 5* G5, Nest 3* G5, HYoda 5* G7",0
"4B4",0,1,85167,BS,"zBS G9, zzGMY JKA G9, zzOld Ben, Ezra G8",1
"4B4",1,1,46851,NS_Alt,"MT 6* G8, AV G8, Daka Talia 6* G9, Spirit 6* G8",0
"4B4",1,1,71527,Ewoks,"Chirpa G9, Elder G8, zPaploo Wicket zLogray",0
"4B4",1,1,58107,zEP,"EP Vader Tarkin G8, DT 5* G9, TFP G8",0
"4B4",0,1,57746,BH,"Jango 5* G9, Greedo G8, Cad G9, Boba G8, Zam G9",0
"4B4",1,0,50508,501st,"Rex G8, Clone Sergeant 6* G8, Echo G8, Fives G9, Ahsoka G8",0
"4B4",1,1,47426,Rogue1,"Jyn 5* Chirrut G8, Baze 5* G8, K-2SO G8, Cassian G8",0
"4B4",0,1,44922,Phoenix,"Hera 5* G8, Kanan G8, Zeb G8, Sabine 5* G8, Chopper G9",0
"4B4",0,1,51810,FO,"KRU 6* G9, Kylo G8, FOTP G8, Phasma G8, FOO G8",0
"Beck",,,347120,HansMF,"Home One, Han's MF 5*, HT Biggs X-wing, Phantom Ghost Cassian's U-wing, Bistan's U-wing",1
"Beck",0,1,83128,Geonosians,"zzGBA Poggle Geo Soldier, Geo Spy G9, Sun Fac G7",1
"Beck",1,1,107247,JTR,"zzzJTR zScav Rey, BB-8 G8, zzR2-D2 zFinn",1
"Beck",1,1,127906,Revan Offense,"zzzJKR zzGMY zBS G8, zJolee zJKA",1
"Beck",1,1,92245,Ewoks,"zChirpa Elder zPaploo Scout zWicket",1
"Beck",0,1,113007,BH,"zzBossk zIG-88 zDengar zGreedo zBoba",1
"Beck",0,1,75088,Phoenix,"zHera Kanan G8, Zeb G8, zSabine Ezra G8",1
"Beck",1,0,108063,Wiggs,"Wedge G9, Biggs zzzCLS zzC-3PO zLeia",1
"Beck",1,0,71101,Wampa (Counter),"Rex G8, Wampa HYoda G7, Jyn G8, FOO G8",1
"Beck",1,1,132652,zEP,"zzEP zzzVader zzTarkin zDooku TFP G8",1
"Beck",1,0,78917,Jawas,"Nebit G8, Jawa Engineer G8, Jawa Scavenger, Jawa G8, Dathcha",1
"Beck",1,0,14209,SionSolo (Counter),"Sion G8",1
"Beck",0,1,47908,Qira,"Qira 6* G4, L3-37 4* G3, Vandor Chewbacca 4* G4, Mission G8, Zaalbar G5",0
"Beck",1,1,91654,NS,"zzMT G8, zzAV zDaka Zombie Spirit G9",0
"Beck",0,1,92075,DR,"zzzDR zzHK-47 zBSF Sith Marauder G4, Thrawn 6* G7",0
"Beck",0,1,74793,Grievous,"zzGG B2 4* G2, Droideka G7, Nute zzT3-M4 G8",0
"Beck",1,0,55777,Troopers,"Veers G8, Starck G5, Snowtrooper G8, Range Trooper 3* G6, Stormtrooper G8",0
"Beck",0,1,55814,BH,"Jango 6* G4, Cad Zam G7, Greef Karga 5* G6, Nest 5* G7",0
"Beck",0,1,74520,FO,"zzKRU G8, zKylo FOTP G3, Phasma G8, FOST G8",0
"BabiHong",0,1,63612,Phoenix,"Hera G9, Kanan G8, Zeb G9, Ezra G9, Chopper G8",1
"Sublimed Cactus",0,1,71238,Phoenix,"Hera G8, Kanan G8, Zeb G8, Ezra G9, Chopper G9",1
"Sublimed Cactus",1,0,68673,Wiggs,"Wedge Biggs G8, Leia G9, Chirrut G9, Baze 3* G8",0
"Sublimed Cactus",0,1,54234,BS,"BS 5* G8, GMY G8, Jolee 3* G6, Old Ben G7, Ahsoka G7",0
"Aylwin",1,1,77867,Ewoks,"zChirpa G9, Elder Paploo G9, zWicket zLogray",1
"Aylwin",1,0,58771,Wiggs,"Wedge G8, Biggs G8, zCLS G8, Ezra G8, Leia G8",1
"Aylwin",0,1,89678,BS,"zBS zzGMY JKA G9, zzOld Ben, Ahsoka G8",1
"Aylwin",1,1,46509,NS,"MT 6* G8, AV G8, Daka G8, Zombie 4* G8, Spirit 6* G8",0
"Aylwin",1,0,45173,ShaakClones,"Shaak Ti 2* G7, Rex G8, Echo G8, Fives G8, Clone Sergeant 5* G8",0
"Aylwin",1,1,64224,zEP,"EP G9, zzVader Tarkin G8, DT 5* G8, TFP G9",0
"Aylwin",0,1,62526,BH,"Jango 5* G8, Dengar G7, Greedo G8, Cad G8, zBoba G8",0
"Aylwin",1,1,45717,Rogue1,"Jyn 5* G8, Chirrut G8, Baze 5* G8, K-2SO G8, Cassian G8",0
"Aylwin",0,1,44641,Phoenix,"Hera 5* G8, Kanan G8, Zeb G8, Sabine 5* G8, Chopper G8",0
"Aylwin",0,1,62408,FO,"KRU G8, Kylo FOTP Phasma G8, FOO G8",0
"Muddgette",0,1,88846,BS,"zBS zzGMY zAhsoka Old Ben G9, Ezra G8",1
"Muddgette",1,0,72161,Zader (Counter),"zVader Tarkin G8, Sidious G9, Boba G9, Stormtrooper G8",1
"Muddgette",1,1,81620,JTR,"JTR G9, Scav Rey, BB-8 G9, zR2-D2 zFinn",0
"Muddgette",1,1,45902,NS_Alt,"MT 5* G8, AV G8, Daka G8, Talia 6* G8, Spirit 5* G8",0
"Muddgette",0,1,57452,BH,"Jango 4* G8, IG-88 G8, Greedo G8, Cad G8, Zam G8",0
"Muddgette",1,0,68759,Wiggs,"Wedge 5* G8, Biggs G8, zzzCLS Fulcrum G8, Leia",0
"Muddgette",1,0,44616,Clones,"Cody 6* G8, Rex 6* G8, Echo 5* G8, Fives 6* G8, Clone Sergeant G8",0
"Muddgette",0,1,78468,FO,"zKRU G9, Kylo Phasma G9, FOE FOO",0
"Muddgette",1,1,48031,Rogue1,"Jyn 5* G8, Chirrut G8, Baze 5* G8, K-2SO G8, Cassian G8",0
"Muddgette",0,1,45472,Phoenix,"Hera 5* G8, Kanan G8, Zeb G8, Sabine 5* G8, Chopper G8",0
"Reaper of Rhodium",0,1,67719,Phoenix,"Hera G9, Kanan G8, Zeb G8, Sabine G9, Ezra G8",1
"Sherveen Muschifurche",1,1,53095,zEP,"EP 6* G7, Vader G9, Tarkin G8, Dooku 6* G6, TFP 6* G7",0
"Sherveen Muschifurche",1,0,47747,501st,"Rex G4, Clone Sergeant G6, Echo G4, Fives G7, Ahsoka G7",0
"Eltiko",0,1,62473,Phoenix,"Hera G8, Kanan G8, Zeb G8, Ezra G9, Chopper G8",1
"PrinceKarnatie",1,1,108579,NS,"zzMT zzAV zDaka Zombie Spirit",1
"PrinceKarnatie",0,1,88381,Geonosians,"zzGBA Poggle Geo Soldier, Geo Spy, Sun Fac G9",1
"PrinceKarnatie",0,1,114074,BH,"zzJango zDengar zGreedo zzBossk zBoba",1
"PrinceKarnatie",1,0,101638,501st,"zRex zARC Trooper, zEcho zzFives zAhsoka",1
"PrinceKarnatie",1,0,51870,Wiggs,"Wedge 6* G4, Biggs G5, Han G5, Ezra G7, Leia G6",0
"PrinceKarnatie",1,0,86864,Zader (Counter),"zzzVader Wampa 6* G6, zzTarkin zSidious Stormtrooper G4",0
"Ceth Senpai",0,1,93293,Geonosians,"zzGBA Poggle Geo Soldier, Geo Spy, Sun Fac",1
"Ceth Senpai",0,1,92860,Phoenix,"zHera zKanan zZeb Sabine zEzra",1
"Ceth Senpai",1,1,46629,NS_Alt,"MT 5* G8, AV G8, Daka 6* G8, Talia G8, Spirit 5* G8",0
"Ceth Senpai",1,1,74512,zEP,"zzEP G9, zVader G9, Tarkin Dooku 5* TFP 6* G8",0
"Ceth Senpai",1,0,49611,501st,"Rex 6* G8, Clone Sergeant G9, Echo 5* G8, Fives G8, Ahsoka 6* G8",0
"Ceth Senpai",1,0,37836,Troopers,"Veers 5* G8, Starck G7, Snowtrooper 6* G8, DT 5* G8, Stormtrooper 5* G8",0
"Ceth Senpai",1,1,41087,Rogue1,"Jyn 5* G8, Chirrut 5* G8, Baze 5* G8, Scarif G8, K-2SO G8",0
"Ceth Senpai",0,1,42603,FO,"KRU 5* G8, Kylo 5* G8, FOTP 6* G8, Phasma G8, FOE 5* G9",0
"Joinacult",1,0,73218,Zader (Counter),"Vader G9, Wampa Tarkin G8, Sidious G8, Boba G9",1
"Squuak Keek",1,1,119454,JTR,"zzzJTR Scav Rey, zzBB-8 zzR2-D2 zFinn",1
"Squuak Keek",1,1,112626,Revan Offense,"zzzJKR zzGMY zBS zJolee zzHYoda",1
"Squuak Keek",1,1,88301,Ewoks,"zChirpa Elder zPaploo Teebo zWicket",1
"Squuak Keek",0,1,97898,BH,"zzBossk Dengar G8, zGreedo Cad zBoba",1
"Squuak Keek",1,0,111389,Wiggs,"Wedge Biggs zzzCLS zHan zzC-3PO",1
"Squuak Keek",0,1,81482,Phoenix,"Hera G8, zKanan G8, zZeb Sabine G8, zEzra",1
"Squuak Keek",1,1,76704,Rogue1,"Jyn G8, Chirrut Baze G8, K-2SO G8, zCassian G8",1
"Squuak Keek",1,0,91738,Zader (Counter),"zzzVader zMission zZaalbar G8, Tarkin Sidious G8",1
"Squuak Keek",0,1,76267,padme,"zPadme 6* G7, zGK 6* JKA Ahsoka G9, CW Chewbacca G8",0
"Squuak Keek",0,1,76267,Geonosians,"zGBA G8, Poggle G8, Geo Soldier, Geo Spy G8, Sun Fac G8",0
"Squuak Keek",1,1,57690,NS,"MT 4* G8, AV G8, Daka G8, Zombie 6* G7, Spirit 6* G7",0
"Squuak Keek",,,74302,Nute-Sep,"Nute G8, Dooku G9, zzJango 5* zNest 3* G8, GG G7",0
"Squuak Keek",1,0,61021,ShaakClones,"Shaak Ti 3* G6, Rex G7, Echo G7, Fives G8, zARC Trooper 6* G5",0
"Squuak Keek",1,0,45204,Troopers,"Veers 5* G7, Starck 5* G6, Snowtrooper G7, DT 3* G7, Stormtrooper G8",0
"Squuak Keek",0,1,68897,FO,"KRU G8, Kylo G8, FOTP G8, Phasma G9, FOO G8",0
"Squuak Keek",1,0,58992,Jawas,"Nebit G8, Jawa Engineer 4* G7, Jawa Scavenger G7, Jawa G7, Dathcha G7",0
"Squuak Keek",1,0,10036,SionSolo (Counter),"Sion 4* G8",0
"Jokur",1,0,83693,Wiggs,"Wedge Biggs zCLS Han Leia",1
"Jokur",0,1,67228,Phoenix,"Hera G8, Kanan G8, Zeb G8, Ezra G9, Chopper G8",1
"Jokur",1,1,85694,JTR,"JTR Scav Rey, zBB-8 R2-D2 Finn G8",0
"Jokur",1,1,75825,zEP,"EP Vader Tarkin G8, Dooku TFP G8",0
